A1: 序号 | B1: 转债代码 | C1: 转债名称 | D1: 股票代码 | E1: 股票名称 | F1: 行业 | G1: 子行业 | H1: 转债价格 | I1: 涨跌 | J1: 日内套利 | K1: 股价 | L1: 涨跌 | M1: 剩余本息 | N1: 转股价格 | O1: 转股溢价率 | P1: 转股价值 | Q1: 距离转股日 | R1: 剩余年限 | S1: 回售年限 | T1: 转债余额 | U1: 转债成交额 | V1: 转债换手率 | W1: 余额/市值 | X1: 余额/股本 | Y1: 股票市值 | Z1: P/B | AA1: 税前收益率 | AB1: 税后收益率 | AC1: 税前回售收益 | AD1: 税后回售收益 | AE1: 回售价值 | AF1: 纯债价值 | AG1: 弹性 | AH1: 信用 | AI1: 折现率 | AJ1: 双低 | AK1: 老式双低 | AL1: 老式排名 | AM1: 新式双低 | AN1: 新式排名 | AO1: MA20乖离 | AP1: 热门度 | AQ1: 转债名称
A2: 276 | B2: 128062 | C2: 亚药转债! | D2: 2370 | E2: 亚太药业 | F2: 医药 | G2: 化学制药 | H2: 80.374 | I2: 7.000000000000001e-004 | J2: -8.0000000000000004e-004 | K2: 4.24 | L2: -1.3999999999999999e-002 | M2: 119.3 | N2: 16.25 | O2: 2.0800000000000001 | P2: 26.09 | Q2: 转股中 | R2: 3.82年 | S2: 1.83年 | T2: 9.63 | U2: 9.3 | V2: 1.2e-002 | W2: 0.42299999999999999 | X2: 0.11 | Y2: 23 | Z2: 5.26 | AA2: 0.111 | AB2: 0.10099999999999999 | AC2: 0.13200000000000001 | AD2: 0.129 | AE2: 81.51 | AF2: 76.83 | AG2: 0 | AH2: BB | AI2: 0.1244 | AJ2: =H2+100*O2 -> 288.37400000000002 | AK2: 134.7 | AL2: 196 | AM2: 53.1 | AN2: 261 | AO2: 3.7000000000000005e-002 | AP2: 84 | AQ2: 亚药转债!
A3: 138 | B3: 113595 | C3: 花王转债! | D3: 603007 | E3: ST花王 | F3: 城市公用 | G3: 生态环境 | H3: 87.99 | I3: -7.000000000000001e-004 | J3: 2.3999999999999998e-003 | K3: 3.26 | L3: 2.52e-002 | M3: 125.3 | N3: 6.93 | O3: 0.87 | P3: 47.04 | Q3: 转股中 | R3: 5年46天 | S3: 3年47天 | T3: 3.3 | U3: 13 | V3: 4.4999999999999998e-002 | W3: 0.30199999999999999 | X3: 0.14199999999999999 | Y3: 11 | Z3: 0.95 | AA3: 7.3200000000000001e-002 | AB3: 6.4100000000000004e-002 | AC3: 5.3499999999999999e-002 | AD3: 5.0700000000000002e-002 | AE3: 85.09 | AF3: 91.69 | AG3: 0.07 | AH3: AA- | AI3: 6.4399999999999999e-002 | AJ3: =H3+100*O3 -> 174.99000000000001 | AK3: 128.9 | AL3: 128 | AM3: 37.3 | AN3: 137 | AO3: 1.8000000000000002e-002 | AP3: 43 | AQ3: 花王转债!
A4: 196 | B4: 128100 | C4: 搜特转债! | D4: 2503 | E4: 搜于特 | F4: 服装纺织 | G4: 服装行业 | H4: 84.266 | I4: -1.21e-002 | J4: 1.1000000000000001e-002 | K4: 1.65 | L4: -1.2e-002 | M4: 116.9 | N4: 2.9 | O4: 0.48100000000000004 | P4: 56.9 | Q4: 转股中 | R4: 4.77年 | S4: 2.77年 | T4: 7.99 | U4: 44 | V4: 6.5000000000000002e-002 | W4: 0.157 | X4: 8.900000000000001e-002 | Y4: 51 | Z4: 1.52 | AA4: 7.2499999999999995e-002 | AB4: 6.5599999999999992e-002 | AC4: 7.2800000000000004e-002 | AD4: 7.0300000000000001e-002 | AE4: 91.63 | AF4: 96.26 | AG4: 0.09 | AH4: AA | AI4: 4.24e-002 | AJ4: =H4+100*O4 -> 132.36600000000001 | AK4: 111.6 | AL4: 7 | AM4: 15.4 | AN4: 3 | AO4: -4.4999999999999998e-002 | AP4: 64 | AQ4: 搜特转债!
A5: 274 | B5: 128063 | C5: 未来转债! | D5: 2631 | E5: 德尔未来 | F5: 其他 | G5: 家居用品 | H5: 103.46 | I5: 1.1999999999999999e-003 | J5: -2.8999999999999998e-003 | K5: 6.09 | L5: -8.1000000000000013e-003 | M5: 127.5 | N5: 8.6 | O5: 0.46100000000000002 | P5: 70.81 | Q5: 转股中 | R5: 3.83年 | S5: 2.83年 | T5: 6.3 | U5: 5.6 | V5: 9.0000000000000011e-003 | W5: 0.155 | X5: 0.11 | Y5: 41 | Z5: 2.41 | AA5: 5.7699999999999994e-002 | AB5: 4.4999999999999998e-002 | AC5: 1.5300000000000001e-002 | AD5: 1.e-002 | AE5: 90.33 | AF5: 101.43 | AG5: 0.2 | AH5: AA- | AI5: 6.3399999999999998e-002 | AJ5: =H5+100*O5 -> 149.56 | AK5: 136.1 | AL5: 206 | AM5: 34.7 | AN5: 119 | AO5: 1.4999999999999999e-002 | AP5: 32 | AQ5: 未来转债!
A6: 183 | B6: 113576 | C6: 起步转债!! | D6: 603557 | E6: ST起步 | F6: 服装纺织 | G6: 鞋服行业 | H6: 93.47 | I6: -5.4000000000000003e-003 | J6: 3.3e-003 | K6: 4.86 | L6: -2.2099999999999998e-002 | M6: 121.3 | N6: 10.55 | O6: 1.03 | P6: 46.07 | Q6: 转股中 | R6: 4.85年 | S6: 2.85年 | T6: 2.66 | U6: 45 | V6: 0.18100000000000002 | W6: 0.11 | X6: 5.0999999999999997e-002 | Y6: 24 | Z6: 1.54 | AA6: 5.6600000000000004e-002 | AB6: 4.8399999999999999e-002 | AC6: 3.7200000000000004e-002 | AD6: 3.4300000000000004e-002 | AE6: 81.84 | AF6: 82.67 | AG6: 0.1 | AH6: A | AI6: 8.4399999999999989e-002 | AJ6: =H6+100*O6 -> 196.47 | AK6: 140.9 | AL6: 246 | AM6: 58.2 | AN6: 290 | AO6: -9.5000000000000001e-002 | AP6: 32 | AQ6: 起步转债!!
A7: 79 | B7: 128138 | C7: 侨银转债! | D7: 2973 | E7: 侨银股份 | F7: 城市公用 | G7: 城市公用 | H7: 102.456 | I7: -1.1999999999999999e-003 | J7: 1.5e-003 | K7: 16.89 | L7: 1.1999999999999999e-003 | M7: 136.5 | N7: 25.33 | O7: 0.53700000000000003 | P7: 66.68 | Q7: 转股中 | R7: 5.45年 | S7: 3.45年 | T7: 4.2 | U7: 3.5 | V7: 8.0000000000000002e-003 | W7: 6.0999999999999999e-002 | X7: 4.0999999999999995e-002 | Y7: 69 | Z7: 4.58 | AA7: 5.5099999999999996e-002 | AB7: 4.4199999999999996e-002 | AC7: 5.3e-003 | AD7: 2.8999999999999998e-003 | AE7: 83.5 | AF7: 97.79 | AG7: 0.23 | AH7: AA- | AI7: 6.4399999999999999e-002 | AJ7: =H7+100*O7 -> 156.15600000000001 | AK7: 138.2 | AL7: 225 | AM7: 40.4 | AN7: 170 | AO7: 1.8000000000000002e-002 | AP7: 11 | AQ7: 侨银转债!
A8: 122 | B8: 113600 | C8: 新星转债! | D8: 603978 | E8: 深圳新星 | F8: 有色金属 | G8: 有色行业 | H8: 97.02 | I8: 2.9999999999999997e-004 | J8: -5.0000000000000001e-004 | K8: 16.61 | L8: -5.9999999999999995e-004 | M8: 126 | N8: 23.85 | O8: 0.39299999999999996 | P8: 69.64 | Q8: 转股中 | R8: 5.19年 | S8: 3.19年 | T8: 5.95 | U8: 3.5 | V8: 6.0000000000000001e-003 | W8: 0.22399999999999998 | X8: 0.156 | Y8: 27 | Z8: 1.74 | AA8: 5.28e-002 | AB8: 4.3899999999999995e-002 | AC8: 2.0899999999999998e-002 | AD8: 1.8500000000000003e-002 | AE8: 84.47 | AF8: 91.77 | AG8: 0.31 | AH8: AA- | AI8: 6.4399999999999999e-002 | AJ8: =H8+100*O8 -> 136.31999999999999 | AK8: 124.4 | AL8: 73 | AM8: 32.6 | AN8: 95 | AO8: -4.0999999999999995e-002 | AP8: 21 | AQ8: 新星转债!
A9: 260 | B9: 123028 | C9: 清水转债! | D9: 300437 | E9: 清水源 | F9: 城市公用 | G9: 三废处理 | H9: 100.089 | I9: -3.0000000000000001e-003 | J9: -3.8e-003 | K9: 8.77 | L9: -2.23e-002 | M9: 121.8 | N9: 11.84 | O9: 0.35100000000000003 | P9: 74.07 | Q9: 转股中 | R9: 4年14天 | S9: 2年15天 | T9: 4.55 | U9: 7.2 | V9: 1.6e-002 | W9: 0.23499999999999999 | X9: 0.17399999999999999 | Y9: 19 | Z9: 1.75 | AA9: 5.1399999999999994e-002 | AB9: 4.1399999999999999e-002 | AC9: 2.1000000000000001e-002 | AD9: 1.67e-002 | AE9: 91.64 | AF9: 95.75 | AG9: 0.31 | AH9: AA- | AI9: 6.3399999999999998e-002 | AJ9: =H9+100*O9 -> 135.18899999999999 | AK9: 126.1 | AL9: 89 | AM9: 30.4 | AN9: 67 | AO9: 1.2e-002 | AP9: 51 | AQ9: 清水转债!
A10: 155 | B10: 127018 | C10: 本钢转债! | D10: 761 | E10: 本钢板材 | F10: 钢铁 | G10: 炼钢 | H10: 101 | I10: -1.1000000000000001e-003 | J10: -4.0000000000000001e-003 | K10: 4.21 | L10: -1.41e-002 | M10: 128.6 | N10: 5.03 | O10: 0.20699999999999999 | P10: 83.7 | Q10: 转股中 | R10: 5年24天 | S10: 3年25天 | T10: 67.5 | U10: 72 | V10: 1.1000000000000001e-002 | W10: 0.41399999999999998 | X10: 0.34600000000000003 | Y10: 163 | Z10: 0.79 | AA10: 5.0499999999999996e-002 | AB10: 4.0599999999999997e-002 | AC10: 1.66e-002 | AD10: 1.2699999999999999e-002 | AE10: 91.59 | AF10: 102.01 | AG10: 0.36 | AH10: AAA | AI10: 4.8399999999999999e-002 | AJ10: =H10+100*O10 -> 121.7 | AK10: 118.3 | AL10: 25 | AM10: 16.3 | AN10: 4 | AO10: -6.4000000000000001e-002 | AP10: 63 | AQ10: 本钢转债!
A11: 361 | B11: 127003 | C11: 海印转债! | D11: 861 | E11: 海印股份 | F11: 商业零售 | G11: 商场 | H11: 106.46 | I11: -2.0000000000000001e-004 | J11: 0. | K11: 2.19 | L11: -9.0000000000000011e-003 | M11: 111.8 | N11: 3 | O11: 0.45799999999999996 | P11: 73 | Q11: 转股中 | R11: 1年4.1天 | S11: 回售内 | T11: 6.74 | U11: 6.3 | V11: 9.0000000000000011e-003 | W11: 0.13200000000000001 | X11: 9.6999999999999989e-002 | Y11: 51 | Z11: 1.34 | AA11: 5.04e-002 | AB11: 2.81e-002 | AC11: 回售内 | AD11: 回售内 | AE11: 100.3 | AF11: 107.46 | AG11: 0.02 | AH11: AA | AI11: 4.0599999999999997e-002 | AJ11: =H11+100*O11 -> 152.25999999999999 | AK11: 139.9 | AL11: 238 | AM11: 32.5 | AN11: 93 | AO11: -1.7000000000000001e-002 | AP11: 71 | AQ11: 海印转债!
A12: 201 | B12: 113569 | C12: 科达转债! | D12: 603660 | E12: 苏州科达 | F12: 通信互联 | G12: 物联网 | H12: 96.68 | I12: 2.5000000000000001e-003 | J12: -2.3e-003 | K12: 6.98 | L12: 2.8999999999999998e-003 | M12: 120.3 | N12: 14.8 | O12: 1.05 | P12: 47.16 | Q12: 转股中 | R12: 4.76年 | S12: 2.76年 | T12: 5.16 | U12: 0.8 | V12: 2.e-003 | W12: 0.14800000000000002 | X12: 7.0000000000000007e-002 | Y12: 35 | Z12: 1.93 | AA12: 4.8000000000000001e-002 | AB12: 4.0199999999999993e-002 | AC12: 2.4300000000000002e-002 | AD12: 2.1700000000000001e-002 | AE12: 86.72 | AF12: 90.33 | AG12: 0.06 | AH12: AA- | AI12: 6.3399999999999998e-002 | AJ12: =H12+100*O12 -> 201.68000000000001 | AK12: 146.2 | AL12: 273 | AM12: 55.9 | AN12: 276 | AO12: 6.9999999999999993e-003 | AP12: 27 | AQ12: 科达转债!
A13: 306 | B13: 113519 | C13: 长久转债! | D13: 603569 | E13: 长久物流 | F13: 交通运输 | G13: 物流业 | H13: 102.02 | I13: 4.0000000000000002e-004 | J13: -7.000000000000001e-004 | K13: 7.76 | L13: -2.5999999999999999e-003 | M13: 119.3 | N13: 11.15 | O13: 0.46600000000000003 | P13: 69.6 | Q13: 转股中 | R13: 3.42年 | S13: 1.43年 | T13: 6.97 | U13: 1.7 | V13: 2.e-003 | W13: 0.16 | X13: 0.11199999999999999 | Y13: 43 | Z13: 1.98 | AA13: 4.7699999999999992e-002 | AB13: 3.73e-002 | AC13: 4.7999999999999996e-003 | AD13: 1.4000000000000002e-003 | AE13: 96.27 | AF13: 103.77 | AG13: 0.12 | AH13: AA | AI13: 4.24e-002 | AJ13: =H13+100*O13 -> 148.62 | AK13: 134.4 | AL13: 193 | AM13: 30.7 | AN13: 73 | AO13: -2.e-003 | AP13: 21 | AQ13: 长久转债!
A14: 336 | B14: 113017 | C14: 吉视转债! | D14: 601929 | E14: 吉视传媒 | F14: 传媒娱乐 | G14: 影视娱乐 | H14: 96.98 | I14: -2.0000000000000001e-004 | J14: -4.0000000000000002e-004 | K14: 1.88 | L14: -1.0500000000000001e-002 | M14: 108.8 | N14: 2.95 | O14: 0.52200000000000002 | P14: 63.73 | Q14: 转股中 | R14: 2.56年 | S14: 0.56年 | T14: 15.6 | U14: 7.6 | V14: 5.0000000000000001e-003 | W14: 0.26700000000000002 | X14: 0.17000000000000001 | Y14: 58 | Z14: 0.88 | AA14: 4.6600000000000003e-002 | AB14: 3.9699999999999999e-002 | AC14: 6.5199999999999994e-002 | AD14: 6.0700000000000004e-002 | AE14: 98.85 | AF14: 99.12 | AG14: 0.05 | AH14: AA+ | AI14: 3.7599999999999995e-002 | AJ14: =H14+100*O14 -> 149.18000000000001 | AK14: 130.2 | AL14: 142 | AM14: 31.1 | AN14: 75 | AO14: -1.3999999999999999e-002 | AP14: 64 | AQ14: 吉视转债!
A15: 130 | B15: 113596 | C15: 城地转债! | D15: 603887 | E15: 城地香江 | F15: 通信互联 | G15: 通信设备 | H15: 90.5 | I15: 8.6999999999999994e-003 | J15: -8.8000000000000005e-003 | K15: 11.99 | L15: -4.1999999999999997e-003 | M15: 113.5 | N15: 29.21 | O15: 1.2 | P15: 41.05 | Q15: 转股中 | R15: 5年53天 | S15: 3年54天 | T15: 12 | U15: 13 | V15: 1.2e-002 | W15: 0.26600000000000001 | X15: 0.109 | Y15: 45 | Z15: 1.18 | AA15: 4.5999999999999999e-002 | AB15: 4.0899999999999999e-002 | AC15: 4.2800000000000005e-002 | AD15: 4.0399999999999998e-002 | AE15: 84.64 | AF15: 82.93 | AG15: 0.03 | AH15: AA- | AI15: 6.4399999999999999e-002 | AJ15: =H15+100*O15 -> 210.5 | AK15: 140 | AL15: 239 | AM15: 55.3 | AN15: 271 | AO15: 5.0000000000000001e-003 | AP15: 24 | AQ15: 城地转债!
A16: 355 | B16: 128015 | C16: 久其转债! | D16: 2279 | E16: 久其软件 | F16: 计算机及 | G16: 软件开发 | H16: 101.441 | I16: -1.e-004 | J16: 1.e-004 | K16: 4.95 | L16: 0. | M16: 110.8 | N16: 6.97 | O16: 0.42799999999999999 | P16: 71.02 | Q16: 转股中 | R16: 2年4.1天 | S16: 4.1天 | T16: 7.8 | U16: 13 | V16: 1.6e-002 | W16: 0.222 | X16: 0.157 | Y16: 35 | Z16: 4.09 | AA16: 4.58e-002 | AB16: 3.5200000000000002e-002 | AC16: 6.0999999999999995e-003 | AD16: -1.1200000000000002e-002 | AE16: 100.31 | AF16: 96.5 | AG16: 0 | AH16: A+ | AI16: 7.2599999999999998e-002 | AJ16: =H16+100*O16 -> 144.24099999999999 | AK16: 131.9 | AL16: 164 | AM16: 31.6 | AN16: 82 | AO16: 3.1e-002 | AP16: 66 | AQ16: 久其转债!
A17: 289 | B17: 110052 | C17: 贵广转债! | D17: 600996 | E17: 贵广网络 | F17: 传媒娱乐 | G17: 影视娱乐 | H17: 99.95 | I17: -5.0000000000000001e-004 | J17: 2.0000000000000001e-004 | K17: 4.51 | L17: -6.6e-003 | M17: 117.7 | N17: 7.94 | O17: 0.76000000000000001 | P17: 56.8 | Q17: 转股中 | R17: 3.75年 | S17: 1.75年 | T17: 15.3 | U17: 2.6 | V17: 2.e-003 | W17: 0.32200000000000001 | X17: 0.183 | Y17: 47 | Z17: 1.12 | AA17: 4.5499999999999999e-002 | AB17: 3.6699999999999997e-002 | AC17: 1.61e-002 | AD17: 1.29e-002 | AE17: 95.73 | AF17: 102.11 | AG17: 0.04 | AH17: AA+ | AI17: 3.9399999999999998e-002 | AJ17: =H17+100*O17 -> 175.94999999999999 | AK17: 143.1 | AL17: 262 | AM17: 41 | AN17: 182 | AO17: -2.1000000000000001e-002 | AP17: 18 | AQ17: 贵广转债!
A18: 176 | B18: 113573 | C18: 纵横转债! | D18: 603602 | E18: 纵横通信 | F18: 通信互联 | G18: 通信设备 | H18: 100.85 | I18: 5.0000000000000001e-003 | J18: -4.1999999999999997e-003 | K18: 10.63 | L18: 4.6999999999999993e-003 | M18: 124.2 | N18: 18.78 | O18: 0.78200000000000003 | P18: 56.6 | Q18: 转股中 | R18: 4.87年 | S18: 2.87年 | T18: 2.7 | U18: 6.2 | V18: 2.3e-002 | W18: 0.125 | X18: 7.0999999999999994e-002 | Y18: 22 | Z18: 3.05 | AA18: 4.4699999999999997e-002 | AB18: 3.5900000000000001e-002 | AC18: 1.0700000000000001e-002 | AD18: 8.0000000000000002e-003 | AE18: 83.92 | AF18: 88.27 | AG18: 0.17 | AH18: A+ | AI18: 7.4400000000000008e-002 | AJ18: =H18+100*O18 -> 179.05000000000001 | AK18: 145.1 | AL18: 269 | AM18: 56.8 | AN18: 284 | AO18: 3.4000000000000002e-002 | AP18: 24 | AQ18: 纵横转债!
A19: 100 | B19: 123069 | C19: 金诺转债! | D19: 300505 | E19: 川金诺 | F19: 化工 | G19: 农化 | H19: 100.139 | I19: -4.8999999999999998e-003 | J19: 3.3e-003 | K19: 14.19 | L19: -4.1999999999999997e-003 | M19: 126 | N19: 19.15 | O19: 0.35100000000000003 | P19: 74.1 | Q19: 转股中 | R19: 5.36年 | S19: 3.37年 | T19: 3.68 | U19: 6.1 | V19: 1.6e-002 | W19: 0.19800000000000001 | X19: 0.14699999999999999 | Y19: 19 | Z19: 1.96 | AA19: 4.4699999999999997e-002 | AB19: 3.6200000000000003e-002 | AC19: 1.0700000000000001e-002 | AD19: 8.5000000000000006e-003 | AE19: 83.55 | AF19: 90.77 | AG19: 0.37 | AH19: AA- | AI19: 6.4399999999999999e-002 | AJ19: =H19+100*O19 -> 135.239 | AK19: 126.2 | AL19: 92 | AM19: 35.4 | AN19: 126 | AO19: 2.6000000000000002e-002 | AP19: 18 | AQ19: 金诺转债!
A20: 279 | B20: 113530 | C20: 大丰转债! | D20: 603081 | E20: 大丰实业 | F20: 建筑 | G20: 装饰工程 | H20: 102.98 | I20: -7.000000000000001e-004 | J20: -1.1000000000000001e-003 | K20: 11.44 | L20: -1.46e-002 | M20: 121 | N20: 16.64 | O20: 0.498 | P20: 68.75 | Q20: 转股中 | R20: 3.81年 | S20: 1.81年 | T20: 6.3 | U20: 4.9 | V20: 8.0000000000000002e-003 | W20: 0.13699999999999998 | X20: 9.4e-002 | Y20: 46 | Z20: 2.07 | AA20: 4.41e-002 | AB20: 3.4099999999999998e-002 | AC20: -2.9999999999999997e-004 | AD20: -3.2000000000000002e-003 | AE20: 94.86 | AF20: 103.6 | AG20: 0.12 | AH20: AA | AI20: 4.24e-002 | AJ20: =H20+100*O20 -> 152.78 | AK20: 137.2 | AL20: 215 | AM20: 33.6 | AN20: 105 | AO20: -2.4e-002 | AP20: 33 | AQ20: 大丰转债!
A21: 121 | B21: 110072 | C21: 广汇转债! | D21: 600297 | E21: 广汇汽车 | F21: 汽车 | G21: 分销、售 | H21: 91.96 | I21: 4.0000000000000002e-004 | J21: 5.0000000000000001e-004 | K21: 2.84 | L21: 3.4999999999999996e-003 | M21: 114.5 | N21: 4.03 | O21: 0.30499999999999999 | P21: 70.47 | Q21: 转股中 | R21: 5.20年 | S21: 3.21年 | T21: 33.7 | U21: 21 | V21: 6.9999999999999993e-003 | W21: 0.14599999999999999 | X21: 0.10300000000000001 | Y21: 230 | Z21: 0.57 | AA21: 4.3700000000000003e-002 | AB21: 3.8399999999999997e-002 | AC21: 3.44e-002 | AD21: 3.2599999999999997e-002 | AE21: 90.21 | AF21: 93.48 | AG21: 0.25 | AH21: AA+ | AI21: 4.0399999999999998e-002 | AJ21: =H21+100*O21 -> 122.45999999999999 | AK21: 113.4 | AL21: 9 | AM21: 20 | AN21: 11 | AO21: -3.2000000000000001e-002 | AP21: 56 | AQ21: 广汇转债!
A22: 150 | B22: 128118 | C22: 瀛通转债! | D22: 2861 | E22: 瀛通通讯 | F22: 电子 | G22: 电子产品 | H22: 98.988 | I22: -7.000000000000001e-004 | J22: 7.000000000000001e-004 | K22: 14.18 | L22: 0. | M22: 122.1 | N22: 21.12 | O22: 0.47399999999999998 | P22: 67.14 | Q22: 转股中 | R22: 5年27天 | S22: 3年28天 | T22: 3 | U22: 1.8 | V22: 6.0000000000000001e-003 | W22: 0.13400000000000001 | X22: 8.9999999999999997e-002 | Y22: 22 | Z22: 1.61 | AA22: 4.3299999999999998e-002 | AB22: 3.5400000000000001e-002 | AC22: 1.7399999999999999e-002 | AD22: 1.4499999999999999e-002 | AE22: 85.67 | AF22: 89.69 | AG22: 0.3 | AH22: AA- | AI22: 6.4399999999999999e-002 | AJ22: =H22+100*O22 -> 146.38800000000001 | AK22: 130.8 | AL22: 149 | AM22: 41.1 | AN22: 184 | AO22: -0.13500000000000001 | AP22: 15 | AQ22: 瀛通转债!
A23: 145 | B23: 127019 | C23: 国城转债! | D23: 688 | E23: 国城矿业 | F23: 有色金属 | G23: 锌铅镍锡 | H23: 93.17 | I23: 1.e-003 | J23: -1.1000000000000001e-003 | K23: 9.14 | L23: -3.3e-003 | M23: 115.1 | N23: 21.07 | O23: 1.1499999999999999 | P23: 43.38 | Q23: 转股中 | R23: 5年40天 | S23: 3年41天 | T23: 8.5 | U23: 7.4 | V23: 9.0000000000000011e-003 | W23: 8.199999999999999e-002 | X23: 3.5000000000000003e-002 | Y23: 104 | Z23: 4.48 | AA23: 4.3099999999999999e-002 | AB23: 3.7400000000000003e-002 | AC23: 3.32e-002 | AD23: 3.0899999999999997e-002 | AE23: 90.26 | AF23: 93.04 | AG23: 0.03 | AH23: AA | AI23: 4.3400000000000001e-002 | AJ23: =H23+100*O23 -> 208.16999999999999 | AK23: 143 | AL23: 259 | AM23: 49.9 | AN23: 243 | AO23: -5.2999999999999999e-002 | AP23: 40 | AQ23: 国城转债!
A24: 326 | B24: 128037 | C24: 岩土转债! | D24: 2542 | E24: 中化岩土 | F24: 建筑 | G24: 建筑工程 | H24: 99.459 | I24: 2.8999999999999998e-003 | J24: -2.8000000000000004e-003 | K24: 3.04 | L24: 3.0499999999999999e-002 | M24: 111.3 | N24: 7.99 | O24: 1.6100000000000001 | P24: 38.05 | Q24: 转股中 | R24: 2.78年 | S24: 0.78年 | T24: 5.99 | U24: 21 | V24: 3.6000000000000004e-002 | W24: 0.109 | X24: 4.2000000000000003e-002 | Y24: 55 | Z24: 1.38 | AA24: 4.2000000000000003e-002 | AB24: 3.4099999999999998e-002 | AC24: 2.5000000000000001e-002 | AD24: 2.1099999999999997e-002 | AE24: 98.05 | AF24: 99.83 | AG24: 0 | AH24: AA | AI24: 4.0599999999999997e-002 | AJ24: =H24+100*O24 -> 260.459 | AK24: 160.9 | AL24: 316 | AM24: 61 | AN24: 298 | AO24: 3.9e-002 | AP24: 49 | AQ24: 岩土转债!
A25: 265 | B25: 113535 | C25: 大业转债! | D25: 603278 | E25: 大业股份 | F25: 汽车 | G25: 零部件制 | H25: 99.93 | I25: 1.1000000000000001e-003 | J25: -2.0000000000000001e-004 | K25: 8.53 | L25: 7.0999999999999995e-003 | M25: 112.5 | N25: 12.4 | O25: 0.45299999999999996 | P25: 68.79 | Q25: 转股中 | R25: 2.93年 | S25: 0.93年 | T25: 5 | U25: 3.4 | V25: 6.9999999999999993e-003 | W25: 0.20199999999999999 | X25: 0.13900000000000001 | Y25: 25 | Z25: 1.44 | AA25: 4.1799999999999997e-002 | AB25: 3.3599999999999998e-002 | AC25: 1.21e-002 | AD25: 9.7999999999999997e-003 | AE25: 96.94 | AF25: 100.25 | AG25: 0.13 | AH25: AA | AI25: 4.0599999999999997e-002 | AJ25: =H25+100*O25 -> 145.23000000000002 | AK25: 131.1 | AL25: 152 | AM25: 30.8 | AN25: 74 | AO25: -1.7000000000000001e-002 | AP25: 47 | AQ25: 大业转债!
A26: 342 | B26: 128026 | C26: 众兴转债! | D26: 2772 | E26: 众兴菌业 | F26: 农业 | G26: 种植业 | H26: 98.9 | I26: 4.0000000000000002e-004 | J26: 0. | K26: 7.95 | L26: 7.6e-003 | M26: 109.3 | N26: 11.36 | O26: 0.41299999999999998 | P26: 69.98 | Q26: 转股中 | R26: 2.53年 | S26: 0.53年 | T26: 9.19 | U26: 6 | V26: 6.9999999999999993e-003 | W26: 0.314 | X26: 0.22 | Y26: 29 | Z26: 1.14 | AA26: 4.1100000000000005e-002 | AB26: 3.3799999999999997e-002 | AC26: 4.2800000000000005e-002 | AD26: 3.7400000000000003e-002 | AE26: 97.69 | AF26: 94.24 | AG26: 0.06 | AH26: AA- | AI26: 6.1600000000000002e-002 | AJ26: =H26+100*O26 -> 140.19999999999999 | AK26: 127.8 | AL26: 111 | AM26: 30.1 | AN26: 63 | AO26: 1.e-003 | AP26: 62 | AQ26: 众兴转债!
A27: 198 | B27: 123044 | C27: 红相转债!! | D27: 300427 | E27: 红相股份 | F27: 能源电力 | G27: 电力设备 | H27: 103.799 | I27: 3.9000000000000003e-003 | J27: -2.3999999999999998e-003 | K27: 12.68 | L27: 5.6000000000000008e-003 | M27: 125 | N27: 18.67 | O27: 0.52800000000000002 | P27: 67.92 | Q27: 转股中 | R27: 4.77年 | S27: 2.77年 | T27: 5.5 | U27: 9.1 | V27: 1.6e-002 | W27: 0.12 | X27: 8.199999999999999e-002 | Y27: 46 | Z27: 1.95 | AA27: 4.0800000000000003e-002 | AB27: 3.15e-002 | AC27: 2.3e-003 | AD27: -5.9999999999999995e-004 | AE27: 87.43 | AF27: 93.93 | AG27: 0.26 | AH27: AA- | AI27: 6.3399999999999998e-002 | AJ27: =H27+100*O27 -> 156.59900000000002 | AK27: 139.7 | AL27: 234 | AM27: 45.8 | AN27: 223 | AO27: 1.3000000000000001e-002 | AP27: 20 | AQ27: 红相转债!!
A28: 73 | B28: 128139 | C28: 祥鑫转债! | D28: 2965 | E28: 祥鑫科技 | F28: 汽车 | G28: 零部件制 | H28: 97.59 | I28: 8.6999999999999994e-003 | J28: 6.6e-003 | K28: 25.13 | L28: 4.58e-002 | M28: 121 | N28: 36.96 | O28: 0.435 | P28: 67.99 | Q28: 3.1天 | R28: 5.49年 | S28: 3.49年 | T28: 6.47 | U28: 41 | V28: 6.5000000000000002e-002 | W28: 0.17100000000000001 | X28: 0.11599999999999999 | Y28: 38 | Z28: 2.14 | AA28: 4.0800000000000003e-002 | AB28: 3.3799999999999997e-002 | AC28: 1.7500000000000002e-002 | AD28: 1.5300000000000001e-002 | AE28: 82.9 | AF28: 86.51 | AG28: 0.33 | AH28: AA- | AI28: 6.4399999999999999e-002 | AJ28: =H28+100*O28 -> 141.09 | AK28: 127.2 | AL28: 101 | AM28: 40.7 | AN28: 178 | AO28: -1.7000000000000001e-002 | AP28: 13 | AQ28: 祥鑫转债!
A29: 151 | B29: 128117 | C29: 道恩转债! | D29: 2838 | E29: 道恩股份 | F29: 化工 | G29: 橡胶塑料 | H29: 101.47 | I29: 5.0000000000000001e-004 | J29: 8.9999999999999998e-004 | K29: 18.91 | L29: 5.3e-003 | M29: 123.5 | N29: 28.83 | O29: 0.54700000000000004 | P29: 65.59 | Q29: 转股中 | R29: 5年27天 | S29: 3年28天 | T29: 3.6 | U29: 8 | V29: 2.2000000000000002e-002 | W29: 4.7e-002 | X29: 3.1e-002 | Y29: 77 | Z29: 4.06 | AA29: 4.0300000000000002e-002 | AB29: 3.2099999999999997e-002 | AC29: 7.1999999999999998e-003 | AD29: 4.8999999999999998e-003 | AE29: 85.01 | AF29: 90.58 | AG29: 0.26 | AH29: AA- | AI29: 6.4399999999999999e-002 | AJ29: =H29+100*O29 -> 156.17000000000002 | AK29: 137.3 | AL29: 216 | AM29: 46.8 | AN29: 229 | AO29: 2.3e-002 | AP29: 21 | AQ29: 道恩转债!
A30: 76 | B30: 123077 | C30: 汉得转债! | D30: 300170 | E30: 汉得信息 | F30: 计算机及 | G30: 软件开发 | H30: 101.502 | I30: 1.e-002 | J30: -9.5999999999999992e-003 | K30: 6.93 | L30: 1.4000000000000002e-003 | M30: 125.5 | N30: 9.69 | O30: 0.41899999999999998 | P30: 71.52 | Q30: 转股中 | R30: 5.47年 | S30: 3.47年 | T30: 9.37 | U30: 21 | V30: 2.2000000000000002e-002 | W30: 0.153 | X30: 0.109 | Y30: 61 | Z30: 1.93 | AA30: 4.0300000000000002e-002 | AB30: 3.2199999999999999e-002 | AC30: 6.3e-003 | AD30: 4.3e-003 | AE30: 89.11 | AF30: 99.92 | AG30: 0.23 | AH30: AA | AI30: 4.3400000000000001e-002 | AJ30: =H30+100*O30 -> 143.40199999999999 | AK30: 131.5 | AL30: 158 | AM30: 31.6 | AN30: 83 | AO30: 1.3999999999999999e-002 | AP30: 13 | AQ30: 汉得转债!
A31: 224 | B31: 110064 | C31: 建工转债! | D31: 600939 | E31: 重庆建工 | F31: 建筑 | G31: 建筑工程 | H31: 100.68 | I31: 5.1000000000000004e-003 | J31: -1.1000000000000001e-003 | K31: 3.68 | L31: 1.38e-002 | M31: 119.8 | N31: 4.57 | O31: 0.25 | P31: 80.53 | Q31: 转股中 | R31: 4.54年 | S31: 2.55年 | T31: 16.6 | U31: 6.9 | V31: 4.0000000000000001e-003 | W31: 0.249 | X31: 0.20000000000000001 | Y31: 67 | Z31: 0.95 | AA31: 4.0000000000000001e-002 | AB31: 3.2000000000000001e-002 | AC31: 1.26e-002 | AD31: 9.5999999999999992e-003 | AE31: 93.87 | AF31: 100.93 | AG31: 0.29 | AH31: AA+ | AI31: 3.9399999999999998e-002 | AJ31: =H31+100*O31 -> 125.68000000000001 | AK31: 120.8 | AL31: 40 | AM31: 19.9 | AN31: 10 | AO31: 2.2000000000000002e-002 | AP31: 44 | AQ31: 建工转债!
A32: 308 | B32: 128044 | C32: 岭南转债! | D32: 2717 | E32: 岭南股份 | F32: 城市公用 | G32: 生态环境 | H32: 98.51 | I32: 2.2000000000000001e-003 | J32: -3.4000000000000002e-003 | K32: 3.36 | L32: -2.6099999999999998e-002 | M32: 111.3 | N32: 5.91 | O32: 0.73299999999999998 | P32: 56.85 | Q32: 转股中 | R32: 3.19年 | S32: 1.19年 | T32: 6.59 | U32: 46 | V32: 7.0999999999999994e-002 | W32: 0.128 | X32: 7.2999999999999995e-002 | Y32: 51 | Z32: 1.18 | AA32: 3.9900000000000005e-002 | AB32: 3.2899999999999999e-002 | AC32: 3.2099999999999997e-002 | AD32: 2.7900000000000001e-002 | AE32: 97.21 | AF32: 97.77 | AG32: 0.04 | AH32: AA | AI32: 4.24e-002 | AJ32: =H32+100*O32 -> 171.81 | AK32: 140.2 | AL32: 243 | AM32: 42.4 | AN32: 197 | AO32: 5.2999999999999999e-002 | AP32: 45 | AQ32: 岭南转债!
A33: 119 | B33: 128127 | C33: 文科转债! | D33: 2775 | E33: 文科园林 | F33: 城市公用 | G33: 生态环境 | H33: 99.4 | I33: 1.7000000000000001e-003 | J33: -3.0000000000000001e-003 | K33: 4.4 | L33: -2.3e-003 | M33: 121.3 | N33: 4.88 | O33: 0.10199999999999999 | P33: 90.16 | Q33: 转股中 | R33: 5.21年 | S33: 3.21年 | T33: 9.5 | U33: 18 | V33: 1.9e-002 | W33: 0.42100000000000004 | X33: 0.38 | Y33: 23 | Z33: 0.95 | AA33: 3.9900000000000005e-002 | AB33: 3.2500000000000001e-002 | AC33: 1.43e-002 | AD33: 1.18e-002 | AE33: 84.66 | AF33: 88.33 | AG33: 0.55 | AH33: AA- | AI33: 6.4399999999999999e-002 | AJ33: =H33+100*O33 -> 109.60000000000001 | AK33: 108.6 | AL33: 1 | AM33: 20.3 | AN33: 13 | AO33: -4.2999999999999997e-002 | AP33: 46 | AQ33: 文科转债!
A34: 315 | B34: 123011 | C34: 德尔转债! | D34: 300473 | E34: 德尔股份 | F34: 汽车 | G34: 零部件制 | H34: 103.4 | I34: -2.e-003 | J34: -8.9999999999999998e-004 | K34: 20.5 | L34: -1.9599999999999999e-002 | M34: 116.3 | N34: 31.38 | O34: 0.58299999999999996 | P34: 65.33 | Q34: 转股中 | R34: 3年43天 | S34: 1年44天 | T34: 2.51 | U34: 19 | V34: 7.2000000000000008e-002 | W34: 9.0999999999999998e-002 | X34: 5.9000000000000004e-002 | Y34: 28 | Z34: 1.25 | AA34: 3.9300000000000002e-002 | AB34: 2.9500000000000002e-002 | AC34: -4.5999999999999999e-003 | AD34: -8.8000000000000005e-003 | AE34: 95.06 | AF34: 96.42 | AG34: 0.15 | AH34: AA- | AI34: 6.3399999999999998e-002 | AJ34: =H34+100*O34 -> 161.69999999999999 | AK34: 141.5 | AL34: 250 | AM34: 45 | AN34: 218 | AO34: -2.3e-002 | AP34: 42 | AQ34: 德尔转债!
A35: 109 | B35: 128132 | C35: 交建转债! | D35: 2941 | E35: 新疆交建 | F35: 建筑 | G35: 建筑工程 | H35: 96.172 | I35: 3.2000000000000002e-003 | J35: -3.5999999999999999e-003 | K35: 10.91 | L35: -2.7000000000000001e-003 | M35: 117.3 | N35: 18.57 | O35: 0.63700000000000001 | P35: 58.75 | Q35: 转股中 | R35: 5.28年 | S35: 3.28年 | T35: 8.5 | U35: 5 | V35: 6.0000000000000001e-003 | W35: 0.121 | X35: 7.0999999999999994e-002 | Y35: 70 | Z35: 2.9 | AA35: 3.9100000000000003e-002 | AB35: 3.3000000000000002e-002 | AC35: 2.2599999999999999e-002 | AD35: 2.0400000000000001e-002 | AE35: 89.8 | AF35: 94.16 | AG35: 0.12 | AH35: AA | AI35: 4.3400000000000001e-002 | AJ35: =H35+100*O35 -> 159.87200000000001 | AK35: 133.6 | AL35: 184 | AM35: 39.4 | AN35: 163 | AO35: -5.0000000000000001e-003 | AP35: 19 | AQ35: 交建转债!
A36: 56 | B36: 123088 | C36: 威唐转债! | D36: 300707 | E36: 威唐工业 | F36: 汽车 | G36: 零部件制 | H36: 98.85 | I36: 1.5e-003 | J36: -5.7999999999999996e-003 | K36: 14.94 | L36: -9.300000000000001e-003 | M36: 121.6 | N36: 20.72 | O36: 0.371 | P36: 72.1 | Q36: 17天 | R36: 5.53年 | S36: 3.53年 | T36: 3.01 | U36: 2.5 | V36: 8.0000000000000002e-003 | W36: 0.128 | X36: 9.3000000000000013e-002 | Y36: 23 | Z36: 3.4 | AA36: 3.9100000000000003e-002 | AB36: 3.2000000000000001e-002 | AC36: 1.5600000000000001e-002 | AD36: 1.3100000000000001e-002 | AE36: 80.22 | AF36: 82.15 | AG36: 0.46 | AH36: A+ | AI36: 7.5399999999999995e-002 | AJ36: =H36+100*O36 -> 135.94999999999999 | AK36: 125.6 | AL36: 82 | AM36: 43.4 | AN36: 205 | AO36: 2.e-002 | AP36: 12 | AQ36: 威唐转债!
A37: 299 | B37: 113524 | C37: 奇精转债! | D37: 603677 | E37: 奇精机械 | F37: 家电 | G37: 零部件制 | H37: 103 | I37: 2.8000000000000004e-003 | J37: -6.0000000000000001e-003 | K37: 10.74 | L37: -1.01e-002 | M37: 117.3 | N37: 13.98 | O37: 0.34100000000000003 | P37: 76.82 | Q37: 转股中 | R37: 3.53年 | S37: 1.53年 | T37: 3.3 | U37: 4.3 | V37: 1.3000000000000001e-002 | W37: 0.16 | X37: 0.12300000000000001 | Y37: 21 | Z37: 2.1 | AA37: 3.8300000000000001e-002 | AB37: 2.92e-002 | AC37: -1.1999999999999999e-003 | AD37: -4.4000000000000003e-003 | AE37: 92.71 | AF37: 94.84 | AG37: 0.31 | AH37: AA- | AI37: 6.3399999999999998e-002 | AJ37: =H37+100*O37 -> 137.09999999999999 | AK37: 129.2 | AL37: 130 | AM37: 34.3 | AN37: 114 | AO37: -5.0000000000000001e-003 | AP37: 44 | AQ37: 奇精转债!
A38: 261 | B38: 113027 | C38: 华钰转债!! | D38: 601020 | E38: ST华钰 | F38: 有色金属 | G38: 锌铅镍锡 | H38: 99.26 | I38: -4.5000000000000005e-003 | J38: 6.0000000000000001e-003 | K38: 7.25 | L38: 4.1999999999999997e-003 | M38: 114.9 | N38: 10.17 | O38: 0.39200000000000002 | P38: 71.29 | Q38: 转股中 | R38: 4年9天 | S38: 2年10天 | T38: 3.25 | U38: 60 | V38: 0.18600000000000003 | W38: 8.1000000000000003e-002 | X38: 5.7999999999999996e-002 | Y38: 40 | Z38: 1.62 | AA38: 3.7900000000000003e-002 | AB38: 3.0800000000000001e-002 | AC38: 1.9e-002 | AD38: 1.5900000000000001e-002 | AE38: 86.76 | AF38: 83.57 | AG38: 0.35 | AH38: A | AI38: 8.4399999999999989e-002 | AJ38: =H38+100*O38 -> 138.46000000000001 | AK38: 127.2 | AL38: 102 | AM38: 40.5 | AN38: 172 | AO38: 5.2000000000000005e-002 | AP38: 46 | AQ38: 华钰转债!!
A39: 318 | B39: 123010 | C39: 博世转债! | D39: 300422 | E39: 博世科 | F39: 城市公用 | G39: 三废处理 | H39: 100.45 | I39: -3.5999999999999999e-003 | J39: 3.2000000000000002e-003 | K39: 8.62 | L39: -2.3e-003 | M39: 112.3 | N39: 12.2 | O39: 0.42200000000000004 | P39: 70.66 | Q39: 转股中 | R39: 3年30天 | S39: 1年31天 | T39: 4.3 | U39: 1.6 | V39: 4.0000000000000001e-003 | W39: 0.12300000000000001 | X39: 8.6999999999999994e-002 | Y39: 35 | Z39: 1.44 | AA39: 3.7699999999999997e-002 | AB39: 2.9999999999999999e-002 | AC39: 1.89e-002 | AD39: 1.43e-002 | AE39: 95.27 | AF39: 93.33 | AG39: 0.19 | AH39: AA- | AI39: 6.3399999999999998e-002 | AJ39: =H39+100*O39 -> 142.65000000000001 | AK39: 130.2 | AL39: 143 | AM39: 35 | AN39: 121 | AO39: 1.6e-002 | AP39: 30 | AQ39: 博世转债!
A40: 259 | B40: 128069 | C40: 华森转债! | D40: 2907 | E40: 华森制药 | F40: 医药 | G40: 化学制药 | H40: 103.7 | I40: 0. | J40: -1.9e-003 | K40: 12.57 | L40: -7.9000000000000008e-003 | M40: 120 | N40: 18.04 | O40: 0.48799999999999999 | P40: 69.68 | Q40: 转股中 | R40: 4年19天 | S40: 2年20天 | T40: 3 | U40: 11 | V40: 3.6000000000000004e-002 | W40: 5.9000000000000004e-002 | X40: 4.0999999999999995e-002 | Y40: 50 | Z40: 4.44 | AA40: 3.7499999999999999e-002 | AB40: 2.86e-002 | AC40: -8.9999999999999998e-004 | AD40: -4.0000000000000001e-003 | AE40: 90.45 | AF40: 94.08 | AG40: 0.24 | AH40: AA- | AI40: 6.3399999999999998e-002 | AJ40: =H40+100*O40 -> 152.5 | AK40: 137.7 | AL40: 218 | AM40: 43.6 | AN40: 207 | AO40: -6.0000000000000001e-003 | AP40: 45 | AQ40: 华森转债!
A41: 282 | B41: 123023 | C41: 迪森转债! | D41: 300335 | E41: 迪森股份 | F41: 能源电力 | G41: 电力供应 | H41: 100.401 | I41: -8.8999999999999999e-003 | J41: 3.4999999999999996e-003 | K41: 5.09 | L41: -2.4900000000000002e-002 | M41: 114.3 | N41: 7.04 | O41: 0.38900000000000001 | P41: 72.3 | Q41: 转股中 | R41: 3.79年 | S41: 2.79年 | T41: 5.29 | U41: 25 | V41: 4.5999999999999999e-002 | W41: 0.27899999999999997 | X41: 0.20100000000000001 | Y41: 19 | Z41: 1.36 | AA41: 3.5499999999999997e-002 | AB41: 2.8300000000000002e-002 | AC41: 1.43e-002 | AD41: 1.11e-002 | AE41: 92.69 | AF41: 97.94 | AG41: 0.21 | AH41: AA | AI41: 4.24e-002 | AJ41: =H41+100*O41 -> 139.30099999999999 | AK41: 128.5 | AL41: 120 | AM41: 30.6 | AN41: 71 | AO41: 5.0000000000000003e-002 | AP41: 50 | AQ41: 迪森转债!
A42: 162 | B42: 123054 | C42: 思特转债! | D42: 300608 | E42: 思特奇 | F42: 通信互联 | G42: 通信设备 | H42: 102.973 | I42: -1.e-004 | J42: -8.0000000000000004e-004 | K42: 9.83 | L42: -2.e-003 | M42: 121.7 | N42: 12.63 | O42: 0.32299999999999995 | P42: 77.83 | Q42: 转股中 | R42: 5年5.1天 | S42: 3年6.1天 | T42: 2.71 | U42: 5.3 | V42: 1.9e-002 | W42: 0.13500000000000001 | X42: 0.105 | Y42: 20 | Z42: 2.02 | AA42: 3.4799999999999998e-002 | AB42: 2.7000000000000003e-002 | AC42: 5.1000000000000004e-003 | AD42: 2.2000000000000001e-003 | AE42: 86.02 | AF42: 89.74 | AG42: 0.42 | AH42: AA- | AI42: 6.4399999999999999e-002 | AJ42: =H42+100*O42 -> 135.273 | AK42: 128.1 | AL42: 114 | AM42: 38.4 | AN42: 153 | AO42: -0.14800000000000002 | AP42: 21 | AQ42: 思特转债!
A43: 242 | B43: 113546 | C43: 迪贝转债! | D43: 603320 | E43: 迪贝电气 | F43: 家电 | G43: 零部件制 | H43: 104.24 | I43: -2.0000000000000001e-004 | J43: 9.300000000000001e-003 | K43: 11.36 | L43: 1.9699999999999999e-002 | M43: 120.6 | N43: 14 | O43: 0.28499999999999998 | P43: 81.14 | Q43: 转股中 | R43: 4.38年 | S43: 2.39年 | T43: 2.3 | U43: 3 | V43: 1.2e-002 | W43: 0.156 | X43: 0.126 | Y43: 15 | Z43: 2.13 | AA43: 3.4599999999999999e-002 | AB43: 2.6099999999999998e-002 | AC43: -1.1999999999999999e-003 | AD43: -4.1999999999999997e-003 | AE43: 86.75 | AF43: 88.73 | AG43: 0.46 | AH43: A+ | AI43: 7.4400000000000008e-002 | AJ43: =H43+100*O43 -> 132.73999999999998 | AK43: 127.3 | AL43: 103 | AM43: 38.6 | AN43: 155 | AO43: 2.2000000000000002e-002 | AP43: 39 | AQ43: 迪贝转债!
A44: 319 | B44: 127007 | C44: 湖广转债! | D44: 665 | E44: 湖北广电 | F44: 传媒娱乐 | G44: 影视娱乐 | H44: 101.45 | I44: 1.6000000000000001e-003 | J44: -4.5000000000000005e-003 | K44: 3.98 | L44: -1.9699999999999999e-002 | M44: 112.3 | N44: 5.58 | O44: 0.42200000000000004 | P44: 71.33 | Q44: 转股中 | R44: 3年23天 | S44: 1年24天 | T44: 12.2 | U44: 6.6 | V44: 5.0000000000000001e-003 | W44: 0.311 | X44: 0.222 | Y44: 39 | Z44: 0.67 | AA44: 3.4500000000000003e-002 | AB44: 2.6800000000000001e-002 | AC44: 1.09e-002 | AD44: 6.4000000000000003e-003 | AE44: 98.07 | AF44: 100.03 | AG44: 0.15 | AH44: AA+ | AI44: 3.9399999999999998e-002 | AJ44: =H44+100*O44 -> 143.65000000000001 | AK44: 131.6 | AL44: 160 | AM44: 31.5 | AN44: 81 | AO44: -9.0000000000000011e-003 | AP44: 17 | AQ44: 湖广转债!
A45: 144 | B45: 123059 | C45: 银信转债! | D45: 300231 | E45: 银信科技 | F45: 计算机及 | G45: 软件开发 | H45: 104.794 | I45: -1.7000000000000001e-003 | J45: 5.9999999999999995e-004 | K45: 7.77 | L45: -2.5999999999999999e-003 | M45: 124.1 | N45: 9.72 | O45: 0.311 | P45: 79.94 | Q45: 转股中 | R45: 5年40天 | S45: 3年41天 | T45: 3.91 | U45: 4 | V45: 1.e-002 | W45: 0.114 | X45: 9.0999999999999998e-002 | Y45: 34 | Z45: 2.52 | AA45: 3.44e-002 | AB45: 2.6099999999999998e-002 | AC45: -2.3e-003 | AD45: -4.6999999999999993e-003 | AE45: 84.99 | AF45: 90.86 | AG45: 0.43 | AH45: AA- | AI45: 6.4399999999999999e-002 | AJ45: =H45+100*O45 -> 135.89400000000001 | AK45: 129.6 | AL45: 133 | AM45: 38.8 | AN45: 156 | AO45: 3.5000000000000003e-002 | AP45: 15 | AQ45: 银信转债!
A46: 303 | B46: 128049 | C46: 华源转债! | D46: 2787 | E46: 华源控股 | F46: 造纸包装 | G46: 包装材料 | H46: 102.052 | I46: 3.5999999999999999e-003 | J46: -4.1999999999999997e-003 | K46: 5.79 | L46: -1.7000000000000001e-003 | M46: 114.5 | N46: 7.42 | O46: 0.308 | P46: 78.03 | Q46: 转股中 | R46: 3.48年 | S46: 1.48年 | T46: 3.63 | U46: 1.3 | V46: 4.0000000000000001e-003 | W46: 0.19800000000000001 | X46: 0.155 | Y46: 18 | Z46: 1.22 | AA46: 3.4300000000000004e-002 | AB46: 2.6499999999999999e-002 | AC46: 4.6999999999999993e-003 | AD46: 1.2999999999999999e-003 | AE46: 93 | AF46: 92.86 | AG46: 0.35 | AH46: AA- | AI46: 6.3399999999999998e-002 | AJ46: =H46+100*O46 -> 132.852 | AK46: 126.1 | AL46: 88 | AM46: 33.1 | AN46: 100 | AO46: 6.9999999999999993e-003 | AP46: 44 | AQ46: 华源转债!
A47: 252 | B47: 128072 | C47: 翔鹭转债! | D47: 2842 | E47: 翔鹭钨业 | F47: 有色金属 | G47: 小金属 | H47: 100.288 | I47: -1.6000000000000001e-003 | J47: -1.e-004 | K47: 9.28 | L47: -8.5000000000000006e-003 | M47: 115.1 | N47: 15.34 | O47: 0.65799999999999992 | P47: 60.5 | Q47: 转股中 | R47: 4.21年 | S47: 2.21年 | T47: 3.02 | U47: 4.2 | V47: 1.3999999999999999e-002 | W47: 0.11900000000000001 | X47: 7.2000000000000008e-002 | Y47: 25 | Z47: 2.72 | AA47: 3.4000000000000002e-002 | AB47: 2.7300000000000001e-002 | AC47: 1.32e-002 | AD47: 1.03e-002 | AE47: 89.52 | AF47: 89.38 | AG47: 0.2 | AH47: AA- | AI47: 6.3399999999999998e-002 | AJ47: =H47+100*O47 -> 166.08799999999999 | AK47: 140.1 | AL47: 241 | AM47: 50.6 | AN47: 248 | AO47: -5.4000000000000006e-002 | AP47: 29 | AQ47: 翔鹭转债!
A48: 341 | B48: 123004 | C48: 铁汉转债! | D48: 300197 | E48: 节能铁汉 | F48: 城市公用 | G48: 生态环境 | H48: 100.152 | I48: -2.9999999999999997e-004 | J48: -2.2000000000000001e-003 | K48: 2.99 | L48: -1.32e-002 | M48: 108.8 | N48: 3.82 | O48: 0.28000000000000003 | P48: 78.27 | Q48: 转股中 | R48: 2.54年 | S48: 0.54年 | T48: 8.03 | U48: 7 | V48: 9.0000000000000011e-003 | W48: 9.5000000000000001e-002 | X48: 7.400000000000001e-002 | Y48: 84 | Z48: 1.29 | AA48: 3.3700000000000001e-002 | AB48: 2.69e-002 | AC48: 1.9900000000000001e-002 | AD48: 1.55e-002 | AE48: 98.74 | AF48: 98.49 | AG48: 0.19 | AH48: AA | AI48: 4.0599999999999997e-002 | AJ48: =H48+100*O48 -> 128.15200000000002 | AK48: 122 | AL48: 52 | AM48: 23.3 | AN48: 20 | AO48: -4.0000000000000001e-003 | AP48: 45 | AQ48: 铁汉转债!
A49: 266 | B49: 128066 | C49: 亚泰转债! | D49: 2811 | E49: 郑中设计 | F49: 建筑 | G49: 装饰工程 | H49: 102.972 | I49: -3.4999999999999996e-003 | J49: -6.0999999999999995e-003 | K49: 8.46 | L49: -2.0799999999999999e-002 | M49: 116.7 | N49: 9.67 | O49: 0.17699999999999999 | P49: 87.49 | Q49: 转股中 | R49: 3.87年 | S49: 1.87年 | T49: 4.8 | U49: 5.9 | V49: 1.2e-002 | W49: 0.20999999999999999 | X49: 0.184 | Y49: 23 | Z49: 1.54 | AA49: 3.3599999999999998e-002 | AB49: 2.5600000000000001e-002 | AC49: 2.9999999999999997e-004 | AD49: -2.5999999999999999e-003 | AE49: 91.01 | AF49: 92.45 | AG49: 0.46 | AH49: AA- | AI49: 6.3399999999999998e-002 | AJ49: =H49+100*O49 -> 120.672 | AK49: 118.5 | AL49: 26 | AM49: 26 | AN49: 28 | AO49: 1.e-002 | AP49: 61 | AQ49: 亚泰转债!
A50: 156 | B50: 113589 | C50: 天创转债! | D50: 603608 | E50: 天创时尚 | F50: 服装纺织 | G50: 鞋服行业 | H50: 98.21 | I50: 2.8900000000000002e-002 | J50: -1.3000000000000001e-002 | K50: 7.65 | L50: 0.10099999999999999 | M50: 115.3 | N50: 12.44 | O50: 0.59699999999999998 | P50: 61.5 | Q50: 转股中 | R50: 5年19天 | S50: 3年20天 | T50: 6 | U50: 410 | V50: 0.69200000000000006 | W50: 0.183 | X50: 0.11199999999999999 | Y50: 33 | Z50: 2.02 | AA50: 3.3000000000000002e-002 | AB50: 2.7300000000000001e-002 | AC50: 1.7500000000000002e-002 | AD50: 1.52e-002 | AE50: 90.67 | AF50: 93.46 | AG50: 0.16 | AH50: AA | AI50: 4.3400000000000001e-002 | AJ50: =H50+100*O50 -> 157.91 | AK50: 134.9 | AL50: 200 | AM50: 41.5 | AN50: 189 | AO50: 0.14699999999999999 | AP50: 27 | AQ50: 天创转债!
A51: 78 | B51: 123076 | C51: 强力转债! | D51: 300429 | E51: 强力新材 | F51: 化工 | G51: 化工 | H51: 99.715 | I51: -1.e-003 | J51: 4.4000000000000003e-003 | K51: 12.26 | L51: 1.1599999999999999e-002 | M51: 118.5 | N51: 18.98 | O51: 0.54400000000000004 | P51: 64.59 | Q51: 转股中 | R51: 5.46年 | S51: 3.46年 | T51: 8.5 | U51: 32 | V51: 3.7999999999999999e-002 | W51: 0.13500000000000001 | X51: 8.6999999999999994e-002 | Y51: 63 | Z51: 3.58 | AA51: 3.2799999999999996e-002 | AB51: 2.6600000000000002e-002 | AC51: 1.1299999999999999e-002 | AD51: 9.1999999999999998e-003 | AE51: 83 | AF51: 84.88 | AG51: 0.3 | AH51: AA- | AI51: 6.4399999999999999e-002 | AJ51: =H51+100*O51 -> 154.11500000000001 | AK51: 134.8 | AL51: 198 | AM51: 50 | AN51: 244 | AO51: 9.4e-002 | AP51: 15 | AQ51: 强力转债!
A52: 117 | B52: 113601 | C52: 塞力转债! | D52: 603716 | E52: 塞力医疗 | F52: 医药 | G52: 医药商业 | H52: 103.25 | I52: 4.0199999999999993e-002 | J52: 1.26e-002 | K52: 14.76 | L52: 9.9900000000000003e-002 | M52: 121.3 | N52: 16.98 | O52: 0.188 | P52: 86.93 | Q52: 转股中 | R52: 5.21年 | S52: 3.21年 | T52: 5.43 | U52: 131 | V52: 0.23399999999999999 | W52: 0.17899999999999999 | X52: 0.156 | Y52: 30 | Z52: 1.94 | AA52: 3.2199999999999999e-002 | AB52: 2.4799999999999999e-002 | AC52: 2.8000000000000004e-003 | AD52: 4.0000000000000002e-004 | AE52: 84.64 | AF52: 88.31 | AG52: 0.53 | AH52: AA- | AI52: 6.4399999999999999e-002 | AJ52: =H52+100*O52 -> 122.05 | AK52: 119.6 | AL52: 29 | AM52: 31.3 | AN52: 78 | AO52: 9.8000000000000004e-002 | AP52: 37 | AQ52: 塞力转债!
A53: 175 | B53: 113578 | C53: 全筑转债! | D53: 603030 | E53: 全筑股份 | F53: 建筑 | G53: 装饰工程 | H53: 101.33 | I53: -2.5999999999999999e-003 | J53: 2.9999999999999997e-004 | K53: 4.36 | L53: -6.8000000000000005e-003 | M53: 117.9 | N53: 5.43 | O53: 0.26200000000000001 | P53: 80.29 | Q53: 转股中 | R53: 4.87年 | S53: 2.88年 | T53: 3.84 | U53: 9.6 | V53: 2.5000000000000001e-002 | W53: 0.16399999999999998 | X53: 0.13100000000000001 | Y53: 23 | Z53: 1.03 | AA53: 3.2099999999999997e-002 | AB53: 2.5399999999999999e-002 | AC53: 6.7000000000000002e-003 | AD53: 4.5000000000000005e-003 | AE53: 91.22 | AF53: 96.65 | AG53: 0.33 | AH53: AA | AI53: 4.24e-002 | AJ53: =H53+100*O53 -> 127.53 | AK53: 122.4 | AL53: 56 | AM53: 25.7 | AN53: 26 | AO53: -9.0000000000000011e-003 | AP53: 19 | AQ53: 全筑转债!
A54: 124 | B54: 113599 | C54: 嘉友转债! | D54: 603871 | E54: 嘉友国际 | F54: 交通运输 | G54: 物流业 | H54: 107.5 | I54: -5.5000000000000005e-003 | J54: 5.1999999999999998e-003 | K54: 23.32 | L54: -4.0000000000000002e-004 | M54: 126 | N54: 24.82 | O54: 0.14400000000000002 | P54: 93.96 | Q54: 转股中 | R54: 5.17年 | S54: 3.17年 | T54: 7.2 | U54: 5 | V54: 6.0000000000000001e-003 | W54: 0.14099999999999999 | X54: 0.13200000000000001 | Y54: 51 | Z54: 2.38 | AA54: 3.1899999999999998e-002 | AB54: 2.3199999999999998e-002 | AC54: -1.0200000000000001e-002 | AD54: -1.24e-002 | AE54: 84.59 | AF54: 91.89 | AG54: 0.54 | AH54: AA- | AI54: 6.4399999999999999e-002 | AJ54: =H54+100*O54 -> 121.90000000000001 | AK54: 121 | AL54: 43 | AM54: 29.2 | AN54: 54 | AO54: -2.e-002 | AP54: 19 | AQ54: 嘉友转债!
A55: 360 | B55: 128013 | C55: 洪涛转债! | D55: 2325 | E55: 洪涛股份 | F55: 建筑 | G55: 装饰工程 | H55: 105.969 | I55: -3.2000000000000002e-003 | J55: -2.3e-003 | K55: 2.33 | L55: -1.2699999999999999e-002 | M55: 109.8 | N55: 2.32 | O55: 5.5e-002 | P55: 100.43 | Q55: 转股中 | R55: 1年55天 | S55: 回售内 | T55: 11.6 | U55: 11 | V55: 9.0000000000000011e-003 | W55: 0.39600000000000002 | X55: 0.39700000000000002 | Y55: 29 | Z55: 1.08 | AA55: 3.1800000000000002e-002 | AB55: 1.55e-002 | AC55: 回售内 | AD55: 回售内 | AE55: 100.3 | AF55: 102.61 | AG55: 0.44 | AH55: AA- | AI55: 6.1600000000000002e-002 | AJ55: =H55+100*O55 -> 111.46899999999999 | AK55: 111.5 | AL55: 5 | AM55: 8.9 | AN55: 1 | AO55: -1.e-003 | AP55: 91 | AQ55: 洪涛转债!
A56: 268 | B56: 127013 | C56: 创维转债! | D56: 810 | E56: 创维数字 | F56: 电子 | G56: 电子产品 | H56: 104.4 | I56: 3.8e-003 | J56: -1.1999999999999999e-003 | K56: 8.57 | L56: 1.3000000000000001e-002 | M56: 117.3 | N56: 11.39 | O56: 0.38799999999999996 | P56: 75.24 | Q56: 转股中 | R56: 3.86年 | S56: 1.86年 | T56: 9.78 | U56: 8 | V56: 8.0000000000000002e-003 | W56: 0.107 | X56: 8.1000000000000003e-002 | Y56: 91 | Z56: 2.16 | AA56: 3.1200000000000002e-002 | AB56: 2.3e-002 | AC56: -7.6e-003 | AD56: -1.03e-002 | AE56: 94.55 | AF56: 100.2 | AG56: 0.2 | AH56: AA | AI56: 4.24e-002 | AJ56: =H56+100*O56 -> 143.19999999999999 | AK56: 133.6 | AL56: 183 | AM56: 33.4 | AN56: 101 | AO56: 1.9e-002 | AP56: 23 | AQ56: 创维转债!
A57: 157 | B57: 123056 | C57: 雪榕转债! | D57: 300511 | E57: 雪榕生物 | F57: 农业 | G57: 种植业 | H57: 104.101 | I57: 5.6999999999999993e-003 | J57: 6.0000000000000001e-003 | K57: 9.11 | L57: 2.8199999999999999e-002 | M57: 121.1 | N57: 11.77 | O57: 0.34499999999999997 | P57: 77.4 | Q57: 转股中 | R57: 5年19天 | S57: 3年20天 | T57: 5.84 | U57: 12 | V57: 1.9e-002 | W57: 0.14499999999999999 | X57: 0.11199999999999999 | Y57: 40 | Z57: 1.94 | AA57: 3.1099999999999999e-002 | AB57: 2.3599999999999999e-002 | AC57: -2.0000000000000001e-004 | AD57: -2.7000000000000001e-003 | AE57: 85.29 | AF57: 89 | AG57: 0.41 | AH57: AA- | AI57: 6.4399999999999999e-002 | AJ57: =H57+100*O57 -> 138.601 | AK57: 130.8 | AL57: 146 | AM57: 41.8 | AN57: 191 | AO57: 3.4000000000000002e-002 | AP57: 16 | AQ57: 雪榕转债!
A58: 240 | B58: 110059 | C58: 浦发转债! | D58: 600000 | E58: 浦发银行 | F58: 金融 | G58: 银行行业 | H58: 103.26 | I58: 0. | J58: 0. | K58: 10.23 | L58: 0. | M58: 117.6 | N58: 14.45 | O58: 0.45899999999999996 | P58: 70.8 | Q58: 转股中 | R58: 4.40年 | S58: 无权 | T58: 500 | U58: 103 | V58: 2.e-003 | W58: 0.16699999999999998 | X58: 0.11800000000000001 | Y58: 3003. | Z58: 0.55 | AA58: 3.0899999999999997e-002 | AB58: 2.35e-002 | AC58: 无权 | AD58: 无权 | AE58: 无权 | AF58: 100.55 | AG58: 0.19 | AH58: AAA | AI58: 3.7400000000000003e-002 | AJ58: =H58+100*O58 -> 149.16 | AK58: 135.7 | AL58: 205 | AM58: 35.2 | AN58: 124 | AO58: 5.0000000000000001e-003 | AP58: 64 | AQ58: 浦发转债!
A59: 29 | B59: 113620 | C59: 傲农转债! | D59: 603363 | E59: 傲农生物 | F59: 农业 | G59: 畜牧业 | H59: 102 | I59: 0. | J59: 8.0000000000000004e-004 | K59: 10.8 | L59: 2.8000000000000004e-003 | M59: 121.1 | N59: 14.66 | O59: 0.38500000000000001 | P59: 73.67 | Q59: 3月14天 | R59: 5.76年 | S59: 3.76年 | T59: 10 | U59: 5.4 | V59: 5.0000000000000001e-003 | W59: 0.13500000000000001 | X59: 0.10000000000000001 | Y59: 74 | Z59: 2.51 | AA59: 3.0800000000000001e-002 | AB59: 2.4199999999999999e-002 | AC59: 4.0000000000000001e-003 | AD59: 2.2000000000000001e-003 | AE59: 87.79 | AF59: 95.19 | AG59: 0.29 | AH59: AA | AI59: 4.3400000000000001e-002 | AJ59: =H59+100*O59 -> 140.5 | AK59: 130.3 | AL59: 145 | AM59: 35.1 | AN59: 123 | AO59: -2.6000000000000002e-002 | AP59: 5 | AQ59: 傲农转债!
A60: 187 | B60: 127016 | C60: 鲁泰转债! | D60: 726 | E60: 鲁 泰Ａ | F60: 服装纺织 | G60: 纺织行业 | H60: 100.375 | I60: -3.4999999999999996e-003 | J60: 1.1999999999999999e-003 | K60: 6.29 | L60: -1.1000000000000001e-002 | M60: 115.9 | N60: 8.91 | O60: 0.42200000000000004 | P60: 70.59 | Q60: 转股中 | R60: 4.84年 | S60: 2.85年 | T60: 14 | U60: 2.6 | V60: 2.e-003 | W60: 0.25900000000000001 | X60: 0.183 | Y60: 54 | Z60: 0.7 | AA60: 3.0699999999999998e-002 | AB60: 2.46e-002 | AC60: 1.e-002 | AD60: 7.8000000000000005e-003 | AE60: 92.13 | AF60: 96.45 | AG60: 0.21 | AH60: AA+ | AI60: 3.9399999999999998e-002 | AJ60: =H60+100*O60 -> 142.57499999999999 | AK60: 130.2 | AL60: 138 | AM60: 33.7 | AN60: 106 | AO60: 4.0000000000000001e-003 | AP60: 22 | AQ60: 鲁泰转债!
A61: 166 | B61: 113584 | C61: 家悦转债! | D61: 603708 | E61: 家家悦 | F61: 商业零售 | G61: 超市 | H61: 99.43 | I61: -5.4000000000000003e-003 | J61: 5.6999999999999993e-003 | K61: 19.38 | L61: 5.6999999999999993e-003 | M61: 115.3 | N61: 37.97 | O61: 0.94799999999999995 | P61: 51.04 | Q61: 转股中 | R61: 5年0.1天 | S61: 3年1.1天 | T61: 6.45 | U61: 7.3 | V61: 1.1000000000000001e-002 | W61: 5.5e-002 | X61: 2.7999999999999997e-002 | Y61: 118 | Z61: 4.19 | AA61: 3.0699999999999998e-002 | AB61: 2.5000000000000001e-002 | AC61: 1.38e-002 | AD61: 1.1399999999999999e-002 | AE61: 90.87 | AF61: 93.67 | AG61: 0.06 | AH61: AA | AI61: 4.3400000000000001e-002 | AJ61: =H61+100*O61 -> 194.23000000000002 | AK61: 147.8 | AL61: 281 | AM61: 54.1 | AN61: 268 | AO61: 6.6000000000000003e-002 | AP61: 12 | AQ61: 家悦转债!
A62: 37 | B62: 123096 | C62: 思创转债! | D62: 300078 | E62: 思创医惠 | F62: 通信互联 | G62: 物联网 | H62: 105 | I62: 2.7000000000000001e-003 | J62: -5.0000000000000001e-004 | K62: 6.72 | L62: 4.5000000000000005e-003 | M62: 124 | N62: 8.27 | O62: 0.29199999999999998 | P62: 81.26 | Q62: 59天 | R62: 5.64年 | S62: 3.65年 | T62: 8.17 | U62: 3.2 | V62: 4.0000000000000001e-003 | W62: 0.14000000000000001 | X62: 0.114 | Y62: 58 | Z62: 1.96 | AA62: 3.0499999999999999e-002 | AB62: 2.3099999999999999e-002 | AC62: -2.7000000000000001e-003 | AD62: -4.6999999999999993e-003 | AE62: 82.11 | AF62: 87.79 | AG62: 0.48 | AH62: AA- | AI62: 6.4399999999999999e-002 | AJ62: =H62+100*O62 -> 134.19999999999999 | AK62: 128.7 | AL62: 125 | AM62: 41 | AN62: 181 | AO62: -1.8000000000000002e-002 | AP62: 5 | AQ62: 思创转债!
A63: 206 | B63: 113566 | C63: 翔港转债! | D63: 603499 | E63: 翔港科技 | F63: 造纸包装 | G63: 包装材料 | H63: 107.94 | I63: -9.300000000000001e-003 | J63: 4.7999999999999996e-003 | K63: 8.03 | L63: -1.11e-002 | M63: 124 | N63: 10.77 | O63: 0.44799999999999995 | P63: 74.56 | Q63: 转股中 | R63: 4.73年 | S63: 2.74年 | T63: 1.61 | U63: 34 | V63: 0.19699999999999998 | W63: 0.10000000000000001 | X63: 7.400000000000001e-002 | Y63: 16 | Z63: 2.85 | AA63: 3.04e-002 | AB63: 2.1600000000000001e-002 | AC63: -1.23e-002 | AD63: -1.4999999999999999e-002 | AE63: 84.79 | AF63: 88.97 | AG63: 0.4 | AH63: A+ | AI63: 7.4400000000000008e-002 | AJ63: =H63+100*O63 -> 152.74000000000001 | AK63: 141.3 | AL63: 249 | AM63: 52.3 | AN63: 256 | AO63: -1.e-003 | AP63: 29 | AQ63: 翔港转债!
A64: 290 | B64: 113021 | C64: 中信转债! | D64: 601998 | E64: 中信银行 | F64: 金融 | G64: 银行行业 | H64: 105.93 | I64: -2.9999999999999997e-004 | J64: 1.e-003 | K64: 5.24 | L64: 3.8e-003 | M64: 118 | N64: 6.98 | O64: 0.41100000000000003 | P64: 75.07 | Q64: 转股中 | R64: 3.75年 | S64: 无权 | T64: 400 | U64: 123 | V64: 3.0000000000000001e-003 | W64: 0.156 | X64: 0.11699999999999999 | Y64: 2564. | Z64: 0.53 | AA64: 3.0099999999999998e-002 | AB64: 2.12e-002 | AC64: 无权 | AD64: 无权 | AE64: 无权 | AF64: 103.24 | AG64: 0.2 | AH64: AAA | AI64: 3.7400000000000003e-002 | AJ64: =H64+100*O64 -> 147.03 | AK64: 136.8 | AL64: 212 | AM64: 33.6 | AN64: 104 | AO64: -8.0000000000000002e-003 | AP64: 45 | AQ64: 中信转债!
A65: 275 | B65: 113532 | C65: 海环转债! | D65: 603817 | E65: XD海峡环 | F65: 城市公用 | G65: 三废处理 | H65: 100.45 | I65: -7.000000000000001e-004 | J65: -2.8999999999999998e-003 | K65: 5.79 | L65: -1.3600000000000001e-002 | M65: 112.3 | N65: 7.63 | O65: 0.32400000000000001 | P65: 75.88 | Q65: 转股中 | R65: 3.82年 | S65: 1.83年 | T65: 4.59 | U65: 3 | V65: 6.0000000000000001e-003 | W65: 0.17600000000000002 | X65: 0.13400000000000001 | Y65: 26 | Z65: 1.47 | AA65: 3.0099999999999998e-002 | AB65: 2.4e-002 | AC65: 1.1699999999999999e-002 | AD65: 8.8999999999999999e-003 | AE65: 94.69 | AF65: 96.09 | AG65: 0.26 | AH65: AA | AI65: 4.24e-002 | AJ65: =H65+100*O65 -> 132.84999999999999 | AK65: 125 | AL65: 76 | AM65: 28.9 | AN65: 52 | AO65: -2.1000000000000001e-002 | AP65: 26 | AQ65: 海环转债!
A66: 188 | B66: 113033 | C66: 利群转债! | D66: 601366 | E66: 利群股份 | F66: 商业零售 | G66: 商场 | H66: 99.97 | I66: 5.9999999999999995e-004 | J66: -1.2999999999999999e-003 | K66: 6.21 | L66: -1.6000000000000001e-003 | M66: 114.9 | N66: 7.01 | O66: 0.128 | P66: 88.59 | Q66: 转股中 | R66: 4.82年 | S66: 2.82年 | T66: 18 | U66: 17 | V66: 9.0000000000000011e-003 | W66: 0.33700000000000002 | X66: 0.29799999999999999 | Y66: 53 | Z66: 1.15 | AA66: 2.98e-002 | AB66: 2.41e-002 | AC66: 1.1399999999999999e-002 | AD66: 9.1999999999999998e-003 | AE66: 91.42 | AF66: 94.41 | AG66: 0.45 | AH66: AA | AI66: 4.24e-002 | AJ66: =H66+100*O66 -> 112.77 | AK66: 111.4 | AL66: 4 | AM66: 16.9 | AN66: 6 | AO66: -4.0000000000000001e-003 | AP66: 56 | AQ66: 利群转债!
A67: 267 | B67: 110058 | C67: 永鼎转债! | D67: 600105 | E67: 永鼎股份 | F67: 通信互联 | G67: 通信设备 | H67: 102.3 | I67: 4.8999999999999998e-003 | J67: 3.0000000000000001e-003 | K67: 3.68 | L67: 3.6600000000000001e-002 | M67: 114.3 | N67: 5.04 | O67: 0.40100000000000002 | P67: 73.02 | Q67: 转股中 | R67: 3.86年 | S67: 1.87年 | T67: 2.61 | U67: 20 | V67: 7.5999999999999998e-002 | W67: 5.0999999999999997e-002 | X67: 3.7999999999999999e-002 | Y67: 51 | Z67: 1.82 | AA67: 2.9700000000000001e-002 | AB67: 2.2700000000000001e-002 | AC67: 2.3999999999999998e-003 | AD67: -2.9999999999999997e-004 | AE67: 94.54 | AF67: 97.64 | AG67: 0.22 | AH67: AA | AI67: 4.24e-002 | AJ67: =H67+100*O67 -> 142.40000000000001 | AK67: 131.6 | AL67: 161 | AM67: 33.9 | AN67: 108 | AO67: 5.0000000000000003e-002 | AP67: 48 | AQ67: 永鼎转债!
A68: 292 | B68: 128056 | C68: 今飞转债! | D68: 2863 | E68: 今飞凯达 | F68: 汽车 | G68: 零部件制 | H68: 108.1 | I68: 5.0000000000000001e-004 | J68: 1.7000000000000001e-003 | K68: 5.2 | L68: 5.7999999999999996e-003 | M68: 120.2 | N68: 6.7 | O68: 0.39299999999999996 | P68: 77.61 | Q68: 转股中 | R68: 3.74年 | S68: 1.74年 | T68: 1.72 | U68: 3.3 | V68: 1.8000000000000002e-002 | W68: 6.6000000000000003e-002 | X68: 5.0999999999999997e-002 | Y68: 26 | Z68: 1.39 | AA68: 2.9399999999999999e-002 | AB68: 1.9799999999999998e-002 | AC68: -2.3399999999999997e-002 | AD68: -2.6800000000000001e-002 | AE68: 90.28 | AF68: 92.47 | AG68: 0.36 | AH68: A+ | AI68: 7.4400000000000008e-002 | AJ68: =H68+100*O68 -> 147.39999999999998 | AK68: 138.6 | AL68: 227 | AM68: 46.1 | AN68: 225 | AO68: 2.2000000000000002e-002 | AP68: 53 | AQ68: 今飞转债!
A69: 39 | B69: 113042 | C69: 上银转债! | D69: 601229 | E69: 上海银行 | F69: 金融 | G69: 银行行业 | H69: 103.19 | I69: 4.0000000000000002e-004 | J69: -4.0000000000000002e-004 | K69: 8.59 | L69: 0. | M69: 120.9 | N69: 11.03 | O69: 0.32500000000000001 | P69: 77.88 | Q69: 55天 | R69: 5.64年 | S69: 无权 | T69: 200 | U69: 82 | V69: 4.0000000000000001e-003 | W69: 0.16399999999999998 | X69: 0.128 | Y69: 1220. | Z69: 0.7 | AA69: 2.9300000000000003e-002 | AB69: 2.2599999999999999e-002 | AC69: 无权 | AD69: 无权 | AE69: 无权 | AF69: 98.33 | AG69: 0.33 | AH69: AAA | AI69: 3.8399999999999997e-002 | AJ69: =H69+100*O69 -> 135.69 | AK69: 128.5 | AL69: 121 | AM69: 30.2 | AN69: 65 | AO69: 2.5000000000000001e-002 | AP69: 12 | AQ69: 上银转债!
A70: 149 | B70: 113036 | C70: 宁建转债! | D70: 601789 | E70: 宁波建工 | F70: 建筑 | G70: 建筑工程 | H70: 101.66 | I70: 1.8e-003 | J70: -3.4999999999999996e-003 | K70: 3.79 | L70: -5.1999999999999998e-003 | M70: 117.3 | N70: 4.86 | O70: 0.30399999999999999 | P70: 77.98 | Q70: 转股中 | R70: 5年31天 | S70: 3年32天 | T70: 5.4 | U70: 3.7 | V70: 6.9999999999999993e-003 | W70: 0.14599999999999999 | X70: 0.114 | Y70: 37 | Z70: 1.18 | AA70: 2.92e-002 | AB70: 2.29e-002 | AC70: 6.5000000000000006e-003 | AD70: 4.1999999999999997e-003 | AE70: 90.54 | AF70: 94.94 | AG70: 0.32 | AH70: AA | AI70: 4.3400000000000001e-002 | AJ70: =H70+100*O70 -> 132.06 | AK70: 125.3 | AL70: 81 | AM70: 30.4 | AN70: 68 | AO70: -4.0000000000000001e-003 | AP70: 9 | AQ70: 宁建转债!
A71: 154 | B71: 128116 | C71: 瑞达转债! | D71: 2961 | E71: 瑞达期货 | F71: 金融 | G71: 期货行业 | H71: 100.005 | I71: 1.e-004 | J71: 2.9999999999999997e-004 | K71: 20.74 | L71: 1.4000000000000002e-003 | M71: 115.3 | N71: 29.55 | O71: 0.42499999999999999 | P71: 70.19 | Q71: 转股中 | R71: 5年24天 | S71: 3年25天 | T71: 6.5 | U71: 11 | V71: 1.6e-002 | W71: 7.0000000000000007e-002 | X71: 4.9000000000000002e-002 | Y71: 92 | Z71: 4.71 | AA71: 2.9100000000000001e-002 | AB71: 2.3399999999999997e-002 | AC71: 1.15e-002 | AD71: 9.1999999999999998e-003 | AE71: 90.54 | AF71: 93.4 | AG71: 0.27 | AH71: AA | AI71: 4.3400000000000001e-002 | AJ71: =H71+100*O71 -> 142.505 | AK71: 129.8 | AL71: 137 | AM71: 36.4 | AN71: 133 | AO71: 2.5000000000000001e-002 | AP71: 18 | AQ71: 瑞达转债!
A72: 68 | B72: 123081 | C72: 精研转债! | D72: 300709 | E72: 精研科技 | F72: 电子 | G72: 电子产品 | H72: 103.92 | I72: 1.1599999999999999e-002 | J72: 1.01e-002 | K72: 37.33 | L72: 6.0199999999999997e-002 | M72: 121.3 | N72: 53.4 | O72: 0.48700000000000004 | P72: 69.91 | Q72: 5.1天 | R72: 5.50年 | S72: 3.50年 | T72: 5.7 | U72: 58 | V72: 9.8000000000000004e-002 | W72: 0.11 | X72: 7.6999999999999999e-002 | Y72: 52 | Z72: 2.71 | AA72: 2.9100000000000001e-002 | AB72: 2.2200000000000001e-002 | AC72: 8.0000000000000004e-004 | AD72: -1.4000000000000002e-003 | AE72: 83.11 | AF72: 86.72 | AG72: 0.36 | AH72: AA- | AI72: 6.4399999999999999e-002 | AJ72: =H72+100*O72 -> 152.62 | AK72: 137.9 | AL72: 219 | AM72: 51.2 | AN72: 251 | AO72: 2.9999999999999999e-002 | AP72: 7 | AQ72: 精研转债!
A73: 312 | B73: 128042 | C73: 凯中转债! | D73: 2823 | E73: 凯中精密 | F73: 能源电力 | G73: 电力设备 | H73: 106.5 | I73: 0. | J73: 0. | K73: 10.22 | L73: 0. | M73: 116.3 | N73: 12.86 | O73: 0.34000000000000002 | P73: 79.47 | Q73: 转股中 | R73: 3年55天 | S73: 1年56天 | T73: 4.16 | U73: 2.9 | V73: 6.0000000000000001e-003 | W73: 0.14199999999999999 | X73: 0.113 | Y73: 29 | Z73: 2.16 | AA73: 2.8999999999999998e-002 | AB73: 1.9400000000000001e-002 | AC73: -2.6699999999999998e-002 | AD73: -3.0699999999999998e-002 | AE73: 97.37 | AF73: 102.32 | AG73: 0.23 | AH73: AA | AI73: 4.24e-002 | AJ73: =H73+100*O73 -> 140.5 | AK73: 133.5 | AL73: 182 | AM73: 31.2 | AN73: 77 | AO73: 1.6e-002 | AP73: 26 | AQ73: 凯中转债!
A74: 90 | B74: 123074 | C74: 隆利转债! | D74: 300752 | E74: 隆利科技 | F74: 电子 | G74: 液晶显示 | H74: 106.592 | I74: -3.9000000000000003e-003 | J74: -1.0500000000000001e-002 | K74: 15.85 | L74: -2.76e-002 | M74: 124 | N74: 18.33 | O74: 0.23300000000000001 | P74: 86.47 | Q74: 转股中 | R74: 5.40年 | S74: 3.40年 | T74: 3.24 | U74: 18 | V74: 5.2999999999999999e-002 | W74: 0.106 | X74: 9.1999999999999998e-002 | Y74: 31 | Z74: 2.2 | AA74: 2.8999999999999998e-002 | AB74: 2.1299999999999999e-002 | AC74: -7.0999999999999995e-003 | AD74: -9.300000000000001e-003 | AE74: 83.37 | AF74: 89.14 | AG74: 0.52 | AH74: AA- | AI74: 6.4399999999999999e-002 | AJ74: =H74+100*O74 -> 129.892 | AK74: 126.7 | AL74: 96 | AM74: 37.6 | AN74: 140 | AO74: -0.33799999999999997 | AP74: 14 | AQ74: 隆利转债!
A75: 202 | B75: 113568 | C75: 新春转债! | D75: 603667 | E75: 五洲新春 | F75: 机械装备 | G75: 通用设备 | H75: 108.9 | I75: -5.7999999999999996e-003 | J75: -7.000000000000001e-004 | K75: 8.78 | L75: -1.1299999999999999e-002 | M75: 124.3 | N75: 8.91 | O75: 0.105 | P75: 98.54 | Q75: 转股中 | R75: 4.75年 | S75: 2.75年 | T75: 3.3 | U75: 2.2 | V75: 6.0000000000000001e-003 | W75: 0.129 | X75: 0.127 | Y75: 26 | Z75: 1.45 | AA75: 2.8900000000000002e-002 | AB75: 2.e-002 | AC75: -1.5100000000000001e-002 | AD75: -1.78e-002 | AE75: 87.27 | AF75: 93.45 | AG75: 0.57 | AH75: AA- | AI75: 6.3399999999999998e-002 | AJ75: =H75+100*O75 -> 119.40000000000001 | AK75: 119.3 | AL75: 27 | AM75: 25.8 | AN75: 27 | AO75: 1.e-003 | AP75: 50 | AQ75: 新春转债!
A76: 191 | B76: 110068 | C76: 龙净转债! | D76: 600388 | E76: 龙净环保 | F76: 城市公用 | G76: 三废处理 | H76: 100.4 | I76: -2.9999999999999997e-004 | J76: -5.0000000000000001e-004 | K76: 8.64 | L76: -2.3e-003 | M76: 114.8 | N76: 10.73 | O76: 0.247 | P76: 80.52 | Q76: 转股中 | R76: 4.80年 | S76: 2.80年 | T76: 20 | U76: 8.4 | V76: 4.0000000000000001e-003 | W76: 0.217 | X76: 0.17399999999999999 | Y76: 92 | Z76: 1.52 | AA76: 2.8799999999999999e-002 | AB76: 2.3099999999999999e-002 | AC76: 9.7000000000000003e-003 | AD76: 7.4999999999999997e-003 | AE76: 92.18 | AF76: 95.68 | AG76: 0.34 | AH76: AA+ | AI76: 3.9399999999999998e-002 | AJ76: =H76+100*O76 -> 125.10000000000001 | AK76: 120.3 | AL76: 35 | AM76: 24.6 | AN76: 22 | AO76: -2.e-003 | AP76: 33 | AQ76: 龙净转债!
A77: 127 | B77: 113597 | C77: 佳力转债! | D77: 603912 | E77: 佳力图 | F77: 机械装备 | G77: 专用设备 | H77: 108.05 | I77: 9.5999999999999992e-003 | J77: -6.8999999999999999e-003 | K77: 15.18 | L77: 1.0700000000000001e-002 | M77: 124.5 | N77: 23.4 | O77: 0.66599999999999993 | P77: 64.87 | Q77: 转股中 | R77: 5年55天 | S77: 3年56天 | T77: 3 | U77: 160 | V77: 0.496 | W77: 9.0999999999999998e-002 | X77: 5.9000000000000004e-002 | Y77: 33 | Z77: 3.54 | AA77: 2.86e-002 | AB77: 2.0299999999999999e-002 | AC77: -1.04e-002 | AD77: -1.29e-002 | AE77: 85.11 | AF77: 90.97 | AG77: 0.26 | AH77: AA- | AI77: 6.4399999999999999e-002 | AJ77: =H77+100*O77 -> 174.64999999999998 | AK77: 151.2 | AL77: 296 | AM77: 60.3 | AN77: 295 | AO77: 2.9999999999999999e-002 | AP77: 14 | AQ77: 佳力转债!
A78: 2 | B78: 113624 | C78: 正川转债 | D78: 603976 | E78: 正川股份 | F78: 医药 | G78: 医药行业 | H78: 103.36 | I78: 1.5e-003 | J78: -3.3e-003 | K78: 39.86 | L78: -3.0000000000000001e-003 | M78: 121.6 | N78: 46.69 | O78: 0.21100000000000002 | P78: 85.37 | Q78: 5月7天 | R78: 5.90年 | S78: 3.90年 | T78: 4.05 | U78: 63 | V78: 0.14999999999999999 | W78: 6.7000000000000004e-002 | X78: 5.7000000000000002e-002 | Y78: 60 | Z78: 5.71 | AA78: 2.86e-002 | AB78: 2.2000000000000002e-002 | AC78: 3.0000000000000001e-003 | AD78: 8.0000000000000004e-004 | AE78: 78.11 | AF78: 79.99 | AG78: 0.62 | AH78: A+ | AI78: 7.5399999999999995e-002 | AJ78: =H78+100*O78 -> 124.46000000000001 | AK78: 121.3 | AL78: 46 | AM78: 41.4 | AN78: 188 | AO78: -0.14000000000000001 | AP78: 3 | AQ78: 正川转债
A79: 353 | B79: 113014 | C79: 林洋转债! | D79: 601222 | E79: 林洋能源 | F79: 能源电力 | G79: 电力设备 | H79: 102.36 | I79: -1.4000000000000002e-003 | J79: -1.7000000000000001e-003 | K79: 6.58 | L79: -1.7899999999999999e-002 | M79: 109.3 | N79: 8.54 | O79: 0.32899999999999996 | P79: 77.05 | Q79: 转股中 | R79: 2.40年 | S79: 0.40年 | T79: 30 | U79: 9.4 | V79: 3.0000000000000001e-003 | W79: 0.26100000000000001 | X79: 0.20100000000000001 | Y79: 115 | Z79: 1.1 | AA79: 2.8300000000000002e-002 | AB79: 2.07e-002 | AC79: -9.7000000000000003e-003 | AD79: -1.5900000000000001e-002 | AE79: 99.55 | AF79: 99.53 | AG79: 0.17 | AH79: AA | AI79: 4.0599999999999997e-002 | AJ79: =H79+100*O79 -> 135.25999999999999 | AK79: 127.7 | AL79: 107 | AM79: 28.1 | AN79: 44 | AO79: -2.e-002 | AP79: 30 | AQ79: 林洋转债!
A80: 357 | B80: 128014 | C80: 永东转债! | D80: 2753 | E80: 永东股份 | F80: 化工 | G80: 化工 | H80: 104.321 | I80: 5.1000000000000004e-003 | J80: -5.0000000000000001e-003 | K80: 8.85 | L80: 1.1000000000000001e-003 | M80: 109.8 | N80: 12.52 | O80: 0.47600000000000003 | P80: 70.69 | Q80: 转股中 | R80: 1.87年 | S80: 回售内 | T80: 3.37 | U80: 4.2 | V80: 1.2e-002 | W80: 0.10099999999999999 | X80: 7.2000000000000008e-002 | Y80: 33 | Z80: 1.67 | AA80: 2.7999999999999997e-002 | AB80: 1.8000000000000002e-002 | AC80: 回售内 | AD80: 回售内 | AE80: 100.3 | AF80: 98.3 | AG80: 0.08 | AH80: AA- | AI80: 6.1600000000000002e-002 | AJ80: =H80+100*O80 -> 151.92099999999999 | AK80: 138 | AL80: 222 | AM80: 37.7 | AN80: 144 | AO80: 2.5000000000000001e-002 | AP80: 38 | AQ80: 永东转债!
A81: 101 | B81: 123068 | C81: 弘信转债 | D81: 300657 | E81: 弘信电子 | F81: 电子 | G81: 元器件制 | H81: 105.021 | I81: -9.1999999999999998e-003 | J81: -8.6e-003 | K81: 16 | L81: -3.32e-002 | M81: 121.2 | N81: 18.45 | O81: 0.21100000000000002 | P81: 86.72 | Q81: 转股中 | R81: 5.36年 | S81: 3.36年 | T81: 5.7 | U81: 15 | V81: 2.5000000000000001e-002 | W81: 0.10400000000000001 | X81: 8.9999999999999997e-002 | Y81: 55 | Z81: 3.89 | AA81: 2.7699999999999999e-002 | AB81: 2.06e-002 | AC81: -2.5000000000000001e-003 | AD81: -4.6999999999999993e-003 | AE81: 83.75 | AF81: 87.39 | AG81: 0.54 | AH81: AA- | AI81: 6.4399999999999999e-002 | AJ81: =H81+100*O81 -> 126.12100000000001 | AK81: 123.3 | AL81: 62 | AM81: 35.9 | AN81: 132 | AO81: -3.0000000000000001e-003 | AP81: 7 | AQ81: 弘信转债
A82: 153 | B82: 113591 | C82: 胜达转债! | D82: 603687 | E82: 大胜达 | F82: 造纸包装 | G82: 包装用纸 | H82: 106.8 | I82: 6.8999999999999999e-003 | J82: -6.8999999999999999e-003 | K82: 8.55 | L82: 0. | M82: 122.2 | N82: 8.83 | O82: 0.10300000000000001 | P82: 96.83 | Q82: 转股中 | R82: 5年26天 | S82: 3年27天 | T82: 5.5 | U82: 12 | V82: 2.e-002 | W82: 0.157 | X82: 0.152 | Y82: 35 | Z82: 2.03 | AA82: 2.75e-002 | AB82: 1.9799999999999998e-002 | AC82: -7.9000000000000008e-003 | AD82: -1.03e-002 | AE82: 85.29 | AF82: 89.72 | AG82: 0.6 | AH82: AA- | AI82: 6.4399999999999999e-002 | AJ82: =H82+100*O82 -> 117.09999999999999 | AK82: 116.8 | AL82: 16 | AM82: 27 | AN82: 36 | AO82: 2.9999999999999999e-002 | AP82: 26 | AQ82: 胜达转债!
A83: 60 | B83: 123084 | C83: 高澜转债! | D83: 300499 | E83: 高澜股份 | F83: 能源电力 | G83: 电力设备 | H83: 105.318 | I83: 1.6000000000000001e-003 | J83: 2.8000000000000004e-003 | K83: 8.01 | L83: 1.01e-002 | M83: 121.9 | N83: 11.36 | O83: 0.49399999999999999 | P83: 70.51 | Q83: 12天 | R83: 5.52年 | S83: 3.52年 | T83: 2.8 | U83: 3.5 | V83: 1.2e-002 | W83: 0.126 | X83: 8.900000000000001e-002 | Y83: 22 | Z83: 2.66 | AA83: 2.75e-002 | AB83: 2.0499999999999997e-002 | AC83: -1.2999999999999999e-003 | AD83: -3.8e-003 | AE83: 80.47 | AF83: 82.46 | AG83: 0.43 | AH83: A+ | AI83: 7.5399999999999995e-002 | AJ83: =H83+100*O83 -> 154.71799999999999 | AK83: 140.1 | AL83: 242 | AM83: 57.7 | AN83: 288 | AO83: 2.9999999999999999e-002 | AP83: 12 | AQ83: 高澜转债!
A84: 19 | B84: 123106 | C84: 正丹转债! | D84: 300641 | E84: 正丹股份 | F84: 化工 | G84: 化工 | H84: 107.598 | I84: 1.6200000000000003e-002 | J84: 0. | K84: 7.18 | L84: 2.7200000000000002e-002 | M84: 125.5 | N84: 7.52 | O84: 0.127 | P84: 95.48 | Q84: 3月28天 | R84: 5.80年 | S84: 3.80年 | T84: 3.2 | U84: 77 | V84: 0.222 | W84: 9.0999999999999998e-002 | X84: 8.6999999999999994e-002 | Y84: 35 | Z84: 2.52 | AA84: 2.7400000000000001e-002 | AB84: 1.9900000000000001e-002 | AC84: -9.0000000000000011e-003 | AD84: -1.0800000000000001e-002 | AE84: 81.25 | AF84: 87.96 | AG84: 0.6 | AH84: AA- | AI84: 6.4399999999999999e-002 | AJ84: =H84+100*O84 -> 120.298 | AK84: 119.7 | AL84: 31 | AM84: 31.8 | AN84: 84 | AO84: 8.8000000000000009e-002 | AP84: 9 | AQ84: 正丹转债!
A85: 179 | B85: 123049 | C85: 维尔转债 | D85: 300190 | E85: 维尔利 | F85: 城市公用 | G85: 三废处理 | H85: 109.38 | I85: 4.5999999999999999e-003 | J85: -3.0999999999999999e-003 | K85: 6.77 | L85: 3.0000000000000001e-003 | M85: 124.3 | N85: 7.38 | O85: 0.192 | P85: 91.73 | Q85: 转股中 | R85: 4.85年 | S85: 2.86年 | T85: 9.17 | U85: 8.8 | V85: 9.0000000000000011e-003 | W85: 0.17300000000000001 | X85: 0.159 | Y85: 53 | Z85: 1.22 | AA85: 2.7300000000000001e-002 | AB85: 1.8600000000000002e-002 | AC85: -1.6e-002 | AD85: -1.8600000000000002e-002 | AE85: 86.71 | AF85: 92.85 | AG85: 0.52 | AH85: AA- | AI85: 6.3399999999999998e-002 | AJ85: =H85+100*O85 -> 128.57999999999998 | AK85: 127 | AL85: 99 | AM85: 34.2 | AN85: 111 | AO85: 3.0000000000000001e-003 | AP85: 17 | AQ85: 维尔转债
A86: 61 | B86: 127027 | C86: 靖远转债! | D86: 552 | E86: 靖远煤电 | F86: 煤炭 | G86: 煤炭开采 | H86: 99.892 | I86: -6.5000000000000006e-003 | J86: -3.4999999999999996e-003 | K86: 2.92 | L86: -2.0099999999999996e-002 | M86: 115.3 | N86: 3.23 | O86: 0.105 | P86: 90.4 | Q86: 12天 | R86: 5.52年 | S86: 3.52年 | T86: 28 | U86: 42 | V86: 1.4999999999999999e-002 | W86: 0.41899999999999998 | X86: 0.379 | Y86: 67 | Z86: 0.84 | AA86: 2.69e-002 | AB86: 2.1700000000000001e-002 | AC86: 1.06e-002 | AD86: 8.5000000000000006e-003 | AE86: 89.84 | AF86: 93.08 | AG86: 0.5 | AH86: AA+ | AI86: 4.0399999999999998e-002 | AJ86: =H86+100*O86 -> 110.392 | AK86: 109.4 | AL86: 2 | AM86: 16.3 | AN86: 5 | AO86: -5.2000000000000005e-002 | AP86: 37 | AQ86: 靖远转债!
A87: 111 | B87: 123065 | C87: 宝莱转债! | D87: 300246 | E87: 宝莱特 | F87: 医药 | G87: 医疗器械 | H87: 106.012 | I87: -6.8000000000000005e-003 | J87: 5.4000000000000003e-003 | K87: 19.44 | L87: -1.4199999999999999e-002 | M87: 121.4 | N87: 40.54 | O87: 1.21 | P87: 47.95 | Q87: 转股中 | R87: 5.25年 | S87: 3.25年 | T87: 2.19 | U87: 19 | V87: 8.3000000000000004e-002 | W87: 7.6999999999999999e-002 | X87: 3.7000000000000005e-002 | Y87: 28 | Z87: 3.2 | AA87: 2.6800000000000001e-002 | AB87: 1.95e-002 | AC87: -4.6999999999999993e-003 | AD87: -7.1999999999999998e-003 | AE87: 84.49 | AF87: 88.16 | AG87: 0.1 | AH87: AA- | AI87: 6.4399999999999999e-002 | AJ87: =H87+100*O87 -> 227.012 | AK87: 164.1 | AL87: 321 | AM87: 75.9 | AN87: 321 | AO87: 3.7999999999999999e-002 | AP87: 17 | AQ87: 宝莱转债!
A88: 55 | B88: 123087 | C88: 明电转债! | D88: 300739 | E88: 明阳电路 | F88: 电子 | G88: 元器件制 | H88: 105.1 | I88: 1.37e-002 | J88: 2.3599999999999999e-002 | K88: 15.3 | L88: 6.1799999999999994e-002 | M88: 121.2 | N88: 16.32 | O88: 0.121 | P88: 93.75 | Q88: 17天 | R88: 5.53年 | S88: 4.53年 | T88: 6.73 | U88: 73 | V88: 0.10300000000000001 | W88: 0.158 | X88: 0.14800000000000002 | Y88: 43 | Z88: 3.02 | AA88: 2.6699999999999998e-002 | AB88: 1.9900000000000001e-002 | AC88: 3.3e-003 | AD88: 5.0000000000000001e-004 | AE88: 80.01 | AF88: 86.48 | AG88: 0.6 | AH88: AA- | AI88: 6.4399999999999999e-002 | AJ88: =H88+100*O88 -> 117.19999999999999 | AK88: 116.5 | AL88: 15 | AM88: 30 | AN88: 61 | AO88: 8.5999999999999993e-002 | AP88: 13 | AQ88: 明电转债!
A89: 219 | B89: 123039 | C89: 开润转债! | D89: 300577 | E89: 开润股份 | F89: 服装纺织 | G89: 纺织行业 | H89: 107.812 | I89: -1.2999999999999999e-003 | J89: 0. | K89: 22.45 | L89: -3.0999999999999999e-003 | M89: 121 | N89: 29.9 | O89: 0.436 | P89: 75.08 | Q89: 转股中 | R89: 4.56年 | S89: 2.56年 | T89: 2.22 | U89: 2.1 | V89: 9.0000000000000011e-003 | W89: 4.0999999999999995e-002 | X89: 3.1e-002 | Y89: 54 | Z89: 3.52 | AA89: 2.6200000000000001e-002 | AB89: 1.8100000000000002e-002 | AC89: -1.3000000000000001e-002 | AD89: -1.5800000000000002e-002 | AE89: 85.78 | AF89: 87.92 | AG89: 0.4 | AH89: A+ | AI89: 7.4400000000000008e-002 | AJ89: =H89+100*O89 -> 151.41200000000001 | AK89: 140.5 | AL89: 245 | AM89: 52.6 | AN89: 258 | AO89: 1.9e-002 | AP89: 23 | AQ89: 开润转债!
A90: 126 | B90: 128125 | C90: 华阳转债! | D90: 2949 | E90: 华阳国际 | F90: 建筑 | G90: 建筑工程 | H90: 103.997 | I90: 1.9e-003 | J90: -5.0000000000000001e-003 | K90: 17.77 | L90: -8.8999999999999999e-003 | M90: 118.5 | N90: 25.39 | O90: 0.48599999999999999 | P90: 69.99 | Q90: 转股中 | R90: 5年55天 | S90: 3年56天 | T90: 4.5 | U90: 4.8 | V90: 1.e-002 | W90: 0.129 | X90: 8.9999999999999997e-002 | Y90: 35 | Z90: 2.73 | AA90: 2.6200000000000001e-002 | AB90: 1.9699999999999999e-002 | AC90: -5.0000000000000001e-004 | AD90: -2.7000000000000001e-003 | AE90: 84.61 | AF90: 86.53 | AG90: 0.35 | AH90: AA- | AI90: 6.4399999999999999e-002 | AJ90: =H90+100*O90 -> 152.59700000000001 | AK90: 138 | AL90: 223 | AM90: 51.5 | AN90: 253 | AO90: -2.9999999999999999e-002 | AP90: 7 | AQ90: 华阳转债!
A91: 69 | B91: 123080 | C91: 海波转债! | D91: 300517 | E91: 海波重科 | F91: 建筑 | G91: 建筑工程 | H91: 110.19 | I91: -1.52e-002 | J91: -7.6e-003 | K91: 11.95 | L91: -3.4000000000000002e-002 | M91: 126.5 | N91: 11.58 | O91: 6.8000000000000005e-002 | P91: 103.2 | Q91: 4.1天 | R91: 5.49年 | S91: 3.50年 | T91: 2.45 | U91: 9.1 | V91: 3.4000000000000002e-002 | W91: 0.107 | X91: 0.11 | Y91: 23 | Z91: 1.54 | AA91: 2.6000000000000002e-002 | AB91: 1.78e-002 | AC91: -1.41e-002 | AD91: -1.6500000000000001e-002 | AE91: 80.49 | AF91: 85.66 | AG91: 0.67 | AH91: A+ | AI91: 7.5399999999999995e-002 | AJ91: =H91+100*O91 -> 116.98999999999999 | AK91: 117.2 | AL91: 17 | AM91: 31.5 | AN91: 80 | AO91: -0.42899999999999999 | AP91: 18 | AQ91: 海波转债!
A92: 298 | B92: 113525 | C92: 台华转债! | D92: 603055 | E92: 台华新材 | F92: 服装纺织 | G92: 纺织行业 | H92: 104.59 | I92: 1.6000000000000001e-003 | J92: -4.0000000000000002e-004 | K92: 6.03 | L92: 5.0000000000000001e-003 | M92: 114.3 | N92: 7.78 | O92: 0.34899999999999998 | P92: 77.51 | Q92: 转股中 | R92: 3.53年 | S92: 1.54年 | T92: 4.69 | U92: 1.9 | V92: 4.0000000000000001e-003 | W92: 9.3000000000000013e-002 | X92: 7.2000000000000008e-002 | Y92: 50 | Z92: 1.65 | AA92: 2.5899999999999999e-002 | AB92: 1.84e-002 | AC92: -1.0200000000000001e-002 | AD92: -1.3300000000000001e-002 | AE92: 95.83 | AF92: 98.98 | AG92: 0.25 | AH92: AA | AI92: 4.24e-002 | AJ92: =H92+100*O92 -> 139.49000000000001 | AK92: 131.7 | AL92: 162 | AM92: 32.7 | AN92: 96 | AO92: -1.e-002 | AP92: 20 | AQ92: 台华转债!
A93: 5 | B93: 127033 | C93: 中装转2 | D93: 2822 | E93: 中装建设 | F93: 建筑 | G93: 装饰工程 | H93: 101.096 | I93: 2.9999999999999997e-004 | J93: -2.8999999999999998e-003 | K93: 5.74 | L93: -5.1999999999999998e-003 | M93: 117.1 | N93: 6.33 | O93: 0.115 | P93: 90.68 | Q93: 4月20天 | R93: 5.86年 | S93: 3.87年 | T93: 11.6 | U93: 36 | V93: 3.1e-002 | W93: 0.28000000000000003 | X93: 0.254 | Y93: 41 | Z93: 1.23 | AA93: 2.58e-002 | AB93: 2.0499999999999997e-002 | AC93: 6.0999999999999995e-003 | AD93: 4.4000000000000003e-003 | AE93: 87.41 | AF93: 91.67 | AG93: 0.51 | AH93: AA | AI93: 4.3400000000000001e-002 | AJ93: =H93+100*O93 -> 112.596 | AK93: 111.5 | AL93: 6 | AM93: 19.8 | AN93: 9 | AO93: -1.3999999999999999e-002 | AP93: 15 | AQ93: 中装转2
A94: 329 | B94: 113505 | C94: 杭电转债! | D94: 603618 | E94: 杭电股份 | F94: 能源电力 | G94: 电力设备 | H94: 103.99 | I94: 2.5000000000000001e-003 | J94: 1.6000000000000001e-003 | K94: 6.38 | L94: 1.11e-002 | M94: 111.3 | N94: 7.08 | O94: 0.154 | P94: 90.11 | Q94: 转股中 | R94: 2.75年 | S94: 0.75年 | T94: 7.5 | U94: 7.4 | V94: 9.0000000000000011e-003 | W94: 0.17000000000000001 | X94: 0.153 | Y94: 44 | Z94: 1.63 | AA94: 2.5399999999999999e-002 | AB94: 1.7600000000000001e-002 | AC94: -2.29e-002 | AD94: -2.6699999999999998e-002 | AE94: 98.15 | AF94: 99.93 | AG94: 0.37 | AH94: AA | AI94: 4.0599999999999997e-002 | AJ94: =H94+100*O94 -> 119.39 | AK94: 117.9 | AL94: 22 | AM94: 17.9 | AN94: 7 | AO94: 2.3e-002 | AP94: 42 | AQ94: 杭电转债!
A95: 9 | B95: 123112 | C95: 万讯转债 | D95: 300112 | E95: 万讯自控 | F95: 机械装备 | G95: 专用设备 | H95: 107.8 | I95: 4.6999999999999993e-003 | J95: -9.5999999999999992e-003 | K95: 8.17 | L95: -8.5000000000000006e-003 | M95: 124.4 | N95: 8.93 | O95: 0.17800000000000002 | P95: 91.49 | Q95: 4月12天 | R95: 5.84年 | S95: 3.84年 | T95: 2.46 | U95: 7.3 | V95: 2.7999999999999997e-002 | W95: 0.105 | X95: 9.6000000000000002e-002 | Y95: 23 | Z95: 2.18 | AA95: 2.53e-002 | AB95: 1.8100000000000002e-002 | AC95: -8.199999999999999e-003 | AD95: -1.03e-002 | AE95: 81.43 | AF95: 87.04 | AG95: 0.58 | AH95: AA- | AI95: 6.4399999999999999e-002 | AJ95: =H95+100*O95 -> 125.59999999999999 | AK95: 124.1 | AL95: 67 | AM95: 37.1 | AN95: 135 | AO95: -1.1000000000000001e-002 | AP95: 8 | AQ95: 万讯转债
A96: 59 | B96: 123086 | C96: 海兰转债! | D96: 300065 | E96: 海兰信 | F96: 电子 | G96: 电子产品 | H96: 107.93 | I96: 2.5999999999999999e-003 | J96: 2.9999999999999997e-004 | K96: 10.36 | L96: 4.7999999999999996e-003 | M96: 123.5 | N96: 10.88 | O96: 0.13300000000000001 | P96: 95.22 | Q96: 13天 | R96: 5.52年 | S96: 3.52年 | T96: 7.3 | U96: 15 | V96: 1.9e-002 | W96: 0.17699999999999999 | X96: 0.16899999999999998 | Y96: 41 | Z96: 2.78 | AA96: 2.52e-002 | AB96: 1.78e-002 | AC96: -1.0500000000000001e-002 | AD96: -1.2500000000000001e-002 | AE96: 82.69 | AF96: 88.11 | AG96: 0.59 | AH96: AA- | AI96: 6.4399999999999999e-002 | AJ96: =H96+100*O96 -> 121.23 | AK96: 120.6 | AL96: 39 | AM96: 32.5 | AN96: 94 | AO96: -5.0000000000000001e-003 | AP96: 16 | AQ96: 海兰转债!
A97: 58 | B97: 123085 | C97: 万顺转2! | D97: 300057 | E97: 万顺新材 | F97: 有色金属 | G97: 铝金属 | H97: 99.1 | I97: 3.7000000000000002e-003 | J97: 9.3999999999999986e-003 | K97: 5.01 | L97: 2.4500000000000001e-002 | M97: 113.3 | N97: 6.2 | O97: 0.22600000000000001 | P97: 80.81 | Q97: 13天 | R97: 5.52年 | S97: 3.52年 | T97: 9 | U97: 11 | V97: 1.2e-002 | W97: 0.26600000000000001 | X97: 0.215 | Y97: 34 | Z97: 0.95 | AA97: 2.5099999999999997e-002 | AB97: 2.0499999999999997e-002 | AC97: 1.2800000000000001e-002 | AD97: 1.0700000000000001e-002 | AE97: 82.66 | AF97: 80.87 | AG97: 0.53 | AH97: AA- | AI97: 6.4399999999999999e-002 | AJ97: =H97+100*O97 -> 121.69999999999999 | AK97: 117.4 | AL97: 19 | AM97: 34.7 | AN97: 120 | AO97: 6.2e-002 | AP97: 23 | AQ97: 万顺转2!
A98: 123 | B98: 127021 | C98: 特发转2! | D98: 70 | E98: 特发信息 | F98: 通信互联 | G98: 通信设备 | H98: 102.4 | I98: -2.e-003 | J98: 2.3e-003 | K98: 7.27 | L98: 2.8000000000000004e-003 | M98: 113.3 | N98: 12.33 | O98: 0.73699999999999999 | P98: 58.96 | Q98: 转股中 | R98: 4.17年 | S98: 2.18年 | T98: 5.5 | U98: 2.5 | V98: 4.0000000000000001e-003 | W98: 9.1999999999999998e-002 | X98: 5.4000000000000006e-002 | Y98: 60 | Z98: 2.05 | AA98: 2.4900000000000002e-002 | AB98: 1.89e-002 | AC98: -1.5e-003 | AD98: -3.2000000000000002e-003 | AE98: 92.65 | AF98: 95.49 | AG98: 0.1 | AH98: AA | AI98: 4.24e-002 | AJ98: =H98+100*O98 -> 176.10000000000002 | AK98: 145.8 | AL98: 271 | AM98: 50.3 | AN98: 246 | AO98: -2.4e-002 | AP98: 11 | AQ98: 特发转2!
A99: 128 | B99: 123063 | C99: 大禹转债 | D99: 300021 | E99: 大禹节水 | F99: 化工 | G99: 橡胶塑料 | H99: 111.855 | I99: 3.2000000000000002e-003 | J99: -3.2000000000000002e-003 | K99: 4.99 | L99: 0. | M99: 126.5 | N99: 4.84 | O99: 8.5000000000000006e-002 | P99: 103.1 | Q99: 转股中 | R99: 5年53天 | S99: 4年54天 | T99: 6.38 | U99: 2.7 | V99: 4.0000000000000001e-003 | W99: 0.16 | X99: 0.16500000000000001 | Y99: 40 | Z99: 2.62 | AA99: 2.4700000000000003e-002 | AB99: 1.6e-002 | AC99: -1.04e-002 | AD99: -1.34e-002 | AE99: 82.18 | AF99: 92.44 | AG99: 0.61 | AH99: AA- | AI99: 6.4399999999999999e-002 | AJ99: =H99+100*O99 -> 120.355 | AK99: 120.6 | AL99: 36 | AM99: 28.2 | AN99: 45 | AO99: -8.0000000000000002e-003 | AP99: 17 | AQ99: 大禹转债
A100: 310 | B100: 113516 | C100: 苏农转债! | D100: 603323 | E100: 苏农银行 | F100: 金融 | G100: 银行行业 | H100: 106.05 | I100: 4.0000000000000002e-004 | J100: 2.0999999999999999e-003 | K100: 4.57 | L100: 8.8000000000000005e-003 | M100: 114.3 | N100: 5.52 | O100: 0.28100000000000003 | P100: 82.79 | Q100: 转股中 | R100: 3年58天 | S100: 无权 | T100: 12.9 | U100: 4 | V100: 3.0000000000000001e-003 | W100: 0.156 | X100: 0.13 | Y100: 82 | Z100: 0.67 | AA100: 2.4500000000000001e-002 | AB100: 1.61e-002 | AC100: 无权 | AD100: 无权 | AE100: 无权 | AF100: 101.43 | AG100: 0.28 | AH100: AA+ | AI100: 3.9399999999999998e-002 | AJ100: =H100+100*O100 -> 134.15000000000001 | AK100: 129.3 | AL100: 132 | AM100: 27.9 | AN100: 43 | AO100: 6.0000000000000001e-003 | AP100: 29 | AQ100: 苏农转债!
A101: 345 | B101: 128022 | C101: 众信转债! | D101: 2707 | E101: 众信旅游 | F101: 旅游餐饮 | G101: 旅游 | H101: 102.55 | I101: -5.0000000000000001e-004 | J101: 2.9999999999999997e-004 | K101: 5.7 | L101: -1.8e-003 | M101: 108.8 | N101: 7.92 | O101: 0.42499999999999999 | P101: 71.97 | Q101: 转股中 | R101: 2.49年 | S101: 0.49年 | T101: 4.56 | U101: 6.3 | V101: 1.3000000000000001e-002 | W101: 8.8000000000000009e-002 | X101: 6.4000000000000001e-002 | Y101: 52 | Z101: 7.73 | AA101: 2.4399999999999998e-002 | AB101: 1.7600000000000001e-002 | AC101: -1.4800000000000001e-002 | AD101: -1.9299999999999998e-002 | AE101: 97.64 | AF101: 93.96 | AG101: 0.09 | AH101: AA- | AI101: 6.1600000000000002e-002 | AJ101: =H101+100*O101 -> 145.05000000000001 | AK101: 133.1 | AL101: 178 | AM101: 35.5 | AN101: 127 | AO101: 3.1e-002 | AP101: 30 | AQ101: 众信转债!
A102: 344 | B102: 128023 | C102: 亚太转债! | D102: 2284 | E102: 亚太股份 | F102: 汽车 | G102: 零部件制 | H102: 104.902 | I102: 2.0000000000000001e-004 | J102: 4.0000000000000002e-004 | K102: 7.34 | L102: 5.5000000000000005e-003 | M102: 111.3 | N102: 10.34 | O102: 0.47799999999999998 | P102: 70.99 | Q102: 转股中 | R102: 2.50年 | S102: 0.50年 | T102: 9.99 | U102: 26 | V102: 2.5000000000000001e-002 | W102: 0.185 | X102: 0.13100000000000001 | Y102: 54 | Z102: 2.17 | AA102: 2.4399999999999998e-002 | AB102: 1.5800000000000002e-002 | AC102: -4.41e-002 | AD102: -4.9100000000000005e-002 | AE102: 99.14 | AF102: 100.93 | AG102: 0.11 | AH102: AA | AI102: 4.0599999999999997e-002 | AJ102: =H102+100*O102 -> 152.702 | AK102: 138.8 | AL102: 229 | AM102: 37.9 | AN102: 148 | AO102: 3.6000000000000004e-002 | AP102: 67 | AQ102: 亚太转债!
A103: 233 | B103: 113549 | C103: 白电转债 | D103: 603861 | E103: 白云电器 | F103: 能源电力 | G103: 电力设备 | H103: 103.45 | I103: 0. | J103: -2.2000000000000001e-003 | K103: 7.87 | L103: -5.1000000000000004e-003 | M103: 114.8 | N103: 8.88 | O103: 0.16699999999999998 | P103: 88.63 | Q103: 转股中 | R103: 4.45年 | S103: 2.45年 | T103: 8.8 | U103: 2.9 | V103: 3.0000000000000001e-003 | W103: 0.253 | X103: 0.22399999999999998 | Y103: 35 | Z103: 1.35 | AA103: 2.4199999999999999e-002 | AB103: 1.8000000000000002e-002 | AC103: -5.9999999999999995e-004 | AD103: -3.0000000000000001e-003 | AE103: 92.76 | AF103: 95.79 | AG103: 0.43 | AH103: AA | AI103: 4.24e-002 | AJ103: =H103+100*O103 -> 120.15000000000001 | AK103: 118.3 | AL103: 24 | AM103: 22.5 | AN103: 18 | AO103: -1.9e-002 | AP103: 40 | AQ103: 白电转债
A104: 141 | B104: 113593 | C104: 沪工转债 | D104: 603131 | E104: 上海沪工 | F104: 机械装备 | G104: 通用设备 | H104: 107.88 | I104: 3.0000000000000001e-003 | J104: -1.15e-002 | K104: 18.04 | L104: -1.5300000000000001e-002 | M104: 121.6 | N104: 21.32 | O104: 0.27500000000000002 | P104: 84.62 | Q104: 转股中 | R104: 5年45天 | S104: 3年46天 | T104: 4 | U104: 5.5 | V104: 1.3000000000000001e-002 | W104: 7.0000000000000007e-002 | X104: 5.9000000000000004e-002 | Y104: 57 | Z104: 4.36 | AA104: 2.4199999999999999e-002 | AB104: 1.6799999999999999e-002 | AC104: -9.3999999999999986e-003 | AD104: -1.21e-002 | AE104: 82.59 | AF104: 84.58 | AG104: 0.56 | AH104: A+ | AI104: 7.5399999999999995e-002 | AJ104: =H104+100*O104 -> 135.38 | AK104: 131.1 | AL104: 153 | AM104: 46.6 | AN104: 228 | AO104: -3.0000000000000001e-003 | AP104: 10 | AQ104: 沪工转债
A105: 135 | B105: 113037 | C105: 紫银转债 | D105: 601860 | E105: 紫金银行 | F105: 金融 | G105: 银行行业 | H105: 102.84 | I105: 3.0999999999999999e-003 | J105: -2.0999999999999999e-003 | K105: 3.83 | L105: 2.5999999999999999e-003 | M105: 115.8 | N105: 4.75 | O105: 0.27500000000000002 | P105: 80.63 | Q105: 转股中 | R105: 5年48天 | S105: 无权 | T105: 45 | U105: 20 | V105: 4.0000000000000001e-003 | W105: 0.32100000000000001 | X105: 0.25900000000000001 | Y105: 140 | Z105: 0.95 | AA105: 2.3900000000000001e-002 | AB105: 1.8200000000000001e-002 | AC105: 无权 | AD105: 无权 | AE105: 无权 | AF105: 94.92 | AG105: 0.37 | AH105: AA+ | AI105: 4.0399999999999998e-002 | AJ105: =H105+100*O105 -> 130.34 | AK105: 125 | AL105: 77 | AM105: 30.1 | AN105: 62 | AO105: -1.e-003 | AP105: 19 | AQ105: 紫银转债
A106: 142 | B106: 128120 | C106: 联诚转债! | D106: 2921 | E106: 联诚精密 | F106: 汽车 | G106: 零部件制 | H106: 105.4 | I106: 3.8e-003 | J106: 8.6999999999999994e-003 | K106: 16.18 | L106: 1.95e-002 | M106: 118.4 | N106: 18.44 | O106: 0.20100000000000001 | P106: 87.74 | Q106: 转股中 | R106: 5年42天 | S106: 3年43天 | T106: 2.6 | U106: 3.1 | V106: 1.1000000000000001e-002 | W106: 0.151 | X106: 0.13300000000000001 | Y106: 17 | Z106: 1.67 | AA106: 2.3599999999999999e-002 | AB106: 1.7000000000000001e-002 | AC106: -2.3999999999999998e-003 | AD106: -5.1000000000000004e-003 | AE106: 80.21 | AF106: 78.74 | AG106: 0.64 | AH106: A | AI106: 8.539999999999999e-002 | AJ106: =H106+100*O106 -> 125.5 | AK106: 123.1 | AL106: 61 | AM106: 42.8 | AN106: 201 | AO106: -8.0000000000000002e-003 | AP106: 20 | AQ106: 联诚转债!
A107: 245 | B107: 128076 | C107: 金轮转债! | D107: 2722 | E107: 金轮股份 | F107: 机械装备 | G107: 专用设备 | H107: 104.039 | I107: -2.e-003 | J107: 5.0000000000000001e-004 | K107: 11.99 | L107: -3.3e-003 | M107: 114.9 | N107: 14.66 | O107: 0.27200000000000002 | P107: 81.79 | Q107: 转股中 | R107: 4.36年 | S107: 2.36年 | T107: 2.14 | U107: 1.9 | V107: 8.0000000000000002e-003 | W107: 0.10199999999999999 | X107: 8.3000000000000004e-002 | Y107: 21 | Z107: 1.11 | AA107: 2.35e-002 | AB107: 1.72e-002 | AC107: -2.5000000000000001e-003 | AD107: -5.1000000000000004e-003 | AE107: 88.67 | AF107: 88.4 | AG107: 0.46 | AH107: AA- | AI107: 6.3399999999999998e-002 | AJ107: =H107+100*O107 -> 131.239 | AK107: 126.3 | AL107: 94 | AM107: 37.6 | AN107: 142 | AO107: -6.9999999999999993e-003 | AP107: 41 | AQ107: 金轮转债!
A108: 110 | B108: 128131 | C108: 崇达转2! | D108: 2815 | E108: 崇达技术 | F108: 电子 | G108: 元器件制 | H108: 102.3 | I108: -3.4000000000000002e-003 | J108: 4.5999999999999999e-003 | K108: 12.01 | L108: 7.6e-003 | M108: 115.2 | N108: 19.38 | O108: 0.65099999999999991 | P108: 61.97 | Q108: 转股中 | R108: 5.26年 | S108: 3.26年 | T108: 14 | U108: 0.5 | V108: 0. | W108: 0.13300000000000001 | X108: 8.199999999999999e-002 | Y108: 105 | Z108: 2.51 | AA108: 2.3300000000000001e-002 | AB108: 1.7899999999999999e-002 | AC108: 4.0000000000000001e-003 | AD108: 1.9e-003 | AE108: 89.78 | AF108: 92.55 | AG108: 0.16 | AH108: AA | AI108: 4.3400000000000001e-002 | AJ108: =H108+100*O108 -> 167.39999999999998 | AK108: 142.6 | AL108: 257 | AM108: 50.1 | AN108: 245 | AO108: 4.0999999999999995e-002 | AP108: 9 | AQ108: 崇达转2!
A109: 189 | B109: 113574 | C109: 华体转债! | D109: 603679 | E109: 华体科技 | F109: 城市公用 | G109: 城市公用 | H109: 104.01 | I109: 8.9999999999999998e-004 | J109: -8.0000000000000004e-004 | K109: 18.95 | L109: 5.0000000000000001e-004 | M109: 115.9 | N109: 33.99 | O109: 0.86599999999999999 | P109: 55.75 | Q109: 转股中 | R109: 4.82年 | S109: 2.82年 | T109: 2.09 | U109: 1.3 | V109: 6.0000000000000001e-003 | W109: 7.6999999999999999e-002 | X109: 4.2999999999999997e-002 | Y109: 27 | Z109: 3.49 | AA109: 2.3199999999999998e-002 | AB109: 1.7100000000000001e-002 | AC109: 2.0000000000000001e-004 | AD109: -2.3999999999999998e-003 | AE109: 84.16 | AF109: 82.68 | AG109: 0.16 | AH109: A+ | AI109: 7.4400000000000008e-002 | AJ109: =H109+100*O109 -> 190.61000000000001 | AK109: 152.3 | AL109: 301 | AM109: 68.1 | AN109: 315 | AO109: 6.0000000000000001e-003 | AP109: 18 | AQ109: 华体转债!
A110: 41 | B110: 113619 | C110: 世运转债! | D110: 603920 | E110: 世运电路 | F110: 电子 | G110: 元器件制 | H110: 101.5 | I110: -2.9999999999999997e-004 | J110: 5.0000000000000001e-004 | K110: 16.22 | L110: 1.1999999999999999e-003 | M110: 115.2 | N110: 26.5 | O110: 0.65799999999999992 | P110: 61.21 | Q110: 52天 | R110: 5.63年 | S110: 3.63年 | T110: 10 | U110: 2.4 | V110: 2.e-003 | W110: 0.151 | X110: 9.1999999999999998e-002 | Y110: 66 | Z110: 2.43 | AA110: 2.3199999999999998e-002 | AB110: 1.8200000000000001e-002 | AC110: 5.6999999999999993e-003 | AD110: 3.8e-003 | AE110: 88.38 | AF110: 91.11 | AG110: 0.18 | AH110: AA | AI110: 4.3400000000000001e-002 | AJ110: =H110+100*O110 -> 167.30000000000001 | AK110: 141.8 | AL110: 251 | AM110: 50.7 | AN110: 249 | AO110: 3.4000000000000002e-002 | AP110: 5 | AQ110: 世运转债!
A111: 250 | B111: 128073 | C111: 哈尔转债! | D111: 2615 | E111: 哈尔斯 | F111: 其他 | G111: 家居用品 | H111: 107.31 | I111: -5.8999999999999999e-003 | J111: 3.0999999999999999e-003 | K111: 4.6 | L111: -8.6e-003 | M111: 115.3 | N111: 5.7 | O111: 0.33000000000000002 | P111: 80.7 | Q111: 转股中 | R111: 3.21年 | S111: 1.22年 | T111: 2.99 | U111: 13 | V111: 3.9e-002 | W111: 0.157 | X111: 0.127 | Y111: 19 | Z111: 2.42 | AA111: 2.3e-002 | AB111: 1.43e-002 | AC111: -3.6000000000000004e-002 | AD111: -3.8699999999999998e-002 | AE111: 93.8 | AF111: 94.93 | AG111: 0.33 | AH111: AA- | AI111: 6.3399999999999998e-002 | AJ111: =H111+100*O111 -> 140.31 | AK111: 133.9 | AL111: 189 | AM111: 39 | AN111: 160 | AO111: -2.4e-002 | AP111: 40 | AQ111: 哈尔转债!
A112: 204 | B112: 113567 | C112: 君禾转债! | D112: 603617 | E112: 君禾股份 | F112: 机械装备 | G112: 通用设备 | H112: 106.99 | I112: -2.9999999999999997e-004 | J112: 7.9000000000000008e-003 | K112: 9.84 | L112: 1.34e-002 | M112: 118.8 | N112: 11.16 | O112: 0.21299999999999999 | P112: 88.17 | Q112: 转股中 | R112: 4.75年 | S112: 2.75年 | T112: 2.1 | U112: 0.8 | V112: 3.0000000000000001e-003 | W112: 0.107 | X112: 9.4e-002 | Y112: 20 | Z112: 2.77 | AA112: 2.2799999999999997e-002 | AB112: 1.5700000000000002e-002 | AC112: -9.8999999999999991e-003 | AD112: -1.2500000000000001e-002 | AE112: 84.54 | AF112: 85.18 | AG112: 0.57 | AH112: A+ | AI112: 7.4400000000000008e-002 | AJ112: =H112+100*O112 -> 128.28999999999999 | AK112: 125.8 | AL112: 85 | AM112: 40.6 | AN112: 174 | AO112: -4.5999999999999999e-002 | AP112: 34 | AQ112: 君禾转债!
A113: 228 | B113: 128083 | C113: 新北转债! | D113: 2376 | E113: 新北洋 | F113: 电子 | G113: 电子产品 | H113: 104 | I113: 3.9000000000000003e-003 | J113: 8.9999999999999998e-004 | K113: 9.09 | L113: 1.4499999999999999e-002 | M113: 114.9 | N113: 11.45 | O113: 0.31 | P113: 79.39 | Q113: 转股中 | R113: 4.52年 | S113: 2.52年 | T113: 8.77 | U113: 27 | V113: 2.8999999999999998e-002 | W113: 0.14499999999999999 | X113: 0.115 | Y113: 61 | Z113: 1.75 | AA113: 2.2700000000000001e-002 | AB113: 1.66e-002 | AC113: -2.2000000000000001e-003 | AD113: -4.5999999999999999e-003 | AE113: 92.58 | AF113: 95.59 | AG113: 0.33 | AH113: AA | AI113: 4.24e-002 | AJ113: =H113+100*O113 -> 135. | AK113: 128.6 | AL113: 123 | AM113: 33 | AN113: 99 | AO113: -5.0000000000000001e-003 | AP113: 19 | AQ113: 新北转债!
A114: 80 | B114: 113608 | C114: 威派转债! | D114: 603956 | E114: 威派格 | F114: 机械装备 | G114: 专用设备 | H114: 108.02 | I114: -1.e-003 | J114: 3.2000000000000002e-003 | K114: 16.26 | L114: 3.7000000000000002e-003 | M114: 121.6 | N114: 19.08 | O114: 0.26800000000000002 | P114: 85.22 | Q114: 转股中 | R114: 5.43年 | S114: 3.43年 | T114: 4.2 | U114: 2.2 | V114: 5.0000000000000001e-003 | W114: 6.0999999999999999e-002 | X114: 5.2000000000000005e-002 | Y114: 69 | Z114: 5.98 | AA114: 2.2599999999999999e-002 | AB114: 1.5600000000000001e-002 | AC114: -9.0000000000000011e-003 | AD114: -1.1399999999999999e-002 | AE114: 80.8 | AF114: 82.74 | AG114: 0.58 | AH114: A+ | AI114: 7.5399999999999995e-002 | AJ114: =H114+100*O114 -> 134.81999999999999 | AK114: 130.8 | AL114: 148 | AM114: 48.1 | AN114: 239 | AO114: -2.e-002 | AP114: 6 | AQ114: 威派转债!
A115: 291 | B115: 113528 | C115: 长城转债! | D115: 603897 | E115: 长城科技 | F115: 机械装备 | G115: 专用设备 | H115: 107.76 | I115: 1.1000000000000001e-003 | J115: 1.1999999999999999e-003 | K115: 19.38 | L115: 5.6999999999999993e-003 | M115: 116.8 | N115: 23.35 | O115: 0.29799999999999999 | P115: 83 | Q115: 转股中 | R115: 3.74年 | S115: 1.74年 | T115: 6.34 | U115: 19 | V115: 2.7000000000000003e-002 | W115: 0.183 | X115: 0.152 | Y115: 35 | Z115: 1.76 | AA115: 2.2200000000000001e-002 | AB115: 1.41e-002 | AC115: -2.29e-002 | AD115: -2.6000000000000002e-002 | AE115: 91.82 | AF115: 93.27 | AG115: 0.4 | AH115: AA- | AI115: 6.3399999999999998e-002 | AJ115: =H115+100*O115 -> 137.56 | AK115: 132.5 | AL115: 171 | AM115: 39.2 | AN115: 162 | AO115: 3.7000000000000005e-002 | AP115: 39 | AQ115: 长城转债!
A116: 258 | B116: 128070 | C116: 智能转债! | D116: 2877 | E116: 智能自控 | F116: 机械装备 | G116: 通用设备 | H116: 107.95 | I116: -5.1999999999999998e-003 | J116: 2.3999999999999998e-003 | K116: 6.47 | L116: -9.1999999999999998e-003 | M116: 117.6 | N116: 9.51 | O116: 0.58700000000000008 | P116: 68.03 | Q116: 转股中 | R116: 4年27天 | S116: 无权 | T116: 2.3 | U116: 17 | V116: 6.7000000000000004e-002 | W116: 0.107 | X116: 7.2999999999999995e-002 | Y116: 22 | Z116: 2.91 | AA116: 2.18e-002 | AB116: 1.3899999999999999e-002 | AC116: 无权 | AD116: 无权 | AE116: 无权 | AF116: 88.48 | AG116: 0.31 | AH116: A+ | AI116: 7.4400000000000008e-002 | AJ116: =H116+100*O116 -> 166.65000000000001 | AK116: 147.9 | AL116: 282 | AM116: 59.4 | AN116: 292 | AO116: -4.0000000000000001e-003 | AP116: 30 | AQ116: 智能转债!
A117: 164 | B117: 123053 | C117: 宝通转债! | D117: 300031 | E117: 宝通科技 | F117: 通信互联 | G117: 互联网 | H117: 109.2 | I117: -5.0000000000000001e-004 | J117: -1.5e-003 | K117: 17.61 | L117: -4.0000000000000001e-003 | M117: 121.3 | N117: 20.8 | O117: 0.28999999999999998 | P117: 84.66 | Q117: 转股中 | R117: 5年0.1天 | S117: 3年1.1天 | T117: 5 | U117: 5.5 | V117: 1.e-002 | W117: 7.2000000000000008e-002 | X117: 6.0999999999999999e-002 | Y117: 70 | Z117: 2.27 | AA117: 2.18e-002 | AB117: 1.4199999999999999e-002 | AC117: -1.4800000000000001e-002 | AD117: -1.7299999999999999e-002 | AE117: 85.76 | AF117: 89.48 | AG117: 0.49 | AH117: AA- | AI117: 6.4399999999999999e-002 | AJ117: =H117+100*O117 -> 138.19999999999999 | AK117: 133.7 | AL117: 186 | AM117: 44.3 | AN117: 209 | AO117: 2.8999999999999998e-002 | AP117: 9 | AQ117: 宝通转债!
A118: 132 | B118: 128123 | C118: 国光转债! | D118: 2749 | E118: 国光股份 | F118: 化工 | G118: 农化 | H118: 104.545 | I118: -1.e-003 | J118: 5.9999999999999995e-004 | K118: 9.78 | L118: -1.e-003 | M118: 116.2 | N118: 13.48 | O118: 0.441 | P118: 72.55 | Q118: 转股中 | R118: 5年52天 | S118: 3年53天 | T118: 3.2 | U118: 1.3 | V118: 4.0000000000000001e-003 | W118: 7.4999999999999997e-002 | X118: 5.4000000000000006e-002 | Y118: 43 | Z118: 3.42 | AA118: 2.1299999999999999e-002 | AB118: 1.55e-002 | AC118: -1.1999999999999999e-003 | AD118: -3.5999999999999999e-003 | AE118: 84.91 | AF118: 84.97 | AG118: 0.4 | AH118: AA- | AI118: 6.4399999999999999e-002 | AJ118: =H118+100*O118 -> 148.64500000000001 | AK118: 136.5 | AL118: 210 | AM118: 51.6 | AN118: 255 | AO118: -2.e-002 | AP118: 11 | AQ118: 国光转债!
A119: 22 | B119: 113046 | C119: 金田转债 | D119: 601609 | E119: 金田铜业 | F119: 有色金属 | G119: 铜金属 | H119: 102.05 | I119: 5.0000000000000001e-004 | J119: -4.5999999999999999e-003 | K119: 8.98 | L119: -9.8999999999999991e-003 | M119: 114.9 | N119: 10.95 | O119: 0.24399999999999999 | P119: 82.01 | Q119: 3月25天 | R119: 5.79年 | S119: 3.80年 | T119: 15 | U119: 11 | V119: 6.9999999999999993e-003 | W119: 0.115 | X119: 9.4e-002 | Y119: 131 | Z119: 1.92 | AA119: 2.1000000000000001e-002 | AB119: 1.6299999999999999e-002 | AC119: 3.4000000000000002e-003 | AD119: 1.7000000000000001e-003 | AE119: 88.49 | AF119: 91.69 | AG119: 0.41 | AH119: AA+ | AI119: 4.0399999999999998e-002 | AJ119: =H119+100*O119 -> 126.44999999999999 | AK119: 122.1 | AL119: 54 | AM119: 30.4 | AN119: 69 | AO119: -3.9e-002 | AP119: 10 | AQ119: 金田转债
A120: 1 | B120: 127034 | C120: 绿茵转债 | D120: 2887 | E120: 绿茵生态 | F120: 城市公用 | G120: 生态环境 | H120: 105.52 | I120: 2.8000000000000004e-003 | J120: -7.0999999999999995e-003 | K120: 11.61 | L120: -6.8000000000000005e-003 | M120: 119 | N120: 12.38 | O120: 0.125 | P120: 93.78 | Q120: 5月10天 | R120: 5.90年 | S120: 3.90年 | T120: 7.12 | U120: 45 | V120: 5.9999999999999998e-002 | W120: 0.19699999999999998 | X120: 0.184 | Y120: 36 | Z120: 1.69 | AA120: 2.1000000000000001e-002 | AB120: 1.52e-002 | AC120: -3.8e-003 | AD120: -5.6000000000000008e-003 | AE120: 80.8 | AF120: 82.93 | AG120: 0.63 | AH120: AA- | AI120: 6.4399999999999999e-002 | AJ120: =H120+100*O120 -> 118.02 | AK120: 117.3 | AL120: 18 | AM120: 34.3 | AN120: 113 | AO120: 1.4999999999999999e-002 | AP120: 7 | AQ120: 绿茵转债
A121: 283 | B121: 110056 | C121: 亨通转债! | D121: 600487 | E121: 亨通光电 | F121: 通信互联 | G121: 通信设备 | H121: 105.82 | I121: 4.0000000000000001e-003 | J121: -1.7000000000000001e-003 | K121: 12.04 | L121: 8.3999999999999995e-003 | M121: 114.3 | N121: 15.01 | O121: 0.31900000000000001 | P121: 80.21 | Q121: 转股中 | R121: 3.79年 | S121: 1.79年 | T121: 17.1 | U121: 19 | V121: 1.e-002 | W121: 5.9999999999999998e-002 | X121: 4.8000000000000001e-002 | Y121: 284 | Z121: 1.41 | AA121: 2.0899999999999998e-002 | AB121: 1.3999999999999999e-002 | AC121: -1.4800000000000001e-002 | AD121: -1.7500000000000002e-002 | AE121: 95.37 | AF121: 99 | AG121: 0.27 | AH121: AA+ | AI121: 3.9399999999999998e-002 | AJ121: =H121+100*O121 -> 137.72 | AK121: 131.4 | AL121: 157 | AM121: 32.4 | AN121: 92 | AO121: 2.5000000000000001e-002 | AP121: 29 | AQ121: 亨通转债!
A122: 152 | B122: 123057 | C122: 美联转债! | D122: 300586 | E122: 美联新材 | F122: 化工 | G122: 橡胶塑料 | H122: 106.84 | I122: 5.6999999999999993e-003 | J122: 4.3e-003 | K122: 8.26 | L122: 1.9799999999999998e-002 | M122: 118.2 | N122: 9.91 | O122: 0.28199999999999997 | P122: 83.35 | Q122: 转股中 | R122: 5年26天 | S122: 3年27天 | T122: 2.07 | U122: 44 | V122: 0.19699999999999998 | W122: 5.5e-002 | X122: 4.5999999999999999e-002 | Y122: 38 | Z122: 5.08 | AA122: 2.06e-002 | AB122: 1.41e-002 | AC122: -8.0000000000000002e-003 | AD122: -1.04e-002 | AE122: 85.28 | AF122: 86.8 | AG122: 0.51 | AH122: AA- | AI122: 6.4399999999999999e-002 | AJ122: =H122+100*O122 -> 135.03999999999999 | AK122: 130.3 | AL122: 144 | AM122: 43.5 | AN122: 206 | AO122: 4.0999999999999995e-002 | AP122: 18 | AQ122: 美联转债!
A123: 200 | B123: 113570 | C123: 百达转债! | D123: 603331 | E123: 百达精工 | F123: 机械装备 | G123: 机械装备 | H123: 104.66 | I123: 1.1000000000000001e-003 | J123: -1.7000000000000001e-003 | K123: 10.13 | L123: -1.e-003 | M123: 114.9 | N123: 11.54 | O123: 0.192 | P123: 87.78 | Q123: 转股中 | R123: 4.76年 | S123: 2.77年 | T123: 2.8 | U123: 1.3 | V123: 4.0000000000000001e-003 | W123: 0.154 | X123: 0.13600000000000001 | Y123: 18 | Z123: 2.15 | AA123: 2.0199999999999999e-002 | AB123: 1.44e-002 | AC123: -4.0999999999999995e-003 | AD123: -6.4000000000000003e-003 | AE123: 83.92 | AF123: 82.18 | AG123: 0.6 | AH123: A+ | AI123: 7.4400000000000008e-002 | AJ123: =H123+100*O123 -> 123.86 | AK123: 121.5 | AL123: 48 | AM123: 37.6 | AN123: 141 | AO123: 1.1000000000000001e-002 | AP123: 34 | AQ123: 百达转债!
A124: 136 | B124: 123061 | C124: 航新转债! | D124: 300424 | E124: 航新科技 | F124: 航空航天 | G124: 航空航天 | H124: 112.9 | I124: -7.9000000000000008e-003 | J124: -5.6999999999999993e-003 | K124: 14.27 | L124: -2.1899999999999999e-002 | M124: 124.8 | N124: 14.86 | O124: 0.17600000000000002 | P124: 96.03 | Q124: 转股中 | R124: 5年47天 | S124: 3年48天 | T124: 2.5 | U124: 138 | V124: 0.48499999999999999 | W124: 7.2999999999999995e-002 | X124: 7.0000000000000007e-002 | Y124: 34 | Z124: 5.13 | AA124: 2.0199999999999999e-002 | AB124: 1.1899999999999999e-002 | AC124: -2.2799999999999997e-002 | AD124: -2.5499999999999998e-002 | AE124: 82.69 | AF124: 86.81 | AG124: 0.62 | AH124: A+ | AI124: 7.5399999999999995e-002 | AJ124: =H124+100*O124 -> 130.5 | AK124: 129.8 | AL124: 136 | AM124: 43 | AN124: 203 | AO124: 2.2000000000000002e-002 | AP124: 16 | AQ124: 航新转债!
A125: 71 | B125: 113610 | C125: 灵康转债 | D125: 603669 | E125: 灵康药业 | F125: 医药 | G125: 化学制药 | H125: 108.73 | I125: 6.3e-003 | J125: 5.1000000000000004e-003 | K125: 8.83 | L125: 1.7299999999999999e-002 | M125: 121.1 | N125: 8.61 | O125: 5.9999999999999998e-002 | P125: 102.56 | Q125: 3.1天 | R125: 5.49年 | S125: 3.49年 | T125: 5.25 | U125: 21 | V125: 3.6000000000000004e-002 | W125: 8.3000000000000004e-002 | X125: 8.5000000000000006e-002 | Y125: 63 | Z125: 4.48 | AA125: 2.0199999999999999e-002 | AB125: 1.3500000000000002e-002 | AC125: -1.21e-002 | AD125: -1.4199999999999999e-002 | AE125: 82.99 | AF125: 86.6 | AG125: 0.66 | AH125: AA- | AI125: 6.4399999999999999e-002 | AJ125: =H125+100*O125 -> 114.73 | AK125: 114.9 | AL125: 10 | AM125: 28.3 | AN125: 47 | AO125: -2.7999999999999997e-002 | AP125: 24 | AQ125: 灵康转债
A126: 225 | B126: 128087 | C126: 孚日转债! | D126: 2083 | E126: 孚日股份 | F126: 服装纺织 | G126: 家纺 | H126: 103.41 | I126: -1.8e-003 | J126: 5.9999999999999995e-004 | K126: 4.24 | L126: -2.3999999999999998e-003 | M126: 112.9 | N126: 4.5 | O126: 9.8000000000000004e-002 | P126: 94.22 | Q126: 转股中 | R126: 4.53年 | S126: 2.54年 | T126: 6.5 | U126: 6.7 | V126: 1.e-002 | W126: 0.16899999999999998 | X126: 0.159 | Y126: 39 | Z126: 1.06 | AA126: 2.e-002 | AB126: 1.46e-002 | AC126: 0. | AD126: -2.5000000000000001e-003 | AE126: 92.52 | AF126: 93.88 | AG126: 0.52 | AH126: AA | AI126: 4.24e-002 | AJ126: =H126+100*O126 -> 113.20999999999999 | AK126: 112.6 | AL126: 8 | AM126: 18.7 | AN126: 8 | AO126: 1.3999999999999999e-002 | AP126: 62 | AQ126: 孚日转债!
A127: 139 | B127: 113594 | C127: 淳中转债! | D127: 603516 | E127: 淳中科技 | F127: 电子 | G127: 电子产品 | H127: 109.96 | I127: -4.0000000000000002e-004 | J127: -7.4999999999999997e-003 | K127: 21.74 | L127: -1.5800000000000002e-002 | M127: 121.4 | N127: 27.84 | O127: 0.40799999999999997 | P127: 78.09 | Q127: 转股中 | R127: 5年46天 | S127: 3年47天 | T127: 3 | U127: 0.6 | V127: 2.e-003 | W127: 7.400000000000001e-002 | X127: 5.7999999999999996e-002 | Y127: 41 | Z127: 2.96 | AA127: 2.e-002 | AB127: 1.26e-002 | AC127: -1.5300000000000001e-002 | AD127: -1.7899999999999999e-002 | AE127: 82.58 | AF127: 84.44 | AG127: 0.49 | AH127: A+ | AI127: 7.5399999999999995e-002 | AJ127: =H127+100*O127 -> 150.75999999999999 | AK127: 141.8 | AL127: 252 | AM127: 57.4 | AN127: 287 | AO127: -2.7999999999999997e-002 | AP127: 8 | AQ127: 淳中转债!
A128: 125 | B128: 113598 | C128: 法兰转债 | D128: 603966 | E128: 法兰泰克 | F128: 机械装备 | G128: 工程机械 | H128: 110.11 | I128: -8.6e-003 | J128: 3.7000000000000002e-003 | K128: 12.69 | L128: -8.6e-003 | M128: 121.2 | N128: 13.88 | O128: 0.20399999999999999 | P128: 91.43 | Q128: 转股中 | R128: 5年56天 | S128: 3年57天 | T128: 2.75 | U128: 10 | V128: 3.4000000000000002e-002 | W128: 0.10099999999999999 | X128: 9.1999999999999998e-002 | Y128: 27 | Z128: 2.33 | AA128: 1.9199999999999998e-002 | AB128: 1.2e-002 | AC128: -1.6899999999999998e-002 | AD128: -1.9199999999999998e-002 | AE128: 84.85 | AF128: 88.53 | AG128: 0.56 | AH128: AA- | AI128: 6.4399999999999999e-002 | AJ128: =H128+100*O128 -> 130.50999999999999 | AK128: 128.8 | AL128: 127 | AM128: 40.3 | AN128: 169 | AO128: -9.8000000000000004e-002 | AP128: 10 | AQ128: 法兰转债
A129: 159 | B129: 128114 | C129: 正邦转债 | D129: 2157 | E129: 正邦科技 | F129: 农业 | G129: 畜牧业 | H129: 105.112 | I129: -1.1000000000000001e-003 | J129: 2.e-003 | K129: 13 | L129: 2.3e-003 | M129: 115.3 | N129: 15.46 | O129: 0.25 | P129: 84.09 | Q129: 转股中 | R129: 5年12天 | S129: 3年13天 | T129: 16 | U129: 20 | V129: 1.2e-002 | W129: 3.9e-002 | X129: 3.3000000000000002e-002 | Y129: 409 | Z129: 1.74 | AA129: 1.9e-002 | AB129: 1.34e-002 | AC129: -3.9000000000000003e-003 | AD129: -6.1999999999999998e-003 | AE129: 91.58 | AF129: 94.87 | AG129: 0.4 | AH129: AA+ | AI129: 4.0399999999999998e-002 | AJ129: =H129+100*O129 -> 130.11199999999999 | AK129: 126.1 | AL129: 90 | AM129: 31.3 | AN129: 79 | AO129: -2.9999999999999999e-002 | AP129: 16 | AQ129: 正邦转债
A130: 281 | B130: 123024 | C130: 岱勒转债! | D130: 300700 | E130: 岱勒新材 | F130: 机械装备 | G130: 专用设备 | H130: 106.863 | I130: 5.9999999999999995e-004 | J130: -6.8999999999999999e-003 | K130: 12.48 | L130: -1.4199999999999999e-002 | M130: 112.5 | N130: 14.1 | O130: 0.20699999999999999 | P130: 88.51 | Q130: 转股中 | R130: 2.79年 | S130: 0.79年 | T130: 2.1 | U130: 12 | V130: 5.2000000000000005e-002 | W130: 0.157 | X130: 0.13900000000000001 | Y130: 13 | Z130: 2.12 | AA130: 1.8799999999999997e-002 | AB130: 1.0500000000000001e-002 | AC130: -5.4699999999999999e-002 | AD130: -5.7099999999999998e-002 | AE130: 94.66 | AF130: 92.7 | AG130: 0.44 | AH130: A+ | AI130: 7.2599999999999998e-002 | AJ130: =H130+100*O130 -> 127.563 | AK130: 125.2 | AL130: 80 | AM130: 30.6 | AN130: 70 | AO130: -0.157 | AP130: 35 | AQ130: 岱勒转债!
A131: 3 | B131: 113048 | C131: 晶科转债! | D131: 601778 | E131: 晶科科技 | F131: 能源电力 | G131: 太阳能 | H131: 105.83 | I131: 4.0000000000000002e-004 | J131: -1.9e-003 | K131: 5.42 | L131: -3.7000000000000002e-003 | M131: 117.1 | N131: 6.75 | O131: 0.318 | P131: 80.3 | Q131: 4月27天 | R131: 5.88年 | S131: 3.89年 | T131: 30 | U131: 90 | V131: 2.7999999999999997e-002 | W131: 0.20000000000000001 | X131: 0.161 | Y131: 150 | Z131: 1.38 | AA131: 1.7600000000000001e-002 | AB131: 1.24e-002 | AC131: -5.3e-003 | AD131: -6.9999999999999993e-003 | AE131: 87.34 | AF131: 91.59 | AG131: 0.4 | AH131: AA | AI131: 4.3400000000000001e-002 | AJ131: =H131+100*O131 -> 137.63 | AK131: 131.4 | AL131: 155 | AM131: 39.8 | AN131: 165 | AO131: -9.0000000000000011e-003 | AP131: 4 | AQ131: 晶科转债!
A132: 36 | B132: 123097 | C132: 美力转债 | D132: 300611 | E132: 美力科技 | F132: 机械装备 | G132: 通用设备 | H132: 110.683 | I132: -1.3500000000000002e-002 | J132: -1.7899999999999999e-002 | K132: 9.41 | L132: -4.5599999999999995e-002 | M132: 121.6 | N132: 9.34 | O132: 9.9000000000000005e-002 | P132: 100.75 | Q132: 59天 | R132: 5.65年 | S132: 3.65年 | T132: 3 | U132: 12 | V132: 3.6000000000000004e-002 | W132: 0.17800000000000002 | X132: 0.17899999999999999 | Y132: 17 | Z132: 2.53 | AA132: 1.72e-002 | AB132: 1.0500000000000001e-002 | AC132: -1.49e-002 | AD132: -1.7100000000000001e-002 | AE132: 79.54 | AF132: 81.45 | AG132: 0.69 | AH132: A+ | AI132: 7.5399999999999995e-002 | AJ132: =H132+100*O132 -> 120.58300000000001 | AK132: 120.6 | AL132: 38 | AM132: 39.2 | AN132: 161 | AO132: 3.6000000000000004e-002 | AP132: 15 | AQ132: 美力转债
A133: 6 | B133: 110080 | C133: 东湖转债 | D133: 600133 | E133: 东湖高新 | F133: 建筑 | G133: 建筑工程 | H133: 104.36 | I133: 1.e-004 | J133: -2.0999999999999999e-003 | K133: 6.04 | L133: -3.3e-003 | M133: 115.1 | N133: 6.16 | O133: 6.4000000000000001e-002 | P133: 98.05 | Q133: 4月14天 | R133: 5.85年 | S133: 3.85年 | T133: 15.5 | U133: 19 | V133: 1.2e-002 | W133: 0.32299999999999995 | X133: 0.316 | Y133: 48 | Z133: 0.89 | AA133: 1.72e-002 | AB133: 1.24e-002 | AC133: -1.8e-003 | AD133: -3.5999999999999999e-003 | AE133: 87.45 | AF133: 90.15 | AG133: 0.59 | AH133: AA | AI133: 4.3400000000000001e-002 | AJ133: =H133+100*O133 -> 110.76000000000001 | AK133: 110.7 | AL133: 3 | AM133: 20.5 | AN133: 14 | AO133: 2.7999999999999997e-002 | AP133: 15 | AQ133: 东湖转债
A134: 66 | B134: 128140 | C134: 润建转债! | D134: 2929 | E134: 润建股份 | F134: 通信互联 | G134: 通信设备 | H134: 105.094 | I134: 1.1999999999999999e-003 | J134: 1.1999999999999999e-003 | K134: 23.62 | L134: 4.6999999999999993e-003 | M134: 115.2 | N134: 26.55 | O134: 0.18100000000000002 | P134: 88.96 | Q134: 7天 | R134: 5.51年 | S134: 3.51年 | T134: 10.9 | U134: 3.6 | V134: 3.0000000000000001e-003 | W134: 0.20899999999999999 | X134: 0.18600000000000003 | Y134: 52 | Z134: 1.65 | AA134: 1.7100000000000001e-002 | AB134: 1.21e-002 | AC134: -3.5999999999999999e-003 | AD134: -5.6000000000000008e-003 | AE134: 88.84 | AF134: 91.58 | AG134: 0.49 | AH134: AA | AI134: 4.3400000000000001e-002 | AJ134: =H134+100*O134 -> 123.19399999999999 | AK134: 121.2 | AL134: 45 | AM134: 29.6 | AN134: 59 | AO134: 1.8000000000000002e-002 | AP134: 14 | AQ134: 润建转债!
A135: 327 | B135: 127006 | C135: 敖东转债! | D135: 623 | E135: 吉林敖东 | F135: 金融 | G135: 证券行业 | H135: 102.551 | I135: 5.0000000000000001e-004 | J135: -1.e-004 | K135: 15.59 | L135: 1.9e-003 | M135: 107.4 | N135: 20.42 | O135: 0.34299999999999997 | P135: 76.35 | Q135: 转股中 | R135: 2.77年 | S135: 0.77年 | T135: 24.1 | U135: 8.8 | V135: 4.0000000000000001e-003 | W135: 0.13300000000000001 | X135: 0.10099999999999999 | Y135: 181 | Z135: 0.79 | AA135: 1.7000000000000001e-002 | AB135: 1.18e-002 | AC135: -1.54e-002 | AD135: -1.7600000000000001e-002 | AE135: 97.63 | AF135: 97.06 | AG135: 0.19 | AH135: AA+ | AI135: 3.7599999999999995e-002 | AJ135: =H135+100*O135 -> 136.851 | AK135: 128.8 | AL135: 126 | AM135: 31.1 | AN135: 76 | AO135: 8.0000000000000002e-003 | AP135: 26 | AQ135: 敖东转债!
A136: 178 | B136: 123050 | C136: 聚飞转债 | D136: 300303 | E136: 聚飞光电 | F136: 电子 | G136: LED制 | H136: 114.248 | I136: 4.7999999999999996e-003 | J136: 4.3e-003 | K136: 4.95 | L136: 1.6399999999999998e-002 | M136: 123.8 | N136: 5.18 | O136: 0.19600000000000001 | P136: 95.56 | Q136: 转股中 | R136: 4.86年 | S136: 2.86年 | T136: 7.05 | U136: 5.8 | V136: 6.9999999999999993e-003 | W136: 0.111 | X136: 0.106 | Y136: 63 | Z136: 2.57 | AA136: 1.7000000000000001e-002 | AB136: 8.6e-003 | AC136: -3.1699999999999999e-002 | AD136: -3.4000000000000002e-002 | AE136: 86.27 | AF136: 92.41 | AG136: 0.55 | AH136: AA- | AI136: 6.3399999999999998e-002 | AJ136: =H136+100*O136 -> 133.84800000000001 | AK136: 132.9 | AL136: 176 | AM136: 40.5 | AN136: 173 | AO136: 2.4e-002 | AP136: 11 | AQ136: 聚飞转债
A137: 168 | B137: 123051 | C137: 今天转债 | D137: 300532 | E137: 今天国际 | F137: 计算机及 | G137: 软件开发 | H137: 112.6 | I137: -1.2999999999999999e-003 | J137: -3.0999999999999999e-003 | K137: 8.71 | L137: -6.8000000000000005e-003 | M137: 122.8 | N137: 8.7 | O137: 0.125 | P137: 100.11 | Q137: 转股中 | R137: 4.997年 | S137: 3年0.1天 | T137: 2.79 | U137: 18 | V137: 5.7999999999999996e-002 | W137: 0.11699999999999999 | X137: 0.11699999999999999 | Y137: 24 | Z137: 3.05 | AA137: 1.7000000000000001e-002 | AB137: 9.300000000000001e-003 | AC137: -2.4300000000000002e-002 | AD137: -2.6800000000000001e-002 | AE137: 83.23 | AF137: 86.14 | AG137: 0.64 | AH137: A+ | AI137: 7.4400000000000008e-002 | AJ137: =H137+100*O137 -> 125.09999999999999 | AK137: 125.1 | AL137: 78 | AM137: 38.9 | AN137: 159 | AO137: 3.5000000000000003e-002 | AP137: 17 | AQ137: 今天转债
A138: 254 | B138: 128071 | C138: 合兴转债! | D138: 2228 | E138: 合兴包装 | F138: 造纸包装 | G138: 包装材料 | H138: 107.35 | I138: -1.4000000000000002e-003 | J138: 2.5000000000000001e-003 | K138: 3.79 | L138: 2.5999999999999999e-003 | M138: 114.8 | N138: 4.28 | O138: 0.21199999999999999 | P138: 88.55 | Q138: 转股中 | R138: 4.20年 | S138: 2.20年 | T138: 3 | U138: 2 | V138: 6.0000000000000001e-003 | W138: 6.4000000000000001e-002 | X138: 5.7000000000000002e-002 | Y138: 47 | Z138: 1.35 | AA138: 1.6399999999999998e-002 | AB138: 1.e-002 | AC138: -1.6299999999999999e-002 | AD138: -1.89e-002 | AE138: 93.73 | AF138: 96.79 | AG138: 0.42 | AH138: AA | AI138: 4.24e-002 | AJ138: =H138+100*O138 -> 128.54999999999998 | AK138: 126.1 | AL138: 91 | AM138: 29.4 | AN138: 56 | AO138: -4.0000000000000001e-003 | AP138: 24 | AQ138: 合兴转债!
A139: 241 | B139: 127014 | C139: 北方转债! | D139: 65 | E139: 北方国际 | F139: 建筑 | G139: 建筑工程 | H139: 107.45 | I139: -3.2000000000000002e-003 | J139: -4.0000000000000001e-003 | K139: 7.69 | L139: -1.7899999999999999e-002 | M139: 115.1 | N139: 8.75 | O139: 0.223 | P139: 87.89 | Q139: 转股中 | R139: 4.39年 | S139: 2.39年 | T139: 5.35 | U139: 7.7 | V139: 1.3000000000000001e-002 | W139: 8.9999999999999997e-002 | X139: 7.9000000000000001e-002 | Y139: 59 | Z139: 1.07 | AA139: 1.6200000000000003e-002 | AB139: 9.7999999999999997e-003 | AC139: -1.43e-002 | AD139: -1.7000000000000001e-002 | AE139: 93.97 | AF139: 97.52 | AG139: 0.41 | AH139: AA+ | AI139: 3.9399999999999998e-002 | AJ139: =H139+100*O139 -> 129.75 | AK139: 127 | AL139: 98 | AM139: 29.5 | AN139: 58 | AO139: -1.4999999999999999e-002 | AP139: 19 | AQ139: 北方转债!
A140: 216 | B140: 113561 | C140: 正裕转债! | D140: 603089 | E140: 正裕工业 | F140: 汽车 | G140: 零部件制 | H140: 109.88 | I140: -1.4000000000000002e-003 | J140: 3.9000000000000003e-003 | K140: 9.03 | L140: 4.4000000000000003e-003 | M140: 118 | N140: 10.08 | O140: 0.22699999999999998 | P140: 89.58 | Q140: 转股中 | R140: 4.57年 | S140: 2.58年 | T140: 1.5 | U140: 14 | V140: 8.5000000000000006e-002 | W140: 7.4999999999999997e-002 | X140: 6.7000000000000004e-002 | Y140: 20 | Z140: 1.89 | AA140: 1.61e-002 | AB140: 9.0000000000000011e-003 | AC140: -1.95e-002 | AD140: -2.2400000000000003e-002 | AE140: 85.77 | AF140: 85.69 | AG140: 0.58 | AH140: A+ | AI140: 7.4400000000000008e-002 | AJ140: =H140+100*O140 -> 132.57999999999998 | AK140: 130.2 | AL140: 140 | AM140: 44.4 | AN140: 210 | AO140: -4.4999999999999998e-002 | AP140: 34 | AQ140: 正裕转债!
A141: 57 | B141: 113044 | C141: 大秦转债! | D141: 601006 | E141: 大秦铁路 | F141: 铁路 | G141: 铁路运输 | H141: 104.71 | I141: 2.9999999999999997e-004 | J141: 1.1000000000000001e-003 | K141: 6.83 | L141: 2.8999999999999998e-003 | M141: 114.1 | N141: 7.66 | O141: 0.17399999999999999 | P141: 89.16 | Q141: 14天 | R141: 5.53年 | S141: 3.53年 | T141: 320 | U141: 74 | V141: 2.e-003 | W141: 0.315 | X141: 0.28100000000000003 | Y141: 1015. | Z141: 0.84 | AA141: 1.6e-002 | AB141: 1.1200000000000002e-002 | AC141: -2.e-003 | AD141: -4.0999999999999995e-003 | AE141: 90.53 | AF141: 93.03 | AG141: 0.48 | AH141: AAA | AI141: 3.8399999999999997e-002 | AJ141: =H141+100*O141 -> 122.10999999999999 | AK141: 120.3 | AL141: 34 | AM141: 27.2 | AN141: 37 | AO141: -1.8000000000000002e-002 | AP141: 14 | AQ141: 大秦转债!
A142: 64 | B142: 127026 | C142: 超声转债! | D142: 823 | E142: 超声电子 | F142: 电子 | G142: 元器件制 | H142: 104.298 | I142: 1.2800000000000001e-002 | J142: 7.000000000000001e-004 | K142: 10.83 | L142: 2.9500000000000002e-002 | M142: 113.1 | N142: 12.85 | O142: 0.23800000000000002 | P142: 84.28 | Q142: 10天 | R142: 5.51年 | S142: 3.51年 | T142: 7 | U142: 11 | V142: 1.4999999999999999e-002 | W142: 0.12 | X142: 0.10099999999999999 | Y142: 58 | Z142: 1.52 | AA142: 1.5100000000000001e-002 | AB142: 1.0700000000000001e-002 | AC142: -1.8e-003 | AD142: -3.7000000000000002e-003 | AE142: 88.73 | AF142: 89.89 | AG142: 0.46 | AH142: AA | AI142: 4.3400000000000001e-002 | AJ142: =H142+100*O142 -> 128.09800000000001 | AK142: 124.3 | AL142: 72 | AM142: 34.4 | AN142: 118 | AO142: 3.6000000000000004e-002 | AP142: 11 | AQ142: 超声转债!
A143: 272 | B143: 113024 | C143: 核建转债! | D143: 601611 | E143: 中国核建 | F143: 建筑 | G143: 建筑工程 | H143: 103.35 | I143: 1.9e-003 | J143: -3.4999999999999996e-003 | K143: 7.2 | L143: -6.8999999999999999e-003 | M143: 109.3 | N143: 9.76 | O143: 0.40100000000000002 | P143: 73.77 | Q143: 转股中 | R143: 3.84年 | S143: 1.84年 | T143: 30 | U143: 4.6 | V143: 1.e-003 | W143: 0.157 | X143: 0.11599999999999999 | Y143: 191 | Z143: 1.61 | AA143: 1.4999999999999999e-002 | AB143: 1.03e-002 | AC143: -2.7000000000000001e-003 | AD143: -5.4000000000000003e-003 | AE143: 95.53 | AF143: 95.17 | AG143: 0.22 | AH143: AAA | AI143: 3.7400000000000003e-002 | AJ143: =H143+100*O143 -> 143.44999999999999 | AK143: 132.9 | AL143: 175 | AM143: 37.4 | AN143: 139 | AO143: -2.5000000000000001e-002 | AP143: 38 | AQ143: 核建转债!
A144: 207 | B144: 113565 | C144: 宏辉转债 | D144: 603336 | E144: 宏辉果蔬 | F144: 农业 | G144: 农产品加 | H144: 110 | I144: 7.3000000000000001e-003 | J144: -6.5000000000000006e-003 | K144: 7.32 | L144: 1.4000000000000002e-003 | M144: 117.8 | N144: 7.64 | O144: 0.14800000000000002 | P144: 95.81 | Q144: 转股中 | R144: 4.73年 | S144: 2.73年 | T144: 2.25 | U144: 26 | V144: 0.10400000000000001 | W144: 7.0000000000000007e-002 | X144: 6.7000000000000004e-002 | Y144: 32 | Z144: 2.36 | AA144: 1.49e-002 | AB144: 8.199999999999999e-003 | AC144: -2.0299999999999999e-002 | AD144: -2.2700000000000001e-002 | AE144: 86.96 | AF144: 88.65 | AG144: 0.6 | AH144: AA- | AI144: 6.3399999999999998e-002 | AJ144: =H144+100*O144 -> 124.8 | AK144: 124.2 | AL144: 68 | AM144: 35.5 | AN144: 129 | AO144: -9.9000000000000005e-002 | AP144: 24 | AQ144: 宏辉转债
A145: 47 | B145: 123092 | C145: 天壕转债 | D145: 300332 | E145: 天壕环境 | F145: 石油天然 | G145: 天然气 | H145: 112.185 | I145: -1.e-004 | J145: -1.03e-002 | K145: 5.29 | L145: -1.49e-002 | M145: 121.6 | N145: 5.2 | O145: 0.10300000000000001 | P145: 101.73 | Q145: 26天 | R145: 5.55年 | S145: 3.56年 | T145: 4.23 | U145: 7.6 | V145: 1.6e-002 | W145: 9.0999999999999998e-002 | X145: 9.1999999999999998e-002 | Y145: 47 | Z145: 1.38 | AA145: 1.49e-002 | AB145: 8.199999999999999e-003 | AC145: -1.8799999999999997e-002 | AD145: -2.1099999999999997e-002 | AE145: 80.08 | AF145: 82 | AG145: 0.69 | AH145: A+ | AI145: 7.5399999999999995e-002 | AJ145: =H145+100*O145 -> 122.485 | AK145: 122.6 | AL145: 57 | AM145: 40.6 | AN145: 175 | AO145: 6.4000000000000001e-002 | AP145: 7 | AQ145: 天壕转债
A146: 106 | B146: 128133 | C146: 奇正转债! | D146: 2287 | E146: 奇正藏药 | F146: 医药 | G146: 中药 | H146: 108.698 | I146: 1.9e-003 | J146: 6.0000000000000001e-003 | K146: 26.79 | L146: 1.7100000000000001e-002 | M146: 117.3 | N146: 30.12 | O146: 0.222 | P146: 88.94 | Q146: 转股中 | R146: 5.30年 | S146: 3.30年 | T146: 8 | U146: 5.2 | V146: 6.0000000000000001e-003 | W146: 5.5999999999999994e-002 | X146: 5.0000000000000003e-002 | Y146: 142 | Z146: 5.49 | AA146: 1.4800000000000001e-002 | AB146: 8.8999999999999999e-003 | AC146: -1.3300000000000001e-002 | AD146: -1.54e-002 | AE146: 89.73 | AF146: 94.09 | AG146: 0.46 | AH146: AA | AI146: 4.3400000000000001e-002 | AJ146: =H146+100*O146 -> 130.898 | AK146: 128.5 | AL146: 119 | AM146: 34.4 | AN146: 115 | AO146: 2.4e-002 | AP146: 15 | AQ146: 奇正转债!
A147: 322 | B147: 128039 | C147: 三力转债! | D147: 2224 | E147: 三 力 士 | F147: 机械装备 | G147: 专用设备 | H147: 105.25 | I147: 8.9999999999999998e-004 | J147: -3.7000000000000002e-003 | K147: 4.8 | L147: -8.3000000000000001e-003 | M147: 109.8 | N147: 5.81 | O147: 0.27399999999999997 | P147: 82.62 | Q147: 转股中 | R147: 3年3.1天 | S147: 1年4.1天 | T147: 2.03 | U147: 3.4 | V147: 1.6e-002 | W147: 5.7999999999999996e-002 | X147: 4.8000000000000001e-002 | Y147: 35 | Z147: 1.52 | AA147: 1.4499999999999999e-002 | AB147: 8.3000000000000001e-003 | AC147: -2.2099999999999998e-002 | AD147: -2.6200000000000001e-002 | AE147: 95.47 | AF147: 91.64 | AG147: 0.35 | AH147: AA- | AI147: 6.3399999999999998e-002 | AJ147: =H147+100*O147 -> 132.65000000000001 | AK147: 127.9 | AL147: 112 | AM147: 32.4 | AN147: 91 | AO147: -3.1e-002 | AP147: 28 | AQ147: 三力转债!
A148: 116 | B148: 113039 | C148: 嘉泽转债! | D148: 601619 | E148: 嘉泽新能 | F148: 能源电力 | G148: 风能 | H148: 105.06 | I148: -1.2999999999999999e-003 | J148: -1.9e-003 | K148: 3.37 | L148: -5.8999999999999999e-003 | M148: 113.1 | N148: 3.57 | O148: 0.113 | P148: 94.4 | Q148: 转股中 | R148: 5.22年 | S148: 3.22年 | T148: 11.8 | U148: 10 | V148: 8.0000000000000002e-003 | W148: 0.161 | X148: 0.152 | Y148: 73 | Z148: 1.96 | AA148: 1.4499999999999999e-002 | AB148: 9.7999999999999997e-003 | AC148: -4.0999999999999995e-003 | AD148: -6.1999999999999998e-003 | AE148: 89.84 | AF148: 91.01 | AG148: 0.55 | AH148: AA | AI148: 4.3400000000000001e-002 | AJ148: =H148+100*O148 -> 116.36 | AK148: 115.7 | AL148: 11 | AM148: 24.7 | AN148: 24 | AO148: -2.7999999999999997e-002 | AP148: 34 | AQ148: 嘉泽转债!
A149: 226 | B149: 128085 | C149: 鸿达转债! | D149: 2002 | E149: 鸿达兴业 | F149: 化工 | G149: 化工 | H149: 116.777 | I149: 3.2500000000000001e-002 | J149: -1.1000000000000001e-003 | K149: 4.6 | L149: 3.8399999999999997e-002 | M149: 124.4 | N149: 3.92 | O149: -5.0000000000000001e-003 | P149: 117.35 | Q149: 转股中 | R149: 4.53年 | S149: 2.53年 | T149: 8.41 | U149: 365 | V149: 0.376 | W149: 6.3e-002 | X149: 7.400000000000001e-002 | Y149: 134 | Z149: 1.58 | AA149: 1.44e-002 | AB149: 5.1999999999999998e-003 | AC149: -4.2699999999999995e-002 | AD149: -4.53e-002 | AE149: 75.96 | AF149: 74.06 | AG149: 0.82 | AH149: BB | AI149: 0.1244 | AJ149: =H149+100*O149 -> 116.277 | AK149: 116.2 | AL149: 14 | AM149: 40.3 | AN149: 168 | AO149: 0.121 | AP149: 100 | AQ149: 鸿达转债!
A150: 215 | B150: 128093 | C150: 百川转债! | D150: 2455 | E150: 百川股份 | F150: 化工 | G150: 化工 | H150: 121.95 | I150: 1.9599999999999999e-002 | J150: -4.6999999999999993e-003 | K150: 6.81 | L150: 2.2499999999999999e-002 | M150: 129.8 | N150: 5.77 | O150: 3.3000000000000002e-002 | P150: 118.02 | Q150: 转股中 | R150: 4.58年 | S150: 2.58年 | T150: 4 | U150: 205 | V150: 0.41899999999999998 | W150: 0.113 | X150: 0.13300000000000001 | Y150: 35 | Z150: 2.59 | AA150: 1.4199999999999999e-002 | AB150: 3.4999999999999996e-003 | AC150: -4.7599999999999996e-002 | AD150: -5.2000000000000005e-002 | AE150: 90.54 | AF150: 98.94 | AG150: 0.67 | AH150: AA- | AI150: 6.3399999999999998e-002 | AJ150: =H150+100*O150 -> 125.25 | AK150: 125.9 | AL150: 87 | AM150: 26.9 | AN150: 35 | AO150: -5.5e-002 | AP150: 48 | AQ150: 百川转债!
A151: 95 | B151: 123071 | C151: 天能转债! | D151: 300569 | E151: 天能重工 | F151: 能源电力 | G151: 风能 | H151: 112.47 | I151: 7.000000000000001e-004 | J151: 2.9999999999999997e-004 | K151: 13.98 | L151: 1.4000000000000002e-003 | M151: 121.1 | N151: 13.4 | O151: 7.8e-002 | P151: 104.33 | Q151: 转股中 | R151: 5.38年 | S151: 3.38年 | T151: 7 | U151: 5.2 | V151: 6.9999999999999993e-003 | W151: 0.125 | X151: 0.13100000000000001 | Y151: 56 | Z151: 2.35 | AA151: 1.41e-002 | AB151: 7.3000000000000001e-003 | AC151: -2.2000000000000002e-002 | AD151: -2.41e-002 | AE151: 83.56 | AF151: 87.2 | AG151: 0.67 | AH151: AA- | AI151: 6.4399999999999999e-002 | AJ151: =H151+100*O151 -> 120.27 | AK151: 120.6 | AL151: 37 | AM151: 33.4 | AN151: 102 | AO151: 3.5000000000000003e-002 | AP151: 13 | AQ151: 天能转债!
A152: 24 | B152: 123105 | C152: 拓尔转债! | D152: 300229 | E152: 拓尔思 | F152: 计算机及 | G152: 软件开发 | H152: 112 | I152: 1.4499999999999999e-002 | J152: -8.5000000000000006e-003 | K152: 9.75 | L152: 9.300000000000001e-003 | M152: 121 | N152: 9.93 | O152: 0.14099999999999999 | P152: 98.19 | Q152: 3月23天 | R152: 5.79年 | S152: 3.79年 | T152: 8 | U152: 74 | V152: 8.199999999999999e-002 | W152: 0.114 | X152: 0.11199999999999999 | Y152: 70 | Z152: 3.21 | AA152: 1.37e-002 | AB152: 7.4000000000000003e-003 | AC152: -1.89e-002 | AD152: -2.0799999999999999e-002 | AE152: 81.38 | AF152: 84.92 | AG152: 0.64 | AH152: AA- | AI152: 6.4399999999999999e-002 | AJ152: =H152+100*O152 -> 126.09999999999999 | AK152: 125.8 | AL152: 86 | AM152: 40.9 | AN152: 179 | AO152: 0.13200000000000001 | AP152: 5 | AQ152: 拓尔转债!
A153: 185 | B153: 128105 | C153: 长集转债! | D153: 2616. | E153: 长青集团 | F153: 城市公用 | G153: 三废处理 | H153: 108.003 | I153: -8.3900000000000002e-002 | J153: 0.10800000000000001 | K153: 7.92 | L153: 4.2099999999999999e-002 | M153: 114.9 | N153: 7.91 | O153: 7.9000000000000001e-002 | P153: 100.13 | Q153: 转股中 | R153: 4.84年 | S153: 2.85年 | T153: 8 | U153: 1692. | V153: 1.8899999999999999 | W153: 0.13600000000000001 | X153: 0.13600000000000001 | Y153: 59 | Z153: 2.21 | AA153: 1.3100000000000001e-002 | AB153: 7.4999999999999997e-003 | AC153: -1.44e-002 | AD153: -1.66e-002 | AE153: 91.34 | AF153: 94.32 | AG153: 0.57 | AH153: AA | AI153: 4.24e-002 | AJ153: =H153+100*O153 -> 115.90300000000001 | AK153: 115.9 | AL153: 12 | AM153: 21.6 | AN153: 17 | AO153: 0.24100000000000002 | AP153: 14 | AQ153: 长集转债!
A154: 134 | B154: 128122 | C154: 兴森转债! | D154: 2436 | E154: 兴森科技 | F154: 电子 | G154: 元器件制 | H154: 107.72 | I154: 1.15e-002 | J154: -6.4000000000000003e-003 | K154: 10.2 | L154: 2.2000000000000002e-002 | M154: 113.3 | N154: 14.1 | O154: 0.48899999999999999 | P154: 72.34 | Q154: 转股中 | R154: 4年48天 | S154: 3年49天 | T154: 2.69 | U154: 50 | V154: 0.17399999999999999 | W154: 1.8000000000000002e-002 | X154: 1.3000000000000001e-002 | Y154: 152 | Z154: 4.73 | AA154: 1.2500000000000001e-002 | AB154: 6.6e-003 | AC154: -1.1699999999999999e-002 | AD154: -1.38e-002 | AE154: 90.48 | AF154: 95.66 | AG154: 0.23 | AH154: AA | AI154: 4.24e-002 | AJ154: =H154+100*O154 -> 156.62 | AK154: 143.1 | AL154: 263 | AM154: 47.4 | AN154: 237 | AO154: 0.115 | AP154: 12 | AQ154: 兴森转债!
A155: 148 | B155: 110071 | C155: 湖盐转债! | D155: 600929 | E155: 雪天盐业 | F155: 食品饮料 | G155: 食品饮料 | H155: 108.64 | I155: -1.5e-003 | J155: -2.0999999999999999e-003 | K155: 6.37 | L155: -6.1999999999999998e-003 | M155: 115.2 | N155: 6.52 | O155: 0.11199999999999999 | P155: 97.7 | Q155: 转股中 | R155: 5年35天 | S155: 3年36天 | T155: 7.2 | U155: 9 | V155: 1.1000000000000001e-002 | W155: 0.12300000000000001 | X155: 0.12 | Y155: 58 | Z155: 2.2 | AA155: 1.18e-002 | AB155: 6.4000000000000003e-003 | AC155: -1.43e-002 | AD155: -1.6399999999999998e-002 | AE155: 90.4 | AF155: 93.19 | AG155: 0.57 | AH155: AA | AI155: 4.3400000000000001e-002 | AJ155: =H155+100*O155 -> 119.84 | AK155: 119.6 | AL155: 30 | AM155: 26.4 | AN155: 30 | AO155: 1.3000000000000001e-002 | AP155: 19 | AQ155: 湖盐转债!
A156: 321 | B156: 128040 | C156: 华通转债! | D156: 2758 | E156: 浙农股份 | F156: 医药 | G156: 医药商业 | H156: 108.499 | I156: -1.1999999999999999e-003 | J156: -8.9999999999999998e-004 | K156: 9.81 | L156: -4.0999999999999995e-003 | M156: 112.3 | N156: 10.33 | O156: 0.14300000000000002 | P156: 94.97 | Q156: 转股中 | R156: 3年9天 | S156: 1年10天 | T156: 2.22 | U156: 1.8 | V156: 6.9999999999999993e-003 | W156: 4.5999999999999999e-002 | X156: 4.4000000000000004e-002 | Y156: 48 | Z156: 1.59 | AA156: 1.1699999999999999e-002 | AB156: 4.0999999999999995e-003 | AC156: -4.4699999999999997e-002 | AD156: -4.9000000000000002e-002 | AE156: 95.61 | AF156: 93.66 | AG156: 0.53 | AH156: AA- | AI156: 6.3399999999999998e-002 | AJ156: =H156+100*O156 -> 122.79899999999999 | AK156: 122 | AL156: 53 | AM156: 26.4 | AN156: 31 | AO156: -5.0000000000000001e-003 | AP156: 31 | AQ156: 华通转债!
A157: 158 | B157: 113588 | C157: 润达转债! | D157: 603108 | E157: 润达医疗 | F157: 医药 | G157: 医疗器械 | H157: 108.01 | I157: 9.0000000000000011e-003 | J157: -5.9999999999999995e-004 | K157: 11.11 | L157: 2.0199999999999999e-002 | M157: 114.2 | N157: 13.36 | O157: 0.29899999999999999 | P157: 83.16 | Q157: 转股中 | R157: 5年12天 | S157: 3年13天 | T157: 5.5 | U157: 1.2 | V157: 2.e-003 | W157: 8.5000000000000006e-002 | X157: 7.0999999999999994e-002 | Y157: 64 | Z157: 2.02 | AA157: 1.1399999999999999e-002 | AB157: 6.1999999999999998e-003 | AC157: -1.2699999999999999e-002 | AD157: -1.49e-002 | AE157: 90.65 | AF157: 92.63 | AG157: 0.42 | AH157: AA | AI157: 4.3400000000000001e-002 | AJ157: =H157+100*O157 -> 137.91 | AK157: 132.9 | AL157: 174 | AM157: 40.2 | AN157: 167 | AO157: -2.3e-002 | AP157: 10 | AQ157: 润达转债!
A158: 218 | B158: 128090 | C158: 汽模转2 | D158: 2510 | E158: 天汽模 | F158: 汽车 | G158: 零部件制 | H158: 109.4 | I158: 2.0000000000000001e-004 | J158: -2.8000000000000004e-003 | K158: 4.08 | L158: -4.8999999999999998e-003 | M158: 114.9 | N158: 4.21 | O158: 0.129 | P158: 96.91 | Q158: 转股中 | R158: 4.56年 | S158: 2.56年 | T158: 3.1 | U158: 7.1 | V158: 2.1000000000000001e-002 | W158: 8.0000000000000002e-002 | X158: 7.6999999999999999e-002 | Y158: 39 | Z158: 1.91 | AA158: 1.1000000000000001e-002 | AB158: 5.1000000000000004e-003 | AC158: -2.06e-002 | AD158: -2.3e-002 | AE158: 92.42 | AF158: 95.43 | AG158: 0.53 | AH158: AA | AI158: 4.24e-002 | AJ158: =H158+100*O158 -> 122.30000000000001 | AK158: 121.9 | AL158: 50 | AM158: 26.5 | AN158: 32 | AO158: -2.e-003 | AP158: 28 | AQ158: 汽模转2
A159: 131 | B159: 123062 | C159: 三超转债 | D159: 300554 | E159: 三超新材 | F159: 机械装备 | G159: 通用设备 | H159: 113.3 | I159: -2.07e-002 | J159: -4.5999999999999999e-003 | K159: 17.96 | L159: -3.44e-002 | M159: 119.7 | N159: 17.17 | O159: 8.3000000000000004e-002 | P159: 104.6 | Q159: 转股中 | R159: 5年52天 | S159: 3年53天 | T159: 1.95 | U159: 115 | V159: 0.51600000000000001 | W159: 0.11599999999999999 | X159: 0.121 | Y159: 17 | Z159: 3.21 | AA159: 1.1000000000000001e-002 | AB159: 4.3e-003 | AC159: -2.41e-002 | AD159: -2.6600000000000002e-002 | AE159: 80.05 | AF159: 79.42 | AG159: 0.74 | AH159: A | AI159: 8.539999999999999e-002 | AJ159: =H159+100*O159 -> 121.59999999999999 | AK159: 122 | AL159: 51 | AM159: 41.9 | AN159: 193 | AO159: 9.1999999999999998e-002 | AP159: 20 | AQ159: 三超转债
A160: 15 | B160: 123107 | C160: 温氏转债! | D160: 300498 | E160: 温氏股份 | F160: 农业 | G160: 畜牧业 | H160: 106.15 | I160: -5.0000000000000001e-004 | J160: 1.1200000000000002e-002 | K160: 14.49 | L160: 2.6200000000000001e-002 | M160: 113 | N160: 17.82 | O160: 0.30499999999999999 | P160: 81.31 | Q160: 4月6天 | R160: 5.81年 | S160: 3.82年 | T160: 93 | U160: 58 | V160: 6.0000000000000001e-003 | W160: 0.10099999999999999 | X160: 8.199999999999999e-002 | Y160: 924 | Z160: 2 | AA160: 1.1000000000000001e-002 | AB160: 6.8999999999999999e-003 | AC160: -6.4000000000000003e-003 | AD160: -8.1000000000000013e-003 | AE160: 89.18 | AF160: 91.1 | AG160: 0.41 | AH160: AAA | AI160: 3.8399999999999997e-002 | AJ160: =H160+100*O160 -> 136.65000000000001 | AK160: 131 | AL160: 151 | AM160: 39.9 | AN160: 166 | AO160: 3.6000000000000004e-002 | AP160: 8 | AQ160: 温氏转债!
A161: 220 | B161: 123038 | C161: 联得转债! | D161: 300545 | E161: 联得装备 | F161: 机械装备 | G161: 专用设备 | H161: 113 | I161: -3.0999999999999999e-003 | J161: -3.8e-003 | K161: 20.81 | L161: -1.2800000000000001e-002 | M161: 118.6 | N161: 24.17 | O161: 0.312 | P161: 86.1 | Q161: 转股中 | R161: 4.56年 | S161: 2.56年 | T161: 1.47 | U161: 8.3 | V161: 5.0000000000000003e-002 | W161: 4.0000000000000001e-002 | X161: 3.4000000000000002e-002 | Y161: 37 | Z161: 3.82 | AA161: 1.09e-002 | AB161: 3.7000000000000002e-003 | AC161: -3.0800000000000001e-002 | AD161: -3.3399999999999999e-002 | AE161: 85.59 | AF161: 86.17 | AG161: 0.54 | AH161: A+ | AI161: 7.4400000000000008e-002 | AJ161: =H161+100*O161 -> 144.19999999999999 | AK161: 139.9 | AL161: 236 | AM161: 53.7 | AN161: 263 | AO161: -1.e-002 | AP161: 18 | AQ161: 联得转债!
A162: 348 | B162: 110038 | C162: 济川转债! | D162: 600566 | E162: 济川药业 | F162: 医药 | G162: 中药 | H162: 105.93 | I162: 8.9999999999999998e-004 | J162: -7.000000000000001e-004 | K162: 18.29 | L162: 1.6000000000000001e-003 | M162: 107.5 | N162: 23.4 | O162: 0.35499999999999998 | P162: 78.16 | Q162: 转股中 | R162: 1.44年 | S162: 回售内 | T162: 6.28 | U162: 1.4 | V162: 2.e-003 | W162: 3.9e-002 | X162: 2.9999999999999999e-002 | Y162: 162 | Z162: 2.01 | AA162: 1.03e-002 | AB162: 5.0000000000000001e-004 | AC162: 回售内 | AD162: 回售内 | AE162: 100.25 | AF162: 101.56 | AG162: 0.08 | AH162: AA | AI162: 4.0599999999999997e-002 | AJ162: =H162+100*O162 -> 141.43000000000001 | AK162: 133.7 | AL162: 185 | AM162: 32.1 | AN162: 89 | AO162: -2.4e-002 | AP162: 22 | AQ162: 济川转债!
A163: 195 | B163: 123045 | C163: 雷迪转债 | D163: 300652 | E163: 雷迪克 | F163: 汽车 | G163: 零部件制 | H163: 113.4 | I163: -2.9999999999999997e-004 | J163: 2.7000000000000001e-003 | K163: 19.07 | L163: 3.7000000000000002e-003 | M163: 118.9 | N163: 20.13 | O163: 0.19699999999999998 | P163: 94.73 | Q163: 转股中 | R163: 4.77年 | S163: 2.77年 | T163: 1.66 | U163: 22 | V163: 0.115 | W163: 9.3000000000000013e-002 | X163: 8.8000000000000009e-002 | Y163: 18 | Z163: 1.89 | AA163: 1.0200000000000001e-002 | AB163: 3.2000000000000002e-003 | AC163: -2.9100000000000001e-002 | AD163: -3.1600000000000003e-002 | AE163: 84.48 | AF163: 85.12 | AG163: 0.63 | AH163: A+ | AI163: 7.4400000000000008e-002 | AJ163: =H163+100*O163 -> 133.09999999999999 | AK163: 132.1 | AL163: 166 | AM163: 46.9 | AN163: 234 | AO163: 7.0999999999999994e-002 | AP163: 34 | AQ163: 雷迪转债
A164: 103 | B164: 113604 | C164: 多伦转债! | D164: 603528 | E164: 多伦科技 | F164: 计算机及 | G164: 软件开发 | H164: 111.45 | I164: 1.1599999999999999e-002 | J164: -1.72e-002 | K164: 9.55 | L164: -9.300000000000001e-003 | M164: 117.3 | N164: 10.44 | O164: 0.218 | P164: 91.48 | Q164: 转股中 | R164: 5.36年 | S164: 3.36年 | T164: 6.4 | U164: 8.5 | V164: 1.2e-002 | W164: 0.107 | X164: 9.8000000000000004e-002 | Y164: 60 | Z164: 3.6 | AA164: 9.7999999999999997e-003 | AB164: 4.0000000000000001e-003 | AC164: -2.0199999999999999e-002 | AD164: -2.2200000000000001e-002 | AE164: 83.5 | AF164: 84.55 | AG164: 0.6 | AH164: AA- | AI164: 6.4399999999999999e-002 | AJ164: =H164+100*O164 -> 133.25 | AK164: 131.4 | AL164: 156 | AM164: 46.9 | AN164: 232 | AO164: 2.4e-002 | AP164: 7 | AQ164: 多伦转债!
A165: 87 | B165: 123075 | C165: 贝斯转债! | D165: 300580 | E165: 贝斯特 | F165: 汽车 | G165: 零部件制 | H165: 109.653 | I165: -5.7999999999999996e-003 | J165: 7.4000000000000003e-003 | K165: 19.73 | L165: 3.0999999999999999e-003 | M165: 115.5 | N165: 23.74 | O165: 0.31900000000000001 | P165: 83.11 | Q165: 转股中 | R165: 5.41年 | S165: 3.41年 | T165: 6 | U165: 8.1 | V165: 1.2e-002 | W165: 0.152 | X165: 0.126 | Y165: 39 | Z165: 2.29 | AA165: 9.7999999999999997e-003 | AB165: 4.6999999999999993e-003 | AC165: -1.5300000000000001e-002 | AD165: -1.7299999999999999e-002 | AE165: 83.24 | AF165: 82.99 | AG165: 0.54 | AH165: AA- | AI165: 6.4399999999999999e-002 | AJ165: =H165+100*O165 -> 141.553 | AK165: 136.2 | AL165: 207 | AM165: 53 | AN165: 260 | AO165: 3.7999999999999999e-002 | AP165: 8 | AQ165: 贝斯转债!
A166: 31 | B166: 128144 | C166: 利民转债 | D166: 2734 | E166: 利民股份 | F166: 化工 | G166: 农化 | H166: 108 | I166: -5.6000000000000008e-003 | J166: 6.8999999999999999e-003 | K166: 12.39 | L166: 2.3999999999999998e-003 | M166: 114.1 | N166: 13.98 | O166: 0.21899999999999997 | P166: 88.63 | Q166: 3月3天 | R166: 5.74年 | S166: 3.74年 | T166: 9.8 | U166: 14 | V166: 1.3000000000000001e-002 | W166: 0.21199999999999999 | X166: 0.188 | Y166: 46 | Z166: 1.68 | AA166: 9.7999999999999997e-003 | AB166: 5.3e-003 | AC166: -1.2500000000000001e-002 | AD166: -1.3899999999999999e-002 | AE166: 87.23 | AF166: 89.74 | AG166: 0.5 | AH166: AA | AI166: 4.3400000000000001e-002 | AJ166: =H166+100*O166 -> 129.90000000000001 | AK166: 127.4 | AL166: 104 | AM166: 37.6 | AN166: 143 | AO166: -2.1000000000000001e-002 | AP166: 5 | AQ166: 利民转债
A167: 229 | B167: 128082 | C167: 华锋转债! | D167: 2806 | E167: 华锋股份 | F167: 电子 | G167: 元器件制 | H167: 116.549 | I167: 4.7999999999999996e-003 | J167: 1.0500000000000001e-002 | K167: 10.55 | L167: 2.1299999999999999e-002 | M167: 121.4 | N167: 9.13 | O167: 9.0000000000000011e-003 | P167: 115.55 | Q167: 转股中 | R167: 4.50年 | S167: 2.50年 | T167: 3.12 | U167: 119 | V167: 0.32500000000000001 | W167: 0.16500000000000001 | X167: 0.19 | Y167: 19 | Z167: 1.92 | AA167: 9.300000000000001e-003 | AB167: 1.1000000000000001e-003 | AC167: -4.0599999999999997e-002 | AD167: -4.3700000000000003e-002 | AE167: 86.51 | AF167: 88.66 | AG167: 0.72 | AH167: A+ | AI167: 7.4400000000000008e-002 | AJ167: =H167+100*O167 -> 117.44900000000001 | AK167: 117.5 | AL167: 20 | AM167: 28.9 | AN167: 50 | AO167: -4.5999999999999999e-002 | AP167: 54 | AQ167: 华锋转债!
A168: 231 | B168: 128081 | C168: 海亮转债! | D168: 2203. | E168: 海亮股份 | F168: 有色金属 | G168: 铜金属 | H168: 110.403 | I168: -6.8000000000000005e-003 | J168: 4.5000000000000005e-003 | K168: 10.23 | L168: -3.9000000000000003e-003 | M168: 114.9 | N168: 9.76 | O168: 5.2999999999999999e-002 | P168: 104.82 | Q168: 转股中 | R168: 4.46年 | S168: 2.47年 | T168: 30.1 | U168: 21 | V168: 6.0000000000000001e-003 | W168: 0.14999999999999999 | X168: 0.157 | Y168: 200 | Z168: 2.11 | AA168: 9.1999999999999998e-003 | AB168: 3.0999999999999999e-003 | AC168: -2.4799999999999999e-002 | AD168: -2.7200000000000002e-002 | AE168: 92.8 | AF168: 95.82 | AG168: 0.61 | AH168: AA | AI168: 4.24e-002 | AJ168: =H168+100*O168 -> 115.703 | AK168: 116 | AL168: 13 | AM168: 20.2 | AN168: 12 | AO168: -1.7000000000000001e-002 | AP168: 52 | AQ168: 海亮转债!
A169: 337 | B169: 110041 | C169: 蒙电转债! | D169: 600863 | E169: 内蒙华电 | F169: 能源电力 | G169: 电力供应 | H169: 106.95 | I169: -1.5e-003 | J169: -1.4000000000000002e-003 | K169: 2.41 | L169: -8.199999999999999e-003 | M169: 109.3 | N169: 2.69 | O169: 0.19399999999999998 | P169: 89.59 | Q169: 转股中 | R169: 2.55年 | S169: 0.55年 | T169: 18.7 | U169: 4.5 | V169: 2.e-003 | W169: 0.13300000000000001 | X169: 0.12 | Y169: 140 | Z169: 1.2 | AA169: 8.6999999999999994e-003 | AB169: 1.8e-003 | AC169: -6.6699999999999995e-002 | AD169: -7.1300000000000002e-002 | AE169: 99.29 | AF169: 100.13 | AG169: 0.35 | AH169: AAA | AI169: 3.56e-002 | AJ169: =H169+100*O169 -> 126.34999999999999 | AK169: 124.3 | AL169: 70 | AM169: 24.2 | AN169: 21 | AO169: -1.2e-002 | AP169: 10 | AQ169: 蒙电转债!
A170: 28 | B170: 123101 | C170: 拓斯转债! | D170: 300607 | E170: 拓斯达 | F170: 机械装备 | G170: 机器人及 | H170: 109.72 | I170: 6.4000000000000003e-003 | J170: -8.199999999999999e-003 | K170: 32.26 | L170: -4.8999999999999998e-003 | M170: 115.1 | N170: 42.25 | O170: 0.43700000000000006 | P170: 76.36 | Q170: 3月14天 | R170: 5.76年 | S170: 3.76年 | T170: 6.7 | U170: 10 | V170: 1.3999999999999999e-002 | W170: 7.8e-002 | X170: 5.9999999999999998e-002 | Y170: 86 | Z170: 3.82 | AA170: 8.5000000000000006e-003 | AB170: 3.8e-003 | AC170: -1.46e-002 | AD170: -1.6299999999999999e-002 | AE170: 87.79 | AF170: 90.5 | AG170: 0.36 | AH170: AA | AI170: 4.3400000000000001e-002 | AJ170: =H170+100*O170 -> 153.42000000000002 | AK170: 143.1 | AL170: 261 | AM170: 52.6 | AN170: 257 | AO170: 6.9999999999999993e-003 | AP170: 4 | AQ170: 拓斯转债!
A171: 174 | B171: 128107 | C171: 交科转债 | D171: 2061 | E171: 浙江交科 | F171: 建筑 | G171: 建筑工程 | H171: 110.405 | I171: 1.4000000000000002e-003 | J171: -3.4000000000000002e-003 | K171: 5.34 | L171: -3.7000000000000002e-003 | M171: 114.9 | N171: 5.36 | O171: 0.10800000000000001 | P171: 99.63 | Q171: 转股中 | R171: 4.88年 | S171: 2.88年 | T171: 25 | U171: 3.2 | V171: 1.e-003 | W171: 0.34000000000000002 | X171: 0.33899999999999997 | Y171: 73 | Z171: 0.86 | AA171: 8.3999999999999995e-003 | AB171: 2.8000000000000004e-003 | AC171: -2.1400000000000002e-002 | AD171: -2.35e-002 | AE171: 92 | AF171: 95.49 | AG171: 0.56 | AH171: AA+ | AI171: 3.9399999999999998e-002 | AJ171: =H171+100*O171 -> 121.205 | AK171: 121.2 | AL171: 44 | AM171: 25.7 | AN171: 25 | AO171: -4.0000000000000001e-003 | AP171: 16 | AQ171: 交科转债
A172: 86 | B172: 110076 | C172: 华海转债! | D172: 600521 | E172: 华海药业 | F172: 医药 | G172: 医药行业 | H172: 110.15 | I172: 3.5999999999999999e-003 | J172: -5.1000000000000004e-003 | K172: 21.73 | L172: -7.8000000000000005e-003 | M172: 115.1 | N172: 34.66 | O172: 0.75700000000000001 | P172: 62.69 | Q172: 转股中 | R172: 5.41年 | S172: 3.41年 | T172: 18.4 | U172: 2.7 | V172: 1.e-003 | W172: 5.7999999999999996e-002 | X172: 3.7000000000000005e-002 | Y172: 316 | Z172: 4.85 | AA172: 8.3000000000000001e-003 | AB172: 3.3e-003 | AC172: -1.7100000000000001e-002 | AD172: -1.9e-002 | AE172: 89.11 | AF172: 91.86 | AG172: 0.19 | AH172: AA | AI172: 4.3400000000000001e-002 | AJ172: =H172+100*O172 -> 185.85000000000002 | AK172: 157.6 | AL172: 312 | AM172: 65.7 | AN172: 312 | AO172: 6.4000000000000001e-002 | AP172: 7 | AQ172: 华海转债!
A173: 239 | B173: 110060 | C173: 天路转债! | D173: 600326 | E173: 西藏天路 | F173: 建筑 | G173: 水泥 | H173: 110.91 | I173: -2.7000000000000001e-003 | J173: -1.1000000000000001e-003 | K173: 7.02 | L173: -7.0999999999999995e-003 | M173: 114.9 | N173: 7.16 | O173: 0.13100000000000001 | P173: 98.04 | Q173: 转股中 | R173: 4.40年 | S173: 2.40年 | T173: 7.06 | U173: 12 | V173: 1.4999999999999999e-002 | W173: 0.109 | X173: 0.107 | Y173: 64 | Z173: 1.53 | AA173: 8.199999999999999e-003 | AB173: 2.0999999999999999e-003 | AC173: -2.7200000000000002e-002 | AD173: -2.9700000000000001e-002 | AE173: 93.05 | AF173: 96.09 | AG173: 0.54 | AH173: AA | AI173: 4.24e-002 | AJ173: =H173+100*O173 -> 124.00999999999999 | AK173: 123.8 | AL173: 66 | AM173: 27.7 | AN173: 40 | AO173: -3.6000000000000004e-002 | AP173: 13 | AQ173: 天路转债!
A174: 211 | B174: 113563 | C174: 柳药转债 | D174: 603368 | E174: 柳药股份 | F174: 医药 | G174: 医药商业 | H174: 108.8 | I174: -8.8000000000000005e-003 | J174: 7.1999999999999998e-003 | K174: 20.83 | L174: -3.8e-003 | M174: 112.9 | N174: 24.47 | O174: 0.27800000000000002 | P174: 85.12 | Q174: 转股中 | R174: 4.62年 | S174: 2.62年 | T174: 8.02 | U174: 19 | V174: 2.2000000000000002e-002 | W174: 0.106 | X174: 8.9999999999999997e-002 | Y174: 75 | Z174: 1.46 | AA174: 8.199999999999999e-003 | AB174: 3.0999999999999999e-003 | AC174: -1.83e-002 | AD174: -2.06e-002 | AE174: 92.21 | AF174: 93.56 | AG174: 0.42 | AH174: AA | AI174: 4.24e-002 | AJ174: =H174+100*O174 -> 136.59999999999999 | AK174: 132.5 | AL174: 168 | AM174: 38.9 | AN174: 158 | AO174: 2.e-003 | AP174: 17 | AQ174: 柳药转债
A175: 346 | B175: 128021 | C175: 兄弟转债!! | D175: 2562 | E175: 兄弟科技 | F175: 医药 | G175: 原料药 | H175: 106.941 | I175: -2.9999999999999997e-004 | J175: -2.5000000000000001e-003 | K175: 4.48 | L175: -8.8000000000000005e-003 | M175: 108.8 | N175: 5.19 | O175: 0.23899999999999999 | P175: 86.32 | Q175: 转股中 | R175: 2.49年 | S175: 0.49年 | T175: 2.65 | U175: 3.6 | V175: 1.3000000000000001e-002 | W175: 5.5999999999999994e-002 | X175: 4.8000000000000001e-002 | Y175: 48 | Z175: 1.61 | AA175: 7.0999999999999995e-003 | AB175: 4.0000000000000002e-004 | AC175: -7.6600000000000001e-002 | AD175: -8.0799999999999997e-002 | AE175: 98.96 | AF175: 98.71 | AG175: 0.32 | AH175: AA | AI175: 4.0599999999999997e-002 | AJ175: =H175+100*O175 -> 130.84100000000001 | AK175: 127.6 | AL175: 106 | AM175: 28.6 | AN175: 48 | AO175: -1.7000000000000001e-002 | AP175: 14 | AQ175: 兄弟转债!!
A176: 129 | B176: 128124 | C176: 科华转债! | D176: 2022 | E176: 科华生物 | F176: 医药 | G176: 生物制药 | H176: 106.421 | I176: -8.0000000000000004e-004 | J176: 2.9999999999999997e-004 | K176: 18.38 | L176: -1.1000000000000001e-003 | M176: 110.3 | N176: 21.51 | O176: 0.245 | P176: 85.45 | Q176: 转股中 | R176: 5年53天 | S176: 3年54天 | T176: 7.38 | U176: 5.5 | V176: 6.9999999999999993e-003 | W176: 7.8e-002 | X176: 6.7000000000000004e-002 | Y176: 95 | Z176: 2.84 | AA176: 7.0999999999999995e-003 | AB176: 3.3e-003 | AC176: -9.7000000000000003e-003 | AD176: -1.15e-002 | AE176: 89.63 | AF176: 88.99 | AG176: 0.48 | AH176: AA | AI176: 4.3400000000000001e-002 | AJ176: =H176+100*O176 -> 130.92099999999999 | AK176: 127.4 | AL176: 105 | AM176: 37.8 | AN176: 146 | AO176: 6.9999999999999993e-003 | AP176: 19 | AQ176: 科华转债!
A177: 256 | B177: 113542 | C177: 好客转债 | D177: 603898 | E177: 好莱客 | F177: 其他 | G177: 家居用品 | H177: 111.73 | I177: -7.000000000000001e-004 | J177: -3.5999999999999999e-003 | K177: 14.3 | L177: -1.04e-002 | M177: 114.9 | N177: 16.14 | O177: 0.26100000000000001 | P177: 88.6 | Q177: 转股中 | R177: 4年57天 | S177: 2年58天 | T177: 6.03 | U177: 1.4 | V177: 2.e-003 | W177: 0.13500000000000001 | X177: 0.12 | Y177: 45 | Z177: 1.73 | AA177: 6.8999999999999999e-003 | AB177: 4.0000000000000002e-004 | AC177: -3.3099999999999997e-002 | AD177: -3.5799999999999998e-002 | AE177: 93.99 | AF177: 97.05 | AG177: 0.42 | AH177: AA | AI177: 4.24e-002 | AJ177: =H177+100*O177 -> 137.83000000000001 | AK177: 134.9 | AL177: 199 | AM177: 37.8 | AN177: 147 | AO177: -6.9000000000000006e-002 | AP177: 17 | AQ177: 好客转债
A178: 25 | B178: 123104 | C178: 卫宁转债 | D178: 300253 | E178: 卫宁健康 | F178: 计算机及 | G178: 软件开发 | H178: 120.418 | I178: -3.3e-003 | J178: 5.4000000000000003e-003 | K178: 15.38 | L178: 5.1999999999999998e-003 | M178: 125.1 | N178: 17.76 | O178: 0.39100000000000001 | P178: 86.6 | Q178: 3月20天 | R178: 5.78年 | S178: 3.78年 | T178: 9.7 | U178: 4 | V178: 3.0000000000000001e-003 | W178: 2.8999999999999998e-002 | X178: 2.6000000000000002e-002 | Y178: 329 | Z178: 7.21 | AA178: 6.7000000000000002e-003 | AB178: -5.0000000000000001e-004 | AC178: -3.7699999999999997e-002 | AD178: -3.9300000000000002e-002 | AE178: 87.73 | AF178: 98.26 | AG178: 0.4 | AH178: AA | AI178: 4.3400000000000001e-002 | AJ178: =H178+100*O178 -> 159.518 | AK178: 154.2 | AL178: 303 | AM178: 56 | AN178: 278 | AO178: -9.0000000000000011e-003 | AP178: 4 | AQ178: 卫宁转债
A179: 165 | B179: 123052 | C179: 飞鹿转债 | D179: 300665 | E179: 飞鹿股份 | F179: 化工 | G179: 化工 | H179: 123.3 | I179: -5.6999999999999993e-003 | J179: -1.9e-003 | K179: 8.38 | L179: -1.06e-002 | M179: 127.3 | N179: 7.05 | O179: 3.7000000000000005e-002 | P179: 118.87 | Q179: 转股中 | R179: 5年0.1天 | S179: 3年1.1天 | T179: 1.53 | U179: 31 | V179: 0.16399999999999998 | W179: 0.106 | X179: 0.125 | Y179: 14 | Z179: 2.18 | AA179: 6.6e-003 | AB179: -2.3999999999999998e-003 | AC179: -4.9500000000000002e-002 | AD179: -5.2400000000000002e-002 | AE179: 83.89 | AF179: 89.43 | AG179: 0.71 | AH179: A+ | AI179: 7.5399999999999995e-002 | AJ179: =H179+100*O179 -> 127. | AK179: 127.7 | AL179: 110 | AM179: 38.3 | AN179: 152 | AO179: -0.245 | AP179: 16 | AQ179: 飞鹿转债
A180: 214 | B180: 127015 | C180: 希望转债!! | D180: 876 | E180: 新 希 望 | F180: 农业 | G180: 畜牧业 | H180: 107 | I180: -1.2e-002 | J180: 9.5999999999999992e-003 | K180: 15.02 | L180: -8.6e-003 | M180: 110 | N180: 19.75 | O180: 0.40700000000000003 | P180: 76.05 | Q180: 转股中 | R180: 4.58年 | S180: 2.58年 | T180: 9.5 | U180: 30 | V180: 2.8999999999999998e-002 | W180: 1.3999999999999999e-002 | X180: 1.1000000000000001e-002 | Y180: 677 | Z180: 1.82 | AA180: 6.0999999999999995e-003 | AB180: 2.0999999999999999e-003 | AC180: -1.4999999999999999e-002 | AD180: -1.6899999999999998e-002 | AE180: 92.87 | AF180: 93.22 | AG180: 0.28 | AH180: AAA | AI180: 3.7400000000000003e-002 | AJ180: =H180+100*O180 -> 147.69999999999999 | AK180: 137.9 | AL180: 221 | AM180: 44.7 | AN180: 215 | AO180: -3.6000000000000004e-002 | AP180: 27 | AQ180: 希望转债!!
A181: 333 | B181: 128034 | C181: 江银转债! | D181: 2807 | E181: 江阴银行 | F181: 金融 | G181: 银行行业 | H181: 106.64 | I181: 2.3999999999999998e-003 | J181: -2.3999999999999998e-003 | K181: 4.04 | L181: 0. | M181: 108.3 | N181: 4.32 | O181: 0.14000000000000001 | P181: 93.52 | Q181: 转股中 | R181: 2.65年 | S181: 无权 | T181: 17.6 | U181: 5.8 | V181: 3.0000000000000001e-003 | W181: 0.20000000000000001 | X181: 0.187 | Y181: 88 | Z181: 0.73 | AA181: 5.8999999999999999e-003 | AB181: 0. | AC181: 无权 | AD181: 无权 | AE181: 无权 | AF181: 98.33 | AG181: 0.43 | AH181: AA+ | AI181: 3.7599999999999995e-002 | AJ181: =H181+100*O181 -> 120.64 | AK181: 119.8 | AL181: 33 | AM181: 21.4 | AN181: 16 | AO181: -1.3999999999999999e-002 | AP181: 25 | AQ181: 江银转债!
A182: 42 | B182: 123093 | C182: 金陵转债 | D182: 300651 | E182: 金陵体育 | F182: 其他 | G182: 文化教育 | H182: 125.414 | I182: 4.8999999999999998e-003 | J182: -8.6999999999999994e-003 | K182: 43.16 | L182: -6.7000000000000002e-003 | M182: 129.3 | N182: 49.29 | O182: 0.43200000000000005 | P182: 87.56 | Q182: 52天 | R182: 5.62年 | S182: 3.63年 | T182: 2.5 | U182: 63 | V182: 0.20199999999999999 | W182: 4.4999999999999998e-002 | X182: 3.9e-002 | Y182: 56 | Z182: 8.06 | AA182: 5.6000000000000008e-003 | AB182: -2.8999999999999998e-003 | AC182: -4.2999999999999997e-002 | AD182: -4.5899999999999996e-002 | AE182: 81.06 | AF182: 86.94 | AG182: 0.57 | AH182: A+ | AI182: 7.5399999999999995e-002 | AJ182: =H182+100*O182 -> 168.614 | AK182: 163.3 | AL182: 320 | AM182: 76.3 | AN182: 324 | AO182: -4.0000000000000001e-003 | AP182: 6 | AQ182: 金陵转债
A183: 230 | B183: 110062 | C183: 烽火转债! | D183: 600498 | E183: 烽火通信 | F183: 通信互联 | G183: 通信设备 | H183: 108.2 | I183: -4.0000000000000002e-004 | J183: 3.5999999999999999e-003 | K183: 18.57 | L183: 9.1999999999999998e-003 | M183: 110.8 | N183: 22.93 | O183: 0.33600000000000002 | P183: 80.99 | Q183: 转股中 | R183: 4.49年 | S183: 2.50年 | T183: 30.9 | U183: 29 | V183: 9.0000000000000011e-003 | W183: 0.14699999999999999 | X183: 0.11900000000000001 | Y183: 210 | Z183: 1.95 | AA183: 5.4000000000000003e-003 | AB183: 8.9999999999999998e-004 | AC183: -1.7399999999999999e-002 | AD183: -1.9799999999999998e-002 | AE183: 93.76 | AF183: 94.26 | AG183: 0.35 | AH183: AAA | AI183: 3.7400000000000003e-002 | AJ183: =H183+100*O183 -> 141.80000000000001 | AK183: 135.4 | AL183: 203 | AM183: 41.2 | AN183: 185 | AO183: 5.5999999999999994e-002 | AP183: 19 | AQ183: 烽火转债!
A184: 180 | B184: 110070 | C184: 凌钢转债! | D184: 600231 | E184: 凌钢股份 | F184: 钢铁 | G184: 炼钢 | H184: 114.99 | I184: -1.15e-002 | J184: -6.5000000000000006e-003 | K184: 2.87 | L184: -3.04e-002 | M184: 117.4 | N184: 2.75 | O184: 0.10199999999999999 | P184: 104.36 | Q184: 转股中 | R184: 4.85年 | S184: 2.86年 | T184: 2.17 | U184: 31 | V184: 0.12300000000000001 | W184: 2.7000000000000003e-002 | X184: 2.7999999999999997e-002 | Y184: 81 | Z184: 0.94 | AA184: 4.4000000000000003e-003 | AB184: -2.e-003 | AC184: -3.3799999999999997e-002 | AD184: -3.6000000000000004e-002 | AE184: 91.6 | AF184: 96.36 | AG184: 0.59 | AH184: AA | AI184: 4.24e-002 | AJ184: =H184+100*O184 -> 125.19 | AK184: 125.6 | AL184: 83 | AM184: 29.3 | AN184: 55 | AO184: -8.4000000000000005e-002 | AP184: 21 | AQ184: 凌钢转债!
A185: 89 | B185: 113606 | C185: 荣泰转债 | D185: 603579 | E185: 荣泰健康 | F185: 机械装备 | G185: 专用设备 | H185: 118.6 | I185: -1.1000000000000001e-003 | J185: -7.6e-003 | K185: 35.04 | L185: -1.3000000000000001e-002 | M185: 121.2 | N185: 33.32 | O185: 0.128 | P185: 105.16 | Q185: 转股中 | R185: 5.40年 | S185: 3.41年 | T185: 6 | U185: 3.4 | V185: 5.0000000000000001e-003 | W185: 0.122 | X185: 0.129 | Y185: 49 | Z185: 2.93 | AA185: 4.0999999999999995e-003 | AB185: -2.5999999999999999e-003 | AC185: -3.6200000000000003e-002 | AD185: -3.8300000000000001e-002 | AE185: 83.54 | AF185: 87.17 | AG185: 0.67 | AH185: AA- | AI185: 6.4399999999999999e-002 | AJ185: =H185+100*O185 -> 131.40000000000001 | AK185: 132 | AL185: 165 | AM185: 44.9 | AN185: 217 | AO185: -1.9e-002 | AP185: 10 | AQ185: 荣泰转债
A186: 169 | B186: 127017 | C186: 万青转债 | D186: 789 | E186: 万年青 | F186: 建筑 | G186: 水泥 | H186: 116 | I186: -1.0500000000000001e-002 | J186: 1.7000000000000001e-003 | K186: 12.5 | L186: -1.8799999999999997e-002 | M186: 118 | N186: 13.46 | O186: 0.249 | P186: 92.87 | Q186: 转股中 | R186: 4.99年 | S186: 2.997年 | T186: 10 | U186: 8.3 | V186: 6.9999999999999993e-003 | W186: 0.10000000000000001 | X186: 9.3000000000000013e-002 | Y186: 100 | Z186: 1.52 | AA186: 3.4999999999999996e-003 | AB186: -2.8000000000000004e-003 | AC186: -3.61e-002 | AD186: -3.7999999999999999e-002 | AE186: 91.53 | AF186: 97.62 | AG186: 0.47 | AH186: AA+ | AI186: 3.9399999999999998e-002 | AJ186: =H186+100*O186 -> 140.90000000000001 | AK186: 139.1 | AL186: 231 | AM186: 41.5 | AN186: 190 | AO186: -8.900000000000001e-002 | AP186: 9 | AQ186: 万青转债
A187: 96 | B187: 123072 | C187: 乐歌转债! | D187: 300729 | E187: 乐歌股份 | F187: 其他 | G187: 家居用品 | H187: 127.27 | I187: -1.18e-002 | J187: 8.8000000000000005e-003 | K187: 25.66 | L187: -3.2099999999999997e-002 | M187: 129.6 | N187: 56.12 | O187: 1.78 | P187: 45.72 | Q187: 转股中 | R187: 5.38年 | S187: 3.38年 | T187: 1.42 | U187: 38 | V187: 0.21100000000000002 | W187: 3.1e-002 | X187: 1.3999999999999999e-002 | Y187: 46 | Z187: 3.48 | AA187: 3.4999999999999996e-003 | AB187: -5.4000000000000003e-003 | AC187: -4.9200000000000001e-002 | AD187: -5.2499999999999998e-002 | AE187: 82.78 | AF187: 88.77 | AG187: 0.09 | AH187: A+ | AI187: 7.5399999999999995e-002 | AJ187: =H187+100*O187 -> 305.26999999999998 | AK187: 208.8 | AL187: 343 | AM187: 120 | AN187: 344 | AO187: -0.161 | AP187: 8 | AQ187: 乐歌转债!
A188: 98 | B188: 128135 | C188: 洽洽转债! | D188: 2557 | E188: 洽洽食品 | F188: 食品饮料 | G188: 休闲食品 | H188: 118.11 | I188: 8.9999999999999998e-004 | J188: 3.3e-003 | K188: 51.57 | L188: 1.0800000000000001e-002 | M188: 120.2 | N188: 60.83 | O188: 0.39299999999999996 | P188: 84.78 | Q188: 转股中 | R188: 5.38年 | S188: 3.38年 | T188: 13.4 | U188: 8.3 | V188: 5.0000000000000001e-003 | W188: 5.0999999999999997e-002 | X188: 4.2999999999999997e-002 | Y188: 261 | Z188: 6.12 | AA188: 3.3e-003 | AB188: -3.0999999999999999e-003 | AC188: -3.6299999999999999e-002 | AD188: -3.8199999999999998e-002 | AE188: 89.34 | AF188: 96.07 | AG188: 0.39 | AH188: AA | AI188: 4.3400000000000001e-002 | AJ188: =H188+100*O188 -> 157.41 | AK188: 151.4 | AL188: 297 | AM188: 55.4 | AN188: 274 | AO188: -1.3999999999999999e-002 | AP188: 10 | AQ188: 洽洽转债!
A189: 67 | B189: 123082 | C189: 北陆转债! | D189: 300016 | E189: 北陆药业 | F189: 医药 | G189: 化学制药 | H189: 119.6 | I189: -3.0999999999999999e-003 | J189: -1.72e-002 | K189: 10.11 | L189: -2.69e-002 | M189: 121.7 | N189: 8.8 | O189: 4.0999999999999995e-002 | P189: 114.89 | Q189: 7天 | R189: 5.51年 | S189: 3.51年 | T189: 5 | U189: 52 | V189: 8.8000000000000009e-002 | W189: 0.10000000000000001 | X189: 0.115 | Y189: 50 | Z189: 3.01 | AA189: 3.2000000000000002e-003 | AB189: -3.4999999999999996e-003 | AC189: -3.61e-002 | AD189: -3.8399999999999997e-002 | AE189: 80.36 | AF189: 82.35 | AG189: 0.75 | AH189: A+ | AI189: 7.5399999999999995e-002 | AJ189: =H189+100*O189 -> 123.69999999999999 | AK189: 124.3 | AL189: 71 | AM189: 42 | AN189: 194 | AO189: 3.1e-002 | AP189: 10 | AQ189: 北陆转债!
A190: 247 | B190: 128074 | C190: 游族转债!! | D190: 2174 | E190: 游族网络 | F190: 通信互联 | G190: 互联网 | H190: 118.35 | I190: -2.8900000000000002e-002 | J190: 2.8900000000000002e-002 | K190: 17.36 | L190: 4.7e-002 | M190: 119.9 | N190: 16.97 | O190: 0.157 | P190: 102.3 | Q190: 转股中 | R190: 4.30年 | S190: 2.30年 | T190: 6.83 | U190: 1191. | V190: 1.4299999999999999 | W190: 4.2999999999999997e-002 | X190: 4.4000000000000004e-002 | Y190: 159 | Z190: 3.11 | AA190: 3.0999999999999999e-003 | AB190: -4.8999999999999998e-003 | AC190: -5.3699999999999998e-002 | AD190: -5.62e-002 | AE190: 93.42 | AF190: 100.65 | AG190: 0 | AH190: AA | AI190: 4.24e-002 | AJ190: =H190+100*O190 -> 134.04999999999998 | AK190: 134.4 | AL190: 192 | AM190: 33.8 | AN190: 107 | AO190: 5.2999999999999999e-002 | AP190: 26 | AQ190: 游族转债!!
A191: 20 | B191: 128145 | C191: 日丰转债 | D191: 2953 | E191: 日丰股份 | F191: 家电 | G191: 零部件制 | H191: 113.5 | I191: -5.3e-003 | J191: 2.3e-003 | K191: 14.65 | L191: -4.0999999999999995e-003 | M191: 115.4 | N191: 13.66 | O191: 5.7999999999999996e-002 | P191: 107.25 | Q191: 3月25天 | R191: 5.79年 | S191: 3.80年 | T191: 3.8 | U191: 4.9 | V191: 1.1000000000000001e-002 | W191: 0.107 | X191: 0.114 | Y191: 36 | Z191: 2.38 | AA191: 2.8999999999999998e-003 | AB191: -1.8e-003 | AC191: -2.2599999999999999e-002 | AD191: -2.4399999999999998e-002 | AE191: 81.18 | AF191: 80.93 | AG191: 0.73 | AH191: AA- | AI191: 6.4399999999999999e-002 | AJ191: =H191+100*O191 -> 119.3 | AK191: 119.8 | AL191: 32 | AM191: 38.6 | AN191: 154 | AO191: -0.247 | AP191: 5 | AQ191: 日丰转债
A192: 269 | B192: 113026 | C192: 核能转债! | D192: 601985 | E192: 中国核电 | F192: 能源电力 | G192: 核电 | H192: 108.16 | I192: 1.9e-003 | J192: -4.3e-003 | K192: 5.16 | L192: -5.7999999999999996e-003 | M192: 109.3 | N192: 5.86 | O192: 0.22800000000000001 | P192: 88.05 | Q192: 转股中 | R192: 3.86年 | S192: 1.86年 | T192: 78 | U192: 43 | V192: 5.0000000000000001e-003 | W192: 8.6999999999999994e-002 | X192: 7.5999999999999998e-002 | Y192: 901 | Z192: 1.46 | AA192: 2.8000000000000004e-003 | AB192: -1.8e-003 | AC192: -2.4900000000000002e-002 | AD192: -2.75e-002 | AE192: 95.47 | AF192: 95.1 | AG192: 0.42 | AH192: AAA | AI192: 3.7400000000000003e-002 | AJ192: =H192+100*O192 -> 130.96000000000001 | AK192: 128.3 | AL192: 116 | AM192: 32.8 | AN192: 97 | AO192: -2.4e-002 | AP192: 45 | AQ192: 核能转债!
A193: 114 | B193: 128129 | C193: 青农转债! | D193: 2958 | E193: 青农商行 | F193: 金融 | G193: 银行行业 | H193: 110.601 | I193: -8.9999999999999998e-004 | J193: 8.9999999999999998e-004 | K193: 4.4 | L193: 0. | M193: 112.2 | N193: 4.47 | O193: 0.124 | P193: 98.43 | Q193: 转股中 | R193: 5.22年 | S193: 无权 | T193: 50 | U193: 6 | V193: 1.e-003 | W193: 0.20499999999999999 | X193: 0.20100000000000001 | Y193: 244 | Z193: 0.89 | AA193: 2.8000000000000004e-003 | AB193: -1.5e-003 | AC193: 无权 | AD193: 无权 | AE193: 无权 | AF193: 92.44 | AG193: 0.57 | AH193: AAA | AI193: 3.8399999999999997e-002 | AJ193: =H193+100*O193 -> 123.001 | AK193: 122.8 | AL193: 58 | AM193: 30.3 | AN193: 66 | AO193: -2.e-003 | AP193: 14 | AQ193: 青农转债!
A194: 244 | B194: 128078 | C194: 太极转债! | D194: 2368 | E194: 太极股份 | F194: 计算机及 | G194: 软件开发 | H194: 115.601 | I194: -6.7000000000000002e-003 | J194: 1.1999999999999999e-003 | K194: 20.81 | L194: -1.0500000000000001e-002 | M194: 116.9 | N194: 22.4 | O194: 0.24399999999999999 | P194: 92.9 | Q194: 转股中 | R194: 4.38年 | S194: 2.38年 | T194: 9.6 | U194: 3.5 | V194: 3.0000000000000001e-003 | W194: 8.0000000000000002e-002 | X194: 7.400000000000001e-002 | Y194: 121 | Z194: 3.6 | AA194: 2.5999999999999999e-003 | AB194: -4.1999999999999997e-003 | AC194: -4.3299999999999998e-002 | AD194: -4.5700000000000005e-002 | AE194: 93.13 | AF194: 97.83 | AG194: 0.53 | AH194: AA | AI194: 4.24e-002 | AJ194: =H194+100*O194 -> 140.001 | AK194: 138.3 | AL194: 226 | AM194: 40.5 | AN194: 171 | AO194: 2.4e-002 | AP194: 10 | AQ194: 太极转债!
A195: 221 | B195: 113030 | C195: 东风转债! | D195: 601515 | E195: 东风股份 | F195: 造纸包装 | G195: 包装材料 | H195: 115.54 | I195: 6.0999999999999995e-003 | J195: 1.9900000000000001e-002 | K195: 6.87 | L195: 4.2500000000000003e-002 | M195: 116.9 | N195: 6.45 | O195: 8.5000000000000006e-002 | P195: 106.51 | Q195: 转股中 | R195: 4.55年 | S195: 2.56年 | T195: 2.95 | U195: 143 | V195: 0.41399999999999998 | W195: 3.2000000000000001e-002 | X195: 3.4000000000000002e-002 | Y195: 92 | Z195: 1.99 | AA195: 2.5999999999999999e-003 | AB195: -3.9000000000000003e-003 | AC195: -4.0300000000000002e-002 | AD195: -4.2599999999999999e-002 | AE195: 92.45 | AF195: 97.12 | AG195: 0.61 | AH195: AA | AI195: 4.24e-002 | AJ195: =H195+100*O195 -> 124.04000000000001 | AK195: 124.6 | AL195: 74 | AM195: 27.4 | AN195: 39 | AO195: 2.e-002 | AP195: 17 | AQ195: 东风转债!
A196: 18 | B196: 127031 | C196: 洋丰转债! | D196: 902 | E196: 新洋丰 | F196: 化工 | G196: 农化 | H196: 115.35 | I196: -1.2999999999999999e-003 | J196: -2.7000000000000001e-003 | K196: 15.13 | L196: -1.18e-002 | M196: 117.1 | N196: 19.94 | O196: 0.52000000000000002 | P196: 75.88 | Q196: 4月6天 | R196: 5.80年 | S196: 3.81年 | T196: 10 | U196: 22 | V196: 1.9e-002 | W196: 5.0999999999999997e-002 | X196: 3.7999999999999999e-002 | Y196: 197 | Z196: 2.72 | AA196: 2.5999999999999999e-003 | AB196: -2.5000000000000001e-003 | AC196: -2.69e-002 | AD196: -2.8500000000000001e-002 | AE196: 87.64 | AF196: 91.9 | AG196: 0.34 | AH196: AA | AI196: 4.3400000000000001e-002 | AJ196: =H196+100*O196 -> 167.34999999999999 | AK196: 154.8 | AL196: 306 | AM196: 62.9 | AN196: 306 | AO196: 2.5000000000000001e-002 | AP196: 2 | AQ196: 洋丰转债!
A197: 143 | B197: 128121 | C197: 宏川转债! | D197: 2930 | E197: 宏川智慧 | F197: 交通运输 | G197: 物流业 | H197: 111.9 | I197: 1.7299999999999999e-002 | J197: -4.6999999999999993e-003 | K197: 16.23 | L197: 2.53e-002 | M197: 113.3 | N197: 20.24 | O197: 0.39500000000000002 | P197: 80.19 | Q197: 转股中 | R197: 5年42天 | S197: 3年43天 | T197: 6.7 | U197: 9.4 | V197: 1.2e-002 | W197: 9.3000000000000013e-002 | X197: 7.4999999999999997e-002 | Y197: 72 | Z197: 3.48 | AA197: 2.5000000000000001e-003 | AB197: -2.2000000000000001e-003 | AC197: -2.2799999999999997e-002 | AD197: -2.5000000000000001e-002 | AE197: 84.77 | AF197: 82.93 | AG197: 0.5 | AH197: AA- | AI197: 6.4399999999999999e-002 | AJ197: =H197+100*O197 -> 151.40000000000001 | AK197: 143.6 | AL197: 266 | AM197: 58.8 | AN197: 291 | AO197: 4.4000000000000004e-002 | AP197: 5 | AQ197: 宏川转债!
A198: 45 | B198: 127028 | C198: 英特转债! | D198: 411 | E198: 英特集团 | F198: 医药 | G198: 医药商业 | H198: 111.75 | I198: -3.5999999999999999e-003 | J198: -8.3000000000000001e-003 | K198: 14.17 | L198: -1.8000000000000002e-002 | M198: 113.1 | N198: 13.4 | O198: 5.7000000000000002e-002 | P198: 105.75 | Q198: 37天 | R198: 5.59年 | S198: 3.59年 | T198: 6 | U198: 16 | V198: 2.3e-002 | W198: 0.17000000000000001 | X198: 0.17999999999999999 | Y198: 35 | Z198: 2.07 | AA198: 2.2000000000000001e-003 | AB198: -2.0999999999999999e-003 | AC198: -2.0099999999999996e-002 | AD198: -2.1899999999999999e-002 | AE198: 89.4 | AF198: 91.02 | AG198: 0.66 | AH198: AA+ | AI198: 4.0399999999999998e-002 | AJ198: =H198+100*O198 -> 117.45 | AK198: 117.8 | AL198: 21 | AM198: 26.7 | AN198: 33 | AO198: -2.7000000000000003e-002 | AP198: 18 | AQ198: 英特转债!
A199: 62 | B199: 113043 | C199: 财通转债! | D199: 601108 | E199: 财通证券 | F199: 金融 | G199: 证券行业 | H199: 108.98 | I199: 1.e-003 | J199: 3.0000000000000001e-003 | K199: 11.12 | L199: 9.1000000000000004e-003 | M199: 110.2 | N199: 13.33 | O199: 0.30599999999999999 | P199: 83.42 | Q199: 12天 | R199: 5.52年 | S199: 无权 | T199: 38 | U199: 112 | V199: 2.7000000000000003e-002 | W199: 9.5000000000000001e-002 | X199: 7.9000000000000001e-002 | Y199: 399 | Z199: 1.74 | AA199: 2.e-003 | AB199: -1.4000000000000002e-003 | AC199: 无权 | AD199: 无权 | AE199: 无权 | AF199: 89.78 | AG199: 0.44 | AH199: AAA | AI199: 3.8399999999999997e-002 | AJ199: =H199+100*O199 -> 139.58000000000001 | AK199: 134.5 | AL199: 194 | AM199: 44.8 | AN199: 216 | AO199: 2.9999999999999999e-002 | AP199: 10 | AQ199: 财通转债!
A200: 91 | B200: 123073 | C200: 同和转债! | D200: 300636 | E200: 同和药业 | F200: 医药 | G200: 原料药 | H200: 121.772 | I200: 5.4000000000000003e-003 | J200: 3.8e-003 | K200: 18.05 | L200: 1.18e-002 | M200: 122.4 | N200: 14.82 | O200: 0. | P200: 121.79 | Q200: 转股中 | R200: 5.39年 | S200: 3.39年 | T200: 3.59 | U200: 32 | V200: 7.2000000000000008e-002 | W200: 9.6999999999999989e-002 | X200: 0.11800000000000001 | Y200: 37 | Z200: 2.96 | AA200: 1.e-003 | AB200: -6.0999999999999995e-003 | AC200: -4.2300000000000004e-002 | AD200: -4.4600000000000001e-002 | AE200: 81 | AF200: 83.5 | AG200: 0.78 | AH200: A+ | AI200: 7.5399999999999995e-002 | AJ200: =H200+100*O200 -> 121.77200000000001 | AK200: 121.7 | AL200: 49 | AM200: 38.2 | AN200: 151 | AO200: -0.12300000000000001 | AP200: 11 | AQ200: 同和转债!
A201: 199 | B201: 110067 | C201: 华安转债! | D201: 600909 | E201: 华安证券 | F201: 金融 | G201: 证券行业 | H201: 110 | I201: 0. | J201: 0. | K201: 6.22 | L201: 0. | M201: 110.3 | N201: 6.98 | O201: 0.23399999999999999 | P201: 89.11 | Q201: 转股中 | R201: 4.77年 | S201: 无权 | T201: 28 | U201: 0 | V201: 0. | W201: 0.124 | X201: 0.111 | Y201: 225 | Z201: 1.57 | AA201: 5.9999999999999995e-004 | AB201: -3.4000000000000002e-003 | AC201: 无权 | AD201: 无权 | AE201: 无权 | AF201: 92.79 | AG201: 0.47 | AH201: AAA | AI201: 3.7400000000000003e-002 | AJ201: =H201+100*O201 -> 133.40000000000001 | AK201: 130.9 | AL201: 150 | AM201: 38.1 | AN201: 150 | AO201: 4.0000000000000001e-003 | AP201: 26 | AQ201: 华安转债!
A202: 12 | B202: 123109 | C202: 昌红转债 | D202: 300151 | E202: 昌红科技 | F202: 机械装备 | G202: 专用设备 | H202: 120.66 | I202: -1.4800000000000001e-002 | J202: 1.5300000000000001e-002 | K202: 31.8 | L202: 5.9999999999999995e-004 | M202: 121 | N202: 28.06 | O202: 6.5000000000000002e-002 | P202: 113.33 | Q202: 4月6天 | R202: 5.82年 | S202: 3.82年 | T202: 4.6 | U202: 11 | V202: 2.e-002 | W202: 2.8999999999999998e-002 | X202: 3.3000000000000002e-002 | Y202: 160 | Z202: 14.94 | AA202: 5.0000000000000001e-004 | AB202: -5.6999999999999993e-003 | AC202: -3.7000000000000005e-002 | AD202: -3.8800000000000001e-002 | AE202: 81.2 | AF202: 84.74 | AG202: 0.72 | AH202: AA- | AI202: 6.4399999999999999e-002 | AJ202: =H202+100*O202 -> 127.16 | AK202: 128 | AL202: 113 | AM202: 43.3 | AN202: 204 | AO202: 0.10099999999999999 | AP202: 4 | AQ202: 昌红转债
A203: 273 | B203: 128064 | C203: 司尔转债! | D203: 2538 | E203: 司尔特 | F203: 化工 | G203: 农化 | H203: 114.199 | I203: 7.3000000000000001e-003 | J203: -6.3e-003 | K203: 6.25 | L203: 1.6000000000000001e-003 | M203: 114.3 | N203: 5.82 | O203: 6.3e-002 | P203: 107.39 | Q203: 转股中 | R203: 3.84年 | S203: 1.84年 | T203: 8 | U203: 5.2 | V203: 6.0000000000000001e-003 | W203: 0.17800000000000002 | X203: 0.191 | Y203: 45 | Z203: 1.12 | AA203: 2.0000000000000001e-004 | AB203: -6.4000000000000003e-003 | AC203: -5.1299999999999998e-002 | AD203: -5.3800000000000001e-002 | AE203: 94.62 | AF203: 97.73 | AG203: 0.62 | AH203: AA | AI203: 4.24e-002 | AJ203: =H203+100*O203 -> 120.499 | AK203: 121 | AL203: 42 | AM203: 23.3 | AN203: 19 | AO203: -9.0000000000000011e-003 | AP203: 45 | AQ203: 司尔转债!
A204: 212 | B204: 128094 | C204: 星帅转债 | D204: 2860 | E204: 星帅尔 | F204: 家电 | G204: 零部件制 | H204: 120.9 | I204: -3.2000000000000002e-003 | J204: 3.7000000000000002e-003 | K204: 16.78 | L204: 5.9999999999999995e-004 | M204: 121 | N204: 13.95 | O204: 5.0000000000000001e-003 | P204: 120.29 | Q204: 转股中 | R204: 4.62年 | S204: 2.62年 | T204: 2.71 | U204: 5.9 | V204: 1.8000000000000002e-002 | W204: 8.1000000000000003e-002 | X204: 9.6999999999999989e-002 | Y204: 33 | Z204: 3.28 | AA204: 2.0000000000000001e-004 | AB204: -7.6e-003 | AC204: -5.2900000000000003e-002 | AD204: -5.5500000000000001e-002 | AE204: 85.42 | AF204: 87.56 | AG204: 0.76 | AH204: A+ | AI204: 7.4400000000000008e-002 | AJ204: =H204+100*O204 -> 121.40000000000001 | AK204: 121.5 | AL204: 47 | AM204: 34 | AN204: 109 | AO204: 9.0000000000000011e-003 | AP204: 29 | AQ204: 星帅转债
A205: 181 | B205: 128106 | C205: 华统转债 | D205: 2840 | E205: 华统股份 | F205: 农业 | G205: 农产品加 | H205: 113.101 | I205: 4.0000000000000002e-004 | J205: 8.9999999999999998e-004 | K205: 9.9 | L205: 2.e-003 | M205: 112.9 | N205: 9.4 | O205: 7.400000000000001e-002 | P205: 105.32 | Q205: 转股中 | R205: 4.85年 | S205: 2.85年 | T205: 5.35 | U205: 4.8 | V205: 8.0000000000000002e-003 | W205: 0.121 | X205: 0.127 | Y205: 44 | Z205: 2.52 | AA205: -4.0000000000000002e-004 | AB205: -5.1999999999999998e-003 | AC205: -2.9500000000000002e-002 | AD205: -3.1600000000000003e-002 | AE205: 91.33 | AF205: 92.67 | AG205: 0.65 | AH205: AA | AI205: 4.24e-002 | AJ205: =H205+100*O205 -> 120.501 | AK205: 120.9 | AL205: 41 | AM205: 28.2 | AN205: 46 | AO205: -3.5000000000000003e-002 | AP205: 9 | AQ205: 华统转债
A206: 133 | B206: 110073 | C206: 国投转债 | D206: 600061 | E206: 国投资本 | F206: 金融 | G206: 证券行业 | H206: 110.72 | I206: 1.8e-003 | J206: 1.8e-003 | K206: 13.55 | L206: 7.4000000000000003e-003 | M206: 110.5 | N206: 15.25 | O206: 0.24600000000000002 | P206: 88.85 | Q206: 转股中 | R206: 5年49天 | S206: 无权 | T206: 80 | U206: 27 | V206: 3.0000000000000001e-003 | W206: 0.14000000000000001 | X206: 0.124 | Y206: 573 | Z206: 1.32 | AA206: -4.0000000000000002e-004 | AB206: -4.1999999999999997e-003 | AC206: 无权 | AD206: 无权 | AE206: 无权 | AF206: 91.3 | AG206: 0.49 | AH206: AAA | AI206: 3.8399999999999997e-002 | AJ206: =H206+100*O206 -> 135.31999999999999 | AK206: 132.6 | AL206: 172 | AM206: 41.3 | AN206: 187 | AO206: 2.1000000000000001e-002 | AP206: 23 | AQ206: 国投转债
A207: 140 | B207: 127020 | C207: 中金转债 | D207: 60 | E207: 中金岭南 | F207: 有色金属 | G207: 有色行业 | H207: 113.991 | I207: -4.7999999999999996e-003 | J207: 1.1999999999999999e-003 | K207: 4.75 | L207: -6.3e-003 | M207: 113.7 | N207: 4.71 | O207: 0.13 | P207: 100.85 | Q207: 转股中 | R207: 5年45天 | S207: 3年46天 | T207: 38 | U207: 12 | V207: 3.0000000000000001e-003 | W207: 0.22399999999999998 | X207: 0.22600000000000001 | Y207: 170 | Z207: 1.42 | AA207: -5.0000000000000001e-004 | AB207: -5.3e-003 | AC207: -3.2099999999999997e-002 | AD207: -3.3500000000000002e-002 | AE207: 90 | AF207: 93.08 | AG207: 0.59 | AH207: AA+ | AI207: 4.0399999999999998e-002 | AJ207: =H207+100*O207 -> 126.991 | AK207: 127.1 | AL207: 100 | AM207: 34.1 | AN207: 110 | AO207: -3.3000000000000002e-002 | AP207: 14 | AQ207: 中金转债
A208: 82 | B208: 127024 | C208: 盈峰转债 | D208: 967 | E208: 盈峰环境 | F208: 机械装备 | G208: 专用设备 | H208: 117.1 | I208: 8.9999999999999998e-004 | J208: -2.0000000000000001e-004 | K208: 7.89 | L208: 1.2999999999999999e-003 | M208: 116.8 | N208: 8.31 | O208: 0.23300000000000001 | P208: 94.95 | Q208: 转股中 | R208: 5.42年 | S208: 3.42年 | T208: 14.8 | U208: 2.9 | V208: 2.e-003 | W208: 5.9000000000000004e-002 | X208: 5.5999999999999994e-002 | Y208: 250 | Z208: 1.49 | AA208: -5.0000000000000001e-004 | AB208: -5.8999999999999999e-003 | AC208: -3.4599999999999999e-002 | AD208: -3.6299999999999999e-002 | AE208: 89.72 | AF208: 94.58 | AG208: 0.52 | AH208: AA+ | AI208: 4.0399999999999998e-002 | AJ208: =H208+100*O208 -> 140.40000000000001 | AK208: 139.3 | AL208: 232 | AM208: 44.7 | AN208: 214 | AO208: -1.3000000000000001e-002 | AP208: 5 | AQ208: 盈峰转债
A209: 305 | B209: 128048 | C209: 张行转债 | D209: 2839 | E209: 张家港行 | F209: 金融 | G209: 银行行业 | H209: 113.609 | I209: -3.2000000000000002e-003 | J209: 5.0000000000000001e-003 | K209: 5.7 | L209: 3.4999999999999996e-003 | M209: 113.3 | N209: 5.76 | O209: 0.14800000000000002 | P209: 98.96 | Q209: 转股中 | R209: 3.44年 | S209: 无权 | T209: 25 | U209: 15 | V209: 5.0000000000000001e-003 | W209: 0.24199999999999999 | X209: 0.23999999999999999 | Y209: 103 | Z209: 0.93 | AA209: -8.0000000000000004e-004 | AB209: -7.8000000000000005e-003 | AC209: 无权 | AD209: 无权 | AE209: 无权 | AF209: 99.47 | AG209: 0.51 | AH209: AA+ | AI209: 3.9399999999999998e-002 | AJ209: =H209+100*O209 -> 128.40899999999999 | AK209: 128.3 | AL209: 115 | AM209: 28.8 | AN209: 49 | AO209: 1.3000000000000001e-002 | AP209: 12 | AQ209: 张行转债
A210: 317 | B210: 110045 | C210: 海澜转债! | D210: 600398 | E210: 海澜之家 | F210: 服装纺织 | G210: 服装行业 | H210: 111.48 | I210: -2.e-003 | J210: -3.0000000000000001e-003 | K210: 7.27 | L210: -9.4999999999999998e-003 | M210: 111.1 | N210: 7.3 | O210: 0.11900000000000001 | P210: 99.59 | Q210: 转股中 | R210: 3年38天 | S210: 1年39天 | T210: 29.5 | U210: 19 | V210: 6.0000000000000001e-003 | W210: 9.4e-002 | X210: 9.4e-002 | Y210: 314 | Z210: 2.24 | AA210: -1.1000000000000001e-003 | AB210: -7.7000000000000002e-003 | AC210: -6.7799999999999999e-002 | AD210: -7.0599999999999996e-002 | AE210: 97.16 | AF210: 98.73 | AG210: 0.52 | AH210: AA+ | AI210: 3.9399999999999998e-002 | AJ210: =H210+100*O210 -> 123.38000000000001 | AK210: 123.4 | AL210: 63 | AM210: 24.6 | AN210: 23 | AO210: 6.0000000000000001e-003 | AP210: 53 | AQ210: 海澜转债!
A211: 44 | B211: 128143 | C211: 锋龙转债! | D211: 2931 | E211: 锋龙股份 | F211: 机械装备 | G211: 专用设备 | H211: 122.5 | I211: -3.3e-003 | J211: -4.0000000000000002e-004 | K211: 20.9 | L211: -4.7999999999999996e-003 | M211: 121.7 | N211: 17.97 | O211: 5.2999999999999999e-002 | P211: 116.3 | Q211: 40天 | R211: 5.59年 | S211: 3.60年 | T211: 2.45 | U211: 270 | V211: 0.91599999999999993 | W211: 8.199999999999999e-002 | X211: 9.6000000000000002e-002 | Y211: 30 | Z211: 4.74 | AA211: -1.1999999999999999e-003 | AB211: -7.8000000000000005e-003 | AC211: -4.1500000000000002e-002 | AD211: -4.3700000000000003e-002 | AE211: 79.85 | AF211: 81.83 | AG211: 0.76 | AH211: A+ | AI211: 7.5399999999999995e-002 | AJ211: =H211+100*O211 -> 127.8 | AK211: 128.7 | AL211: 124 | AM211: 46.9 | AN211: 231 | AO211: 0.26800000000000002 | AP211: 10 | AQ211: 锋龙转债!
A212: 81 | B212: 127025 | C212: 冀东转债 | D212: 401 | E212: 冀东水泥 | F212: 建筑 | G212: 水泥 | H212: 110.9 | I212: -1.3899999999999999e-002 | J212: 7.0999999999999995e-003 | K212: 13.19 | L212: -1.4199999999999999e-002 | M212: 110.1 | N212: 15.28 | O212: 0.28499999999999998 | P212: 86.32 | Q212: 转股中 | R212: 5.42年 | S212: 3.42年 | T212: 17.8 | U212: 15 | V212: 8.0000000000000002e-003 | W212: 9.5000000000000001e-002 | X212: 8.199999999999999e-002 | Y212: 186 | Z212: 1.26 | AA212: -1.4000000000000002e-003 | AB212: -4.7999999999999996e-003 | AC212: -2.0899999999999998e-002 | AD212: -2.2400000000000003e-002 | AE212: 89.93 | AF212: 90.04 | AG212: 0.48 | AH212: AAA | AI212: 3.8399999999999997e-002 | AJ212: =H212+100*O212 -> 139.40000000000001 | AK212: 135.5 | AL212: 204 | AM212: 45.4 | AN212: 222 | AO212: -6.4000000000000001e-002 | AP212: 10 | AQ212: 冀东转债
A213: 182 | B213: 123048 | C213: 应急转债! | D213: 300527 | E213: 中船应急 | F213: 机械装备 | G213: 专用设备 | H213: 113.61 | I213: 1.6000000000000001e-003 | J213: -2.9999999999999997e-004 | K213: 8.73 | L213: 2.3e-003 | M213: 112.8 | N213: 8.9 | O213: 0.158 | P213: 98.09 | Q213: 转股中 | R213: 4.85年 | S213: 2.85年 | T213: 3.8 | U213: 9.6 | V213: 2.2000000000000002e-002 | W213: 4.4999999999999998e-002 | X213: 4.4000000000000004e-002 | Y213: 84 | Z213: 3.16 | AA213: -1.5e-003 | AB213: -6.3e-003 | AC213: -3.1200000000000002e-002 | AD213: -3.3300000000000003e-002 | AE213: 92.02 | AF213: 93.85 | AG213: 0.56 | AH213: AA+ | AI213: 3.9399999999999998e-002 | AJ213: =H213+100*O213 -> 129.41 | AK213: 129.1 | AL213: 129 | AM213: 35.3 | AN213: 125 | AO213: -1.8000000000000002e-002 | AP213: 17 | AQ213: 应急转债!
A214: 53 | B214: 128141 | C214: 旺能转债 | D214: 2034 | E214: 旺能环境 | F214: 城市公用 | G214: 三废处理 | H214: 116.036 | I214: -6.5000000000000006e-003 | J214: -5.0000000000000001e-004 | K214: 17 | L214: -1.11e-002 | M214: 115.1 | N214: 15.97 | O214: 8.9999999999999997e-002 | P214: 106.45 | Q214: 19天 | R214: 5.53年 | S214: 3.54年 | T214: 14 | U214: 8.2 | V214: 5.0000000000000001e-003 | W214: 0.19500000000000001 | X214: 0.20800000000000002 | Y214: 72 | Z214: 1.51 | AA214: -1.5e-003 | AB214: -6.3e-003 | AC214: -3.04e-002 | AD214: -3.2199999999999999e-002 | AE214: 88.64 | AF214: 91.38 | AG214: 0.64 | AH214: AA | AI214: 4.3400000000000001e-002 | AJ214: =H214+100*O214 -> 125.036 | AK214: 125.6 | AL214: 84 | AM214: 34.2 | AN214: 112 | AO214: -7.0999999999999994e-002 | AP214: 6 | AQ214: 旺能转债
A215: 4 | B215: 123113 | C215: 仙乐转债 | D215: 300791 | E215: 仙乐健康 | F215: 食品饮料 | G215: 食品饮料 | H215: 119.51 | I215: -2.3999999999999998e-003 | J215: 9.7000000000000003e-003 | K215: 78.71 | L215: 1.1699999999999999e-002 | M215: 118.5 | N215: 85.98 | O215: 0.30499999999999999 | P215: 91.54 | Q215: 4月23天 | R215: 5.87年 | S215: 3.87年 | T215: 10.3 | U215: 15 | V215: 1.2e-002 | W215: 0.109 | X215: 9.9000000000000005e-002 | Y215: 94 | Z215: 4.21 | AA215: -1.5e-003 | AB215: -6.8999999999999999e-003 | AC215: -3.4500000000000003e-002 | AD215: -3.6200000000000003e-002 | AE215: 80.89 | AF215: 82.72 | AG215: 0.62 | AH215: AA- | AI215: 6.4399999999999999e-002 | AJ215: =H215+100*O215 -> 150.00999999999999 | AK215: 147.5 | AL215: 280 | AM215: 64.8 | AN215: 310 | AO215: 6.0000000000000001e-003 | AP215: 2 | AQ215: 仙乐转债
A216: 30 | B216: 113045 | C216: 环旭转债! | D216: 601231 | E216: 环旭电子 | F216: 电子 | G216: 电子产品 | H216: 113.5 | I216: 0. | J216: -2.3999999999999998e-003 | K216: 15.75 | L216: -6.3e-003 | M216: 112 | N216: 19.75 | O216: 0.42299999999999999 | P216: 79.75 | Q216: 6月9天 | R216: 5.75年 | S216: 2.75年 | T216: 34.5 | U216: 10 | V216: 3.0000000000000001e-003 | W216: 9.9000000000000005e-002 | X216: 7.9000000000000001e-002 | Y216: 348 | Z216: 2.81 | AA216: -2.3e-003 | AB216: -6.0999999999999995e-003 | AC216: -3.3099999999999997e-002 | AD216: -3.5000000000000003e-002 | AE216: 91.69 | AF216: 89.45 | AG216: 0.38 | AH216: AA+ | AI216: 4.0399999999999998e-002 | AJ216: =H216+100*O216 -> 155.80000000000001 | AK216: 147.3 | AL216: 279 | AM216: 55.6 | AN216: 275 | AO216: -5.0000000000000001e-003 | AP216: 4 | AQ216: 环旭转债!
A217: 26 | B217: 123102 | C217: 华自转债 | D217: 300490 | E217: 华自科技 | F217: 机械装备 | G217: 机器人及 | H217: 128.8 | I217: 1.03e-002 | J217: -4.0000000000000001e-003 | K217: 12.26 | L217: 8.199999999999999e-003 | M217: 126.9 | N217: 9.26 | O217: -2.7000000000000003e-002 | P217: 132.4 | Q217: 3月16天 | R217: 5.77年 | S217: 3.77年 | T217: 6.7 | U217: 440 | V217: 0.50700000000000001 | W217: 0.21299999999999999 | X217: 0.28199999999999997 | Y217: 31 | Z217: 1.79 | AA217: -2.5999999999999999e-003 | AB217: -1.0200000000000001e-002 | AC217: -5.1100000000000007e-002 | AD217: -5.33e-002 | AE217: 82.33 | AF217: 89.28 | AG217: 0.77 | AH217: AA- | AI217: 6.4399999999999999e-002 | AJ217: =H217+100*O217 -> 126.10000000000001 | AK217: 125.2 | AL217: 79 | AM217: 35.9 | AN217: 131 | AO217: 0.192 | AP217: 18 | AQ217: 华自转债
A218: 115 | B218: 113602 | C218: 景20转债! | D218: 603228 | E218: 景旺电子 | F218: 电子 | G218: 元器件制 | H218: 114.94 | I218: 6.8000000000000005e-003 | J218: 1.4000000000000002e-003 | K218: 25.63 | L218: 1.4999999999999999e-002 | M218: 113.3 | N218: 27.4 | O218: 0.22899999999999998 | P218: 93.54 | Q218: 转股中 | R218: 5.22年 | S218: 3.22年 | T218: 17.8 | U218: 6.6 | V218: 3.0000000000000001e-003 | W218: 8.1000000000000003e-002 | X218: 7.5999999999999998e-002 | Y218: 219 | Z218: 3.36 | AA218: -2.8000000000000004e-003 | AB218: -7.4000000000000003e-003 | AC218: -2.9900000000000003e-002 | AD218: -3.2000000000000001e-002 | AE218: 90.03 | AF218: 91.2 | AG218: 0.55 | AH218: AA | AI218: 4.3400000000000001e-002 | AJ218: =H218+100*O218 -> 137.84 | AK218: 136.3 | AL218: 208 | AM218: 45.1 | AN218: 221 | AO218: 1.2e-002 | AP218: 9 | AQ218: 景20转债!
A219: 217 | B219: 128091 | C219: 新天转债 | D219: 2873 | E219: 新天药业 | F219: 医药 | G219: 中药 | H219: 121.008 | I219: -1.0800000000000001e-002 | J219: 5.3e-003 | K219: 17.82 | L219: -7.8000000000000005e-003 | M219: 119.4 | N219: 16.39 | O219: 0.113 | P219: 108.72 | Q219: 转股中 | R219: 4.57年 | S219: 2.57年 | T219: 1.76 | U219: 36 | V219: 0.16699999999999998 | W219: 8.4000000000000005e-002 | X219: 9.1999999999999998e-002 | Y219: 21 | Z219: 2.56 | AA219: -3.0000000000000001e-003 | AB219: -1.03e-002 | AC219: -5.28e-002 | AD219: -5.57e-002 | AE219: 86.07 | AF219: 86.77 | AG219: 0.71 | AH219: A+ | AI219: 7.4400000000000008e-002 | AJ219: =H219+100*O219 -> 132.30799999999999 | AK219: 133.3 | AL219: 180 | AM219: 46.5 | AN219: 227 | AO219: -1.3000000000000001e-002 | AP219: 18 | AQ219: 新天转债
A220: 51 | B220: 123090 | C220: 三诺转债 | D220: 300298 | E220: 三诺生物 | F220: 医药 | G220: 医疗器械 | H220: 119.1 | I220: -1.8e-003 | J220: -1.e-003 | K220: 30.8 | L220: -6.0999999999999995e-003 | M220: 117.1 | N220: 35.35 | O220: 0.36700000000000005 | P220: 87.13 | Q220: 21天 | R220: 5.55年 | S220: 3.55年 | T220: 5 | U220: 6.1 | V220: 1.e-002 | W220: 2.8999999999999998e-002 | X220: 2.5000000000000001e-002 | Y220: 174 | Z220: 6.53 | AA220: -3.0999999999999999e-003 | AB220: -8.5000000000000006e-003 | AC220: -3.7100000000000001e-002 | AD220: -3.8900000000000004e-002 | AE220: 88.6 | AF220: 92.91 | AG220: 0.46 | AH220: AA | AI220: 4.3400000000000001e-002 | AJ220: =H220+100*O220 -> 155.80000000000001 | AK220: 151.1 | AL220: 295 | AM220: 58.2 | AN220: 289 | AO220: -6.4000000000000001e-002 | AP220: 3 | AQ220: 三诺转债
A221: 7 | B221: 127032 | C221: 苏行转债 | D221: 2966 | E221: 苏州银行 | F221: 金融 | G221: 银行行业 | H221: 117.23 | I221: 2.e-003 | J221: -1.2999999999999999e-003 | K221: 7.89 | L221: 1.2999999999999999e-003 | M221: 115.1 | N221: 8.1 | O221: 0.20399999999999999 | P221: 97.41 | Q221: 4月16天 | R221: 5.85年 | S221: 无权 | T221: 50 | U221: 135 | V221: 2.3e-002 | W221: 0.19 | X221: 0.185 | Y221: 263 | Z221: 0.86 | AA221: -3.2000000000000002e-003 | AB221: -7.7000000000000002e-003 | AC221: 无权 | AD221: 无权 | AE221: 无权 | AF221: 92.65 | AG221: 0.56 | AH221: AAA | AI221: 3.8399999999999997e-002 | AJ221: =H221+100*O221 -> 137.63 | AK221: 137.1 | AL221: 213 | AM221: 44.4 | AN221: 211 | AO221: 4.0000000000000001e-002 | AP221: 6 | AQ221: 苏行转债
A222: 33 | B222: 123100 | C222: 朗科转债 | D222: 300543 | E222: 朗科智能 | F222: 电子 | G222: 电子产品 | H222: 119.69 | I222: -1.1200000000000002e-002 | J222: -7.7000000000000002e-003 | K222: 12.68 | L222: -2.6099999999999998e-002 | M222: 117.5 | N222: 11.61 | O222: 9.6000000000000002e-002 | P222: 109.22 | Q222: 2月19天 | R222: 5.68年 | S222: 3.69年 | T222: 3.8 | U222: 14 | V222: 3.2000000000000001e-002 | W222: 0.11199999999999999 | X222: 0.122 | Y222: 34 | Z222: 2.79 | AA222: -3.3e-003 | AB222: -8.6999999999999994e-003 | AC222: -3.6499999999999998e-002 | AD222: -3.8300000000000001e-002 | AE222: 81.85 | AF222: 83 | AG222: 0.72 | AH222: AA- | AI222: 6.4399999999999999e-002 | AJ222: =H222+100*O222 -> 129.28999999999999 | AK222: 130.2 | AL222: 139 | AM222: 47.2 | AN222: 235 | AO222: -0.14000000000000001 | AP222: 8 | AQ222: 朗科转债
A223: 13 | B223: 123110 | C223: 九典转债 | D223: 300705 | E223: 九典制药 | F223: 医药 | G223: 化学制药 | H223: 123.7 | I223: -7.4999999999999997e-003 | J223: 1.23e-002 | K223: 29.07 | L223: 6.6e-003 | M223: 121.4 | N223: 26.44 | O223: 0.125 | P223: 109.95 | Q223: 4月6天 | R223: 5.82年 | S223: 3.82年 | T223: 2.7 | U223: 17 | V223: 5.0999999999999997e-002 | W223: 4.0000000000000001e-002 | X223: 4.4000000000000004e-002 | Y223: 68 | Z223: 7.73 | AA223: -3.3e-003 | AB223: -9.4999999999999998e-003 | AC223: -4.2000000000000003e-002 | AD223: -4.3899999999999995e-002 | AE223: 78.35 | AF223: 80.24 | AG223: 0.74 | AH223: A+ | AI223: 7.5399999999999995e-002 | AJ223: =H223+100*O223 -> 136.19999999999999 | AK223: 137.5 | AL223: 217 | AM223: 57.2 | AN223: 286 | AO223: -2.5000000000000001e-002 | AP223: 4 | AQ223: 九典转债
A224: 288 | B224: 128057 | C224: 博彦转债 | D224: 2649 | E224: 博彦科技 | F224: 计算机及 | G224: 软件开发 | H224: 117.868 | I224: 8.3999999999999995e-003 | J224: -7.7000000000000002e-003 | K224: 9.59 | L224: 1.e-003 | M224: 116.3 | N224: 8.5 | O224: 4.4999999999999998e-002 | P224: 112.82 | Q224: 转股中 | R224: 3.75年 | S224: 1.75年 | T224: 5.07 | U224: 7.5 | V224: 1.3000000000000001e-002 | W224: 9.9000000000000005e-002 | X224: 0.11199999999999999 | Y224: 51 | Z224: 1.68 | AA224: -3.5999999999999999e-003 | AB224: -1.1299999999999999e-002 | AC224: -6.93e-002 | AD224: -7.1900000000000006e-002 | AE224: 91.45 | AF224: 92.76 | AG224: 0.7 | AH224: AA- | AI224: 6.3399999999999998e-002 | AJ224: =H224+100*O224 -> 122.36799999999999 | AK224: 122.9 | AL224: 60 | AM224: 30.2 | AN224: 64 | AO224: 4.0000000000000001e-003 | AP224: 25 | AQ224: 博彦转债
A225: 347 | B225: 123002 | C225: 国祯转债!! | D225: 300388 | E225: 节能国祯 | F225: 城市公用 | G225: 三废处理 | H225: 109.899 | I225: -8.9999999999999998e-004 | J225: -6.0000000000000001e-003 | K225: 7.93 | L225: -1.49e-002 | M225: 108.8 | N225: 8.48 | O225: 0.17499999999999999 | P225: 93.51 | Q225: 转股中 | R225: 2.47年 | S225: 0.47年 | T225: 2.52 | U225: 0.7 | V225: 2.e-003 | W225: 4.4999999999999998e-002 | X225: 4.2999999999999997e-002 | Y225: 55 | Z225: 1.5 | AA225: -4.0999999999999995e-003 | AB225: -1.0700000000000001e-002 | AC225: -0.125 | AD225: -0.129 | AE225: 99 | AF225: 98.75 | AG225: 0.46 | AH225: AA | AI225: 4.0599999999999997e-002 | AJ225: =H225+100*O225 -> 127.399 | AK225: 126.3 | AL225: 93 | AM225: 27.3 | AN225: 38 | AO225: -2.3e-002 | AP225: 15 | AQ225: 国祯转债!!
A226: 177 | B226: 113577 | C226: 春秋转债! | D226: 603890 | E226: 春秋电子 | F226: 电子 | G226: 电子产品 | H226: 120.09 | I226: -3.0999999999999999e-003 | J226: 8.0000000000000004e-004 | K226: 12.35 | L226: -3.2000000000000002e-003 | M226: 117.7 | N226: 11.06 | O226: 7.4999999999999997e-002 | P226: 111.66 | Q226: 转股中 | R226: 4.86年 | S226: 2.86年 | T226: 1.78 | U226: 1.8 | V226: 9.0000000000000011e-003 | W226: 3.7000000000000005e-002 | X226: 4.0999999999999995e-002 | Y226: 48 | Z226: 2.55 | AA226: -4.1999999999999997e-003 | AB226: -1.0500000000000001e-002 | AC226: -4.7899999999999998e-002 | AD226: -5.0099999999999999e-002 | AE226: 86.17 | AF226: 87.86 | AG226: 0.7 | AH226: AA- | AI226: 6.3399999999999998e-002 | AJ226: =H226+100*O226 -> 127.59 | AK226: 128.5 | AL226: 122 | AM226: 40.7 | AN226: 176 | AO226: -2.7000000000000003e-002 | AP226: 13 | AQ226: 春秋转债!
A227: 88 | B227: 113607 | C227: 伟20转债! | D227: 603568 | E227: 伟明环保 | F227: 城市公用 | G227: 三废处理 | H227: 117.9 | I227: -4.1999999999999997e-003 | J227: 1.5e-003 | K227: 22.67 | L227: -4.4000000000000003e-003 | M227: 115.1 | N227: 22.01 | O227: 0.14499999999999999 | P227: 103 | Q227: 转股中 | R227: 5.41年 | S227: 3.41年 | T227: 12 | U227: 0.3 | V227: 0. | W227: 4.2000000000000003e-002 | X227: 4.2999999999999997e-002 | Y227: 285 | Z227: 5.1 | AA227: -4.5000000000000005e-003 | AB227: -9.3999999999999986e-003 | AC227: -3.5699999999999996e-002 | AD227: -3.7599999999999995e-002 | AE227: 89.11 | AF227: 91.86 | AG227: 0.63 | AH227: AA | AI227: 4.3400000000000001e-002 | AJ227: =H227+100*O227 -> 132.40000000000001 | AK227: 132.8 | AL227: 173 | AM227: 40.9 | AN227: 180 | AO227: -2.3e-002 | AP227: 5 | AQ227: 伟20转债!
A228: 113 | B228: 128130 | C228: 景兴转债 | D228: 2067 | E228: 景兴纸业 | F228: 造纸包装 | G228: 包装用纸 | H228: 117.889 | I228: 2.e-003 | J228: -2.e-003 | K228: 3.96 | L228: 0. | M228: 115.1 | N228: 3.4 | O228: 1.2e-002 | P228: 116.47 | Q228: 转股中 | R228: 5.24年 | S228: 3.24年 | T228: 10.7 | U228: 13 | V228: 1.e-002 | W228: 0.23199999999999998 | X228: 0.27100000000000002 | Y228: 46 | Z228: 0.94 | AA228: -4.5999999999999999e-003 | AB228: -9.7000000000000003e-003 | AC228: -3.7499999999999999e-002 | AD228: -3.9399999999999998e-002 | AE228: 89.76 | AF228: 92.53 | AG228: 0.71 | AH228: AA | AI228: 4.3400000000000001e-002 | AJ228: =H228+100*O228 -> 119.089 | AK228: 119.3 | AL228: 28 | AM228: 26.8 | AN228: 34 | AO228: 1.3999999999999999e-002 | AP228: 14 | AQ228: 景兴转债
A229: 35 | B229: 123098 | C229: 一品转债 | D229: 300723 | E229: 一品红 | F229: 医药 | G229: 医药行业 | H229: 127.28 | I229: 2.7000000000000001e-003 | J229: 0. | K229: 26.57 | L229: 4.1999999999999997e-003 | M229: 124 | N229: 25.45 | O229: 0.21899999999999997 | P229: 104.4 | Q229: 2月0天 | R229: 5.65年 | S229: 3.65年 | T229: 4.8 | U229: 3.7 | V229: 6.0000000000000001e-003 | W229: 6.3e-002 | X229: 6.6000000000000003e-002 | Y229: 76 | Z229: 2.75 | AA229: -4.6999999999999993e-003 | AB229: -1.1699999999999999e-002 | AC229: -5.2199999999999996e-002 | AD229: -5.4000000000000006e-002 | AE229: 82.08 | AF229: 87.76 | AG229: 0.66 | AH229: AA- | AI229: 6.4399999999999999e-002 | AJ229: =H229+100*O229 -> 149.18000000000001 | AK229: 150.2 | AL229: 289 | AM229: 62.4 | AN229: 304 | AO229: -3.7000000000000005e-002 | AP229: 3 | AQ229: 一品转债
A230: 248 | B230: 128075 | C230: 远东转债! | D230: 2406 | E230: 远东传动 | F230: 汽车 | G230: 零部件制 | H230: 117.295 | I230: -3.8e-003 | J230: -1.5e-003 | K230: 6.11 | L230: -8.1000000000000013e-003 | M230: 114.9 | N230: 5.54 | O230: 6.4000000000000001e-002 | P230: 110.29 | Q230: 转股中 | R230: 4.30年 | S230: 2.30年 | T230: 5.44 | U230: 3.9 | V230: 6.0000000000000001e-003 | W230: 0.14300000000000002 | X230: 0.157 | Y230: 38 | Z230: 1.15 | AA230: -4.8999999999999998e-003 | AB230: -1.1000000000000001e-002 | AC230: -5.0300000000000004e-002 | AD230: -5.2699999999999997e-002 | AE230: 93.42 | AF230: 96.47 | AG230: 0.65 | AH230: AA | AI230: 4.24e-002 | AJ230: =H230+100*O230 -> 123.69500000000001 | AK230: 124.3 | AL230: 69 | AM230: 27.8 | AN230: 41 | AO230: -1.7000000000000001e-002 | AP230: 14 | AQ230: 远东转债!
A231: 264 | B231: 113536 | C231: 三星转债 | D231: 603578 | E231: 三星新材 | F231: 家电 | G231: 零部件制 | H231: 116.83 | I231: 1.4000000000000002e-003 | J231: -4.3e-003 | K231: 14.95 | L231: -4.6999999999999993e-003 | M231: 114.3 | N231: 13.76 | O231: 7.4999999999999997e-002 | P231: 108.65 | Q231: 转股中 | R231: 3.99年 | S231: 1.99年 | T231: 1.49 | U231: 3.5 | V231: 2.e-002 | W231: 7.8e-002 | X231: 8.4000000000000005e-002 | Y231: 19 | Z231: 1.84 | AA231: -5.6000000000000008e-003 | AB231: -1.1899999999999999e-002 | AC231: -5.7999999999999996e-002 | AD231: -6.0299999999999999e-002 | AE231: 94.05 | AF231: 97.14 | AG231: 0.62 | AH231: AA | AI231: 4.24e-002 | AJ231: =H231+100*O231 -> 124.33 | AK231: 125 | AL231: 75 | AM231: 27.9 | AN231: 42 | AO231: -0.24399999999999999 | AP231: 35 | AQ231: 三星转债
A232: 237 | B232: 123033 | C232: 金力转债! | D232: 300748 | E232: 金力永磁 | F232: 电子 | G232: 元器件制 | H232: 124.6 | I232: 4.3e-003 | J232: 6.3e-003 | K232: 27.56 | L232: 1.5800000000000002e-002 | M232: 121.5 | N232: 25.3 | O232: 0.14400000000000002 | P232: 108.93 | Q232: 转股中 | R232: 4.41年 | S232: 2.41年 | T232: 4.34 | U232: 69 | V232: 0.128 | W232: 2.3e-002 | X232: 2.5000000000000001e-002 | Y232: 190 | Z232: 5.67 | AA232: -5.8999999999999999e-003 | AB232: -1.41e-002 | AC232: -6.5199999999999994e-002 | AD232: -6.8499999999999991e-002 | AE232: 89.85 | AF232: 93.43 | AG232: 0.66 | AH232: AA- | AI232: 6.3399999999999998e-002 | AJ232: =H232+100*O232 -> 139. | AK232: 140.3 | AL232: 244 | AM232: 46.8 | AN232: 230 | AO232: -3.0000000000000001e-003 | AP232: 26 | AQ232: 金力转债!
A233: 50 | B233: 123089 | C233: 九洲转2! | D233: 300040 | E233: 九洲集团 | F233: 能源电力 | G233: 电力设备 | H233: 125.1 | I233: 6.4000000000000001e-002 | J233: 2.0799999999999999e-002 | K233: 10.14 | L233: 0.10800000000000001 | M233: 121 | N233: 8 | O233: -1.3000000000000001e-002 | P233: 126.75 | Q233: 21天 | R233: 5.55年 | S233: 3.55年 | T233: 5 | U233: 455 | V233: 0.7340000000000001 | W233: 0.13 | X233: 0.16399999999999998 | Y233: 39 | Z233: 1.73 | AA233: -6.0999999999999995e-003 | AB233: -1.2500000000000001e-002 | AC233: -4.9100000000000005e-002 | AD233: -5.0999999999999997e-002 | AE233: 82.62 | AF233: 86.21 | AG233: 0.78 | AH233: AA- | AI233: 6.4399999999999999e-002 | AJ233: =H233+100*O233 -> 123.8 | AK233: 123.5 | AL233: 64 | AM233: 37.2 | AN233: 136 | AO233: 0.157 | AP233: 21 | AQ233: 九洲转2!
A234: 280 | B234: 127012 | C234: 招路转债! | D234: 1965 | E234: 招商公路 | F234: 机场高速 | G234: 高速 | H234: 110.47 | I234: 8.6999999999999994e-003 | J234: -7.6e-003 | K234: 7.79 | L234: 2.5999999999999999e-003 | M234: 107.9 | N234: 8.81 | O234: 0.249 | P234: 88.42 | Q234: 转股中 | R234: 3.79年 | S234: 1.80年 | T234: 50 | U234: 21 | V234: 4.0000000000000001e-003 | W234: 0.10400000000000001 | X234: 9.1999999999999998e-002 | Y234: 481 | Z234: 0.96 | AA234: -6.3e-003 | AB234: -1.01e-002 | AC234: -4.1700000000000001e-002 | AD234: -4.3200000000000002e-002 | AE234: 94.61 | AF234: 94.02 | AG234: 0.43 | AH234: AAA | AI234: 3.7400000000000003e-002 | AJ234: =H234+100*O234 -> 135.37 | AK234: 132.5 | AL234: 170 | AM234: 37.9 | AN234: 149 | AO234: -3.6000000000000004e-002 | AP234: 31 | AQ234: 招路转债!
A235: 75 | B235: 113609 | C235: 永安转债! | D235: 603776 | E235: 永安行 | F235: 城市公用 | G235: 其他 | H235: 124.67 | I235: 4.7999999999999996e-003 | J235: 5.3e-003 | K235: 25.59 | L235: 1.2699999999999999e-002 | M235: 120.5 | N235: 20.34 | O235: -9.0000000000000011e-003 | P235: 125.81 | Q235: 转股中 | R235: 5.47年 | S235: 3.47年 | T235: 8.35 | U235: 175 | V235: 0.17000000000000001 | W235: 0.17399999999999999 | X235: 0.21899999999999997 | Y235: 48 | Z235: 1.53 | AA235: -6.3e-003 | AB235: -1.2699999999999999e-002 | AC235: -4.9400000000000006e-002 | AD235: -5.1299999999999998e-002 | AE235: 82.93 | AF235: 86.23 | AG235: 0.79 | AH235: AA- | AI235: 6.4399999999999999e-002 | AJ235: =H235+100*O235 -> 123.77 | AK235: 123.5 | AL235: 65 | AM235: 37.3 | AN235: 138 | AO235: -2.8999999999999998e-002 | AP235: 21 | AQ235: 永安转债!
A236: 167 | B236: 128109 | C236: 楚江转债 | D236: 2171 | E236: 楚江新材 | F236: 有色金属 | G236: 铜金属 | H236: 118.75 | I236: -7.0999999999999995e-003 | J236: 7.7000000000000002e-003 | K236: 8.15 | L236: 1.1999999999999999e-003 | M236: 115.3 | N236: 8.63 | O236: 0.25700000000000001 | P236: 94.44 | Q236: 转股中 | R236: 4.997年 | S236: 3年0.1天 | T236: 18.3 | U236: 4 | V236: 2.e-003 | W236: 0.16800000000000001 | X236: 0.159 | Y236: 109 | Z236: 1.92 | AA236: -6.7000000000000002e-003 | AB236: -1.1899999999999999e-002 | AC236: -4.3099999999999999e-002 | AD236: -4.4999999999999998e-002 | AE236: 90.76 | AF236: 93.72 | AG236: 0.52 | AH236: AA | AI236: 4.24e-002 | AJ236: =H236+100*O236 -> 144.44999999999999 | AK236: 143.1 | AL236: 260 | AM236: 49.3 | AN236: 241 | AO236: 1.7000000000000001e-002 | AP236: 6 | AQ236: 楚江转债
A237: 137 | B237: 123060 | C237: 苏试转债 | D237: 300416 | E237: 苏试试验 | F237: 机械装备 | G237: 专用设备 | H237: 121.902 | I237: 0. | J237: 6.0999999999999995e-003 | K237: 18.99 | L237: 9.0000000000000011e-003 | M237: 117.6 | N237: 18.28 | O237: 0.17300000000000001 | P237: 103.88 | Q237: 转股中 | R237: 5年46天 | S237: 3年47天 | T237: 3.1 | U237: 11 | V237: 2.8999999999999998e-002 | W237: 6.2e-002 | X237: 6.4000000000000001e-002 | Y237: 50 | Z237: 4.14 | AA237: -7.0999999999999995e-003 | AB237: -1.3100000000000001e-002 | AC237: -4.7699999999999992e-002 | AD237: -4.9800000000000004e-002 | AE237: 84.83 | AF237: 86.03 | AG237: 0.68 | AH237: AA- | AI237: 6.4399999999999999e-002 | AJ237: =H237+100*O237 -> 139.202 | AK237: 139.9 | AL237: 237 | AM237: 53.9 | AN237: 265 | AO237: 2.6000000000000002e-002 | AP237: 9 | AQ237: 苏试转债
A238: 105 | B238: 113603 | C238: 东缆转债! | D238: 603606 | E238: 东方电缆 | F238: 能源电力 | G238: 电力设备 | H238: 119.45 | I238: -1.7899999999999999e-002 | J238: 2.5999999999999999e-003 | K238: 21.25 | L238: -3.1e-002 | M238: 115.1 | N238: 23.65 | O238: 0.32899999999999996 | P238: 89.85 | Q238: 转股中 | R238: 5.30年 | S238: 3.31年 | T238: 8 | U238: 84 | V238: 8.6999999999999994e-002 | W238: 5.7999999999999996e-002 | X238: 5.2000000000000005e-002 | Y238: 139 | Z238: 4.16 | AA238: -7.0999999999999995e-003 | AB238: -1.21e-002 | AC238: -4.0500000000000001e-002 | AD238: -4.2300000000000004e-002 | AE238: 89.51 | AF238: 92.27 | AG238: 0.49 | AH238: AA | AI238: 4.3400000000000001e-002 | AJ238: =H238+100*O238 -> 152.34999999999999 | AK238: 149 | AL238: 287 | AM238: 56.8 | AN238: 283 | AO238: 6.3e-002 | AP238: 7 | AQ238: 东缆转债!
A239: 65 | B239: 113612 | C239: 永冠转债 | D239: 603681 | E239: 永冠新材 | F239: 化工 | G239: 其他 | H239: 126.25 | I239: -6.7000000000000002e-003 | J239: -2.0000000000000001e-004 | K239: 25.95 | L239: -8.8000000000000005e-003 | M239: 121.2 | N239: 20.79 | O239: 1.1000000000000001e-002 | P239: 124.82 | Q239: 10天 | R239: 5.51年 | S239: 3.51年 | T239: 5.2 | U239: 20 | V239: 2.9999999999999999e-002 | W239: 0.12 | X239: 0.14999999999999999 | Y239: 43 | Z239: 2.75 | AA239: -7.4999999999999997e-003 | AB239: -1.3999999999999999e-002 | AC239: -5.16e-002 | AD239: -5.3499999999999999e-002 | AE239: 82.99 | AF239: 86.59 | AG239: 0.78 | AH239: AA- | AI239: 6.4399999999999999e-002 | AJ239: =H239+100*O239 -> 127.34999999999999 | AK239: 127.7 | AL239: 109 | AM239: 41.1 | AN239: 183 | AO239: 5.5999999999999994e-002 | AP239: 6 | AQ239: 永冠转债
A240: 84 | B240: 128136 | C240: 立讯转债! | D240: 2475 | E240: 立讯精密 | F240: 电子 | G240: 元器件制 | H240: 116.9 | I240: 7.7000000000000002e-003 | J240: -8.8000000000000005e-003 | K240: 38.35 | L240: -4.6999999999999993e-003 | M240: 111.9 | N240: 58.36 | O240: 0.77900000000000003 | P240: 65.71 | Q240: 转股中 | R240: 5.41年 | S240: 3.42年 | T240: 30 | U240: 63 | V240: 1.8000000000000002e-002 | W240: 1.1000000000000001e-002 | X240: 6.9999999999999993e-003 | Y240: 2698. | Z240: 9.33 | AA240: -8.1000000000000013e-003 | AB240: -1.21e-002 | AC240: -3.6400000000000002e-002 | AD240: -3.7599999999999995e-002 | AE240: 88.9 | AF240: 90.53 | AG240: 0.22 | AH240: AA+ | AI240: 4.0399999999999998e-002 | AJ240: =H240+100*O240 -> 194.80000000000001 | AK240: 168.1 | AL240: 323 | AM240: 77.6 | AN240: 325 | AO240: 5.0999999999999997e-002 | AP240: 12 | AQ240: 立讯转债!
A241: 17 | B241: 113622 | C241: 杭叉转债 | D241: 603298 | E241: 杭叉集团 | F241: 机械装备 | G241: 通用设备 | H241: 118.07 | I241: -1.1599999999999999e-002 | J241: 1.11e-002 | K241: 19.08 | L241: -1.e-003 | M241: 112.5 | N241: 23.08 | O241: 0.42799999999999999 | P241: 82.67 | Q241: 4月6天 | R241: 5.80年 | S241: 3.81年 | T241: 11.5 | U241: 3.2 | V241: 2.e-003 | W241: 7.0000000000000007e-002 | X241: 5.7999999999999996e-002 | Y241: 165 | Z241: 3.22 | AA241: -8.3999999999999995e-003 | AB241: -1.23e-002 | AC241: -3.4000000000000002e-002 | AD241: -3.5299999999999998e-002 | AE241: 88.09 | AF241: 89.7 | AG241: 0.44 | AH241: AA+ | AI241: 4.0399999999999998e-002 | AJ241: =H241+100*O241 -> 160.87 | AK241: 153.5 | AL241: 302 | AM241: 63.8 | AN241: 309 | AO241: -2.9999999999999999e-002 | AP241: 4 | AQ241: 杭叉转债
A242: 77 | B242: 110077 | C242: 洪城转债 | D242: 600461 | E242: 洪城环境 | F242: 城市公用 | G242: 城市公用 | H242: 118.94 | I242: 2.98e-002 | J242: 1.09e-002 | K242: 7.81 | L242: 5.9699999999999996e-002 | M242: 113.5 | N242: 7.13 | O242: 8.5999999999999993e-002 | P242: 109.54 | Q242: 转股中 | R242: 5.46年 | S242: 3.46年 | T242: 18 | U242: 57 | V242: 2.7000000000000003e-002 | W242: 0.24299999999999999 | X242: 0.26600000000000001 | Y242: 74 | Z242: 1.38 | AA242: -8.6e-003 | AB242: -1.3000000000000001e-002 | AC242: -4.0999999999999995e-002 | AD242: -4.2099999999999999e-002 | AE242: 88.64 | AF242: 91.67 | AG242: 0.68 | AH242: AA+ | AI242: 4.0399999999999998e-002 | AJ242: =H242+100*O242 -> 127.53999999999999 | AK242: 128.3 | AL242: 117 | AM242: 36.7 | AN242: 134 | AO242: 4.5999999999999999e-002 | AP242: 6 | AQ242: 洪城转债
A243: 74 | B243: 123078 | C243: 飞凯转债! | D243: 300398 | E243: 飞凯材料 | F243: 化工 | G243: 化工 | H243: 120.69 | I243: 1.2500000000000001e-002 | J243: -1.e-004 | K243: 16.61 | L243: 1.9e-002 | M243: 115.2 | N243: 15.56 | O243: 0.13100000000000001 | P243: 106.75 | Q243: 转股中 | R243: 5.48年 | S243: 3.48年 | T243: 8.2 | U243: 25 | V243: 2.5000000000000001e-002 | W243: 9.6000000000000002e-002 | X243: 0.10199999999999999 | Y243: 86 | Z243: 3.19 | AA243: -8.6e-003 | AB243: -1.3500000000000002e-002 | AC243: -4.1100000000000005e-002 | AD243: -4.2900000000000001e-002 | AE243: 88.94 | AF243: 91.68 | AG243: 0.65 | AH243: AA | AI243: 4.3400000000000001e-002 | AJ243: =H243+100*O243 -> 133.78999999999999 | AK243: 134.6 | AL243: 195 | AM243: 42.9 | AN243: 202 | AO243: 0.10199999999999999 | AP243: 8 | AQ243: 飞凯转债!
A244: 197 | B244: 113572 | C244: 三祥转债! | D244: 603663 | E244: 三祥新材 | F244: 其他 | G244: 其他 | H244: 117.58 | I244: -1.24e-002 | J244: -2.0999999999999999e-003 | K244: 15.05 | L244: -1.95e-002 | M244: 112.8 | N244: 14.09 | O244: 0.10099999999999999 | P244: 106.81 | Q244: 转股中 | R244: 4.77年 | S244: 2.77年 | T244: 1.69 | U244: 12 | V244: 5.7999999999999996e-002 | W244: 5.7999999999999996e-002 | X244: 6.2e-002 | Y244: 29 | Z244: 4.53 | AA244: -8.8000000000000005e-003 | AB244: -1.3600000000000001e-002 | AC244: -4.3400000000000001e-002 | AD244: -4.5499999999999999e-002 | AE244: 83.81 | AF244: 80.65 | AG244: 0.74 | AH244: A+ | AI244: 7.4400000000000008e-002 | AJ244: =H244+100*O244 -> 127.67999999999999 | AK244: 128.3 | AL244: 118 | AM244: 44.5 | AN244: 212 | AO244: 3.9e-002 | AP244: 18 | AQ244: 三祥转债!
A245: 194 | B245: 128101 | C245: 联创转债! | D245: 2036 | E245: 联创电子 | F245: 电子 | G245: 液晶显示 | H245: 119.8 | I245: 0. | J245: 6.8000000000000005e-003 | K245: 12.26 | L245: 1.49e-002 | M245: 114.8 | N245: 13.74 | O245: 0.34299999999999997 | P245: 89.23 | Q245: 转股中 | R245: 4.78年 | S245: 2.78年 | T245: 3 | U245: 38 | V245: 0.10400000000000001 | W245: 2.3e-002 | X245: 2.1000000000000001e-002 | Y245: 130 | Z245: 3.54 | AA245: -9.0000000000000011e-003 | AB245: -1.4499999999999999e-002 | AC245: -4.9400000000000006e-002 | AD245: -5.1399999999999994e-002 | AE245: 91.49 | AF245: 94.48 | AG245: 0.46 | AH245: AA | AI245: 4.24e-002 | AJ245: =H245+100*O245 -> 154.09999999999999 | AK245: 150.4 | AL245: 291 | AM245: 55.9 | AN245: 277 | AO245: 6.2e-002 | AP245: 16 | AQ245: 联创转债!
A246: 93 | B246: 113605 | C246: 大参转债 | D246: 603233 | E246: 大参林 | F246: 医药 | G246: 医药商业 | H246: 120.94 | I246: -4.0000000000000002e-004 | J246: -5.4000000000000003e-003 | K246: 71.03 | L246: -1.3300000000000001e-002 | M246: 115.2 | N246: 83.71 | O246: 0.42499999999999999 | P246: 84.85 | Q246: 转股中 | R246: 5.38年 | S246: 3.38年 | T246: 14.1 | U246: 3.6 | V246: 2.e-003 | W246: 2.9999999999999999e-002 | X246: 2.5000000000000001e-002 | Y246: 468 | Z246: 8.74 | AA246: -9.1999999999999998e-003 | AB246: -1.41e-002 | AC246: -4.2699999999999995e-002 | AD246: -4.4600000000000001e-002 | AE246: 89.32 | AF246: 92.07 | AG246: 0.44 | AH246: AA | AI246: 4.3400000000000001e-002 | AJ246: =H246+100*O246 -> 163.44 | AK246: 157 | AL246: 309 | AM246: 65 | AN246: 311 | AO246: -2.e-002 | AP246: 6 | AQ246: 大参转债
A247: 34 | B247: 123099 | C247: 普利转债 | D247: 300630 | E247: 普利制药 | F247: 医药 | G247: 化学制药 | H247: 130.04 | I247: 4.0000000000000002e-004 | J247: 2.1099999999999997e-002 | K247: 53.6 | L247: 2.98e-002 | M247: 123.5 | N247: 46.22 | O247: 0.121 | P247: 115.97 | Q247: 2月20天 | R247: 5.68年 | S247: 3.69年 | T247: 8.5 | U247: 7 | V247: 6.0000000000000001e-003 | W247: 3.6000000000000004e-002 | X247: 4.2000000000000003e-002 | Y247: 234 | Z247: 10.73 | AA247: -9.1999999999999998e-003 | AB247: -1.6e-002 | AC247: -5.7200000000000001e-002 | AD247: -5.9000000000000004e-002 | AE247: 81.85 | AF247: 87.21 | AG247: 0.72 | AH247: AA- | AI247: 6.4399999999999999e-002 | AJ247: =H247+100*O247 -> 142.13999999999999 | AK247: 144.1 | AL247: 267 | AM247: 56.9 | AN247: 285 | AO247: 6.7000000000000004e-002 | AP247: 4 | AQ247: 普利转债
A248: 16 | B248: 110079 | C248: 杭银转债 | D248: 600926 | E248: 杭州银行 | F248: 金融 | G248: 银行行业 | H248: 119 | I248: 1.0200000000000001e-002 | J248: -1.1000000000000001e-003 | K248: 16.36 | L248: 1.61e-002 | M248: 112.4 | N248: 17.06 | O248: 0.24100000000000002 | P248: 95.9 | Q248: 4月6天 | R248: 5.81年 | S248: 3.82年 | T248: 150 | U248: 198 | V248: 1.1000000000000001e-002 | W248: 0.155 | X248: 0.14800000000000002 | Y248: 970 | Z248: 1.47 | AA248: -9.8999999999999991e-003 | AB248: -1.37e-002 | AC248: -3.6000000000000004e-002 | AD248: -3.7400000000000003e-002 | AE248: 88.64 | AF248: 90.57 | AG248: 0.56 | AH248: AAA | AI248: 3.8399999999999997e-002 | AJ248: =H248+100*O248 -> 143.09999999999999 | AK248: 142.1 | AL248: 255 | AM248: 51.5 | AN248: 254 | AO248: -1.8000000000000002e-002 | AP248: 11 | AQ248: 杭银转债
A249: 349 | B249: 113502 | C249: 嘉澳转债! | D249: 603822 | E249: 嘉澳环保 | F249: 化工 | G249: 化工 | H249: 114.06 | I249: -1.1000000000000001e-003 | J249: 1.1000000000000001e-003 | K249: 25.39 | L249: 1.1599999999999999e-002 | M249: 111.3 | N249: 44.79 | O249: 1.01 | P249: 56.69 | Q249: 转股中 | R249: 2.44年 | S249: 0.44年 | T249: 1.85 | U249: 78 | V249: 0.371 | W249: 9.9000000000000005e-002 | X249: 5.5999999999999994e-002 | Y249: 19 | Z249: 2.33 | AA249: -1.0200000000000001e-002 | AB249: -1.8600000000000002e-002 | AC249: -0.188 | AD249: -0.193 | AE249: 98.21 | AF249: 96.48 | AG249: 0.01 | AH249: AA- | AI249: 6.1600000000000002e-002 | AJ249: =H249+100*O249 -> 215.06 | AK249: 171.4 | AL249: 326 | AM249: 73.2 | AN249: 318 | AO249: 0.159 | AP249: 36 | AQ249: 嘉澳转债!
A250: 304 | B250: 110047 | C250: 山鹰转债 | D250: 600567 | E250: 山鹰国际 | F250: 造纸包装 | G250: 包装用纸 | H250: 121.65 | I250: -1.8e-003 | J250: -2.8999999999999998e-003 | K250: 3.61 | L250: -8.199999999999999e-003 | M250: 117.5 | N250: 3.34 | O250: 0.126 | P250: 108.08 | Q250: 转股中 | R250: 3.46年 | S250: 1.47年 | T250: 22.5 | U250: 15 | V250: 5.0000000000000001e-003 | W250: 0.13500000000000001 | X250: 0.14599999999999999 | Y250: 167 | Z250: 1.07 | AA250: -1.0200000000000001e-002 | AB250: -1.89e-002 | AC250: -9.8599999999999993e-002 | AD250: -0.10099999999999999 | AE250: 96.6 | AF250: 103.05 | AG250: 0.57 | AH250: AA+ | AI250: 3.9399999999999998e-002 | AJ250: =H250+100*O250 -> 134.25 | AK250: 135.2 | AL250: 202 | AM250: 32.2 | AN250: 90 | AO250: -4.8000000000000001e-002 | AP250: 32 | AQ250: 山鹰转债
A251: 287 | B251: 127011 | C251: 中鼎转2! | D251: 887 | E251: 中鼎股份 | F251: 汽车 | G251: 零部件制 | H251: 119 | I251: -8.0000000000000004e-004 | J251: 1.2999999999999999e-003 | K251: 11.22 | L251: 8.9999999999999998e-004 | M251: 114.5 | N251: 11.59 | O251: 0.22899999999999998 | P251: 96.81 | Q251: 转股中 | R251: 3.76年 | S251: 1.76年 | T251: 12 | U251: 4.6 | V251: 3.0000000000000001e-003 | W251: 8.8000000000000009e-002 | X251: 8.5000000000000006e-002 | Y251: 137 | Z251: 1.54 | AA251: -1.04e-002 | AB251: -1.72e-002 | AC251: -7.3499999999999996e-002 | AD251: -7.6100000000000001e-002 | AE251: 95.51 | AF251: 99.3 | AG251: 0.49 | AH251: AA+ | AI251: 3.9399999999999998e-002 | AJ251: =H251+100*O251 -> 141.90000000000001 | AK251: 141.2 | AL251: 248 | AM251: 41.9 | AN251: 192 | AO251: -6.0000000000000001e-003 | AP251: 22 | AQ251: 中鼎转2!
A252: 83 | B252: 128137 | C252: 洁美转债 | D252: 2859 | E252: 洁美科技 | F252: 电子 | G252: 元器件制 | H252: 124 | I252: 3.4000000000000002e-003 | J252: 3.2000000000000002e-003 | K252: 28.1 | L252: 9.7000000000000003e-003 | M252: 117.3 | N252: 27.63 | O252: 0.21899999999999997 | P252: 101.7 | Q252: 转股中 | R252: 5.42年 | S252: 3.42年 | T252: 6 | U252: 2.9 | V252: 4.0000000000000001e-003 | W252: 5.2000000000000005e-002 | X252: 5.2999999999999999e-002 | Y252: 115 | Z252: 6.26 | AA252: -1.04e-002 | AB252: -1.5900000000000001e-002 | AC252: -4.8799999999999996e-002 | AD252: -5.0700000000000002e-002 | AE252: 83.19 | AF252: 84.24 | AG252: 0.68 | AH252: AA- | AI252: 6.4399999999999999e-002 | AJ252: =H252+100*O252 -> 145.90000000000001 | AK252: 146.3 | AL252: 274 | AM252: 62.1 | AN252: 302 | AO252: -1.1000000000000001e-002 | AP252: 4 | AQ252: 洁美转债
A253: 301 | B253: 128050 | C253: 钧达转债!! | D253: 2865 | E253: 钧达股份 | F253: 汽车 | G253: 零部件制 | H253: 127.334 | I253: -5.8999999999999999e-003 | J253: -7.6e-003 | K253: 18.25 | L253: -1.3500000000000002e-002 | M253: 122.7 | N253: 14.8 | O253: 3.3000000000000002e-002 | P253: 123.31 | Q253: 转股中 | R253: 3.52年 | S253: 1.52年 | T253: 1.41 | U253: 9.8 | V253: 5.5e-002 | W253: 5.7999999999999996e-002 | X253: 7.2000000000000008e-002 | Y253: 24 | Z253: 2.26 | AA253: -1.0700000000000001e-002 | AB253: -2.1400000000000002e-002 | AC253: -0.10400000000000001 | AD253: -0.106 | AE253: 92.99 | AF253: 99.3 | AG253: 1 | AH253: AA- | AI253: 6.3399999999999998e-002 | AJ253: =H253+100*O253 -> 130.63400000000001 | AK253: 131.4 | AL253: 154 | AM253: 32.1 | AN253: 87 | AO253: -2.2000000000000002e-002 | AP253: 51 | AQ253: 钧达转债!!
A254: 334 | B254: 123007 | C254: 道氏转债! | D254: 300409 | E254: 道氏技术 | F254: 建筑 | G254: 建筑行业 | H254: 113.549 | I254: 2.52e-002 | J254: -8.6e-003 | K254: 14.61 | L254: 2.8900000000000002e-002 | M254: 110.3 | N254: 14.5 | O254: 0.127 | P254: 100.76 | Q254: 转股中 | R254: 2.57年 | S254: 0.57年 | T254: 3.04 | U254: 81 | V254: 0.23499999999999999 | W254: 3.7000000000000005e-002 | X254: 3.7999999999999999e-002 | Y254: 81 | Z254: 2.21 | AA254: -1.1399999999999999e-002 | AB254: -1.8700000000000001e-002 | AC254: -0.14599999999999999 | AD254: -0.151 | AE254: 97.45 | AF254: 94.87 | AG254: 0.58 | AH254: AA- | AI254: 6.1600000000000002e-002 | AJ254: =H254+100*O254 -> 126.24900000000001 | AK254: 126.3 | AL254: 95 | AM254: 28.9 | AN254: 51 | AO254: 8.1000000000000003e-002 | AP254: 22 | AQ254: 道氏转债!
A255: 234 | B255: 123035 | C255: 利德转债! | D255: 300296 | E255: 利亚德 | F255: 电子 | G255: LED制 | H255: 121.137 | I255: 5.1000000000000004e-003 | J255: -5.1000000000000004e-003 | K255: 7.04 | L255: 0. | M255: 115.1 | N255: 6.96 | O255: 0.19800000000000001 | P255: 101.15 | Q255: 转股中 | R255: 4.44年 | S255: 2.45年 | T255: 8 | U255: 10 | V255: 1.1000000000000001e-002 | W255: 4.4999999999999998e-002 | X255: 4.4999999999999998e-002 | Y255: 179 | Z255: 2.45 | AA255: -1.1699999999999999e-002 | AB255: -1.7600000000000001e-002 | AC255: -5.8700000000000002e-002 | AD255: -6.1100000000000002e-002 | AE255: 93.76 | AF255: 97.31 | AG255: 0.56 | AH255: AA+ | AI255: 3.9399999999999998e-002 | AJ255: =H255+100*O255 -> 140.93700000000001 | AK255: 141.1 | AL255: 247 | AM255: 43.8 | AN255: 208 | AO255: -4.0000000000000001e-003 | AP255: 14 | AQ255: 利德转债!
A256: 147 | B256: 128119 | C256: 龙大转债! | D256: 2726 | E256: 龙大肉食 | F256: 食品饮料 | G256: 肉制品 | H256: 127.5 | I256: -2.e-003 | J256: 8.3999999999999995e-003 | K256: 11.8 | L256: 8.5000000000000006e-003 | M256: 120.2 | N256: 9.38 | O256: 1.3999999999999999e-002 | P256: 125.8 | Q256: 转股中 | R256: 5年38天 | S256: 3年39天 | T256: 9.46 | U256: 28 | V256: 2.3e-002 | W256: 8.0000000000000002e-002 | X256: 0.10099999999999999 | Y256: 118 | Z256: 3.39 | AA256: -1.1699999999999999e-002 | AB256: -1.84e-002 | AC256: -6.1699999999999998e-002 | AD256: -6.3700000000000007e-002 | AE256: 90.37 | AF256: 97.18 | AG256: 0.75 | AH256: AA | AI256: 4.3400000000000001e-002 | AJ256: =H256+100*O256 -> 128.90000000000001 | AK256: 129.2 | AL256: 131 | AM256: 32 | AN256: 86 | AO256: 9.0000000000000011e-003 | AP256: 8 | AQ256: 龙大转债!
A257: 72 | B257: 123079 | C257: 运达转债 | D257: 300772 | E257: 运达股份 | F257: 能源电力 | G257: 风能 | H257: 123.31 | I257: -7.4999999999999997e-003 | J257: -7.000000000000001e-004 | K257: 17.01 | L257: -1.1599999999999999e-002 | M257: 115.1 | N257: 15.12 | O257: 9.6000000000000002e-002 | P257: 112.5 | Q257: 3.1天 | R257: 5.49年 | S257: 3.49年 | T257: 5.77 | U257: 3 | V257: 4.0000000000000001e-003 | W257: 0.11199999999999999 | X257: 0.126 | Y257: 51 | Z257: 2.96 | AA257: -1.2699999999999999e-002 | AB257: -1.7500000000000002e-002 | AC257: -4.6799999999999994e-002 | AD257: -4.8600000000000004e-002 | AE257: 88.81 | AF257: 91.55 | AG257: 0.7 | AH257: AA | AI257: 4.3400000000000001e-002 | AJ257: =H257+100*O257 -> 132.91 | AK257: 134.1 | AL257: 190 | AM257: 42.6 | AN257: 199 | AO257: 7.2999999999999995e-002 | AP257: 4 | AQ257: 运达转债
A258: 210 | B258: 128096 | C258: 奥瑞转债!! | D258: 2701 | E258: 奥瑞金 | F258: 造纸包装 | G258: 包装材料 | H258: 122.58 | I258: -1.8e-003 | J258: -6.0999999999999995e-003 | K258: 5.22 | L258: -1.1399999999999999e-002 | M258: 115.5 | N258: 4.54 | O258: 6.6000000000000003e-002 | P258: 114.98 | Q258: 转股中 | R258: 4.69年 | S258: 2.69年 | T258: 6.79 | U258: 20 | V258: 2.5000000000000001e-002 | W258: 5.4000000000000006e-002 | X258: 6.2e-002 | Y258: 126 | Z258: 1.88 | AA258: -1.29e-002 | AB258: -1.8600000000000002e-002 | AC258: -5.7000000000000002e-002 | AD258: -5.9400000000000001e-002 | AE258: 93.09 | AF258: 96.75 | AG258: 0.7 | AH258: AA+ | AI258: 3.9399999999999998e-002 | AJ258: =H258+100*O258 -> 129.18000000000001 | AK258: 130.2 | AL258: 141 | AM258: 33.4 | AN258: 103 | AO258: -4.5999999999999999e-002 | AP258: 19 | AQ258: 奥瑞转债!!
A259: 170 | B259: 128108 | C259: 蓝帆转债! | D259: 2382 | E259: 蓝帆医疗 | F259: 医药 | G259: 医疗器械 | H259: 120.388 | I259: 1.e-003 | J259: 2.8999999999999998e-003 | K259: 20.12 | L259: 5.5000000000000005e-003 | M259: 112.9 | N259: 17.79 | O259: 6.4000000000000001e-002 | P259: 113.1 | Q259: 转股中 | R259: 4.98年 | S259: 3.98年 | T259: 15.3 | U259: 35 | V259: 1.9e-002 | W259: 7.2999999999999995e-002 | X259: 8.199999999999999e-002 | Y259: 211 | Z259: 1.69 | AA259: -1.3000000000000001e-002 | AB259: -1.7600000000000001e-002 | AC259: -3.2300000000000002e-002 | AD259: -3.4599999999999999e-002 | AE259: 88.8 | AF259: 92.17 | AG259: 0.71 | AH259: AA | AI259: 4.24e-002 | AJ259: =H259+100*O259 -> 126.78800000000001 | AK259: 127.7 | AL259: 108 | AM259: 35.5 | AN259: 128 | AO259: -7.0000000000000007e-002 | AP259: 26 | AQ259: 蓝帆转债!
A260: 32 | B260: 118000 | C260: 嘉元转债 | D260: 688388 | E260: 嘉元科技 | F260: 电子 | G260: 电子产品 | H260: 130.27 | I260: 4.1999999999999997e-003 | J260: 2.0899999999999998e-002 | K260: 88.71 | L260: 3.5099999999999999e-002 | M260: 121 | N260: 78.74 | O260: 0.156 | P260: 112.66 | Q260: 2月29天 | R260: 5.72年 | S260: 3.72年 | T260: 12.4 | U260: 49 | V260: 2.9999999999999999e-002 | W260: 6.0999999999999999e-002 | X260: 6.8000000000000005e-002 | Y260: 205 | Z260: 7.53 | AA260: -1.3100000000000001e-002 | AB260: -1.9199999999999998e-002 | AC260: -5.6900000000000006e-002 | AD260: -5.8700000000000002e-002 | AE260: 81.72 | AF260: 85.27 | AG260: 0.71 | AH260: AA- | AI260: 6.4399999999999999e-002 | AJ260: =H260+100*O260 -> 145.87 | AK260: 147.9 | AL260: 283 | AM260: 62.6 | AN260: 305 | AO260: 0.20899999999999999 | AP260: 4 | AQ260: 嘉元转债
A261: 227 | B261: 110063 | C261: 鹰19转债 | D261: 600567 | E261: 山鹰国际 | F261: 造纸包装 | G261: 包装用纸 | H261: 122.93 | I261: 5.0000000000000001e-004 | J261: -5.6999999999999993e-003 | K261: 3.61 | L261: -8.199999999999999e-003 | M261: 115.9 | N261: 3.3 | O261: 0.124 | P261: 109.39 | Q261: 转股中 | R261: 4.52年 | S261: 2.53年 | T261: 18.5 | U261: 18 | V261: 8.0000000000000002e-003 | W261: 0.111 | X261: 0.121 | Y261: 167 | Z261: 1.07 | AA261: -1.32e-002 | AB261: -1.9299999999999998e-002 | AC261: -6.3299999999999995e-002 | AD261: -6.54e-002 | AE261: 93.12 | AF261: 97.63 | AG261: 0.63 | AH261: AA+ | AI261: 3.9399999999999998e-002 | AJ261: =H261+100*O261 -> 135.33000000000001 | AK261: 136.5 | AL261: 209 | AM261: 38.8 | AN261: 157 | AO261: -4.8000000000000001e-002 | AP261: 35 | AQ261: 鹰19转债
A262: 112 | B262: 123064 | C262: 万孚转债! | D262: 300482 | E262: 万孚生物 | F262: 医药 | G262: 医疗器械 | H262: 123.5 | I262: 8.199999999999999e-003 | J262: 1.61e-002 | K262: 71 | L262: 4.1700000000000001e-002 | M262: 115.1 | N262: 71.64 | O262: 0.24600000000000002 | P262: 99.11 | Q262: 转股中 | R262: 5.24年 | S262: 3.24年 | T262: 5.99 | U262: 16 | V262: 2.2000000000000002e-002 | W262: 1.9e-002 | X262: 1.9e-002 | Y262: 316 | Z262: 8.37 | AA262: -1.3600000000000001e-002 | AB262: -1.8600000000000002e-002 | AC262: -5.0599999999999999e-002 | AD262: -5.2499999999999998e-002 | AE262: 89.75 | AF262: 92.52 | AG262: 0.58 | AH262: AA | AI262: 4.3400000000000001e-002 | AJ262: =H262+100*O262 -> 148.09999999999999 | AK262: 147.9 | AL262: 284 | AM262: 55.4 | AN262: 273 | AO262: -0.16800000000000001 | AP262: 11 | AQ262: 万孚转债!
A263: 49 | B263: 123091 | C263: 长海转债 | D263: 300196 | E263: 长海股份 | F263: 其他 | G263: 非金属矿 | H263: 125.24 | I263: -8.8000000000000005e-003 | J263: -1.2999999999999999e-003 | K263: 16.86 | L263: -1.5800000000000002e-002 | M263: 116.2 | N263: 16.14 | O263: 0.19899999999999998 | P263: 104.46 | Q263: 25天 | R263: 5.55年 | S263: 3.55年 | T263: 5.5 | U263: 5.2 | V263: 8.0000000000000002e-003 | W263: 8.0000000000000002e-002 | X263: 8.3000000000000004e-002 | Y263: 69 | Z263: 2.32 | AA263: -1.3600000000000001e-002 | AB263: -1.8700000000000001e-002 | AC263: -4.99e-002 | AD263: -5.16e-002 | AE263: 88.67 | AF263: 92.2 | AG263: 0.64 | AH263: AA | AI263: 4.3400000000000001e-002 | AJ263: =H263+100*O263 -> 145.13999999999999 | AK263: 146 | AL263: 272 | AM263: 53.8 | AN263: 264 | AO263: -2.7000000000000003e-002 | AP263: 3 | AQ263: 长海转债
A264: 52 | B264: 128142 | C264: 新乳转债 | D264: 2946 | E264: 新乳业 | F264: 食品饮料 | G264: 乳制品 | H264: 124.1 | I264: -1.2999999999999999e-003 | J264: -2.8000000000000004e-003 | K264: 17.37 | L264: -7.4000000000000003e-003 | M264: 115.1 | N264: 18.54 | O264: 0.32500000000000001 | P264: 93.69 | Q264: 20天 | R264: 5.54年 | S264: 3.54年 | T264: 7.18 | U264: 4.8 | V264: 5.0000000000000001e-003 | W264: 4.8000000000000001e-002 | X264: 4.4999999999999998e-002 | Y264: 151 | Z264: 5.8 | AA264: -1.37e-002 | AB264: -1.8500000000000003e-002 | AC264: -4.7899999999999998e-002 | AD264: -4.9599999999999998e-002 | AE264: 88.63 | AF264: 91.37 | AG264: 0.55 | AH264: AA | AI264: 4.3400000000000001e-002 | AJ264: =H264+100*O264 -> 156.59999999999999 | AK264: 154.5 | AL264: 305 | AM264: 63.1 | AN264: 307 | AO264: -2.7000000000000003e-002 | AP264: 4 | AQ264: 新乳转债
A265: 172 | B265: 113579 | C265: 健友转债! | D265: 603707 | E265: 健友股份 | F265: 医药 | G265: 原料药 | H265: 122.15 | I265: 1.6000000000000001e-003 | J265: 1.5800000000000002e-002 | K265: 41.03 | L265: 3.0899999999999997e-002 | M265: 113.9 | N265: 42.05 | O265: 0.252 | P265: 97.57 | Q265: 转股中 | R265: 4.88年 | S265: 2.89年 | T265: 5.03 | U265: 3.1 | V265: 5.0000000000000001e-003 | W265: 1.3000000000000001e-002 | X265: 1.3000000000000001e-002 | Y265: 383 | Z265: 9.96 | AA265: -1.4499999999999999e-002 | AB265: -1.95e-002 | AC265: -5.3499999999999999e-002 | AD265: -5.5500000000000001e-002 | AE265: 91.19 | AF265: 93.35 | AG265: 0.56 | AH265: AA | AI265: 4.24e-002 | AJ265: =H265+100*O265 -> 147.34999999999999 | AK265: 146.7 | AL265: 275 | AM265: 53.4 | AN265: 262 | AO265: -3.7999999999999999e-002 | AP265: 9 | AQ265: 健友转债!
A266: 97 | B266: 123070 | C266: 鹏辉转债 | D266: 300438 | E266: 鹏辉能源 | F266: 汽车 | G266: 零部件制 | H266: 124.3 | I266: 9.1000000000000004e-003 | J266: 5.8600000000000006e-002 | K266: 23.84 | L266: 9.06e-002 | M266: 115.1 | N266: 20.06 | O266: 4.5999999999999999e-002 | P266: 118.84 | Q266: 转股中 | R266: 5.38年 | S266: 3.38年 | T266: 8.9 | U266: 420 | V266: 0.37200000000000005 | W266: 8.900000000000001e-002 | X266: 0.106 | Y266: 100 | Z266: 4.23 | AA266: -1.4499999999999999e-002 | AB266: -1.9299999999999998e-002 | AC266: -5.0499999999999996e-002 | AD266: -5.2300000000000006e-002 | AE266: 89.24 | AF266: 92 | AG266: 0.75 | AH266: AA | AI266: 4.3400000000000001e-002 | AJ266: =H266+100*O266 -> 128.90000000000001 | AK266: 129.8 | AL266: 135 | AM266: 37.8 | AN266: 145 | AO266: 0.28000000000000003 | AP266: 4 | AQ266: 鹏辉转债
A267: 107 | B267: 123067 | C267: 斯莱转债 | D267: 300382 | E267: 斯莱克 | F267: 机械装备 | G267: 专用设备 | H267: 131.106 | I267: 2.4300000000000002e-002 | J267: -1.0700000000000001e-002 | K267: 11.29 | L267: 1.8000000000000002e-002 | M267: 121.2 | N267: 9.38 | O267: 8.900000000000001e-002 | P267: 120.36 | Q267: 转股中 | R267: 5.29年 | S267: 3.29年 | T267: 3.88 | U267: 79 | V267: 0.155 | W267: 6.0999999999999999e-002 | X267: 7.2999999999999995e-002 | Y267: 64 | Z267: 6.14 | AA267: -1.5100000000000001e-002 | AB267: -2.1700000000000001e-002 | AC267: -6.5199999999999994e-002 | AD267: -6.7199999999999996e-002 | AE267: 84.15 | AF267: 87.81 | AG267: 0.75 | AH267: AA- | AI267: 6.4399999999999999e-002 | AJ267: =H267+100*O267 -> 140.006 | AK267: 141.8 | AL267: 253 | AM267: 54 | AN267: 267 | AO267: 0.114 | AP267: 13 | AQ267: 斯莱转债
A268: 63 | B268: 123083 | C268: 朗新转债 | D268: 300682 | E268: 朗新科技 | F268: 计算机及 | G268: 软件开发 | H268: 125 | I268: 1.8e-003 | J268: -3.0000000000000001e-003 | K268: 17.15 | L268: -1.7000000000000001e-003 | M268: 115.1 | N268: 15.45 | O268: 0.126 | P268: 111 | Q268: 11天 | R268: 5.51年 | S268: 3.52年 | T268: 8 | U268: 16 | V268: 1.6e-002 | W268: 4.5999999999999999e-002 | X268: 5.0999999999999997e-002 | Y268: 175 | Z268: 3.33 | AA268: -1.5100000000000001e-002 | AB268: -1.9900000000000001e-002 | AC268: -5.0099999999999999e-002 | AD268: -5.1799999999999999e-002 | AE268: 88.72 | AF268: 91.46 | AG268: 0.69 | AH268: AA | AI268: 4.3400000000000001e-002 | AJ268: =H268+100*O268 -> 137.59999999999999 | AK268: 139 | AL268: 230 | AM268: 47.5 | AN268: 238 | AO268: 2.5000000000000001e-002 | AP268: 5 | AQ268: 朗新转债
A269: 277 | B269: 110057 | C269: 现代转债 | D269: 600420 | E269: 国药现代 | F269: 医药 | G269: 化学制药 | H269: 116.82 | I269: -5.9999999999999995e-004 | J269: -1.1200000000000002e-002 | K269: 11.01 | L269: -1.7000000000000001e-002 | M269: 110.3 | N269: 9.89 | O269: 4.9000000000000002e-002 | P269: 111.32 | Q269: 转股中 | R269: 3.82年 | S269: 1.82年 | T269: 16.2 | U269: 34 | V269: 1.8000000000000002e-002 | W269: 0.14300000000000002 | X269: 0.159 | Y269: 113 | Z269: 1.4 | AA269: -1.52e-002 | AB269: -2.e-002 | AC269: -6.2600000000000003e-002 | AD269: -6.5099999999999991e-002 | AE269: 95.6 | AF269: 96.11 | AG269: 0.69 | AH269: AAA | AI269: 3.7400000000000003e-002 | AJ269: =H269+100*O269 -> 121.72 | AK269: 122.3 | AL269: 55 | AM269: 26.2 | AN269: 29 | AO269: 9.0000000000000011e-003 | AP269: 24 | AQ269: 现代转债
A270: 286 | B270: 110053 | C270: 苏银转债! | D270: 600919 | E270: 江苏银行 | F270: 金融 | G270: 银行行业 | H270: 125.45 | I270: 3.5999999999999999e-003 | J270: 1.5e-003 | K270: 7.92 | L270: 7.6e-003 | M270: 118.3 | N270: 6.69 | O270: 5.9999999999999998e-002 | P270: 118.39 | Q270: 转股中 | R270: 3.77年 | S270: 无权 | T270: 200 | U270: 241 | V270: 1.e-002 | W270: 0.17100000000000001 | X270: 0.20199999999999999 | Y270: 1170. | Z270: 0.84 | AA270: -1.5900000000000001e-002 | AB270: -2.41e-002 | AC270: 无权 | AD270: 无权 | AE270: 无权 | AF270: 103.41 | AG270: 0.67 | AH270: AAA | AI270: 3.7400000000000003e-002 | AJ270: =H270+100*O270 -> 131.44999999999999 | AK270: 132.5 | AL270: 169 | AM270: 29.1 | AN270: 53 | AO270: 6.5000000000000002e-002 | AP270: 39 | AQ270: 苏银转债!
A271: 10 | B271: 113623 | C271: 凤21转债 | D271: 603225 | E271: 新凤鸣 | F271: 化工 | G271: 化纤 | H271: 129.32 | I271: 1.24e-002 | J271: -1.9e-003 | K271: 19.91 | L271: 1.43e-002 | M271: 117.1 | N271: 16.6 | O271: 7.8e-002 | P271: 119.94 | Q271: 4月12天 | R271: 5.84年 | S271: 3.84年 | T271: 25 | U271: 11 | V271: 3.0000000000000001e-003 | W271: 8.9999999999999997e-002 | X271: 0.107 | Y271: 279 | Z271: 2.28 | AA271: -1.7100000000000001e-002 | AB271: -2.2099999999999998e-002 | AC271: -5.4199999999999998e-002 | AD271: -5.57e-002 | AE271: 87.49 | AF271: 91.75 | AG271: 0.73 | AH271: AA | AI271: 4.3400000000000001e-002 | AJ271: =H271+100*O271 -> 137.12 | AK271: 138.7 | AL271: 228 | AM271: 46.9 | AN271: 233 | AO271: 7.0000000000000007e-002 | AP271: 3 | AQ271: 凤21转债
A272: 293 | B272: 110051 | C272: 中天转债! | D272: 600522 | E272: 中天科技 | F272: 通信互联 | G272: 通信设备 | H272: 121.17 | I272: 1.4000000000000002e-003 | J272: -8.0000000000000004e-004 | K272: 10.42 | L272: 1.e-003 | M272: 113.3 | N272: 9.99 | O272: 0.16200000000000001 | P272: 104.3 | Q272: 转股中 | R272: 3.74年 | S272: 1.74年 | T272: 39.6 | U272: 14 | V272: 3.0000000000000001e-003 | W272: 0.124 | X272: 0.129 | Y272: 319 | Z272: 1.37 | AA272: -1.8100000000000002e-002 | AB272: -2.4399999999999998e-002 | AC272: -8.3299999999999999e-002 | AD272: -8.5800000000000001e-002 | AE272: 95.56 | AF272: 98.33 | AG272: 0.59 | AH272: AA+ | AI272: 3.9399999999999998e-002 | AJ272: =H272+100*O272 -> 137.37 | AK272: 138 | AL272: 224 | AM272: 39.7 | AN272: 164 | AO272: 2.4e-002 | AP272: 24 | AQ272: 中天转债!
A273: 108 | B273: 123066 | C273: 赛意转债 | D273: 300687 | E273: 赛意信息 | F273: 计算机及 | G273: 软件开发 | H273: 134.013 | I273: -1.23e-002 | J273: 2.5000000000000001e-003 | K273: 18.87 | L273: -1.2e-002 | M273: 121.4 | N273: 14.01 | O273: -5.0000000000000001e-003 | P273: 134.69 | Q273: 转股中 | R273: 5.28年 | S273: 3.29年 | T273: 2.75 | U273: 85 | V273: 0.22800000000000001 | W273: 4.2000000000000003e-002 | X273: 5.5999999999999994e-002 | Y273: 66 | Z273: 4.17 | AA273: -1.89e-002 | AB273: -2.5600000000000001e-002 | AC273: -7.0699999999999999e-002 | AD273: -7.2800000000000004e-002 | AE273: 81.42 | AF273: 83.44 | AG273: 0.82 | AH273: A+ | AI273: 7.5399999999999995e-002 | AJ273: =H273+100*O273 -> 133.51300000000001 | AK273: 133.3 | AL273: 181 | AM273: 49.9 | AN273: 242 | AO273: -0.28300000000000003 | AP273: 8 | AQ273: 赛意转债
A274: 331 | B274: 128035 | C274: 大族转债! | D274: 2008 | E274: 大族激光 | F274: 机械装备 | G274: 专用设备 | H274: 113.173 | I274: 1.5e-003 | J274: -4.0000000000000002e-004 | K274: 38.61 | L274: 1.29e-002 | M274: 107.4 | N274: 51.9 | O274: 0.52100000000000002 | P274: 74.39 | Q274: 转股中 | R274: 2.68年 | S274: 0.68年 | T274: 23 | U274: 27 | V274: 1.e-002 | W274: 5.5999999999999994e-002 | X274: 4.2000000000000003e-002 | Y274: 412 | Z274: 4.28 | AA274: -1.9599999999999999e-002 | AB274: -2.4700000000000003e-002 | AC274: -0.10099999999999999 | AD274: -0.109 | AE274: 100.62 | AF274: 97.41 | AG274: 0.09 | AH274: AA+ | AI274: 3.7599999999999995e-002 | AJ274: =H274+100*O274 -> 165.273 | AK274: 152 | AL274: 300 | AM274: 51.3 | AN274: 252 | AO274: 7.0999999999999994e-002 | AP274: 19 | AQ274: 大族转债!
A275: 54 | B275: 113614 | C275: 健20转债! | D275: 603707 | E275: 健友股份 | F275: 医药 | G275: 原料药 | H275: 127.37 | I275: 4.3e-003 | J275: 1.67e-002 | K275: 41.03 | L275: 3.0899999999999997e-002 | M275: 114.2 | N275: 38.04 | O275: 0.18100000000000002 | P275: 107.86 | Q275: 19天 | R275: 5.53年 | S275: 3.54年 | T275: 7.8 | U275: 2.8 | V275: 3.0000000000000001e-003 | W275: 2.e-002 | X275: 2.2000000000000002e-002 | Y275: 383 | Z275: 9.96 | AA275: -1.9900000000000001e-002 | AB275: -2.4300000000000002e-002 | AC275: -5.4400000000000004e-002 | AD275: -5.62e-002 | AE275: 88.74 | AF275: 90.68 | AG275: 0.68 | AH275: AA | AI275: 4.3400000000000001e-002 | AJ275: =H275+100*O275 -> 145.47 | AK275: 146.9 | AL275: 277 | AM275: 56.2 | AN275: 280 | AO275: -3.7999999999999999e-002 | AP275: 4 | AQ275: 健20转债!
A276: 104 | B276: 128134 | C276: 鸿路转债! | D276: 2541 | E276: 鸿路钢构 | F276: 建筑 | G276: 其他 | H276: 128.5 | I276: -7.6e-003 | J276: -1.03e-002 | K276: 52.4 | L276: -2.3799999999999998e-002 | M276: 115.1 | N276: 43.74 | O276: 7.2999999999999995e-002 | P276: 119.8 | Q276: 转股中 | R276: 5.35年 | S276: 3.35年 | T276: 18.8 | U276: 19 | V276: 8.0000000000000002e-003 | W276: 6.9000000000000006e-002 | X276: 8.199999999999999e-002 | Y276: 274 | Z276: 4.72 | AA276: -2.07e-002 | AB276: -2.5600000000000001e-002 | AC276: -5.9900000000000002e-002 | AD276: -6.1699999999999998e-002 | AE276: 89.36 | AF276: 92.11 | AG276: 0.75 | AH276: AA | AI276: 4.3400000000000001e-002 | AJ276: =H276+100*O276 -> 135.80000000000001 | AK276: 137.2 | AL276: 214 | AM276: 45.1 | AN276: 219 | AO276: 1.e-002 | AP276: 4 | AQ276: 鸿路转债!
A277: 350 | B277: 128018 | C277: 时达转债! | D277: 2527 | E277: 新时达 | F277: 机械装备 | G277: 机器人及 | H277: 115.557 | I277: -3.8e-003 | J277: -2.3e-003 | K277: 7.39 | L277: -1.2e-002 | M277: 109.3 | N277: 7.42 | O277: 0.16 | P277: 99.6 | Q277: 转股中 | R277: 2.42年 | S277: 0.42年 | T277: 4.04 | U277: 11 | V277: 2.4e-002 | W277: 8.8000000000000009e-002 | X277: 8.8000000000000009e-002 | Y277: 46 | Z277: 1.74 | AA277: -2.3099999999999999e-002 | AB277: -2.9999999999999999e-002 | AC277: -0.21199999999999999 | AD277: -0.217 | AE277: 99.44 | AF277: 99.43 | AG277: 0.51 | AH277: AA | AI277: 4.0599999999999997e-002 | AJ277: =H277+100*O277 -> 131.55700000000002 | AK277: 131.5 | AL277: 159 | AM277: 32.1 | AN277: 88 | AO277: 6.2e-002 | AP277: 36 | AQ277: 时达转债!
A278: 300 | B278: 128051 | C278: 光华转债! | D278: 2741 | E278: 光华科技 | F278: 电子 | G278: 元器件制 | H278: 124.52 | I278: 4.3799999999999999e-002 | J278: 1.1200000000000002e-002 | K278: 16.06 | L278: 6.9199999999999998e-002 | M278: 114.8 | N278: 12.72 | O278: -1.3999999999999999e-002 | P278: 126.26 | Q278: 转股中 | R278: 3.53年 | S278: 1.53年 | T278: 2.47 | U278: 370 | V278: 1.21 | W278: 4.0999999999999995e-002 | X278: 5.2000000000000005e-002 | Y278: 60 | Z278: 4.86 | AA278: -2.3199999999999998e-002 | AB278: -3.0499999999999999e-002 | AC278: -0.106 | AD278: -0.109 | AE278: 93.01 | AF278: 92.87 | AG278: 0.79 | AH278: AA- | AI278: 6.3399999999999998e-002 | AJ278: =H278+100*O278 -> 123.11999999999999 | AK278: 122.8 | AL278: 59 | AM278: 29.8 | AN278: 60 | AO278: 9.1999999999999998e-002 | AP278: 27 | AQ278: 光华转债!
A279: 363 | B279: 110034 | C279: 九州转债! | D279: 600998 | E279: 九州通 | F279: 医药 | G279: 医药商业 | H279: 109.58 | I279: -2.9999999999999997e-004 | J279: 8.0000000000000004e-004 | K279: 16.9 | L279: 4.7999999999999996e-003 | M279: 108 | N279: 18.32 | O279: 0.188 | P279: 92.25 | Q279: 转股中 | R279: 0.62年 | S279: 回售内 | T279: 15 | U279: 6.6 | V279: 4.0000000000000001e-003 | W279: 4.7e-002 | X279: 4.4000000000000004e-002 | Y279: 317 | Z279: 1.57 | AA279: -2.3300000000000001e-002 | AB279: -4.6699999999999998e-002 | AC279: 回售内 | AD279: 回售内 | AE279: 103 | AF279: 105.82 | AG279: 0.12 | AH279: AA+ | AI279: 3.3700000000000001e-002 | AJ279: =H279+100*O279 -> 128.38 | AK279: 126.9 | AL279: 97 | AM279: 21.1 | AN279: 15 | AO279: 0. | AP279: 24 | AQ279: 九州转债!
A280: 314 | B280: 123012 | C280: 万顺转债! | D280: 300057 | E280: 万顺新材 | F280: 有色金属 | G280: 铝金属 | H280: 118.71 | I280: 3.5999999999999999e-003 | J280: 1.e-002 | K280: 5.01 | L280: 2.4500000000000001e-002 | M280: 110.3 | N280: 5.27 | O280: 0.249 | P280: 95.07 | Q280: 转股中 | R280: 3年45天 | S280: 1年46天 | T280: 1.29 | U280: 23 | V280: 0.14999999999999999 | W280: 3.7999999999999999e-002 | X280: 3.6000000000000004e-002 | Y280: 34 | Z280: 0.95 | AA280: -2.3700000000000002e-002 | AB280: -2.9600000000000001e-002 | AC280: -0.10000000000000001 | AD280: -0.10400000000000001 | AE280: 95.03 | AF280: 91.44 | AG280: 0.55 | AH280: AA- | AI280: 6.3399999999999998e-002 | AJ280: =H280+100*O280 -> 143.60999999999999 | AK280: 142.4 | AL280: 256 | AM280: 47.3 | AN280: 236 | AO280: 6.2e-002 | AP280: 19 | AQ280: 万顺转债!
A281: 243 | B281: 128079 | C281: 英联转债! | D281: 2846 | E281: 英联股份 | F281: 造纸包装 | G281: 包装材料 | H281: 130.4 | I281: -9.0000000000000011e-003 | J281: 9.0000000000000011e-003 | K281: 8.14 | L281: -1.09e-002 | M281: 117.5 | N281: 8.29 | O281: 0.32799999999999996 | P281: 98.19 | Q281: 转股中 | R281: 4.38年 | S281: 2.38年 | T281: 1.52 | U281: 26 | V281: 0.13400000000000001 | W281: 5.9000000000000004e-002 | X281: 5.7999999999999996e-002 | Y281: 26 | Z281: 3.36 | AA281: -2.4e-002 | AB281: -3.0699999999999998e-002 | AC281: -8.6899999999999991e-002 | AD281: -8.929999999999999e-002 | AE281: 86.52 | AF281: 86.44 | AG281: 0 | AH281: A+ | AI281: 7.4400000000000008e-002 | AJ281: =H281+100*O281 -> 163.19999999999999 | AK281: 162.6 | AL281: 319 | AM281: 76.1 | AN281: 322 | AO281: -1.7000000000000001e-002 | AP281: 18 | AQ281: 英联转债!
A282: 163 | B282: 113585 | C282: 寿仙转债! | D282: 603896 | E282: 寿仙谷 | F282: 医药 | G282: 中药 | H282: 133.35 | I282: -8.3000000000000001e-003 | J282: 1.2999999999999999e-003 | K282: 38.36 | L282: -8.3000000000000001e-003 | M282: 117.8 | N282: 28.68 | O282: -3.0000000000000001e-003 | P282: 133.75 | Q282: 转股中 | R282: 5年4.1天 | S282: 3年5.1天 | T282: 1.5 | U282: 20 | V282: 9.8000000000000004e-002 | W282: 2.6000000000000002e-002 | X282: 3.5000000000000003e-002 | Y282: 57 | Z282: 4.15 | AA282: -2.5000000000000001e-002 | AB282: -3.0899999999999997e-002 | AC282: -7.5700000000000003e-002 | AD282: -7.7800000000000008e-002 | AE282: 85.64 | AF282: 86.84 | AG282: 0.84 | AH282: AA- | AI282: 6.4399999999999999e-002 | AJ282: =H282+100*O282 -> 133.04999999999998 | AK282: 132.9 | AL282: 177 | AM282: 46.1 | AN282: 224 | AO282: 2.4e-002 | AP282: 10 | AQ282: 寿仙转债!
A283: 43 | B283: 113618 | C283: 美诺转债! | D283: 603538 | E283: 美诺华 | F283: 医药 | G283: 原料药 | H283: 132.78 | I283: 7.5800000000000006e-002 | J283: 2.8999999999999998e-003 | K283: 44.87 | L283: 0.10000000000000001 | M283: 115.3 | N283: 37.47 | O283: 0.109 | P283: 119.75 | Q283: 46天 | R283: 5.61年 | S283: 3.61年 | T283: 5.2 | U283: 1386. | V283: 2.04 | W283: 7.6999999999999999e-002 | X283: 9.3000000000000013e-002 | Y283: 67 | Z283: 4.23 | AA283: -2.53e-002 | AB283: -2.9900000000000003e-002 | AC283: -6.3600000000000004e-002 | AD283: -6.5299999999999997e-002 | AE283: 82.18 | AF283: 81.81 | AG283: 0.79 | AH283: AA- | AI283: 6.4399999999999999e-002 | AJ283: =H283+100*O283 -> 143.68000000000001 | AK283: 145.8 | AL283: 270 | AM283: 63.6 | AN283: 308 | AO283: 0.19600000000000001 | AP283: 4 | AQ283: 美诺转债!
A284: 48 | B284: 113615 | C284: 金诚转债 | D284: 603979 | E284: 金诚信 | F284: 有色金属 | G284: 有色行业 | H284: 135.26 | I284: 1.8e-003 | J284: -8.0000000000000004e-004 | K284: 16.69 | L284: 1.1999999999999999e-003 | M284: 117.3 | N284: 12.73 | O284: 3.2000000000000001e-002 | P284: 131.11 | Q284: 25天 | R284: 5.55年 | S284: 3.55年 | T284: 10 | U284: 13 | V284: 1.e-002 | W284: 0.10300000000000001 | X284: 0.13500000000000001 | Y284: 97 | Z284: 2.1 | AA284: -2.58e-002 | AB284: -3.1e-002 | AC284: -6.93e-002 | AD284: -7.0999999999999994e-002 | AE284: 88.77 | AF284: 93.08 | AG284: 0.81 | AH284: AA | AI284: 4.3400000000000001e-002 | AJ284: =H284+100*O284 -> 138.45999999999998 | AK284: 139.4 | AL284: 233 | AM284: 46.3 | AN284: 226 | AO284: 1.6e-002 | AP284: 3 | AQ284: 金诚转债
A285: 102 | B285: 110075 | C285: 南航转债 | D285: 600029 | E285: 南方航空 | F285: 交通运输 | G285: 航空运输 | H285: 127.5 | I285: 5.0000000000000001e-003 | J285: 8.9999999999999998e-004 | K285: 6.46 | L285: 9.3999999999999986e-003 | M285: 110 | N285: 6.24 | O285: 0.23199999999999998 | P285: 103.53 | Q285: 转股中 | R285: 5.36年 | S285: 3.36年 | T285: 160 | U285: 15 | V285: 1.e-003 | W285: 0.16200000000000001 | X285: 0.16699999999999998 | Y285: 990 | Z285: 1.52 | AA285: -2.75e-002 | AB285: -3.0800000000000001e-002 | AC285: -6.0899999999999996e-002 | AD285: -6.2e-002 | AE285: 89.59 | AF285: 90.11 | AG285: 0.63 | AH285: AAA | AI285: 3.8399999999999997e-002 | AJ285: =H285+100*O285 -> 150.69999999999999 | AK285: 151.5 | AL285: 298 | AM285: 61.4 | AN285: 299 | AO285: -4.0000000000000001e-003 | AP285: 7 | AQ285: 南航转债
A286: 14 | B286: 123108 | C286: 乐普转2 | D286: 300003 | E286: 乐普医疗 | F286: 医药 | G286: 医疗器械 | H286: 128 | I286: -1.e-004 | J286: 6.9999999999999993e-003 | K286: 32.41 | L286: 1.03e-002 | M286: 111.1 | N286: 29.73 | O286: 0.17399999999999999 | P286: 109.01 | Q286: 4月6天 | R286: 4.82年 | S286: 2.82年 | T286: 16.4 | U286: 7.7 | V286: 4.0000000000000001e-003 | W286: 2.7999999999999997e-002 | X286: 3.1e-002 | Y286: 585 | Z286: 5.5 | AA286: -2.9300000000000003e-002 | AB286: -3.3300000000000003e-002 | AC286: -7.3300000000000004e-002 | AD286: -7.4499999999999997e-002 | AE286: 90.97 | AF286: 92.43 | AG286: 0.66 | AH286: AA+ | AI286: 3.9399999999999998e-002 | AJ286: =H286+100*O286 -> 145.40000000000001 | AK286: 147 | AL286: 278 | AM286: 54.6 | AN286: 270 | AO286: 1.7000000000000001e-002 | AP286: 8 | AQ286: 乐普转2
A287: 278 | B287: 123025 | C287: 精测转债!! | D287: 300567 | E287: 精测电子 | F287: 电子 | G287: 液晶显示 | H287: 130.341 | I287: -3.7000000000000002e-003 | J287: 2.1700000000000001e-002 | K287: 55.3 | L287: 2.6200000000000001e-002 | M287: 116.5 | N287: 49.37 | O287: 0.16399999999999998 | P287: 112.01 | Q287: 转股中 | R287: 3.81年 | S287: 1.82年 | T287: 3.09 | U287: 29 | V287: 7.0000000000000007e-002 | W287: 2.e-002 | X287: 2.3e-002 | Y287: 154 | Z287: 7.75 | AA287: -2.9500000000000002e-002 | AB287: -3.6799999999999999e-002 | AC287: -0.113 | AD287: -0.115 | AE287: 91.11 | AF287: 92.55 | AG287: 0.69 | AH287: AA- | AI287: 6.3399999999999998e-002 | AJ287: =H287+100*O287 -> 146.74100000000001 | AK287: 148.7 | AL287: 286 | AM287: 56.1 | AN287: 279 | AO287: 5.2999999999999999e-002 | AP287: 16 | AQ287: 精测转债!!
A288: 325 | B288: 128036 | C288: 金农转债!! | D288: 2548 | E288: 金新农 | F288: 农业 | G288: 畜牧业 | H288: 119 | I288: -3.3e-003 | J288: -8.9999999999999998e-004 | K288: 6.01 | L288: -1.15e-002 | M288: 109.3 | N288: 6.96 | O288: 0.37799999999999995 | P288: 86.35 | Q288: 转股中 | R288: 2.76年 | S288: 0.76年 | T288: 1.46 | U288: 21 | V288: 0.122 | W288: 3.5000000000000003e-002 | X288: 2.9999999999999999e-002 | Y288: 42 | Z288: 1.59 | AA288: -3.0800000000000001e-002 | AB288: -3.6799999999999999e-002 | AC288: -0.157 | AD288: -0.161 | AE288: 96.32 | AF288: 92.92 | AG288: 0.36 | AH288: AA- | AI288: 6.1600000000000002e-002 | AJ288: =H288+100*O288 -> 156.80000000000001 | AK288: 151.6 | AL288: 299 | AM288: 55.3 | AN288: 272 | AO288: -1.3000000000000001e-002 | AP288: 16 | AQ288: 金农转债!!
A289: 271 | B289: 113534 | C289: 鼎胜转债! | D289: 603876 | E289: 鼎胜新材 | F289: 有色金属 | G289: 小金属 | H289: 128.86 | I289: 8.5900000000000004e-002 | J289: -5.8999999999999999e-003 | K289: 19.44 | L289: 0.10000000000000001 | M289: 114.3 | N289: 15.18 | O289: 6.0000000000000001e-003 | P289: 128.06 | Q289: 转股中 | R289: 3.84年 | S289: 1.85年 | T289: 12 | U289: 2267. | V289: 1.47 | W289: 0.14199999999999999 | X289: 0.182 | Y289: 84 | Z289: 2.33 | AA289: -3.1200000000000002e-002 | AB289: -3.7599999999999995e-002 | AC289: -0.107 | AD289: -0.109 | AE289: 94.61 | AF289: 97.72 | AG289: 0.8 | AH289: AA | AI289: 4.24e-002 | AJ289: =H289+100*O289 -> 129.46000000000001 | AK289: 129.7 | AL289: 134 | AM289: 31.9 | AN289: 85 | AO289: 0.42599999999999999 | AP289: 37 | AQ289: 鼎胜转债!
A290: 186 | B290: 113575 | C290: 东时转债! | D290: 603377 | E290: 东方时尚 | F290: 其他 | G290: 其他 | H290: 131.65 | I290: -4.5000000000000005e-003 | J290: 2.7000000000000001e-003 | K290: 10.54 | L290: -6.6e-003 | M290: 113.1 | N290: 14.56 | O290: 0.81900000000000006 | P290: 72.39 | Q290: 转股中 | R290: 4.84年 | S290: 2.85年 | T290: 0.98 | U290: 27 | V290: 0.20999999999999999 | W290: 1.4999999999999999e-002 | X290: 1.1000000000000001e-002 | Y290: 64 | Z290: 3.07 | AA290: -3.1400000000000004e-002 | AB290: -3.61e-002 | AC290: -7.7499999999999999e-002 | AD290: -7.9399999999999998e-002 | AE290: 91.37 | AF290: 92.85 | AG290: 0.27 | AH290: AA | AI290: 4.24e-002 | AJ290: =H290+100*O290 -> 213.55000000000001 | AK290: 190.9 | AL290: 338 | AM290: 98.1 | AN290: 337 | AO290: -0.11800000000000001 | AP290: 14 | AQ290: 东时转债!
A291: 118 | B291: 128128 | C291: 齐翔转2! | D291: 2408 | E291: 齐翔腾达 | F291: 化工 | G291: 化工 | H291: 136.55 | I291: 2.6699999999999998e-002 | J291: -3.9000000000000003e-003 | K291: 11.11 | L291: 2.7799999999999998e-002 | M291: 115.3 | N291: 8.22 | O291: 1.e-002 | P291: 135.16 | Q291: 转股中 | R291: 5.21年 | S291: 3.21年 | T291: 10.8 | U291: 72 | V291: 4.9000000000000002e-002 | W291: 5.0999999999999997e-002 | X291: 6.8000000000000005e-002 | Y291: 214 | Z291: 2.04 | AA291: -3.2500000000000001e-002 | AB291: -3.7499999999999999e-002 | AC291: -7.8899999999999998e-002 | AD291: -8.0700000000000008e-002 | AE291: 89.99 | AF291: 92.83 | AG291: 0.82 | AH291: AA | AI291: 4.3400000000000001e-002 | AJ291: =H291+100*O291 -> 137.55000000000001 | AK291: 137.9 | AL291: 220 | AM291: 45.1 | AN291: 220 | AO291: 1.4999999999999999e-002 | AP291: 36 | AQ291: 齐翔转2!
A292: 38 | B292: 113621 | C292: 彤程转债 | D292: 603650 | E292: 彤程新材 | F292: 化工 | G292: 橡胶塑料 | H292: 138.45 | I292: -1.7000000000000001e-002 | J292: 4.41e-002 | K292: 44.5 | L292: 3.2500000000000001e-002 | M292: 115.1 | N292: 32.96 | O292: 2.5000000000000001e-002 | P292: 135.01 | Q292: 59天 | R292: 5.64年 | S292: 3.65年 | T292: 8 | U292: 1242. | V292: 1.0900000000000001 | W292: 3.1e-002 | X292: 4.0999999999999995e-002 | Y292: 261 | Z292: 10.12 | AA292: -3.27e-002 | AB292: -3.7200000000000004e-002 | AC292: -7.3700000000000002e-002 | AD292: -7.5300000000000006e-002 | AE292: 88.23 | AF292: 90.95 | AG292: 0.83 | AH292: AA | AI292: 4.3400000000000001e-002 | AJ292: =H292+100*O292 -> 140.94999999999999 | AK292: 141.9 | AL292: 254 | AM292: 50.9 | AN292: 250 | AO292: 0.32000000000000001 | AP292: 4 | AQ292: 彤程转债
A293: 362 | B293: 113009 | C293: 广汽转债! | D293: 601238 | E293: 广汽集团 | F293: 汽车 | G293: 乘用车 | H293: 108.32 | I293: 1.1000000000000001e-003 | J293: -1.e-003 | K293: 11.77 | L293: 1.7000000000000001e-003 | M293: 106 | N293: 14.12 | O293: 0.29899999999999999 | P293: 83.36 | Q293: 转股中 | R293: 0.64年 | S293: 回售内 | T293: 25.5 | U293: 12 | V293: 4.0000000000000001e-003 | W293: 2.1000000000000001e-002 | X293: 1.7000000000000001e-002 | Y293: 1218. | Z293: 1.41 | AA293: -3.3500000000000002e-002 | AB293: -5.0599999999999999e-002 | AC293: 回售内 | AD293: 回售内 | AE293: 100.27 | AF293: 103.92 | AG293: 0.03 | AH293: AAA | AI293: 3.1699999999999999e-002 | AJ293: =H293+100*O293 -> 138.22 | AK293: 133.3 | AL293: 179 | AM293: 29.4 | AN293: 57 | AO293: -5.0000000000000001e-003 | AP293: 15 | AQ293: 广汽转债!
A294: 257 | B294: 113541 | C294: 荣晟转债! | D294: 603165 | E294: 荣晟环保 | F294: 造纸包装 | G294: 包装用纸 | H294: 132.18 | I294: -1.49e-002 | J294: -1.8e-003 | K294: 14.34 | L294: -2.0499999999999997e-002 | M294: 115 | N294: 10.84 | O294: -1.e-003 | P294: 132.29 | Q294: 转股中 | R294: 4年48天 | S294: 2年49天 | T294: 1.75 | U294: 64 | V294: 0.27300000000000002 | W294: 4.7e-002 | X294: 6.2e-002 | Y294: 38 | Z294: 2.15 | AA294: -3.3799999999999997e-002 | AB294: -4.0000000000000001e-002 | AC294: -0.10199999999999999 | AD294: -0.10400000000000001 | AE294: 90.01 | AF294: 89.74 | AG294: 0.81 | AH294: AA- | AI294: 6.3399999999999998e-002 | AJ294: =H294+100*O294 -> 132.08000000000001 | AK294: 132.1 | AL294: 167 | AM294: 42.1 | AN294: 195 | AO294: 2.7000000000000003e-002 | AP294: 43 | AQ294: 荣晟转债!
A295: 235 | B295: 110061 | C295: 川投转债 | D295: 600674 | E295: 川投能源 | F295: 能源电力 | G295: 水电 | H295: 128.89 | I295: -8.0000000000000004e-004 | J295: -2.5999999999999999e-003 | K295: 11.75 | L295: -4.1999999999999997e-003 | M295: 110.8 | N295: 9.58 | O295: 5.0999999999999997e-002 | P295: 122.65 | Q295: 转股中 | R295: 4.44年 | S295: 2.44年 | T295: 39.6 | U295: 8.2 | V295: 2.e-003 | W295: 7.6999999999999999e-002 | X295: 9.4e-002 | Y295: 518 | Z295: 1.8 | AA295: -3.4099999999999998e-002 | AB295: -3.8399999999999997e-002 | AC295: -8.2100000000000006e-002 | AD295: -8.43e-002 | AE295: 93.96 | AF295: 94.46 | AG295: 0.79 | AH295: AAA | AI295: 3.7400000000000003e-002 | AJ295: =H295+100*O295 -> 133.98999999999998 | AK295: 135.1 | AL295: 201 | AM295: 40.7 | AN295: 177 | AO295: 0. | AP295: 15 | AQ295: 川投转债
A296: 99 | B296: 127022 | C296: 恒逸转债 | D296: 703 | E296: 恒逸石化 | F296: 化工 | G296: 化工 | H296: 131 | I296: -4.5999999999999999e-003 | J296: 5.1000000000000004e-003 | K296: 12.84 | L296: 8.0000000000000004e-004 | M296: 108.9 | N296: 11.5 | O296: 0.17300000000000001 | P296: 111.65 | Q296: 转股中 | R296: 5.36年 | S296: 3.37年 | T296: 20 | U296: 32 | V296: 1.2e-002 | W296: 4.2000000000000003e-002 | X296: 4.7e-002 | Y296: 473 | Z296: 1.91 | AA296: -3.4300000000000004e-002 | AB296: -3.7200000000000004e-002 | AC296: -6.7000000000000004e-002 | AD296: -6.83e-002 | AE296: 89.32 | AF296: 88.33 | AG296: 0.74 | AH296: AA+ | AI296: 4.0399999999999998e-002 | AJ296: =H296+100*O296 -> 148.30000000000001 | AK296: 150.3 | AL296: 290 | AM296: 61 | AN296: 297 | AO296: 5.0000000000000001e-003 | AP296: 6 | AQ296: 恒逸转债
A297: 192 | B297: 123047 | C297: 久吾转债 | D297: 300631 | E297: 久吾高科 | F297: 机械装备 | G297: 专用设备 | H297: 152.95 | I297: 2.58e-002 | J297: 1.26e-002 | K297: 23.88 | L297: 4.9699999999999994e-002 | M297: 129.6 | N297: 17.43 | O297: 0.11599999999999999 | P297: 137.01 | Q297: 转股中 | R297: 4.79年 | S297: 2.79年 | T297: 1.99 | U297: 1812. | V297: 5.9100000000000001 | W297: 7.6999999999999999e-002 | X297: 0.105 | Y297: 26 | Z297: 3.14 | AA297: -3.4799999999999998e-002 | AB297: -4.4299999999999999e-002 | AC297: -0.11699999999999999 | AD297: -0.12 | AE297: 85.62 | AF297: 92.8 | AG297: 0.77 | AH297: A+ | AI297: 7.4400000000000008e-002 | AJ297: =H297+100*O297 -> 164.54999999999998 | AK297: 168.9 | AL297: 324 | AM297: 76.1 | AN297: 323 | AO297: 0.161 | AP297: 21 | AQ297: 久吾转债
A298: 40 | B298: 123094 | C298: 星源转2! | D298: 300568 | E298: 星源材质 | F298: 电子 | G298: 电子行业 | H298: 143.01 | I298: 1.15e-002 | J298: 1.2800000000000001e-002 | K298: 45.05 | L298: 2.8799999999999999e-002 | M298: 117.3 | N298: 31.53 | O298: 1.e-003 | P298: 142.88 | Q298: 52天 | R298: 5.63年 | S298: 3.63年 | T298: 10 | U298: 150 | V298: 0.105 | W298: 4.9000000000000002e-002 | X298: 7.0999999999999994e-002 | Y298: 202 | Z298: 6.68 | AA298: -3.5200000000000002e-002 | AB298: -4.0300000000000002e-002 | AC298: -8.1600000000000006e-002 | AD298: -8.3199999999999996e-002 | AE298: 88.48 | AF298: 92.78 | AG298: 0.84 | AH298: AA | AI298: 4.3400000000000001e-002 | AJ298: =H298+100*O298 -> 143.10999999999999 | AK298: 143.1 | AL298: 265 | AM298: 50.4 | AN298: 247 | AO298: 0.25800000000000001 | AP298: 4 | AQ298: 星源转2!
A299: 332 | B299: 110043 | C299: 无锡转债! | D299: 600908 | E299: 无锡银行 | F299: 金融 | G299: 银行行业 | H299: 119.1 | I299: -7.4999999999999997e-003 | J299: 7.4999999999999997e-003 | K299: 6.04 | L299: 0. | M299: 108.3 | N299: 5.79 | O299: 0.14199999999999999 | P299: 104.32 | Q299: 转股中 | R299: 2.66年 | S299: 无权 | T299: 29.2 | U299: 35 | V299: 1.e-002 | W299: 0.26000000000000001 | X299: 0.27100000000000002 | Y299: 112 | Z299: 0.91 | AA299: -3.5499999999999997e-002 | AB299: -4.1100000000000005e-002 | AC299: 无权 | AD299: 无权 | AE299: 无权 | AF299: 98.3 | AG299: 0.58 | AH299: AA+ | AI299: 3.7599999999999995e-002 | AJ299: =H299+100*O299 -> 133.29999999999998 | AK299: 133.9 | AL299: 188 | AM299: 35.6 | AN299: 130 | AO299: -6.9999999999999993e-003 | AP299: 24 | AQ299: 无锡转债!
A300: 21 | B300: 127030 | C300: 盛虹转债 | D300: 301 | E300: 东方盛虹 | F300: 化工 | G300: 化纤 | H300: 138.56 | I300: -1.4499999999999999e-002 | J300: 2.7200000000000002e-002 | K300: 17.01 | L300: 1.67e-002 | M300: 112.5 | N300: 14.2 | O300: 0.157 | P300: 119.79 | Q300: 3月25天 | R300: 5.79年 | S300: 3.80年 | T300: 50 | U300: 67 | V300: 1.e-002 | W300: 6.0999999999999999e-002 | X300: 7.2999999999999995e-002 | Y300: 822 | Z300: 4.53 | AA300: -3.5799999999999998e-002 | AB300: -3.95e-002 | AC300: -7.2400000000000006e-002 | AD300: -7.3700000000000002e-002 | AE300: 88.12 | AF300: 89.73 | AG300: 0.76 | AH300: AA+ | AI300: 4.0399999999999998e-002 | AJ300: =H300+100*O300 -> 154.25999999999999 | AK300: 157.3 | AL300: 311 | AM300: 67.6 | AN300: 314 | AO300: 0. | AP300: 4 | AQ300: 盛虹转债
A301: 213 | B301: 123042 | C301: 银河转债! | D301: 300619 | E301: 金银河 | F301: 机械装备 | G301: 专用设备 | H301: 136.401 | I301: -1.6000000000000001e-003 | J301: 1.41e-002 | K301: 21.38 | L301: 2.1499999999999998e-002 | M301: 115.4 | N301: 24.4 | O301: 0.55700000000000005 | P301: 87.62 | Q301: 转股中 | R301: 4.61年 | S301: 2.61年 | T301: 1.67 | U301: 227 | V301: 0.98799999999999999 | W301: 0.105 | X301: 9.1999999999999998e-002 | Y301: 16 | Z301: 3.27 | AA301: -3.6299999999999999e-002 | AB301: -4.1900000000000007e-002 | AC301: -9.4700000000000006e-002 | AD301: -9.69e-002 | AE301: 85.17 | AF301: 83.53 | AG301: 0.58 | AH301: A+ | AI301: 7.4400000000000008e-002 | AJ301: =H301+100*O301 -> 192.101 | AK301: 185.2 | AL301: 335 | AM301: 100 | AN301: 338 | AO301: 0.124 | AP301: 22 | AQ301: 银河转债!
A302: 238 | B302: 113548 | C302: 石英转债! | D302: 603688 | E302: 石英股份 | F302: 电子 | G302: 电子产品 | H302: 146.22 | I302: 1.7000000000000001e-002 | J302: 1.e-004 | K302: 20.49 | L302: 2.1400000000000002e-002 | M302: 124.4 | N302: 14.93 | O302: 6.5000000000000002e-002 | P302: 137.24 | Q302: 转股中 | R302: 4.40年 | S302: 2.40年 | T302: 1.23 | U302: 114 | V302: 0.63400000000000001 | W302: 1.7000000000000001e-002 | X302: 2.3e-002 | Y302: 72 | Z302: 3.67 | AA302: -3.6900000000000002e-002 | AB302: -4.5599999999999995e-002 | AC302: -0.124 | AD302: -0.126 | AE302: 89.27 | AF302: 95.57 | AG302: 0.8 | AH302: AA- | AI302: 6.3399999999999998e-002 | AJ302: =H302+100*O302 -> 152.72 | AK302: 155.2 | AL302: 308 | AM302: 59.6 | AN302: 294 | AO302: 0.13500000000000001 | AP302: 13 | AQ302: 石英转债!
A303: 354 | B303: 113013 | C303: 国君转债! | D303: 601211 | E303: 国泰君安 | F303: 金融 | G303: 证券行业 | H303: 117.33 | I303: 2.3e-003 | J303: 0. | K303: 17.4 | L303: 6.4000000000000003e-003 | M303: 108.3 | N303: 19.01 | O303: 0.28199999999999997 | P303: 91.53 | Q303: 转股中 | R303: 2年33天 | S303: 无权 | T303: 69.9 | U303: 71 | V303: 9.0000000000000011e-003 | W303: 4.4999999999999998e-002 | X303: 4.0999999999999995e-002 | Y303: 1550. | Z303: 1.19 | AA303: -3.8399999999999997e-002 | AB303: -4.5400000000000003e-002 | AC303: 无权 | AD303: 无权 | AE303: 无权 | AF303: 100.82 | AG303: 0.37 | AH303: AAA | AI303: 3.56e-002 | AJ303: =H303+100*O303 -> 145.53 | AK303: 143.1 | AL303: 264 | AM303: 42.3 | AN303: 196 | AO303: 1.8000000000000002e-002 | AP303: 13 | AQ303: 国君转债!
A304: 70 | B304: 113611 | C304: 福20转债 | D304: 603806 | E304: 福斯特 | F304: 能源电力 | G304: 太阳能 | H304: 138.72 | I304: -5.6000000000000008e-003 | J304: -1.1000000000000001e-002 | K304: 70.35 | L304: -2.29e-002 | M304: 111.85 | N304: 61.03 | O304: 0.20300000000000001 | P304: 115.27 | Q304: 3.1天 | R304: 5.49年 | S304: 3.49年 | T304: 17 | U304: 46 | V304: 2.e-002 | W304: 2.6000000000000002e-002 | X304: 2.9999999999999999e-002 | Y304: 650 | Z304: 5.91 | AA304: -3.8900000000000004e-002 | AB304: -4.2599999999999999e-002 | AC304: -7.9500000000000001e-002 | AD304: -8.0700000000000008e-002 | AE304: 87.96 | AF304: 88.88 | AG304: 0.73 | AH304: AA | AI304: 4.3400000000000001e-002 | AJ304: =H304+100*O304 -> 159.02000000000001 | AK304: 162.2 | AL304: 317 | AM304: 73.3 | AN304: 319 | AO304: -0.155 | AP304: 5 | AQ304: 福20转债
A305: 94 | B305: 113040 | C305: 星宇转债 | D305: 601799 | E305: 星宇股份 | F305: 汽车 | G305: 零部件制 | H305: 137.97 | I305: 7.0999999999999995e-003 | J305: 3.3700000000000001e-002 | K305: 199.29 | L305: 5.1100000000000007e-002 | M305: 111.5 | N305: 158 | O305: 9.4e-002 | P305: 126.13 | Q305: 转股中 | R305: 5.38年 | S305: 3.38年 | T305: 15 | U305: 19 | V305: 9.0000000000000011e-003 | W305: 2.7000000000000003e-002 | X305: 3.4000000000000002e-002 | Y305: 550 | Z305: 9.1 | AA305: -3.9199999999999999e-002 | AB305: -4.2900000000000001e-002 | AC305: -8.1300000000000011e-002 | AD305: -8.2400000000000001e-002 | AE305: 88.92 | AF305: 90.34 | AG305: 0.8 | AH305: AA+ | AI305: 4.0399999999999998e-002 | AJ305: =H305+100*O305 -> 147.37 | AK305: 149.8 | AL305: 288 | AM305: 59.5 | AN305: 293 | AO305: 6.8000000000000005e-002 | AP305: 5 | AQ305: 星宇转债
A306: 27 | B306: 123103 | C306: 震安转债 | D306: 300767 | E306: 震安科技 | F306: 化工 | G306: 橡胶塑料 | H306: 152.7 | I306: -1.6299999999999999e-002 | J306: 2.5399999999999999e-002 | K306: 102.1 | L306: 1.1299999999999999e-002 | M306: 121.4 | N306: 79.87 | O306: 0.19500000000000001 | P306: 127.83 | Q306: 3月18天 | R306: 5.77年 | S306: 3.77年 | T306: 2.85 | U306: 131 | V306: 0.29899999999999999 | W306: 1.9e-002 | X306: 2.5000000000000001e-002 | Y306: 147 | Z306: 12.91 | AA306: -3.9699999999999999e-002 | AB306: -4.5700000000000005e-002 | AC306: -9.2600000000000002e-002 | AD306: -9.4399999999999998e-002 | AE306: 78.82 | AF306: 80.6 | AG306: 0.81 | AH306: A+ | AI306: 7.5399999999999995e-002 | AJ306: =H306+100*O306 -> 172.19999999999999 | AK306: 177.6 | AL306: 329 | AM306: 97 | AN306: 336 | AO306: -6.3e-002 | AP306: 3 | AQ306: 震安转债
A307: 302 | B307: 110048 | C307: 福能转债! | D307: 600483 | E307: 福能股份 | F307: 能源电力 | G307: 电力供应 | H307: 130.5 | I307: -7.7000000000000002e-003 | J307: -7.4000000000000003e-003 | K307: 10.29 | L307: -1.9099999999999999e-002 | M307: 113.3 | N307: 8.12 | O307: 2.9999999999999999e-002 | P307: 126.72 | Q307: 转股中 | R307: 3.51年 | S307: 1.51年 | T307: 20.4 | U307: 29 | V307: 1.1000000000000001e-002 | W307: 0.111 | X307: 0.14000000000000001 | Y307: 184 | Z307: 1.16 | AA307: -4.0199999999999993e-002 | AB307: -4.6600000000000003e-002 | AC307: -0.11599999999999999 | AD307: -0.11900000000000001 | AE307: 96.4 | AF307: 99.2 | AG307: 0.79 | AH307: AA+ | AI307: 3.9399999999999998e-002 | AJ307: =H307+100*O307 -> 133.5 | AK307: 134.3 | AL307: 191 | AM307: 35.1 | AN307: 122 | AO307: 0. | AP307: 9 | AQ307: 福能转债!
A308: 294 | B308: 128053 | C308: 尚荣转债! | D308: 2551 | E308: 尚荣医疗 | F308: 医药 | G308: 医疗器械 | H308: 134.09 | I308: 1.e-004 | J308: -6.9999999999999993e-003 | K308: 5.73 | L308: -6.8999999999999999e-003 | M308: 114.3 | N308: 4.89 | O308: 0.14400000000000002 | P308: 117.18 | Q308: 转股中 | R308: 3.70年 | S308: 1.70年 | T308: 1.91 | U308: 72 | V308: 0.28000000000000003 | W308: 4.0999999999999995e-002 | X308: 4.8000000000000001e-002 | Y308: 47 | Z308: 1.54 | AA308: -4.2999999999999997e-002 | AB308: -4.9500000000000002e-002 | AC308: -0.11199999999999999 | AD308: -0.114 | AE308: 95.19 | AF308: 98.31 | AG308: 1 | AH308: AA | AI308: 4.24e-002 | AJ308: =H308+100*O308 -> 148.49000000000001 | AK308: 151 | AL308: 294 | AM308: 52.7 | AN308: 259 | AO308: -5.5e-002 | AP308: 25 | AQ308: 尚荣转债!
A309: 328 | B309: 127005 | C309: 长证转债! | D309: 783 | E309: 长江证券 | F309: 金融 | G309: 证券行业 | H309: 122.2 | I309: 1.6000000000000001e-003 | J309: 5.4000000000000003e-003 | K309: 7.62 | L309: 1.2e-002 | M309: 108.3 | N309: 7.28 | O309: 0.16699999999999998 | P309: 104.67 | Q309: 转股中 | R309: 2.77年 | S309: 无权 | T309: 50 | U309: 114 | V309: 1.9e-002 | W309: 0.11900000000000001 | X309: 0.124 | Y309: 421 | Z309: 1.46 | AA309: -4.3299999999999998e-002 | AB309: -4.8600000000000004e-002 | AC309: 无权 | AD309: 无权 | AE309: 无权 | AF309: 98.46 | AG309: 0.59 | AH309: AAA | AI309: 3.56e-002 | AJ309: =H309+100*O309 -> 138.90000000000001 | AK309: 139.7 | AL309: 235 | AM309: 41.3 | AN309: 186 | AO309: 2.e-002 | AP309: 14 | AQ309: 长证转债!
A310: 203 | B310: 123043 | C310: 正元转债 | D310: 300645 | E310: 正元智慧 | F310: 计算机及 | G310: 软件开发 | H310: 148.8 | I310: -8.0000000000000002e-003 | J310: 9.300000000000001e-003 | K310: 16.33 | L310: 1.8e-003 | M310: 120.9 | N310: 15.41 | O310: 0.40399999999999997 | P310: 105.97 | Q310: 转股中 | R310: 4.75年 | S310: 2.75年 | T310: 1.66 | U310: 263 | V310: 1.0600000000000001 | W310: 8.0000000000000002e-002 | X310: 8.5000000000000006e-002 | Y310: 21 | Z310: 3.23 | AA310: -4.36e-002 | AB310: -5.0599999999999999e-002 | AC310: -0.115 | AD310: -0.11699999999999999 | AE310: 84.6 | AF310: 86.66 | AG310: 0.68 | AH310: A+ | AI310: 7.4400000000000008e-002 | AJ310: =H310+100*O310 -> 189.20000000000002 | AK310: 191.6 | AL310: 339 | AM310: 105 | AN310: 340 | AO310: -1.3000000000000001e-002 | AP310: 18 | AQ310: 正元转债
A311: 92 | B311: 127023 | C311: 华菱转2! | D311: 932 | E311: 华菱钢铁 | F311: 钢铁 | G311: 炼钢 | H311: 140.801 | I311: -2.3199999999999998e-002 | J311: 1.7000000000000001e-003 | K311: 6.83 | L311: -2.1499999999999998e-002 | M311: 110.1 | N311: 4.97 | O311: 2.5000000000000001e-002 | P311: 137.42 | Q311: 转股中 | R311: 5.38年 | S311: 4.39年 | T311: 20.7 | U311: 68 | V311: 2.3e-002 | W311: 4.9000000000000002e-002 | X311: 6.8000000000000005e-002 | Y311: 419 | Z311: 1.19 | AA311: -4.53e-002 | AB311: -4.8499999999999995e-002 | AC311: -6.4100000000000004e-002 | AD311: -6.5799999999999997e-002 | AE311: 88.15 | AF311: 90.16 | AG311: 1 | AH311: AAA | AI311: 3.8399999999999997e-002 | AJ311: =H311+100*O311 -> 143.30099999999999 | AK311: 144.2 | AL311: 268 | AM311: 54 | AN311: 266 | AO311: -6.4000000000000001e-002 | AP311: 12 | AQ311: 华菱转2!
A312: 222 | B312: 110065 | C312: 淮矿转债!! | D312: 600985 | E312: 淮北矿业 | F312: 煤炭 | G312: 煤炭开采 | H312: 137.53 | I312: -1.8600000000000002e-002 | J312: 5.7999999999999996e-003 | K312: 12.01 | L312: -1.4800000000000001e-002 | M312: 110.8 | N312: 8.68 | O312: -6.0000000000000001e-003 | P312: 138.36 | Q312: 转股中 | R312: 4.55年 | S312: 2.55年 | T312: 16.8 | U312: 163 | V312: 7.0999999999999994e-002 | W312: 6.0999999999999999e-002 | X312: 8.5000000000000006e-002 | Y312: 275 | Z312: 1.17 | AA312: -4.7199999999999999e-002 | AB312: -5.1200000000000002e-002 | AC312: -0.10099999999999999 | AD312: -0.10199999999999999 | AE312: 93.57 | AF312: 94.06 | AG312: 0.87 | AH312: AAA | AI312: 3.7400000000000003e-002 | AJ312: =H312+100*O312 -> 136.93000000000001 | AK312: 136.7 | AL312: 211 | AM312: 42.6 | AN312: 200 | AO312: 0. | AP312: 20 | AQ312: 淮矿转债!!
A313: 8 | B313: 113047 | C313: 旗滨转债 | D313: 601636 | E313: 旗滨集团 | F313: 建筑 | G313: 玻璃 | H313: 151.08 | I313: -3.4000000000000002e-003 | J313: -1.6799999999999999e-002 | K313: 17.46 | L313: -2.5099999999999997e-002 | M313: 114 | N313: 13.15 | O313: 0.13800000000000001 | P313: 132.78 | Q313: 4月13天 | R313: 5.84年 | S313: 3.85年 | T313: 15 | U313: 61 | V313: 2.7000000000000003e-002 | W313: 3.2000000000000001e-002 | X313: 4.2000000000000003e-002 | Y313: 469 | Z313: 4.51 | AA313: -4.7599999999999996e-002 | AB313: -5.1500000000000004e-002 | AC313: -9.2499999999999999e-002 | AD313: -9.3599999999999989e-002 | AE313: 87.52 | AF313: 90.71 | AG313: 0.8 | AH313: AA+ | AI313: 4.0399999999999998e-002 | AJ313: =H313+100*O313 -> 164.88000000000002 | AK313: 169.4 | AL313: 325 | AM313: 78.7 | AN313: 326 | AO313: 8.900000000000001e-002 | AP313: 5 | AQ313: 旗滨转债
A314: 11 | B314: 123111 | C314: 东财转3 | D314: 300059 | E314: 东方财富 | F314: 金融 | G314: 证券行业 | H314: 147.6 | I314: -2.0999999999999999e-003 | J314: 6.3e-003 | K314: 31.02 | L314: 5.1999999999999998e-003 | M314: 110.5 | N314: 23.35 | O314: 0.111 | P314: 132.85 | Q314: 4月11天 | R314: 5.84年 | S314: 3.84年 | T314: 158 | U314: 1252. | V314: 5.2999999999999999e-002 | W314: 4.9000000000000002e-002 | X314: 6.5000000000000002e-002 | Y314: 3206. | Z314: 7.61 | AA314: -4.8799999999999996e-002 | AB314: -5.1900000000000002e-002 | AC314: -8.8399999999999992e-002 | AD314: -8.9200000000000002e-002 | AE314: 87.09 | AF314: 87.9 | AG314: 0.82 | AH314: AA+ | AI314: 4.0399999999999998e-002 | AJ314: =H314+100*O314 -> 158.69999999999999 | AK314: 162.4 | AL314: 318 | AM314: 74.4 | AN314: 320 | AO314: -5.7999999999999996e-002 | AP314: 15 | AQ314: 东财转3
A315: 46 | B315: 113616 | C315: 韦尔转债 | D315: 603501 | E315: 韦尔股份 | F315: 电子 | G315: 元器件制 | H315: 151 | I315: -6.4000000000000003e-003 | J315: 5.8999999999999999e-003 | K315: 286.3 | L315: -7.000000000000001e-004 | M315: 114.5 | N315: 222.83 | O315: 0.17499999999999999 | P315: 128.48 | Q315: 31天 | R315: 5.56年 | S315: 3.57年 | T315: 24.4 | U315: 75 | V315: 2.e-002 | W315: 1.e-002 | X315: 1.3000000000000001e-002 | Y315: 2485. | Z315: 19.98 | AA315: -4.9100000000000005e-002 | AB315: -5.3399999999999996e-002 | AC315: -9.7799999999999998e-002 | AD315: -9.9199999999999997e-002 | AE315: 88.92 | AF315: 92.15 | AG315: 0.79 | AH315: AA+ | AI315: 4.0399999999999998e-002 | AJ315: =H315+100*O315 -> 168.5 | AK315: 173.5 | AL315: 327 | AM315: 81.4 | AN315: 330 | AO315: 1.8000000000000002e-002 | AP315: 8 | AQ315: 韦尔转债
A316: 23 | B316: 127029 | C316: 中钢转债 | D316: 928 | E316: 中钢国际 | F316: 建筑 | G316: 建筑工程 | H316: 158.08 | I316: -5.4299999999999994e-002 | J316: -1.24e-002 | K316: 9.89 | L316: -7.400000000000001e-002 | M316: 117.5 | N316: 5.89 | O316: -5.9000000000000004e-002 | P316: 167.91 | Q316: 3月25天 | R316: 5.79年 | S316: 3.79年 | T316: 9.6 | U316: 649 | V316: 0.41899999999999998 | W316: 7.6999999999999999e-002 | X316: 0.13 | Y316: 124 | Z316: 2.16 | AA316: -5.0599999999999999e-002 | AB316: -5.5500000000000001e-002 | AC316: -0.10300000000000001 | AD316: -0.10099999999999999 | AE316: 88.14 | AF316: 93.73 | AG316: 0.9 | AH316: AA+ | AI316: 4.0399999999999998e-002 | AJ316: =H316+100*O316 -> 152.18000000000001 | AK316: 148.2 | AL316: 285 | AM316: 54.5 | AN316: 269 | AO316: -0.14499999999999999 | AP316: 8 | AQ316: 中钢转债
A317: 120 | B317: 110074 | C317: 精达转债! | D317: 600577 | E317: 精达股份 | F317: 电子 | G317: 电子产品 | H317: 154.49 | I317: 1.2699999999999999e-002 | J317: 1.89e-002 | K317: 5.75 | L317: 3.6000000000000004e-002 | M317: 117.3 | N317: 3.73 | O317: 2.e-003 | P317: 154.16 | Q317: 转股中 | R317: 5.21年 | S317: 3.21年 | T317: 7.48 | U317: 607 | V317: 0.51300000000000001 | W317: 6.8000000000000005e-002 | X317: 0.10400000000000001 | Y317: 110 | Z317: 2.91 | AA317: -5.2400000000000002e-002 | AB317: -5.7800000000000004e-002 | AC317: -0.11 | AD317: -0.111 | AE317: 90.08 | AF317: 94.46 | AG317: 0.88 | AH317: AA | AI317: 4.3400000000000001e-002 | AJ317: =H317+100*O317 -> 154.69 | AK317: 154.8 | AL317: 307 | AM317: 60.4 | AN317: 296 | AO317: 0.214 | AP317: 12 | AQ317: 精达转债!
A318: 324 | B318: 113508 | C318: 新凤转债! | D318: 603225 | E318: 新凤鸣 | F318: 服装纺织 | G318: 纺织行业 | H318: 129.97 | I318: 1.06e-002 | J318: 8.9999999999999998e-004 | K318: 19.91 | L318: 1.43e-002 | M318: 111.3 | N318: 15.78 | O318: 2.9999999999999999e-002 | P318: 126.17 | Q318: 转股中 | R318: 2.89年 | S318: 0.89年 | T318: 20.6 | U318: 21 | V318: 8.0000000000000002e-003 | W318: 7.400000000000001e-002 | X318: 9.3000000000000013e-002 | Y318: 279 | Z318: 2.28 | AA318: -5.2900000000000003e-002 | AB318: -5.96e-002 | AC318: -0.20300000000000001 | AD318: -0.20600000000000002 | AE318: 97.61 | AF318: 99.37 | AG318: 0.8 | AH318: AA | AI318: 4.0599999999999997e-002 | AJ318: =H318+100*O318 -> 132.97 | AK318: 133.8 | AL318: 187 | AM318: 34.4 | AN318: 117 | AO318: 7.0000000000000007e-002 | AP318: 22 | AQ318: 新凤转债!
A319: 184 | B319: 113034 | C319: 滨化转债! | D319: 601678 | E319: 滨化股份 | F319: 化工 | G319: 化工 | H319: 149.85 | I319: -9.300000000000001e-003 | J319: 4.0000000000000002e-004 | K319: 6.83 | L319: -1.01e-002 | M319: 114.8 | N319: 4.58 | O319: 5.0000000000000001e-003 | P319: 149.13 | Q319: 转股中 | R319: 4.85年 | S319: 2.85年 | T319: 6 | U319: 69 | V319: 7.5999999999999998e-002 | W319: 4.5999999999999999e-002 | X319: 6.8000000000000005e-002 | Y319: 132 | Z319: 1.49 | AA319: -5.4299999999999994e-002 | AB319: -5.9299999999999999e-002 | AC319: -0.115 | AD319: -0.11699999999999999 | AE319: 91.23 | AF319: 94.21 | AG319: 0.87 | AH319: AA | AI319: 4.24e-002 | AJ319: =H319+100*O319 -> 150.34999999999999 | AK319: 150.6 | AL319: 292 | AM319: 56.4 | AN319: 281 | AO319: -1.e-002 | AP319: 24 | AQ319: 滨化转债!
A320: 359 | B320: 113011 | C320: 光大转债 | D320: 601818 | E320: 光大银行 | F320: 金融 | G320: 银行行业 | H320: 117.93 | I320: -5.9999999999999995e-004 | J320: 1.9e-003 | K320: 3.8 | L320: 2.5999999999999999e-003 | M320: 106.8 | N320: 3.76 | O320: 0.16699999999999998 | P320: 101.06 | Q320: 转股中 | R320: 1.78年 | S320: 无权 | T320: 242 | U320: 180 | V320: 6.0000000000000001e-003 | W320: 0.11800000000000001 | X320: 0.11900000000000001 | Y320: 2053. | Z320: 0.58 | AA320: -5.4600000000000003e-002 | AB320: -6.13e-002 | AC320: 无权 | AD320: 无权 | AE320: 无权 | AF320: 100.4 | AG320: 0.51 | AH320: AAA | AI320: 3.56e-002 | AJ320: =H320+100*O320 -> 134.63 | AK320: 134.8 | AL320: 197 | AM320: 34.4 | AN320: 116 | AO320: -9.0000000000000011e-003 | AP320: 13 | AQ320: 光大转债
A321: 160 | B321: 128113 | C321: 比音转债! | D321: 2832 | E321: 比音勒芬 | F321: 服装纺织 | G321: 服装行业 | H321: 157.4 | I321: -6.6e-003 | J321: 8.5000000000000006e-003 | K321: 23.5 | L321: 2.0999999999999999e-003 | M321: 117.3 | N321: 14.9 | O321: -2.e-003 | P321: 157.72 | Q321: 转股中 | R321: 5年10天 | S321: 3年11天 | T321: 3.63 | U321: 113 | V321: 0.19800000000000001 | W321: 2.7999999999999997e-002 | X321: 4.4999999999999998e-002 | Y321: 128 | Z321: 4.86 | AA321: -5.79e-002 | AB321: -6.3299999999999995e-002 | AC321: -0.121 | AD321: -0.122 | AE321: 90.77 | AF321: 95.18 | AG321: 0.9 | AH321: AA | AI321: 4.3400000000000001e-002 | AJ321: =H321+100*O321 -> 157.20000000000002 | AK321: 157.1 | AL321: 310 | AM321: 61.9 | AN321: 300 | AO321: 8.6999999999999994e-002 | AP321: 8 | AQ321: 比音转债!
A322: 146 | B322: 123058 | C322: 欣旺转债 | D322: 300207 | E322: 欣旺达 | F322: 电子 | G322: 电子产品 | H322: 157.4 | I322: 6.5700000000000008e-002 | J322: 6.7599999999999993e-002 | K322: 34.75 | L322: 0.14699999999999999 | M322: 116.3 | N322: 21.17 | O322: -4.0999999999999995e-002 | P322: 164.15 | Q322: 转股中 | R322: 5年39天 | S322: 3年40天 | T322: 11.2 | U322: 4023. | V322: 2.1899999999999999 | W322: 2.e-002 | X322: 3.4000000000000002e-002 | Y322: 547 | Z322: 7.83 | AA322: -5.8600000000000006e-002 | AB322: -6.3700000000000007e-002 | AC322: -0.11800000000000001 | AD322: -0.11900000000000001 | AE322: 90.46 | AF322: 94.05 | AG322: 0.91 | AH322: AA | AI322: 4.3400000000000001e-002 | AJ322: =H322+100*O322 -> 153.30000000000001 | AK322: 150.7 | AL322: 293 | AM322: 56.6 | AN322: 282 | AO322: 0.37799999999999995 | AP322: 6 | AQ322: 欣旺转债
A323: 343 | B323: 128025 | C323: 特一转债! | D323: 2728 | E323: 特一药业 | F323: 医药 | G323: 化学制药 | H323: 126.4 | I323: -7.6e-003 | J323: 1.78e-002 | K323: 15.85 | L323: 1.41e-002 | M323: 108.8 | N323: 14.05 | O323: 0.12 | P323: 112.81 | Q323: 转股中 | R323: 2.51年 | S323: 0.51年 | T323: 2.98 | U323: 605 | V323: 1.5800000000000001 | W323: 9.1999999999999998e-002 | X323: 0.10400000000000001 | Y323: 32 | Z323: 3.02 | AA323: -5.8899999999999994e-002 | AB323: -6.4899999999999999e-002 | AC323: -0.30299999999999999 | AD323: -0.307 | AE323: 97.56 | AF323: 93.88 | AG323: 0.73 | AH323: AA- | AI323: 6.1600000000000002e-002 | AJ323: =H323+100*O323 -> 138.40000000000001 | AK323: 140 | AL323: 240 | AM323: 42.4 | AN323: 198 | AO323: 6.9999999999999993e-003 | AP323: 50 | AQ323: 特一转债!
A324: 232 | B324: 113550 | C324: 常汽转债! | D324: 603035 | E324: 常熟汽饰 | F324: 汽车 | G324: 零部件制 | H324: 158.82 | I324: 4.0000000000000001e-003 | J324: -1.e-003 | K324: 14.81 | L324: 3.4000000000000002e-003 | M324: 121.3 | N324: 9.33 | O324: 1.e-003 | P324: 158.74 | Q324: 转股中 | R324: 4.45年 | S324: 2.46年 | T324: 3.06 | U324: 230 | V324: 0.47700000000000004 | W324: 5.9000000000000004e-002 | X324: 9.3000000000000013e-002 | Y324: 52 | Z324: 1.38 | AA324: -5.9999999999999998e-002 | AB324: -6.7400000000000002e-002 | AC324: -0.106 | AD324: -0.107 | AE324: 88.88 | AF324: 92.88 | AG324: 0.88 | AH324: AA- | AI324: 6.3399999999999998e-002 | AJ324: =H324+100*O324 -> 158.91999999999999 | AK324: 158.9 | AL324: 313 | AM324: 66 | AN324: 313 | AO324: -6.9999999999999993e-003 | AP324: 16 | AQ324: 常汽转债!
A325: 307 | B325: 128046 | C325: 利尔转债!! | D325: 2258 | E325: 利尔化学 | F325: 化工 | G325: 农化 | H325: 138.85 | I325: -1.38e-002 | J325: 1.9e-003 | K325: 24.1 | L325: -1.1899999999999999e-002 | M325: 112.3 | N325: 18.42 | O325: 6.0999999999999999e-002 | P325: 130.84 | Q325: 转股中 | R325: 3.37年 | S325: 1.37年 | T325: 8.47 | U325: 20 | V325: 1.7000000000000001e-002 | W325: 6.7000000000000004e-002 | X325: 8.8000000000000009e-002 | Y325: 126 | Z325: 3.25 | AA325: -6.2199999999999998e-002 | AB325: -6.8199999999999997e-002 | AC325: -0.159 | AD325: -0.161 | AE325: 96.5 | AF325: 97.93 | AG325: 1 | AH325: AA | AI325: 4.24e-002 | AJ325: =H325+100*O325 -> 144.94999999999999 | AK325: 146.9 | AL325: 276 | AM325: 48.9 | AN325: 240 | AO325: 3.1e-002 | AP325: 9 | AQ325: 利尔转债!!
A326: 338 | B326: 128032 | C326: 双环转债! | D326: 2472 | E326: 双环传动 | F326: 机械装备 | G326: 通用设备 | H326: 128.784 | I326: 6.0999999999999995e-003 | J326: -1.5800000000000002e-002 | K326: 12.41 | L326: -1.1899999999999999e-002 | M326: 109.3 | N326: 9.87 | O326: 2.4e-002 | P326: 125.73 | Q326: 转股中 | R326: 2.56年 | S326: 0.56年 | T326: 9.92 | U326: 33 | V326: 2.6000000000000002e-002 | W326: 0.11599999999999999 | X326: 0.14599999999999999 | Y326: 85 | Z326: 2.44 | AA326: -6.3099999999999989e-002 | AB326: -6.9199999999999998e-002 | AC326: -0.29799999999999999 | AD326: -0.30199999999999999 | AE326: 98.91 | AF326: 98.9 | AG326: 0.81 | AH326: AA | AI326: 4.0599999999999997e-002 | AJ326: =H326+100*O326 -> 131.184 | AK326: 131.8 | AL326: 163 | AM326: 32.9 | AN326: 98 | AO326: 2.7999999999999997e-002 | AP326: 38 | AQ326: 双环转债!
A327: 190 | B327: 128103 | C327: 同德转债! | D327: 2360 | E327: 同德化工 | F327: 化工 | G327: 化工 | H327: 167.302 | I327: 2.8000000000000004e-003 | J327: -1.4999999999999999e-002 | K327: 7.3 | L327: -1.2199999999999999e-002 | M327: 121.3 | N327: 5.08 | O327: 0.16399999999999998 | P327: 143.7 | Q327: 转股中 | R327: 4.81年 | S327: 2.81年 | T327: 1.09 | U327: 44 | V327: 0.24299999999999999 | W327: 3.7000000000000005e-002 | X327: 5.4000000000000006e-002 | Y327: 29 | Z327: 2.27 | AA327: -6.59e-002 | AB327: -7.2800000000000004e-002 | AC327: -0.14499999999999999 | AD327: -0.14699999999999999 | AE327: 84.36 | AF327: 86.6 | AG327: 1 | AH327: A+ | AI327: 7.4400000000000008e-002 | AJ327: =H327+100*O327 -> 183.702 | AK327: 190.9 | AL327: 337 | AM327: 104.3 | AN327: 339 | AO327: -5.5e-002 | AP327: 13 | AQ327: 同德转债!
A328: 284 | B328: 123022 | C328: 长信转债!! | D328: 300088 | E328: 长信科技 | F328: 通信互联 | G328: 通信设备 | H328: 147.4 | I328: -2.07e-002 | J328: 2.07e-002 | K328: 8.29 | L328: 0. | M328: 114.3 | N328: 6.15 | O328: 9.3000000000000013e-002 | P328: 134.8 | Q328: 转股中 | R328: 3.78年 | S328: 1.79年 | T328: 2.57 | U328: 37 | V328: 9.6999999999999989e-002 | W328: 1.3000000000000001e-002 | X328: 1.7000000000000001e-002 | Y328: 204 | Z328: 2.82 | AA328: -6.6000000000000003e-002 | AB328: -7.22e-002 | AC328: -0.13800000000000001 | AD328: -0.13900000000000001 | AE328: 94.85 | AF328: 97.96 | AG328: 0.83 | AH328: AA | AI328: 4.24e-002 | AJ328: =H328+100*O328 -> 156.70000000000002 | AK328: 160 | AL328: 314 | AM328: 62 | AN328: 301 | AO328: 4.4999999999999998e-002 | AP328: 12 | AQ328: 长信转债!!
A329: 364 | B329: 110033 | C329: 国贸转债! | D329: 600755 | E329: 厦门国贸 | F329: 交通运输 | G329: 交通运输 | H329: 112.49 | I329: 1.e-004 | J329: -1.4000000000000002e-003 | K329: 7.69 | L329: -2.5999999999999999e-003 | M329: 108 | N329: 7.18 | O329: 5.0000000000000003e-002 | P329: 107.1 | Q329: 转股中 | R329: 0.59年 | S329: 回售内 | T329: 12.1 | U329: 20 | V329: 1.4999999999999999e-002 | W329: 8.1000000000000003e-002 | X329: 8.6999999999999994e-002 | Y329: 150 | Z329: 0.93 | AA329: -6.6799999999999998e-002 | AB329: -9.0200000000000002e-002 | AC329: 回售内 | AD329: 回售内 | AE329: 100.33 | AF329: 106.03 | AG329: 0.51 | AH329: AAA | AI329: 3.1699999999999999e-002 | AJ329: =H329+100*O329 -> 117.48999999999999 | AK329: 117.9 | AL329: 23 | AM329: 11.8 | AN329: 2 | AO329: 7.2999999999999995e-002 | AP329: 18 | AQ329: 国贸转债!
A330: 223 | B330: 113559 | C330: 永创转债!! | D330: 603901 | E330: 永创智能 | F330: 机械装备 | G330: 专用设备 | H330: 161.84 | I330: 3.3500000000000002e-002 | J330: 6.6e-003 | K330: 16.87 | L330: 4.0099999999999997e-002 | M330: 118.3 | N330: 10.32 | O330: -1.e-002 | P330: 163.47 | Q330: 转股中 | R330: 4.55年 | S330: 2.55年 | T330: 2.84 | U330: 369 | V330: 0.82099999999999995 | W330: 3.7999999999999999e-002 | X330: 6.3e-002 | Y330: 74 | Z330: 5.08 | AA330: -6.8000000000000005e-002 | AB330: -7.4299999999999991e-002 | AC330: -0.10400000000000001 | AD330: -0.105 | AE330: 88.51 | AF330: 90.09 | AG330: 1 | AH330: AA- | AI330: 6.3399999999999998e-002 | AJ330: =H330+100*O330 -> 160.84 | AK330: 160.2 | AL330: 315 | AM330: 70.1 | AN330: 316 | AO330: 0.17000000000000001 | AP330: 18 | AQ330: 永创转债!!
A331: 263 | B331: 113537 | C331: 文灿转债!! | D331: 603348 | E331: 文灿股份 | F331: 汽车 | G331: 零部件制 | H331: 160.35 | I331: 1.1399999999999999e-002 | J331: -4.0000000000000001e-003 | K331: 29.68 | L331: 8.5000000000000006e-003 | M331: 121.5 | N331: 19.43 | O331: 5.0000000000000003e-002 | P331: 152.75 | Q331: 转股中 | R331: 4年5.1天 | S331: 2年6.1天 | T331: 1.44 | U331: 507 | V331: 2.2000000000000002 | W331: 1.9e-002 | X331: 2.8999999999999998e-002 | Y331: 77 | Z331: 2.99 | AA331: -6.8400000000000002e-002 | AB331: -7.6600000000000001e-002 | AC331: -0.13900000000000001 | AD331: -0.14099999999999999 | AE331: 91.5 | AF331: 95.61 | AG331: 0.87 | AH331: AA- | AI331: 6.3399999999999998e-002 | AJ331: =H331+100*O331 -> 165.34999999999999 | AK331: 167.9 | AL331: 322 | AM331: 72.3 | AN331: 317 | AO331: 0.14999999999999999 | AP331: 24 | AQ331: 文灿转债!!
A332: 85 | B332: 113041 | C332: 紫金转债! | D332: 601899 | E332: 紫金矿业 | F332: 有色金属 | G332: 贵金属 | H332: 154.56 | I332: -1.8000000000000002e-002 | J332: 3.4000000000000002e-003 | K332: 10.84 | L332: -1.4499999999999999e-002 | M332: 108 | N332: 7 | O332: -2.e-003 | P332: 154.86 | Q332: 转股中 | R332: 4.41年 | S332: 2.42年 | T332: 53.2 | U332: 734 | V332: 9.0999999999999998e-002 | W332: 1.9e-002 | X332: 2.9999999999999999e-002 | Y332: 2770. | Z332: 5.14 | AA332: -7.85e-002 | AB332: -8.1500000000000003e-002 | AC332: -0.10800000000000001 | AD332: -0.10800000000000001 | AE332: 92.2 | AF332: 91.96 | AG332: 1 | AH332: AAA | AI332: 3.7400000000000003e-002 | AJ332: =H332+100*O332 -> 154.36000000000001 | AK332: 154.3 | AL332: 304 | AM332: 62.1 | AN332: 303 | AO332: -4.0000000000000001e-002 | AP332: 9 | AQ332: 紫金转债!
A333: 311 | B333: 123014 | C333: 凯发转债! | D333: 300407 | E333: 凯发电气 | F333: 能源电力 | G333: 电力设备 | H333: 131.4 | I333: 1.78e-002 | J333: -2.4e-002 | K333: 6.67 | L333: -2.06e-002 | M333: 108.5 | N333: 8.05 | O333: 0.58599999999999997 | P333: 82.86 | Q333: 转股中 | R333: 2年53天 | S333: 53天 | T333: 1.16 | U333: 104 | V333: 0.69099999999999995 | W333: 5.7000000000000002e-002 | X333: 4.7e-002 | Y333: 20 | Z333: 1.49 | AA333: -8.6599999999999996e-002 | AB333: -9.3100000000000002e-002 | AC333: -0.79200000000000004 | AD333: -0.79799999999999993 | AE333: 99.07 | AF333: 93.58 | AG333: 0.3 | AH333: A+ | AI333: 7.2599999999999998e-002 | AJ333: =H333+100*O333 -> 190. | AK333: 179.9 | AL333: 331 | AM333: 80.9 | AN333: 328 | AO333: 6.9999999999999993e-003 | AP333: 16 | AQ333: 凯发转债!
A334: 205 | B334: 110066 | C334: 盛屯转债!! | D334: 600711 | E334: 盛屯矿业 | F334: 有色金属 | G334: 有色行业 | H334: 177.05 | I334: -2.3700000000000002e-002 | J334: -1.54e-002 | K334: 8.06 | L334: -4.2800000000000005e-002 | M334: 114.9 | N334: 4.88 | O334: 7.2000000000000008e-002 | P334: 165.16 | Q334: 转股中 | R334: 4.74年 | S334: 2.74年 | T334: 5.22 | U334: 380 | V334: 0.41200000000000003 | W334: 2.4e-002 | X334: 4.0000000000000001e-002 | Y334: 216 | Z334: 1.93 | AA334: -8.8599999999999998e-002 | AB334: -9.3399999999999997e-002 | AC334: -0.111 | AD334: -0.11199999999999999 | AE334: 91.73 | AF334: 94.73 | AG334: 0.91 | AH334: AA | AI334: 4.24e-002 | AJ334: =H334+100*O334 -> 184.25 | AK334: 188.9 | AL334: 336 | AM334: 94.2 | AN334: 334 | AO334: 2.7000000000000003e-002 | AP334: 34 | AQ334: 盛屯转债!!
A335: 330 | B335: 113504 | C335: 艾华转债!! | D335: 603989 | E335: 艾华集团 | F335: 电子 | G335: 元器件制 | H335: 141.18 | I335: 1.1000000000000001e-003 | J335: -8.1000000000000013e-003 | K335: 29.48 | L335: -7.7000000000000002e-003 | M335: 109.3 | N335: 21.13 | O335: 1.2e-002 | P335: 139.52 | Q335: 转股中 | R335: 2.74年 | S335: 0.74年 | T335: 4.95 | U335: 17 | V335: 2.4e-002 | W335: 4.2000000000000003e-002 | X335: 5.9000000000000004e-002 | Y335: 117 | Z335: 4.37 | AA335: -9.0399999999999994e-002 | AB335: -9.5899999999999999e-002 | AC335: -0.31 | AD335: -0.313 | AE335: 98.19 | AF335: 98.18 | AG335: 0.9 | AH335: AA | AI335: 4.0599999999999997e-002 | AJ335: =H335+100*O335 -> 142.38 | AK335: 142.8 | AL335: 258 | AM335: 44.7 | AN335: 213 | AO335: 1.4999999999999999e-002 | AP335: 9 | AQ335: 艾华转债!!
A336: 208 | B336: 128097 | C336: 奥佳转债! | D336: 2614 | E336: 奥佳华 | F336: 机械装备 | G336: 专用设备 | H336: 180.116 | I336: 3.3300000000000003e-002 | J336: -1.0500000000000001e-002 | K336: 18.5 | L336: 2.4399999999999998e-002 | M336: 114.9 | N336: 10.39 | O336: 1.2e-002 | P336: 178.06 | Q336: 转股中 | R336: 4.73年 | S336: 2.73年 | T336: 5.07 | U336: 220 | V336: 0.24299999999999999 | W336: 4.4000000000000004e-002 | X336: 7.8e-002 | Y336: 116 | Z336: 2.52 | AA336: -9.2200000000000004e-002 | AB336: -9.6999999999999989e-002 | AC336: -0.115 | AD336: -0.11599999999999999 | AE336: 91.79 | AF336: 94.78 | AG336: 0.94 | AH336: AA | AI336: 4.24e-002 | AJ336: =H336+100*O336 -> 181.316 | AK336: 182.2 | AL336: 333 | AM336: 87.4 | AN336: 333 | AO336: 0.13 | AP336: 21 | AQ336: 奥佳转债!
A337: 236 | B337: 123034 | C337: 通光转债! | D337: 300265 | E337: 通光线缆 | F337: 通信互联 | G337: 通信设备 | H337: 182.8 | I337: 7.1999999999999998e-003 | J337: -3.0999999999999999e-003 | K337: 8.77 | L337: 5.6999999999999993e-003 | M337: 118 | N337: 7.97 | O337: 0.66099999999999992 | P337: 110.04 | Q337: 转股中 | R337: 4.42年 | S337: 2.42年 | T337: 0.78 | U337: 56 | V337: 0.39299999999999996 | W337: 2.4e-002 | X337: 2.7000000000000003e-002 | Y337: 32 | Z337: 2.46 | AA337: -9.5899999999999999e-002 | AB337: -0.10199999999999999 | AC337: -0.13800000000000001 | AD337: -0.13900000000000001 | AE337: 86.16 | AF337: 86.54 | AG337: 0.71 | AH337: A+ | AI337: 7.4400000000000008e-002 | AJ337: =H337+100*O337 -> 248.90000000000001 | AK337: 255.6 | AL337: 348 | AM337: 169 | AN337: 349 | AO337: 1.e-002 | AP337: 21 | AQ337: 通光转债!
A338: 193 | B338: 123046 | C338: 天铁转债! | D338: 300587 | E338: 天铁股份 | F338: 铁路 | G338: 铁路设备 | H338: 189.95 | I338: 7.000000000000001e-004 | J338: 2.8000000000000004e-003 | K338: 18.81 | L338: 3.7000000000000002e-003 | M338: 117.7 | N338: 10.12 | O338: 2.2000000000000002e-002 | P338: 185.87 | Q338: 转股中 | R338: 4.79年 | S338: 2.79年 | T338: 0.77 | U338: 72 | V338: 0.49299999999999999 | W338: 1.2e-002 | X338: 2.2000000000000002e-002 | Y338: 64 | Z338: 3.95 | AA338: -9.6699999999999994e-002 | AB338: -0.10199999999999999 | AC338: -0.11900000000000001 | AD338: -0.12 | AE338: 86.55 | AF338: 88.25 | AG338: 0.94 | AH338: AA- | AI338: 6.3399999999999998e-002 | AJ338: =H338+100*O338 -> 192.14999999999998 | AK338: 194 | AL338: 340 | AM338: 105.8 | AN338: 341 | AO338: 8.4000000000000005e-002 | AP338: 12 | AQ338: 天铁转债!
A339: 358 | B339: 113012 | C339: 骆驼转债! | D339: 601311 | E339: 骆驼股份 | F339: 汽车 | G339: 零部件制 | H339: 128.53 | I339: 2.1899999999999999e-002 | J339: 4.7500000000000001e-002 | K339: 12.7 | L339: 8.09e-002 | M339: 106.5 | N339: 10.06 | O339: 1.8000000000000002e-002 | P339: 126.24 | Q339: 转股中 | R339: 1.80年 | S339: 回售内 | T339: 5.09 | U339: 364 | V339: 0.54400000000000004 | W339: 3.6000000000000004e-002 | X339: 4.4999999999999998e-002 | Y339: 142 | Z339: 1.88 | AA339: -9.9700000000000011e-002 | AB339: -0.106 | AC339: 回售内 | AD339: 回售内 | AE339: 100.25 | AF339: 99.18 | AG339: 0.86 | AH339: AA | AI339: 4.0599999999999997e-002 | AJ339: =H339+100*O339 -> 130.33000000000001 | AK339: 130.8 | AL339: 147 | AM339: 30.6 | AN339: 72 | AO339: 3.7999999999999999e-002 | AP339: 16 | AQ339: 骆驼转债!
A340: 246 | B340: 113545 | C340: 金能转债! | D340: 603113 | E340: 金能科技 | F340: 煤炭 | G340: 炼焦 | H340: 180.97 | I340: -3.7900000000000003e-002 | J340: 4.7999999999999996e-003 | K340: 18.66 | L340: -3.5200000000000002e-002 | M340: 114.9 | N340: 10.43 | O340: 1.2e-002 | P340: 178.91 | Q340: 转股中 | R340: 4.36年 | S340: 2.36年 | T340: 10.2 | U340: 134 | V340: 7.2000000000000008e-002 | W340: 6.4000000000000001e-002 | X340: 0.115 | Y340: 159 | Z340: 1.91 | AA340: -0.10099999999999999 | AB340: -0.106 | AC340: -0.14000000000000001 | AD340: -0.14199999999999999 | AE340: 93.2 | AF340: 96.24 | AG340: 0.94 | AH340: AA | AI340: 4.24e-002 | AJ340: =H340+100*O340 -> 182.16999999999999 | AK340: 183 | AL340: 334 | AM340: 86.8 | AN340: 332 | AO340: -1.7000000000000001e-002 | AP340: 17 | AQ340: 金能转债!
A341: 270 | B341: 113025 | C341: 明泰转债!! | D341: 601677 | E341: 明泰铝业 | F341: 有色金属 | G341: 铝金属 | H341: 174.22 | I341: 1.7000000000000001e-003 | J341: -1.1200000000000002e-002 | K341: 18.82 | L341: -1.e-002 | M341: 114.5 | N341: 11 | O341: 1.8000000000000002e-002 | P341: 171.09 | Q341: 转股中 | R341: 3.85年 | S341: 1.85年 | T341: 11 | U341: 62 | V341: 3.3000000000000002e-002 | W341: 8.5999999999999993e-002 | X341: 0.14599999999999999 | Y341: 128 | Z341: 1.43 | AA341: -0.105 | AB341: -0.111 | AC341: -0.18100000000000002 | AD341: -0.182 | AE341: 94.63 | AF341: 97.88 | AG341: 0.94 | AH341: AA | AI341: 4.24e-002 | AJ341: =H341+100*O341 -> 176.02000000000001 | AK341: 177.3 | AL341: 328 | AM341: 79.5 | AN341: 327 | AO341: 1.e-002 | AP341: 24 | AQ341: 明泰转债!!
A342: 335 | B342: 128033 | C342: 迪龙转债! | D342: 2658 | E342: 雪迪龙 | F342: 城市公用 | G342: 三废处理 | H342: 148.85 | I342: -6.3799999999999996e-002 | J342: 1.4000000000000002e-003 | K342: 10.27 | L342: -8.4700000000000011e-002 | M342: 108.8 | N342: 8.71 | O342: 0.26200000000000001 | P342: 117.91 | Q342: 转股中 | R342: 2.56年 | S342: 0.56年 | T342: 2.98 | U342: 549 | V342: 1.1899999999999999 | W342: 4.5999999999999999e-002 | X342: 5.4000000000000006e-002 | Y342: 65 | Z342: 2.71 | AA342: -0.11699999999999999 | AB342: -0.122 | AC342: -0.44799999999999995 | AD342: -0.45100000000000001 | AE342: 98.65 | AF342: 98.4 | AG342: 0.74 | AH342: AA | AI342: 4.0599999999999997e-002 | AJ342: =H342+100*O342 -> 175.05000000000001 | AK342: 179.8 | AL342: 330 | AM342: 81.1 | AN342: 329 | AO342: -5.5e-002 | AP342: 35 | AQ342: 迪龙转债!
A343: 251 | B343: 123030 | C343: 九洲转债! | D343: 300040 | E343: 九洲集团 | F343: 能源电力 | G343: 电力设备 | H343: 202.8 | I343: 3.2199999999999999e-002 | J343: 6.7900000000000002e-002 | K343: 10.14 | L343: 0.10800000000000001 | M343: 120 | N343: 5.65 | O343: 0.13 | P343: 179.47 | Q343: 转股中 | R343: 4.21年 | S343: 2.21年 | T343: 0.97 | U343: 2038. | V343: 10.300000000000001 | W343: 2.5000000000000001e-002 | X343: 4.4999999999999998e-002 | Y343: 39 | Z343: 1.73 | AA343: -0.11900000000000001 | AB343: -0.126 | AC343: -0.17499999999999999 | AD343: -0.17600000000000002 | AE343: 89.59 | AF343: 93.18 | AG343: 0.93 | AH343: AA- | AI343: 6.3399999999999998e-002 | AJ343: =H343+100*O343 -> 215.80000000000001 | AK343: 226.1 | AL343: 346 | AM343: 133 | AN343: 347 | AO343: 0.157 | AP343: 25 | AQ343: 九洲转债!
A344: 255 | B344: 113543 | C344: 欧派转债! | D344: 603833 | E344: 欧派家居 | F344: 其他 | G344: 家居用品 | H344: 219.07 | I344: -6.0999999999999995e-003 | J344: 1.1699999999999999e-002 | K344: 155.22 | L344: 5.7999999999999996e-003 | M344: 114.9 | N344: 71.69 | O344: 1.2e-002 | P344: 216.52 | Q344: 转股中 | R344: 4.20年 | S344: 3.20年 | T344: 3.46 | U344: 30 | V344: 4.0000000000000001e-002 | W344: 4.0000000000000001e-003 | X344: 8.0000000000000002e-003 | Y344: 938 | Z344: 7.72 | AA344: -0.14499999999999999 | AB344: -0.14999999999999999 | AC344: -0.114 | AD344: -0.115 | AE344: 91.73 | AF344: 96.89 | AG344: 0.97 | AH344: AA | AI344: 4.24e-002 | AJ344: =H344+100*O344 -> 220.26999999999998 | AK344: 221.6 | AL344: 345 | AM344: 124.7 | AN344: 345 | AO344: 4.0000000000000001e-003 | AP344: 13 | AQ344: 欧派转债!
A345: 285 | B345: 110055 | C345: 伊力转债!! | D345: 600197 | E345: 伊力特 | F345: 食品饮料 | G345: 白酒 | H345: 209.04 | I345: 8.4900000000000003e-002 | J345: 1.23e-002 | K345: 33.95 | L345: 0.10000000000000001 | M345: 114.3 | N345: 16.81 | O345: 3.5000000000000003e-002 | P345: 201.96 | Q345: 转股中 | R345: 3.78年 | S345: 1.78年 | T345: 2.54 | U345: 6594. | V345: 12.68 | W345: 1.6e-002 | X345: 3.2000000000000001e-002 | Y345: 159 | Z345: 4.46 | AA345: -0.14999999999999999 | AB345: -0.155 | AC345: -0.23499999999999999 | AD345: -0.23600000000000002 | AE345: 94.88 | AF345: 97.99 | AG345: 0.97 | AH345: AA | AI345: 4.24e-002 | AJ345: =H345+100*O345 -> 212.53999999999999 | AK345: 216.1 | AL345: 344 | AM345: 118.1 | AN345: 343 | AO345: 0.223 | AP345: 22 | AQ345: 伊力转债!!
A346: 171 | B346: 113582 | C346: 火炬转债! | D346: 603678 | E346: 火炬电子 | F346: 电子 | G346: 元器件制 | H346: 259.04 | I346: -1.8700000000000001e-002 | J346: 1.7899999999999999e-002 | K346: 60.17 | L346: -8.0000000000000004e-004 | M346: 114.9 | N346: 25.33 | O346: 8.9999999999999997e-002 | P346: 237.54 | Q346: 转股中 | R346: 4.98年 | S346: 2.98年 | T346: 4.18 | U346: 93 | V346: 8.5999999999999993e-002 | W346: 1.4999999999999999e-002 | X346: 3.6000000000000004e-002 | Y346: 277 | Z346: 6.81 | AA346: -0.153 | AB346: -0.157 | AC346: -0.14699999999999999 | AD346: -0.14699999999999999 | AE346: 90.84 | AF346: 93.81 | AG346: 0.98 | AH346: AA | AI346: 4.24e-002 | AJ346: =H346+100*O346 -> 268.04000000000002 | AK346: 280.5 | AL346: 351 | AM346: 186.7 | AN346: 351 | AO346: 1.8000000000000002e-002 | AP346: 5 | AQ346: 火炬转债!
A347: 161 | B347: 128111 | C347: 中矿转债! | D347: 2738 | E347: 中矿资源 | F347: 有色金属 | G347: 有色行业 | H347: 283.41 | I347: 4.9500000000000002e-002 | J347: 3.0099999999999998e-002 | K347: 42.81 | L347: 8.1600000000000006e-002 | M347: 124.7 | N347: 15.47 | O347: 2.4e-002 | P347: 276.73 | Q347: 转股中 | R347: 5年6.1天 | S347: 3年7天 | T347: 1.72 | U347: 2125. | V347: 4.3600000000000003 | W347: 1.2e-002 | X347: 3.5000000000000003e-002 | Y347: 138 | Z347: 4.04 | AA347: -0.154 | AB347: -0.16 | AC347: -0.152 | AD347: -0.152 | AE347: 86.01 | AF347: 91.92 | AG347: 0.98 | AH347: AA- | AI347: 6.4399999999999999e-002 | AJ347: =H347+100*O347 -> 285.81 | AK347: 290.1 | AL347: 352 | AM347: 198.2 | AN347: 352 | AO347: 0.19 | AP347: 8 | AQ347: 中矿转债!
A348: 173 | B348: 113580 | C348: 康隆转债! | D348: 603665 | E348: 康隆达 | F348: 服装纺织 | G348: 服装行业 | H348: 274.07 | I348: -3.7699999999999997e-002 | J348: 6.3399999999999998e-002 | K348: 16.23 | L348: 3.9699999999999999e-002 | M348: 120.8 | N348: 15.51 | O348: 1.6200000000000001 | P348: 104.64 | Q348: 转股中 | R348: 4.88年 | S348: 2.89年 | T348: 0.41 | U348: 323 | V348: 2.77 | W348: 1.6e-002 | X348: 1.7000000000000001e-002 | Y348: 26 | Z348: 2.36 | AA348: -0.157 | AB348: -0.16200000000000001 | AC348: -0.159 | AD348: -0.159 | AE348: 86.14 | AF348: 90.04 | AG348: 0.65 | AH348: AA- | AI348: 6.3399999999999998e-002 | AJ348: =H348+100*O348 -> 436.06999999999999 | AK348: 443.5 | AL348: 361 | AM348: 353.5 | AN348: 361 | AO348: 9.4e-002 | AP348: 9 | AQ348: 康隆转债!
A349: 295 | B349: 113527 | C349: 维格转债!! | D349: 603518 | E349: 锦泓集团 | F349: 服装纺织 | G349: 服装行业 | H349: 222.46 | I349: -6.4299999999999996e-002 | J349: 2.12e-002 | K349: 20.97 | L349: -4.4600000000000001e-002 | M349: 119.5 | N349: 9.85 | O349: 4.4999999999999998e-002 | P349: 212.89 | Q349: 转股中 | R349: 3.64年 | S349: 1.64年 | T349: 4.62 | U349: 1012. | V349: 0.96099999999999997 | W349: 7.8e-002 | X349: 0.16699999999999998 | Y349: 59 | Z349: 2.76 | AA349: -0.159 | AB349: -0.16600000000000001 | AC349: -0.27300000000000002 | AD349: -0.27399999999999997 | AE349: 93.83 | AF349: 99.57 | AG349: 0.97 | AH349: AA | AI349: 5.2400000000000002e-002 | AJ349: =H349+100*O349 -> 226.96000000000001 | AK349: 232 | AL349: 347 | AM349: 132.5 | AN349: 346 | AO349: 0.106 | AP349: 88 | AQ349: 维格转债!!
A350: 209 | B350: 128095 | C350: 恩捷转债!! | D350: 2812 | E350: 恩捷股份 | F350: 电子 | G350: 元器件制 | H350: 271 | I350: 2.7099999999999999e-002 | J350: -4.5999999999999999e-003 | K350: 176 | L350: 2.29e-002 | M350: 114.9 | N350: 64.92 | O350: 0. | P350: 271.1 | Q350: 转股中 | R350: 4.69年 | S350: 2.69年 | T350: 6.06 | U350: 737 | V350: 0.44700000000000001 | W350: 4.0000000000000001e-003 | X350: 1.1000000000000001e-002 | Y350: 1563. | Z350: 13.56 | AA350: -0.17000000000000001 | AB350: -0.17399999999999999 | AC350: -0.17399999999999999 | AD350: -0.17399999999999999 | AE350: 91.94 | AF350: 94.93 | AG350: 0.98 | AH350: AA | AI350: 4.24e-002 | AJ350: =H350+100*O350 -> 271. | AK350: 270.9 | AL350: 350 | AM350: 176 | AN350: 350 | AO350: 0.19600000000000001 | AP350: 15 | AQ350: 恩捷转债!!
A351: 352 | B351: 128017 | C351: 金禾转债!! | D351: 2597 | E351: 金禾实业 | F351: 化工 | G351: 化工 | H351: 171.5 | I351: -1.26e-002 | J351: 1.5300000000000001e-002 | K351: 35.57 | L351: 2.8000000000000004e-003 | M351: 108.8 | N351: 21.97 | O351: 5.9000000000000004e-002 | P351: 161.9 | Q351: 转股中 | R351: 2.41年 | S351: 0.41年 | T351: 5.52 | U351: 18 | V351: 1.9e-002 | W351: 2.7999999999999997e-002 | X351: 4.4999999999999998e-002 | Y351: 200 | Z351: 3.98 | AA351: -0.17399999999999999 | AB351: -0.17899999999999999 | AC351: -0.7390000000000001 | AD351: -0.74199999999999999 | AE351: 99.25 | AF351: 99 | AG351: 0.96 | AH351: AA | AI351: 4.0599999999999997e-002 | AJ351: =H351+100*O351 -> 177.40000000000001 | AK351: 181.1 | AL351: 332 | AM351: 81.8 | AN351: 331 | AO351: 5.0999999999999997e-002 | AP351: 10 | AQ351: 金禾转债!!
A352: 297 | B352: 123018 | C352: 溢利转债! | D352: 300381 | E352: 溢多利 | F352: 医药 | G352: 原料药 | H352: 226.881 | I352: -1.83e-002 | J352: 2.0499999999999997e-002 | K352: 9.3 | L352: 3.2000000000000002e-003 | M352: 114.3 | N352: 8.32 | O352: 1.03 | P352: 111.78 | Q352: 转股中 | R352: 3.54年 | S352: 1.55年 | T352: 0.54 | U352: 79 | V352: 0.63400000000000001 | W352: 1.2e-002 | X352: 1.3000000000000001e-002 | Y352: 46 | Z352: 1.52 | AA352: -0.17800000000000002 | AB352: -0.184 | AC352: -0.29600000000000004 | AD352: -0.29699999999999999 | AE352: 92.61 | AF352: 92.33 | AG352: 0.7 | AH352: AA- | AI352: 6.3399999999999998e-002 | AJ352: =H352+100*O352 -> 329.88099999999997 | AK352: 342 | AL352: 354 | AM352: 249.4 | AN352: 354 | AO352: 1.1000000000000001e-002 | AP352: 12 | AQ352: 溢利转债!
A353: 323 | B353: 113509 | C353: XD新泉转!! | D353: 603179 | E353: 新泉股份 | F353: 汽车 | G353: 零部件制 | H353: 200.26 | I353: -2.7000000000000001e-003 | J353: 4.4000000000000003e-003 | K353: 29.94 | L353: 1.7000000000000001e-003 | M353: 110.3 | N353: 15.25 | O353: 2.e-002 | P353: 196.33 | Q353: 转股中 | R353: 2.997年 | S353: 1年0.1天 | T353: 0.84 | U353: 48 | V353: 0.28499999999999998 | W353: 8.0000000000000002e-003 | X353: 1.4999999999999999e-002 | Y353: 111 | Z353: 3.12 | AA353: -0.185 | AB353: -0.18899999999999997 | AC353: -0.41399999999999998 | AD353: -0.41600000000000004 | AE353: 97.19 | AF353: 97.17 | AG353: 0.98 | AH353: AA | AI353: 4.0599999999999997e-002 | AJ353: =H353+100*O353 -> 202.25999999999999 | AK353: 204.2 | AL353: 342 | AM353: 107 | AN353: 342 | AO353: 4.2999999999999997e-002 | AP353: 12 | AQ353: XD新泉转!!
A354: 356 | B354: 127004 | C354: 模塑转债!! | D354: 700 | E354: 模塑科技 | F354: 汽车 | G354: 零部件制 | H354: 168.279 | I354: 1.8e-003 | J354: -1.e-003 | K354: 5.74 | L354: 1.41e-002 | M354: 111.8 | N354: 7.46 | O354: 1.1899999999999999 | P354: 76.94 | Q354: 转股中 | R354: 1.99年 | S354: 回售内 | T354: 1.32 | U354: 66 | V354: 0.29499999999999998 | W354: 2.5000000000000001e-002 | X354: 1.9e-002 | Y354: 53 | Z354: 1.89 | AA354: -0.187 | AB354: -0.19500000000000001 | AC354: 回售内 | AD354: 回售内 | AE354: 100.3 | AF354: 99.56 | AG354: 0.06 | AH354: AA | AI354: 4.0599999999999997e-002 | AJ354: =H354+100*O354 -> 287.279 | AK354: 259.6 | AL354: 349 | AM354: 159.3 | AN354: 348 | AO354: 2.7000000000000003e-002 | AP354: 31 | AQ354: 模塑转债!!
A355: 249 | B355: 123031 | C355: 晶瑞转债! | D355: 300655 | E355: 晶瑞股份 | F355: 化工 | G355: 化工 | H355: 287.2 | I355: -1.e-003 | J355: 2.e-002 | K355: 27.4 | L355: 1.9299999999999998e-002 | M355: 115.8 | N355: 10.13 | O355: 6.2e-002 | P355: 270.48 | Q355: 转股中 | R355: 4.23年 | S355: 2.24年 | T355: 0.63 | U355: 1126. | V355: 6.1699999999999999 | W355: 6.9999999999999993e-003 | X355: 1.8000000000000002e-002 | Y355: 93 | Z355: 3.89 | AA355: -0.19600000000000001 | AB355: -0.20100000000000001 | AC355: -0.22800000000000001 | AD355: -0.22800000000000001 | AE355: 87.1 | AF355: 86.02 | AG355: 0.98 | AH355: A+ | AI355: 7.4400000000000008e-002 | AJ355: =H355+100*O355 -> 293.39999999999998 | AK355: 303.9 | AL355: 353 | AM355: 216.8 | AN355: 353 | AO355: 0.23899999999999999 | AP355: 16 | AQ355: 晶瑞转债!
A356: 309 | B356: 123015 | C356: 蓝盾转债!! | D356: 300297 | E356: 蓝盾股份 | F356: 计算机及 | G356: 软件开发 | H356: 224.8 | I356: -3.0600000000000002e-002 | J356: 3.0200000000000001e-002 | K356: 3.64 | L356: -8.199999999999999e-003 | M356: 112.3 | N356: 5.79 | O356: 2.5800000000000001 | P356: 62.87 | Q356: 转股中 | R356: 3.19年 | S356: 1.19年 | T356: 1 | U356: 133 | V356: 0.58399999999999996 | W356: 2.2000000000000002e-002 | X356: 1.3999999999999999e-002 | Y356: 45 | Z356: 1.74 | AA356: -0.19899999999999998 | AB356: -0.20399999999999999 | AC356: -0.38600000000000001 | AD356: -0.38799999999999996 | AE356: 94.65 | AF356: 92.71 | AG356: 0.04 | AH356: AA- | AI356: 6.3399999999999998e-002 | AJ356: =H356+100*O356 -> 482.80000000000001 | AK356: 386.7 | AL356: 357 | AM356: 292.1 | AN356: 357 | AO356: 3.9e-002 | AP356: 17 | AQ356: 蓝盾转债!!
A357: 296 | B357: 113526 | C357: 联泰转债! | D357: 603797 | E357: 联泰环保 | F357: 城市公用 | G357: 三废处理 | H357: 274.88 | I357: -2.5399999999999999e-002 | J357: 2.5399999999999999e-002 | K357: 7.78 | L357: 0. | M357: 110.3 | N357: 6.11 | O357: 1.1599999999999999 | P357: 127.33 | Q357: 转股中 | R357: 3.64年 | S357: 1.64年 | T357: 1.93 | U357: 27 | V357: 5.0000000000000003e-002 | W357: 5.5e-002 | X357: 7.0000000000000007e-002 | Y357: 35 | Z357: 2.05 | AA357: -0.22500000000000001 | AB357: -0.22800000000000001 | AC357: -0.318 | AD357: -0.31900000000000001 | AE357: 95.93 | AF357: 96.1 | AG357: 0.79 | AH357: AA+ | AI357: 3.9399999999999998e-002 | AJ357: =H357+100*O357 -> 390.88 | AK357: 422.4 | AL357: 360 | AM357: 326.3 | AN357: 359 | AO357: 2.2000000000000002e-002 | AP357: 9 | AQ357: 联泰转债!
A358: 262 | B358: 123027 | C358: 蓝晓转债! | D358: 300487 | E358: 蓝晓科技 | F358: 化工 | G358: 化工 | H358: 325.8 | I358: 7.4999999999999997e-003 | J358: 6.0299999999999999e-002 | K358: 68.48 | L358: 7.0000000000000007e-002 | M358: 119.5 | N358: 29.22 | O358: 0.39000000000000001 | P358: 234.36 | Q358: 转股中 | R358: 4年6.1天 | S358: 2年7天 | T358: 1.07 | U358: 1118. | V358: 3.1600000000000001 | W358: 6.9999999999999993e-003 | X358: 1.7000000000000001e-002 | Y358: 150 | Z358: 8.15 | AA358: -0.22500000000000001 | AB358: -0.23100000000000001 | AC358: -0.27399999999999997 | AD358: -0.27399999999999997 | AE358: 89.48 | AF358: 90.34 | AG358: 0.97 | AH358: A+ | AI358: 7.4400000000000008e-002 | AJ358: =H358+100*O358 -> 364.80000000000001 | AK358: 417.2 | AL358: 359 | AM358: 326.9 | AN358: 360 | AO358: 9.9000000000000005e-002 | AP358: 19 | AQ358: 蓝晓转债!
A359: 320 | B359: 110044 | C359: 广电转债!! | D359: 600831 | E359: 广电网络 | F359: 传媒娱乐 | G359: 影视娱乐 | H359: 252.59 | I359: -6.0999999999999995e-003 | J359: 9.8999999999999991e-003 | K359: 6.14 | L359: 9.8999999999999991e-003 | M359: 112.3 | N359: 6.9 | O359: 1.8400000000000001 | P359: 88.99 | Q359: 转股中 | R359: 3年22天 | S359: 1年23天 | T359: 0.71 | U359: 61 | V359: 0.33899999999999997 | W359: 1.6e-002 | X359: 1.3999999999999999e-002 | Y359: 44 | Z359: 1.17 | AA359: -0.23600000000000002 | AB359: -0.24100000000000002 | AC359: -0.47299999999999998 | AD359: -0.47399999999999998 | AE359: 97.74 | AF359: 99.19 | AG359: 0.38 | AH359: AA | AI359: 4.24e-002 | AJ359: =H359+100*O359 -> 436.59000000000003 | AK359: 416.2 | AL359: 358 | AM359: 317 | AN359: 358 | AO359: -1.2e-002 | AP359: 11 | AQ359: 广电转债!!
A360: 316 | B360: 128041 | C360: 盛路转债!! | D360: 2446 | E360: 盛路通信 | F360: 通信互联 | G360: 通信设备 | H360: 287.535 | I360: -2.06e-002 | J360: 1.54e-002 | K360: 5.97 | L360: -1.32e-002 | M360: 114.3 | N360: 6.82 | O360: 2.2799999999999998 | P360: 87.54 | Q360: 转股中 | R360: 3年42天 | S360: 1年43天 | T360: 0.53 | U360: 119 | V360: 0.76700000000000002 | W360: 1.e-002 | X360: 9.0000000000000011e-003 | Y360: 54 | Z360: 1.76 | AA360: -0.26000000000000001 | AB360: -0.26500000000000001 | AC360: -0.48700000000000004 | AD360: -0.48799999999999999 | AE360: 97.52 | AF360: 100.72 | AG360: 0.39 | AH360: AA | AI360: 4.24e-002 | AJ360: =H360+100*O360 -> 515.53499999999997 | AK360: 487.5 | AL360: 362 | AM360: 386.8 | AN360: 362 | AO360: 1.3000000000000001e-002 | AP360: 12 | AQ360: 盛路转债!!
A361: 339 | B361: 128030 | C361: 天康转债!! | D361: 2100 | E361: 天康生物 | F361: 农业 | G361: 畜牧业 | H361: 246.2 | I361: -1.8e-003 | J361: 2.8300000000000002e-002 | K361: 10.07 | L361: 2.6499999999999999e-002 | M361: 111.3 | N361: 7.85 | O361: 0.91900000000000004 | P361: 128.28 | Q361: 转股中 | R361: 2.55年 | S361: 0.55年 | T361: 0.94 | U361: 3.8 | V361: 1.6e-002 | W361: 9.0000000000000011e-003 | X361: 1.1000000000000001e-002 | Y361: 108 | Z361: 1.65 | AA361: -0.27100000000000002 | AB361: -0.27600000000000002 | AC361: -0.84200000000000008 | AD361: -0.84400000000000008 | AE361: 98.94 | AF361: 100.73 | AG361: 1 | AH361: AA | AI361: 4.0599999999999997e-002 | AJ361: =H361+100*O361 -> 338.10000000000002 | AK361: 364.1 | AL361: 355 | AM361: 263.4 | AN361: 355 | AO361: 4.0000000000000001e-002 | AP361: 11 | AQ361: 天康转债!!
A362: 340 | B362: 128029 | C362: 太阳转债!! | D362: 2078 | E362: 太阳纸业 | F362: 造纸包装 | G362: 造纸行业 | H362: 181.698 | I362: -1.9e-003 | J362: 1.1899999999999999e-002 | K362: 14.19 | L362: 1.e-002 | M362: 107 | N362: 8.55 | O362: 9.5000000000000001e-002 | P362: 165.96 | Q362: 转股中 | R362: 1.55年 | S362: 回售内 | T362: 9.09 | U362: 25 | V362: 1.4999999999999999e-002 | W362: 2.4e-002 | X362: 4.0999999999999995e-002 | Y362: 372 | Z362: 2.18 | AA362: -0.29100000000000004 | AB362: -0.29600000000000004 | AC362: 回售内 | AD362: 回售内 | AE362: 100.17 | AF362: 101.08 | AG362: 1 | AH362: AA+ | AI362: 3.7599999999999995e-002 | AJ362: =H362+100*O362 -> 191.19800000000001 | AK362: 197.4 | AL362: 341 | AM362: 96.3 | AN362: 335 | AO362: -6.7000000000000004e-002 | AP362: 7 | AQ362: 太阳转债!!
A363: 313 | B363: 123013 | C363: 横河转债! | D363: 300539 | E363: 横河精密 | F363: 机械装备 | G363: 专用设备 | H363: 364.9 | I363: -1.6399999999999998e-002 | J363: 1.e-002 | K363: 7.32 | L363: -1.7399999999999999e-002 | M363: 115.2 | N363: 9.13 | O363: 3.5499999999999998 | P363: 80.18 | Q363: 转股中 | R363: 3年51天 | S363: 1年52天 | T363: 0.38 | U363: 56 | V363: 0.40200000000000002 | W363: 2.3e-002 | X363: 1.9e-002 | Y363: 16 | Z363: 3.28 | AA363: -0.312 | AB363: -0.317 | AC363: -0.53200000000000003 | AD363: -0.53299999999999992 | AE363: 94.21 | AF363: 92.52 | AG363: 0.37 | AH363: A+ | AI363: 7.4400000000000008e-002 | AJ363: =H363+100*O363 -> 719.89999999999998 | AK363: 649.6 | AL363: 363 | AM363: 555.4 | AN363: 363 | AO363: -1.2e-002 | AP363: 14 | AQ363: 横河转债!
A364: 351 | B364: 113016 | C364: 小康转债!! | D364: 601127 | E364: 小康股份 | F364: 汽车 | G364: 零部件制 | H364: 365.25 | I364: -2.3799999999999998e-002 | J364: 6.5000000000000006e-003 | K364: 56 | L364: -1.7500000000000002e-002 | M364: 109.3 | N364: 15.7 | O364: 2.4e-002 | P364: 356.69 | Q364: 转股中 | R364: 2.42年 | S364: 0.42年 | T364: 3.01 | U364: 1606. | V364: 1.45 | W364: 4.0000000000000001e-003 | X364: 1.4999999999999999e-002 | Y364: 723 | Z364: 15.43 | AA364: -0.39600000000000002 | AB364: -0.39899999999999997 | AC364: -1.272 | AD364: -1.2729999999999999 | AE364: 99.44 | AF364: 99.43 | AG364: 0.99 | AH364: AA | AI364: 4.0599999999999997e-002 | AJ364: =H364+100*O364 -> 367.64999999999998 | AK364: 373.8 | AL364: 356 | AM364: 274.4 | AN364: 356 | AO364: -5.5e-002 | AP364: 42 | AQ364: 小康转债!!
A365: 253 | B365: 123029 | C365: 英科转债! | D365: 300677 | E365: 英科医疗 | F365: 医药 | G365: 医疗器械 | H365: 1294 | I365: 0. | J365: 7.000000000000001e-004 | K365: 106.44 | L365: 8.0000000000000004e-004 | M365: 138.2 | N365: 8.32 | O365: 1.1000000000000001e-002 | P365: 1279.33 | Q365: 转股中 | R365: 4.20年 | S365: 2.20年 | T365: 0.33 | U365: 418 | V365: 0.96499999999999997 | W365: 1.e-003 | X365: 1.1000000000000001e-002 | Y365: 386 | Z365: 2.86 | AA365: -0.41799999999999998 | AB365: -0.42399999999999999 | AC365: -0.33500000000000002 | AD365: -0.33500000000000002 | AE365: 97.45 | AF365: 116.86 | AG365: 0.99 | AH365: AA | AI365: 4.24e-002 | AJ365: =H365+100*O365 -> 1295.0999999999999 | AK365: 1308.7 | AL365: 364 | AM365: 1191.8 | AN365: 364 | AO365: -0.23499999999999999 | AP365: 16 | AQ365: 英科转债!